,user_input,retrieved_contexts,reference_contexts,response,reference,context_precision,context_recall,faithfulness,answer_relevancy,semantic_similarity,retriever_time,invoke_time
0,Khoa Công nghệ Hoá có gì đặc biệt không?,"['content: Nhiệm vụ khoa học công nghệ\nTrang HaUI\nPhòng\nPhòng Tổ chức hành chính\nPhòng Đào tạo\nPhòng Công tác sinh viên\nPhòng Khoa học công nghệ\nPhòng hợp tác đối ngoại\nPhòng Tài chính kế toán\nPhòng Quản trị\nPhòng Thanh tra Giáo dục\nKhoa\nKhoa Công nghệ Hoá\nKhoa Công nghệ may & TKTT\nKhoa Công nghệ thông tin\nKhoa Điện\nKhoa Điện tử\nKhoa Khoa học cơ bản\nKhoa Lý luận chính trị - Pháp luật\nTrung tâm Đào tạo\nTrung tâm Đào tạo Sau đại học\nTrung tâm Giáo dục thể chất và Thể thao\nTrung tâm Công nghệ Ô tô và Đào tạo lái xe\nTrung tâm Công nghệ thông tin\nTrung tâm Việt Nhật\nTrung tâm Giáo dục Quốc phòng An ninh\nTrung tâm Dịch vụ\nTrung tâm Truyền thông & Quan hệ Công chúng\nTrạm Y tế\nTrung tâm Hỗ trợ Sinh viên\nTrung tâm Đảm bảo chất lượng\nTrung tâm Thông tin Thư viện\nTrung tâm khảo thí\nViện nghiên cứu\nCông ty Letco\nThư điện tử\nSitemap\nLiên hệ\nToggle navigation\nGIỚI THIỆU\nTHÔNG TIN CHUNG\nCƠ CẤU TỔ CHỨC\nCHIẾN LƯỢC PHÁT TRIỂN\nCÁN BỘ GIẢNG VIÊN\nCƠ SỞ VẬT CHẤT\nLIÊN HỆ\nĐÀO TẠO\nĐẠI HỌC\nKHOA HỌC MÁY TÍNH\nKỸ THUẬT PHẦN MỀM\nHỆ THỐNG THÔNG TIN\nCÔNG NGHỆ THÔNG TIN\nCÔNG NGHỆ ĐA PHƯƠNG TIỆN\nAN TOÀN THÔNG TIN\nSAU ĐẠI HỌC\nHỆ THỐNG THÔNG TIN\nKẾ HOẠCH\nTIẾN ĐỘ\nQUY CHẾ, BIỂU MẪU\nNGHIÊN CỨU KHOA HỌC\nCÔNG TRÌNH CÔNG BỐ\nĐỀ TÀI, DỰ ÁN\nSINH VIÊN NCKH\nTIN KHCN\nCÔNG TÁC SINH VIÊN\nQUY CHẾ\nGƯƠNG SÁNG SINH VIÊN\nHỌC BỔNG\nCÂU LẠC BỘ\nTHƯ VIỆN ẢNH\nTUYỂN DỤNG\nĐỀ TÀI, DỰ ÁN\nTRANG CHỦ > ĐỀ TÀI, DỰ ÁN\nNhiệm vụ khoa học công nghệ\nnext_contents:\n', 'content: Nhiệm vụ khoa học công nghệ\nTrang HaUI\nPhòng\nPhòng Tổ chức hành chính\nPhòng Đào tạo\nPhòng Công tác sinh viên\nPhòng Khoa học công nghệ\nPhòng hợp tác đối ngoại\nPhòng Tài chính kế toán\nPhòng Quản trị\nPhòng Thanh tra Giáo dục\nKhoa\nKhoa Công nghệ Hoá\nKhoa Công nghệ may & TKTT\nKhoa Công nghệ thông tin\nKhoa Điện\nKhoa Điện tử\nKhoa Khoa học cơ bản\nKhoa Lý luận chính trị - Pháp luật\nTrung tâm Đào tạo\nTrung tâm Đào tạo Sau đại học\nTrung tâm Giáo dục thể chất và Thể thao\nTrung tâm Công nghệ Ô tô và Đào tạo lái xe\nTrung tâm Công nghệ thông tin\nTrung tâm Việt Nhật\nTrung tâm Giáo dục Quốc phòng An ninh\nTrung tâm Dịch vụ\nTrung tâm Truyền thông & Quan hệ Công chúng\nTrạm Y tế\nTrung tâm Hỗ trợ Sinh viên\nTrung tâm Đảm bảo chất lượng\nTrung tâm Thông tin Thư viện\nTrung tâm khảo thí\nViện nghiên cứu\nCông ty Letco\nThư điện tử\nSitemap\nLiên hệ\nToggle navigation\nGIỚI THIỆU\nTHÔNG TIN CHUNG\nCƠ CẤU TỔ CHỨC\nCHIẾN LƯỢC PHÁT TRIỂN\nCÁN BỘ GIẢNG VIÊN\nCƠ SỞ VẬT CHẤT\nLIÊN HỆ\nĐÀO TẠO\nĐẠI HỌC\nKHOA HỌC MÁY TÍNH\nKỸ THUẬT PHẦN MỀM\nHỆ THỐNG THÔNG TIN\nCÔNG NGHỆ THÔNG TIN\nCÔNG NGHỆ ĐA PHƯƠNG TIỆN\nAN TOÀN THÔNG TIN\nSAU ĐẠI HỌC\nHỆ THỐNG THÔNG TIN\nKẾ HOẠCH\nTIẾN ĐỘ\nQUY CHẾ, BIỂU MẪU\nNGHIÊN CỨU KHOA HỌC\nCÔNG TRÌNH CÔNG BỐ\nĐỀ TÀI, DỰ ÁN\nSINH VIÊN NCKH\nTIN KHCN\nCÔNG TÁC SINH VIÊN\nQUY CHẾ\nGƯƠNG SÁNG SINH VIÊN\nHỌC BỔNG\nCÂU LẠC BỘ\nTHƯ VIỆN ẢNH\nTUYỂN DỤNG\nĐỀ TÀI, DỰ ÁN\nTRANG CHỦ > ĐỀ TÀI, DỰ ÁN\nNhiệm vụ khoa học công nghệ\nnext_contents:\n', 'content: Đề tài, dự án- KHOA CÔNG NGHỆ THÔNG TIN - ĐẠI HỌC CÔNG NGHIỆP HÀ NỘI || HaUI\nTrang HaUI\nPhòng\nPhòng Tổ chức hành chính\nPhòng Đào tạo\nPhòng Công tác sinh viên\nPhòng Khoa học công nghệ\nPhòng hợp tác đối ngoại\nPhòng Tài chính kế toán\nPhòng Quản trị\nPhòng Thanh tra Giáo dục\nKhoa\nKhoa Công nghệ Hoá\nKhoa Công nghệ may & TKTT\nKhoa Công nghệ thông tin\nKhoa Điện\nKhoa Điện tử\nKhoa Khoa học cơ bản\nKhoa Lý luận chính trị - Pháp luật\nTrung tâm Đào tạo\nTrung tâm Đào tạo Sau đại học\nTrung tâm Giáo dục thể chất và Thể thao\nTrung tâm Công nghệ Ô tô và Đào tạo lái xe\nTrung tâm Công nghệ thông tin\nTrung tâm Việt Nhật\nTrung tâm Giáo dục Quốc phòng An ninh\nTrung tâm Dịch vụ\nTrung tâm Truyền thông & Quan hệ Công chúng\nTrạm Y tế\nTrung tâm Hỗ trợ Sinh viên\nTrung tâm Đảm bảo chất lượng\nTrung tâm Thông tin Thư viện\nTrung tâm khảo thí\nViện nghiên cứu\nCông ty Letco\nThư điện tử\nSitemap\nLiên hệ\nToggle navigation\nGIỚI THIỆU\nTHÔNG TIN CHUNG\nCƠ CẤU TỔ CHỨC\nCHIẾN LƯỢC PHÁT TRIỂN\nCÁN BỘ GIẢNG VIÊN\nCƠ SỞ VẬT CHẤT\nLIÊN HỆ\nĐÀO TẠO\nĐẠI HỌC\nKHOA HỌC MÁY TÍNH\nKỸ THUẬT PHẦN MỀM\nHỆ THỐNG THÔNG TIN\nCÔNG NGHỆ THÔNG TIN\nCÔNG NGHỆ ĐA PHƯƠNG TIỆN\nAN TOÀN THÔNG TIN\nSAU ĐẠI HỌC\nHỆ THỐNG THÔNG TIN\nKẾ HOẠCH\nTIẾN ĐỘ\nQUY CHẾ, BIỂU MẪU\nNGHIÊN CỨU KHOA HỌC\nCÔNG TRÌNH CÔNG BỐ\nĐỀ TÀI, DỰ ÁN\nSINH VIÊN NCKH\nTIN KHCN\nCÔNG TÁC SINH VIÊN\nQUY CHẾ\nGƯƠNG SÁNG SINH VIÊN\nHỌC BỔNG\nCÂU LẠC BỘ\nTHƯ VIỆN ẢNH\nTUYỂN DỤNG\nĐỀ TÀI, DỰ ÁN\nTRANG CHỦ > ĐỀ TÀI, DỰ ÁN\nGiáo trình\nThứ Bảy, 21:22 11/12/2021\nXem thêm\nNhiệm vụ khoa học công nghệ\nThứ Sáu, 13:55 10/12/2021\nXem thêm\n1\nTin tiêu điểm\nSinh viên Khóa 19 Khoa Công nghệ thông tin đạt Học bổng HaUI 100% toàn khóa học.\nThứ Sáu, 11:07 20/09/2024\nnext_contents:\n', 'content: Đề tài, dự án- KHOA CÔNG NGHỆ THÔNG TIN - ĐẠI HỌC CÔNG NGHIỆP HÀ NỘI || HaUI\nTrang HaUI\nPhòng\nPhòng Tổ chức hành chính\nPhòng Đào tạo\nPhòng Công tác sinh viên\nPhòng Khoa học công nghệ\nPhòng hợp tác đối ngoại\nPhòng Tài chính kế toán\nPhòng Quản trị\nPhòng Thanh tra Giáo dục\nKhoa\nKhoa Công nghệ Hoá\nKhoa Công nghệ may & TKTT\nKhoa Công nghệ thông tin\nKhoa Điện\nKhoa Điện tử\nKhoa Khoa học cơ bản\nKhoa Lý luận chính trị - Pháp luật\nTrung tâm Đào tạo\nTrung tâm Đào tạo Sau đại học\nTrung tâm Giáo dục thể chất và Thể thao\nTrung tâm Công nghệ Ô tô và Đào tạo lái xe\nTrung tâm Công nghệ thông tin\nTrung tâm Việt Nhật\nTrung tâm Giáo dục Quốc phòng An ninh\nTrung tâm Dịch vụ\nTrung tâm Truyền thông & Quan hệ Công chúng\nTrạm Y tế\nTrung tâm Hỗ trợ Sinh viên\nTrung tâm Đảm bảo chất lượng\nTrung tâm Thông tin Thư viện\nTrung tâm khảo thí\nViện nghiên cứu\nCông ty Letco\nThư điện tử\nSitemap\nLiên hệ\nToggle navigation\nGIỚI THIỆU\nTHÔNG TIN CHUNG\nCƠ CẤU TỔ CHỨC\nCHIẾN LƯỢC PHÁT TRIỂN\nCÁN BỘ GIẢNG VIÊN\nCƠ SỞ VẬT CHẤT\nLIÊN HỆ\nĐÀO TẠO\nĐẠI HỌC\nKHOA HỌC MÁY TÍNH\nKỸ THUẬT PHẦN MỀM\nHỆ THỐNG THÔNG TIN\nCÔNG NGHỆ THÔNG TIN\nCÔNG NGHỆ ĐA PHƯƠNG TIỆN\nAN TOÀN THÔNG TIN\nSAU ĐẠI HỌC\nHỆ THỐNG THÔNG TIN\nKẾ HOẠCH\nTIẾN ĐỘ\nQUY CHẾ, BIỂU MẪU\nNGHIÊN CỨU KHOA HỌC\nCÔNG TRÌNH CÔNG BỐ\nĐỀ TÀI, DỰ ÁN\nSINH VIÊN NCKH\nTIN KHCN\nCÔNG TÁC SINH VIÊN\nQUY CHẾ\nGƯƠNG SÁNG SINH VIÊN\nHỌC BỔNG\nCÂU LẠC BỘ\nTHƯ VIỆN ẢNH\nTUYỂN DỤNG\nĐỀ TÀI, DỰ ÁN\nTRANG CHỦ > ĐỀ TÀI, DỰ ÁN\nGiáo trình\nThứ Bảy, 21:22 11/12/2021\nXem thêm\nNhiệm vụ khoa học công nghệ\nThứ Sáu, 13:55 10/12/2021\nXem thêm\n1\nTin tiêu điểm\nSinh viên Khóa 19 Khoa Công nghệ thông tin đạt Học bổng HaUI 100% toàn khóa học.\nThứ Sáu, 11:07 20/09/2024\nnext_contents:\n']","['Khoa Công nghệ thông tin - ĐẠI HỌC CÔNG NGHIỆP HÀ NỘI || HaUI Trang HaUI Phòng Phòng Tổ chức hành chính Phòng Đào tạo Phòng Công tác sinh viên Phòng Khoa học công nghệ Phòng hợp tác đối ngoại Phòng Tài chính kế toán Phòng Quản trị Phòng Thanh tra Giáo dục Khoa Khoa Công nghệ Hoá Khoa Công nghệ may & TKTT Khoa Công nghệ thông tin Khoa Điện Khoa Điện tử Khoa Khoa học cơ bản Khoa Lý luận chính trị - Pháp luật Trung tâm Đào tạo Trung tâm Đào tạo Sau đại học Trung tâm Giáo dục thể chất và Thể thao Trung tâm Công nghệ Ô tô và Đào tạo lái xe Trung tâm Công nghệ thông tin Trung tâm Việt Nhật Trung tâm Giáo dục Quốc phòng An ninh Trung tâm Dịch vụ Trung tâm Truyền thông & Quan hệ Công chúng Trạm Y tế Trung tâm Hỗ trợ Sinh viên Trung tâm Đảm bảo chất lượng Trung tâm Thông tin Thư viện Trung tâm khảo thí Viện nghiên cứu Công ty Letco Thư điện tử Sitemap Liên hệ Toggle navigation GIỚI THIỆU THÔNG TIN CHUNG CƠ CẤU TỔ CHỨC CHIẾN LƯỢC PHÁT TRIỂN CÁN BỘ GIẢNG VIÊN CƠ SỞ VẬT CHẤT LIÊN HỆ ĐÀO TẠO ĐẠI HỌC KHOA HỌC MÁY TÍNH KỸ THUẬT PHẦN MỀM HỆ THỐNG THÔNG TIN CÔNG NGHỆ THÔNG TIN CÔNG NGHỆ ĐA PHƯƠNG TIỆN AN TOÀN THÔNG TIN SAU ĐẠI HỌC HỆ THỐNG THÔNG TIN KẾ HOẠCH TIẾN ĐỘ QUY CHẾ, BIỂU MẪU NGHIÊN CỨU KHOA HỌC CÔNG TRÌNH CÔNG BỐ ĐỀ TÀI, DỰ ÁN SINH VIÊN NCKH TIN KHCN ']","Tôi không có thông tin này và khuyến nghị bạn tham khảo nguồn khác. Nếu bạn có câu hỏi nào liên quan đến khoa Công nghệ Thông tin tại trường Đại học Công nghiệp Hà Nội, hãy cho tôi biết!","Khoa Công nghệ Hoá là một trong những khoa tại Đại học Công nghiệp Hà Nội, nhưng thông tin chi tiết về chất lượng đào tạo, cơ hội việc làm hay hỗ trợ sinh viên không được đề cập trong ngữ cảnh.",0.0,1.0,0.0,0.0,0.8675978179045554,0.8697507381439209,2.767097234725952
1,Khóa 21 của Khoa Công nghệ thông tin tại Đại học Công nghiệp Hà Nội có những thông tin gì đáng chú ý?,"['content: Chiến lược Khoa Công nghệ thông tin giai đoạn 2021-2025, tầm nhìn 2030 - ĐẠI HỌC CÔNG NGHIỆP HÀ NỘI || HaUI\nTrang HaUI\nPhòng\nPhòng Tổ chức hành chính\nPhòng Đào tạo\nPhòng Công tác sinh viên\nPhòng Khoa học công nghệ\nPhòng hợp tác đối ngoại\nPhòng Tài chính kế toán\nPhòng Quản trị\nPhòng Thanh tra Giáo dục\nKhoa\nKhoa Công nghệ Hoá\nKhoa Công nghệ may & TKTT\nKhoa Công nghệ thông tin\nKhoa Điện\nKhoa Điện tử\nKhoa Khoa học cơ bản\nKhoa Lý luận chính trị - Pháp luật\nTrung tâm Đào tạo\nTrung tâm Đào tạo Sau đại học\nTrung tâm Giáo dục thể chất và Thể thao\nTrung tâm Công nghệ Ô tô và Đào tạo lái xe\nTrung tâm Công nghệ thông tin\nTrung tâm Việt Nhật\nTrung tâm Giáo dục Quốc phòng An ninh\nTrung tâm Dịch vụ\nTrung tâm Truyền thông & Quan hệ Công chúng\nTrạm Y tế\nTrung tâm Hỗ trợ Sinh viên\nTrung tâm Đảm bảo chất lượng\nTrung tâm Thông tin Thư viện\nTrung tâm khảo thí\nViện nghiên cứu\nCông ty Letco\nThư điện tử\nSitemap\nLiên hệ\nToggle navigation\nGIỚI THIỆU\nTHÔNG TIN CHUNG\nCƠ CẤU TỔ CHỨC\nCHIẾN LƯỢC PHÁT TRIỂN\nCÁN BỘ GIẢNG VIÊN\nCƠ SỞ VẬT CHẤT\nLIÊN HỆ\nĐÀO TẠO\nĐẠI HỌC\nKHOA HỌC MÁY TÍNH\nKỸ THUẬT PHẦN MỀM\nHỆ THỐNG THÔNG TIN\nCÔNG NGHỆ THÔNG TIN\nCÔNG NGHỆ ĐA PHƯƠNG TIỆN\nAN TOÀN THÔNG TIN\nSAU ĐẠI HỌC\nHỆ THỐNG THÔNG TIN\nKẾ HOẠCH\nTIẾN ĐỘ\nQUY CHẾ, BIỂU MẪU\nNGHIÊN CỨU KHOA HỌC\nCÔNG TRÌNH CÔNG BỐ\nĐỀ TÀI, DỰ ÁN\nSINH VIÊN NCKH\nTIN KHCN\nCÔNG TÁC SINH VIÊN\nQUY CHẾ\nGƯƠNG SÁNG SINH VIÊN\nHỌC BỔNG\nCÂU LẠC BỘ\nTHƯ VIỆN ẢNH\nTUYỂN DỤNG\nChiến lược phát triển\nTin tiêu điểm\nSinh viên Khóa 19 Khoa Công nghệ thông tin đạt Học bổng HaUI 100% toàn khóa học.\nThứ Sáu, 11:07 20/09/2024\nĐội bóng khoa Công nghệ thông tin cùng những trận cầu đáng nhớ\nThứ Bảy, 10:00 23/07/2022\nĐại hội đại biểu Liên chi Đoàn khoa Công nghệ thông tin lần thứ X, nhiệm kỳ 2022 - 2024\nThứ Hai, 15:00 18/04/2022\nnext_contents:\n', 'content: Chiến lược Khoa Công nghệ thông tin giai đoạn 2021-2025, tầm nhìn 2030 - ĐẠI HỌC CÔNG NGHIỆP HÀ NỘI || HaUI\nTrang HaUI\nPhòng\nPhòng Tổ chức hành chính\nPhòng Đào tạo\nPhòng Công tác sinh viên\nPhòng Khoa học công nghệ\nPhòng hợp tác đối ngoại\nPhòng Tài chính kế toán\nPhòng Quản trị\nPhòng Thanh tra Giáo dục\nKhoa\nKhoa Công nghệ Hoá\nKhoa Công nghệ may & TKTT\nKhoa Công nghệ thông tin\nKhoa Điện\nKhoa Điện tử\nKhoa Khoa học cơ bản\nKhoa Lý luận chính trị - Pháp luật\nTrung tâm Đào tạo\nTrung tâm Đào tạo Sau đại học\nTrung tâm Giáo dục thể chất và Thể thao\nTrung tâm Công nghệ Ô tô và Đào tạo lái xe\nTrung tâm Công nghệ thông tin\nTrung tâm Việt Nhật\nTrung tâm Giáo dục Quốc phòng An ninh\nTrung tâm Dịch vụ\nTrung tâm Truyền thông & Quan hệ Công chúng\nTrạm Y tế\nTrung tâm Hỗ trợ Sinh viên\nTrung tâm Đảm bảo chất lượng\nTrung tâm Thông tin Thư viện\nTrung tâm khảo thí\nViện nghiên cứu\nCông ty Letco\nThư điện tử\nSitemap\nLiên hệ\nToggle navigation\nGIỚI THIỆU\nTHÔNG TIN CHUNG\nCƠ CẤU TỔ CHỨC\nCHIẾN LƯỢC PHÁT TRIỂN\nCÁN BỘ GIẢNG VIÊN\nCƠ SỞ VẬT CHẤT\nLIÊN HỆ\nĐÀO TẠO\nĐẠI HỌC\nKHOA HỌC MÁY TÍNH\nKỸ THUẬT PHẦN MỀM\nHỆ THỐNG THÔNG TIN\nCÔNG NGHỆ THÔNG TIN\nCÔNG NGHỆ ĐA PHƯƠNG TIỆN\nAN TOÀN THÔNG TIN\nSAU ĐẠI HỌC\nHỆ THỐNG THÔNG TIN\nKẾ HOẠCH\nTIẾN ĐỘ\nQUY CHẾ, BIỂU MẪU\nNGHIÊN CỨU KHOA HỌC\nCÔNG TRÌNH CÔNG BỐ\nĐỀ TÀI, DỰ ÁN\nSINH VIÊN NCKH\nTIN KHCN\nCÔNG TÁC SINH VIÊN\nQUY CHẾ\nGƯƠNG SÁNG SINH VIÊN\nHỌC BỔNG\nCÂU LẠC BỘ\nTHƯ VIỆN ẢNH\nTUYỂN DỤNG\nChiến lược phát triển\nTin tiêu điểm\nSinh viên Khóa 19 Khoa Công nghệ thông tin đạt Học bổng HaUI 100% toàn khóa học.\nThứ Sáu, 11:07 20/09/2024\nĐội bóng khoa Công nghệ thông tin cùng những trận cầu đáng nhớ\nThứ Bảy, 10:00 23/07/2022\nĐại hội đại biểu Liên chi Đoàn khoa Công nghệ thông tin lần thứ X, nhiệm kỳ 2022 - 2024\nThứ Hai, 15:00 18/04/2022\nnext_contents:\n', 'content: Lễ bảo vệ Luận văn Thạc sĩ ngành Hệ thống Thông tin Khóa 12 đợt 1&2\nThứ Sáu, 16:01 20/12/2024\nSeminar ""Chuỗi bài giảng về Hệ mờ và ứng dụng""\nThứ Tư, 11:25 18/12/2024\nChúc mừng Ban chủ nhiệm khóa 14 Câu lạc bộ Tin học HIT\nThứ Ba, 11:07 17/12/2024\nChúc mừng thành công Kỳ thi Olympic Tin học Sinh viên Việt Nam lần thứ 33 (OLP’24), Procon và Kỳ thi lập trình sinh viên quốc tế ICPC Asia Hanoi 2024\nThứ Ba, 10:00 17/12/2024\nViệt Nam xuất sắc giành 2 Huy chương Vàng tại ICPC Asia Hanoi 2024\nChủ Nhật, 05:57 15/12/2024\nTalk show đường đến doanh nghiệp\nThứ Ba, 11:49 31/12/2019\nSinh viên khoa Công nghệ thông tin tiếp tục giành học bổng STP năm 2019\nThứ Tư, 09:53 25/12/2019\nSinh viên khoa Công nghệ thông tin - ĐH Công nghiệp Hà Nội đạt giải tại Olympic Tin học sinh viên lần thứ 28\nThứ Tư, 09:49 25/12/2019\nNhiều doanh nghiệp tuyển dụng sinh viên khoa Công nghệ thông tin thực tập\nThứ Tư, 09:43 25/12/2019\nLễ kỉ niệm 20 năm thành lập khoa CNTT\nThứ Hai, 13:48 18/11/2019\nBản đồ chỉ dẫn\nTrường Đại học Công nghiệp Hà Nội\nTrụ sở chính\nSố 298 đường Cầu Diễn, quận Bắc Từ Liêm, Hà Nội\n+84 243 765 5121\nEmail: dhcnhn@haui.edu.vn\nCác cơ sở khác\nCơ sở 2: Phường Tây Tựu, quận Bắc Từ Liêm, Hà Nội\nCơ sở 3: Phường Lê Hồng Phong, thành phố Phủ Lý, Hà Nam\nLiên kết site\nTrường Đại học Công nghiệp Hà Nội\nThông tin tuyển sinh\nHành chính điện tử\nĐào tạo trực tuyến\nCổng thông tin đào tạo\nCopyright © 2018 Hanoi University of Industry.\nnext_contents:\n- Thứ Sáu, 08:02 06/03/2020\nTags:\nTweet\nCác bài đã đăng\n» Lễ bảo vệ Luận văn Thạc sĩ ngành Hệ thống Thông tin Khóa 12 đợt 1&2 (20/12/2024)\n» Seminar ""Chuỗi bài giảng về Hệ mờ và ứng dụng"" (18/12/2024)\n» Chúc mừng Ban chủ nhiệm khóa 14 Câu lạc bộ Tin học HIT (17/12/2024)\n» Chúc mừng thành công Kỳ thi Olympic Tin học Sinh viên Việt Nam lần thứ 33 (OLP’24), Procon và Kỳ thi lập trình sinh viên quốc tế ICPC Asia Hanoi 2024 (17/12/2024)\n» Việt Nam xuất sắc giành 2 Huy chương Vàng tại ICPC Asia Hanoi 2024 (15/12/2024)\n» Talk show đường đến doanh nghiệp (31/12/2019)\n» Sinh viên khoa Công nghệ thông tin tiếp tục giành học bổng STP năm 2019 (25/12/2019)\n» Sinh viên khoa Công nghệ thông tin - ĐH Công nghiệp Hà Nội đạt giải tại Olympic Tin học sinh viên lần thứ 28 (25/12/2019)\n» Nhiều doanh nghiệp tuyển dụng sinh viên khoa Công nghệ thông tin thực tập (25/12/2019)\n» Lễ kỉ niệm 20 năm thành lập khoa CNTT (18/11/2019)\nTin tiêu điểm\nSinh viên Khóa 19 Khoa Công nghệ thông tin đạt Học bổng HaUI 100% toàn khóa học.\nThứ Sáu, 11:07 20/09/2024\nĐội bóng khoa Công nghệ thông tin cùng những trận cầu đáng nhớ\nThứ Bảy, 10:00 23/07/2022\nĐại hội đại biểu Liên chi Đoàn khoa Công nghệ thông tin lần thứ X, nhiệm kỳ 2022 - 2024\nThứ Hai, 15:00 18/04/2022\nGặp mặt tân Sinh viên K15 khoa Công nghệ thông tin\nThứ Tư, 08:17 28/10/2020\nChương trình thực tập tại SVMC ""SVMC Internship Program 2020""\nThứ Sáu, 14:02 22/05/2020\nCác bài đã đăng\nLễ bảo vệ Luận văn Thạc sĩ ngành Hệ thống Thông tin Khóa 12 đợt 1&2\nThứ Sáu, 16:01 20/12/2024\nSeminar ""Chuỗi bài giảng về Hệ mờ và ứng dụng""\nThứ Tư, 11:25 18/12/2024\nChúc mừng Ban chủ nhiệm khóa 14 Câu lạc bộ Tin học HIT\nThứ Ba, 11:07 17/12/2024\n', 'content: Lễ bảo vệ Luận văn Thạc sĩ ngành Hệ thống Thông tin Khóa 12 đợt 1&2\nThứ Sáu, 16:01 20/12/2024\nSeminar ""Chuỗi bài giảng về Hệ mờ và ứng dụng""\nThứ Tư, 11:25 18/12/2024\nChúc mừng Ban chủ nhiệm khóa 14 Câu lạc bộ Tin học HIT\nThứ Ba, 11:07 17/12/2024\nChúc mừng thành công Kỳ thi Olympic Tin học Sinh viên Việt Nam lần thứ 33 (OLP’24), Procon và Kỳ thi lập trình sinh viên quốc tế ICPC Asia Hanoi 2024\nThứ Ba, 10:00 17/12/2024\nViệt Nam xuất sắc giành 2 Huy chương Vàng tại ICPC Asia Hanoi 2024\nChủ Nhật, 05:57 15/12/2024\nWorkshop chân dung ứng viên CNTT lý tưởng thời đại 4.0\nThứ Hai, 18:27 07/03/2022\nTọa đàm Trực tuyến Xu hướng, Thách thức và Cơ hội với sinh viên ngành CNTT\nThứ Hai, 11:39 07/03/2022\nKhai mạc khảo sát chính thức đánh giá chất lượng chương trình đào tạo ngành Hệ thống thông tin.\nThứ Ba, 07:54 18/01/2022\nHội thảo ""Deep Learning và ứng dụng""\nThứ Sáu, 21:10 14/01/2022\nNhiều sân chơi công nghệ hấp dẫn tại ""IT Festival 2021""\nChủ Nhật, 14:25 09/01/2022\nBản đồ chỉ dẫn\nTrường Đại học Công nghiệp Hà Nội\nTrụ sở chính\nSố 298 đường Cầu Diễn, quận Bắc Từ Liêm, Hà Nội\n+84 243 765 5121\nEmail: dhcnhn@haui.edu.vn\nCác cơ sở khác\nCơ sở 2: Phường Tây Tựu, quận Bắc Từ Liêm, Hà Nội\nCơ sở 3: Phường Lê Hồng Phong, thành phố Phủ Lý, Hà Nam\nLiên kết site\nTrường Đại học Công nghiệp Hà Nội\nThông tin tuyển sinh\nHành chính điện tử\nĐào tạo trực tuyến\nCổng thông tin đào tạo\nCopyright © 2018 Hanoi University of Industry.\nnext_contents:\n- Thứ Bảy, 21:17 12/03/2022\nTags:\nTweet\nCác bài đã đăng\n» Lễ bảo vệ Luận văn Thạc sĩ ngành Hệ thống Thông tin Khóa 12 đợt 1&2 (20/12/2024)\n» Seminar ""Chuỗi bài giảng về Hệ mờ và ứng dụng"" (18/12/2024)\n» Chúc mừng Ban chủ nhiệm khóa 14 Câu lạc bộ Tin học HIT (17/12/2024)\n» Chúc mừng thành công Kỳ thi Olympic Tin học Sinh viên Việt Nam lần thứ 33 (OLP’24), Procon và Kỳ thi lập trình sinh viên quốc tế ICPC Asia Hanoi 2024 (17/12/2024)\n» Việt Nam xuất sắc giành 2 Huy chương Vàng tại ICPC Asia Hanoi 2024 (15/12/2024)\n» Workshop chân dung ứng viên CNTT lý tưởng thời đại 4.0 (07/03/2022)\n» Tọa đàm Trực tuyến Xu hướng, Thách thức và Cơ hội với sinh viên ngành CNTT (07/03/2022)\n» Khai mạc khảo sát chính thức đánh giá chất lượng chương trình đào tạo ngành Hệ thống thông tin. (18/01/2022)\n» Hội thảo ""Deep Learning và ứng dụng"" (14/01/2022)\n» Nhiều sân chơi công nghệ hấp dẫn tại ""IT Festival 2021"" (09/01/2022)\nTin tiêu điểm\nSinh viên Khóa 19 Khoa Công nghệ thông tin đạt Học bổng HaUI 100% toàn khóa học.\nThứ Sáu, 11:07 20/09/2024\nĐội bóng khoa Công nghệ thông tin cùng những trận cầu đáng nhớ\nThứ Bảy, 10:00 23/07/2022\nĐại hội đại biểu Liên chi Đoàn khoa Công nghệ thông tin lần thứ X, nhiệm kỳ 2022 - 2024\nThứ Hai, 15:00 18/04/2022\nGặp mặt tân Sinh viên K15 khoa Công nghệ thông tin\nThứ Tư, 08:17 28/10/2020\nChương trình thực tập tại SVMC ""SVMC Internship Program 2020""\nThứ Sáu, 14:02 22/05/2020\nCác bài đã đăng\nLễ bảo vệ Luận văn Thạc sĩ ngành Hệ thống Thông tin Khóa 12 đợt 1&2\nThứ Sáu, 16:01 20/12/2024\nSeminar ""Chuỗi bài giảng về Hệ mờ và ứng dụng""\nThứ Tư, 11:25 18/12/2024\nChúc mừng Ban chủ nhiệm khóa 14 Câu lạc bộ Tin học HIT\nThứ Ba, 11:07 17/12/2024\n']","['LIÊN HỆ ĐÀO TẠO ĐẠI HỌC KHOA HỌC MÁY TÍNH KỸ THUẬT PHẦN MỀM HỆ THỐNG THÔNG TIN CÔNG NGHỆ THÔNG TIN CÔNG NGHỆ ĐA PHƯƠNG TIỆN AN TOÀN THÔNG TIN SAU ĐẠI HỌC HỆ THỐNG THÔNG TIN KẾ HOẠCH TIẾN ĐỘ QUY CHẾ, BIỂU MẪU NGHIÊN CỨU KHOA HỌC CÔNG TRÌNH CÔNG BỐ ĐỀ TÀI, DỰ ÁN SINH VIÊN NCKH TIN KHCN CÔNG TÁC SINH VIÊN QUY CHẾ GƯƠNG SÁNG SINH VIÊN HỌC BỔNG CÂU LẠC BỘ THƯ VIỆN ẢNH TUYỂN DỤNG Đia chỉ liên hệ Tin tiêu điểm Sinh viên Khóa 19 Khoa Công nghệ thông tin đạt Học bổng HaUI 100% toàn khóa học. Thứ Sáu, 11:07 20/09/2024 Đội bóng khoa Công nghệ thông tin cùng những trận cầu đáng nhớ Thứ Bảy, 10:00 23/07/2022 Đại hội đại biểu Liên chi Đoàn khoa Công nghệ thông tin lần thứ X, nhiệm kỳ 2022 - 2024 Thứ Hai, 15:00 18/04/2022 Gặp mặt tân Sinh viên K15 khoa Công nghệ thông tin Thứ Tư, 08:17 28/10/2020 Chương trình thực tập tại SVMC ""SVMC Internship Program 2020"" Thứ Sáu, 14:02 22/05/2020 Lịch giảng dạy môn Pháp Luật tuần từ 20/4 đến 26/4/2020 Hệ Cao đẳng khóa 21 Thứ Sáu, 15:05 17/04/2020 Danh sách các lớp học trực tuyến từ ngày 06/4/2020 đến ngày 19/4/2020 Thứ Bảy, 12:42 04/04/2020 Danh sách các lớp học trực tuyến từ ngày 30/3/2020 đến ngày 5/4/2020 Thứ Bảy, 14:46 28/03/2020 Kế hoạch tổ chức hoạt động dạy học tuần từ 23/03/2020 đến 05/04/2020 khoa CNTT Thứ Hai, 09:03 23/03/2020 Đội HaUI.NotTrashCar đạt giải nhì vòng sơ loại, giành quyền bước vào vòng bán kết cuộc đua số khu vực miền Bắc năm 2020 Thứ Sáu, 08:02 06/03/2020 Khoa Công nghệ thông tin - Văn phòng khoa: Tầng 6, nhà A1, Số 298 đường Cầu Diễn, Phường Minh Khai, Quận Bắc Từ Liêm, Thành Phố Hà Nội.Điện thoại: 043. 7655121. Số nội bộ 253.- Văn phòng các bộ môn:+ Bộ môn Công nghệ phần mềm: Tầng 6, nhà A1, Số 298 đường Cầu Diễn, Phường Minh Khai, Quận Bắc Từ Liêm, Thành Phố Hà Nội.+ Bộ môn Hệ thống thông tin: Tầng 6, nhà A1,Số 298 đường Cầu Diễn, Phường Minh Khai, Quận Bắc Từ Liêm, Thành Phố Hà Nội.+ Bộ môn Kỹ thuật và mạng máy tính: Tầng 7, nhà A1, Số 298 đường Cầu Diễn, Phường Minh Khai, Quận Bắc Từ Liêm, Thành Phố Hà Nội.+ Bộ môn Khoa học máy tính: Tầng 8, nhà A1, Số 298 đường Cầu Diễn, Phường Minh Khai, Quận Bắc Từ Liêm, Thành Phố Hà Nội.+ Bộ môn Công nghệ đa phương tiện: Tầng 9, nhà A1, Số 298 đường Cầu Diễn, Phường Minh Khai, Quận Bắc Từ Liêm, Thành Phố Hà Nội.+ Tổ Kỹ thuật hành chính: Tầng 7, nhà A1,Số 298 đường Cầu Diễn, Phường Minh Khai, Quận Bắc Từ Liêm, Thành Phố Hà Nội.- Thông tin về Khoa Công nghệ thông tin, Trường ĐHCNHN:Website: https://fit.haui.edu.vn/vn hoặc https://fit-haui.edu.vn/https://www.facebook.com/groups/k16.fit.hauiFacebook: https://www.facebook.com/FITHaUIBộ phận truyền thông FIT Media: https://www.facebook.com/fitmediahauiĐội Thanh niên tình nguyện khoa CNTT-HaUI: https://www.facebook.com/TNTNCNTTĐội nghệ thuật Khoa CNTT Istar-HaUI: https://www.facebook.com/ISTARHaUIĐội hỗ trợ kỹ thuật IT Supporter: https://www.facebook.com/ITSupport.HaUI Bản đồ chỉ dẫn Trường Đại học Công nghiệp Hà Nội Trụ sở chính Số 298 đường Cầu Diễn, quận Bắc Từ Liêm, Hà Nội +84 243 765 5121 Email: dhcnhn@haui.edu.vn Các cơ sở khác Cơ sở 2: Phường Tây Tựu, quận Bắc Từ Liêm, Hà Nội Cơ sở 3: Phường Lê Hồng Phong, thành phố Phủ Lý, Hà Nam Liên kết site Trường Đại học Công nghiệp Hà Nội Thông tin tuyển sinh Hành chính điện tử Đào tạo trực tuyến Cổng thông tin đào tạo Copyright © 2018 Hanoi University of Industry.']","Tôi không có thông tin cụ thể về Khóa 21 của Khoa Công nghệ thông tin tại Đại học Công nghiệp Hà Nội. Tôi khuyến nghị bạn tham khảo thêm thông tin từ trang web chính thức của khoa hoặc liên hệ với bộ phận hỗ trợ sinh viên để có thông tin chi tiết hơn.

Nếu bạn có câu hỏi khác hoặc cần thông tin về các chủ đề liên quan, hãy cho tôi biết!","Khóa 21 của Khoa Công nghệ thông tin tại Đại học Công nghiệp Hà Nội có nhiều thông tin đáng chú ý, bao gồm các hoạt động học tập, chương trình thực tập, và các cơ hội học bổng. Sinh viên Khóa 19 đã đạt Học bổng HaUI 100% toàn khóa học. Khoa cũng tổ chức các hoạt động như đội bóng và các sự kiện giao lưu cho sinh viên.",0.999999999975,0.6666666666666666,0.25,0.0,0.9160795724511889,1.0315649509429932,5.266010284423828
2,Khoa Điện tại Đại học Công nghiệp Hà Nội có những đặc điểm gì nổi bật về chất lượng đào tạo và cơ hội việc làm cho sinh viên?,"['content: tác với doanh nghiệp;+ 20% học phần chuyên ngành có chuyên gia từ doanh nghiệp, giảng viên nước ngoài giảng dạy.+ Hàng năm tổ chức tối thiểu 10 hội thảo chuyên môn, định hướng nghề nghiệp và kỹ năng làm việc cho sinh viên.+ Kết nối tìm kiếm các cơ hội thực tập, việc làm cho sinh viên: 100 thông báo tuyển dụng, 1000 vị trí việc làm hàng năm.Đa dạng hóa, từng bước nâng cao chất lượng hoạt động hỗ trợ người học:+ Có 8-10 câu lạc bộ sinh viên, trong đó 6-8 câu lạc bộ học thuật.+ 100% SV được tư vấn nghề nghiệp từ năm 2 bởi chuyên gia ngoài doanh nghiệp.+ Duy trì và đổi mới các hoạt động của tuần lễ CNTT – IT Festival để thu hút sinh viên và doanh nghiệp tham gia.Giải phápGiải pháp hoạt động đào tạo- Áp dụng quy trình CDIO trong hoạt động phát triển và vận hành CTĐT. Nhân rộng và áp dụng đồng bộ các kết quả của đề án ABET cho các chương trình đào tạo khác trong Khoa. Triển khai thường xuyên các hoạt động tự đánh giá CTĐT và điều chỉnh CTĐT đảm bảo đáp ứng các yêu cầu của các tiêu chuẩn kiểm định chất lượng CTĐT trong nước và quốc tế.- Đẩy mạnh áp dụng phương pháp dạy học kết hợp, dạy học trực tuyến, dạy học theo dự án, dạy học có sự chia sẻ kinh nghiệm thực tiễn của các chuyên gia… nhằm phát huy vai trò chủ động tích cực của người học;- Triển khai có hiệu quả các hoạt động khảo thí trong đánh giá năng lực người học theo chuẩn đầu ra.- Ứng dụng công nghệ thông tin trong thu thập, phân tích dữ liệu phục vụ quản lý đào tạo, nghiên cứu khoa học, phát triển thương hiệu.- Đẩy mạnh hoạt động hợp tác với doanh nghiệp trong phát triển và vận hành chương trình đào tạo. Tăng cường hoạt động của giảng viên và sinh viên ra ngoài doanh nghiệp, thúc đầy doanh nghiệp cùng tham gia quá trình đào tạo.Giải pháp hoạt động khoa học và công nghệ- Xây dựng các lab chủ chốt với quy mô tối thiểu 3 nhân sự giảng viên, 3-5 SV, HV và NCS, có cùng mục tiêu và động lực phát triển về khoa học và công nghệ.- Tăng cường kết nối các nhà khoa học của Khoa với các Khoa khác trong Trường, các cơ sở đào\nnext_contents:\n- hàng năm;+ 100% đề tài NCKH được ứng dụng trong quản lý và đào tạo;+ 40% đề tài NCKH có sinh viên, học viên cao học tham gia;+ 20% đề tài NCKH được chuyển giao cho các doanh nghiệp;+ Đến năm 2025 có 5 lab, trong đó có 2-3 lab với các nhóm nghiên cứu mạnh hoạt động trong các lĩnh vực liên ngành.Đội ngũ và cơ cấu tổ chức- Phát triển nguồn nhân lực đủ về số lượng, đảm bảo chất lượng đáp ứng các yêu cầu hoạt động đào tạo, nghiên cứu khoa học và phục vụ cộng đồng:+ >30% giảng viên có trình độ tiến sỹ.+ >75% giảng viên thực giảng được đào tạo, bồi dưỡng hàng năm.+ 100% giảng viên thực giảng tham gia thực tế tại doanh nghiệp 01 lần/năm.+ 100% giảng viên có báo cáo chuyên đề hàng năm.+ 100% giảng viên cơ hữu đạt yêu cầu về khối lượng giờ NCKH.Hình thành đội ngũ chuyên gia trong các ngành đào tạo: 02 giảng viên có học hàm PGS, 2-3 nhóm nghiên cứu mạnh.Cơ sở vật chất- 100% phòng thực hành của Khoa được quản lý tập trung, được quản trị qua máy chủ và cơ chế ảo hóa.- Có phòng máy chủ lưu trữ bài tập lớn, đồ án tốt nghiệp và các công trình nghiên cứu của giảng viên và sinh viên. Các sản phẩm có thể truy cập được từ xa, cho phép khai thác hiệu quả các tài nguyên số của Khoa.- Các phòng lab đáp ứng đủ nhu cầu nghiên cứu khoa học của giảng viên, tiến tới mỗi bộ môn sẽ có ít nhất 1 phòng lab chuyên sâu. Chất lượng máy móc, trang thiết bị và phần mềm đáp ứng tốt nhu cầu học tập, nghiên cứu của giảng viên và sinh viên.Các hoạt động khácĐẩy mạnh các họat động hợp tác và phát triển:+ Hợp tác thường xuyên với 50 doanh nghiệp, 50% có quy mô > 300 nhân sự;+ 50% sinh viên năm thứ 3, 4 đi tham quan, thực tập tại các doanh nghiệp;+ 40% GV tham gia các hội nghề nghiệp, 90% GV thực hiện kết nối, hợp tác với doanh nghiệp;+ 20% học phần chuyên ngành có chuyên gia từ doanh nghiệp, giảng viên nước ngoài giảng dạy.+ Hàng năm tổ chức tối thiểu 10 hội thảo chuyên môn, định hướng nghề nghiệp và kỹ năng làm việc cho sinh viên.+ Kết nối tìm kiếm các cơ hội thực tập, việc làm cho sinh viên: 100 thông báo\n', 'content: I. Quá trình hình thành và phát triểnSự hình thành và phát triển của Phòng Đào tạo gắn liền với thành tích hơn 125 năm xây dựng và phát triển Nhà trường về số lượng cán bộ, viên chức, về quy mô đào tạo và uy tín.II. Chức năng, nhiệm vụ* Chức năng- Phòng Đào tạo là đơn vị thuộc Trường Đại học Công nghiệp Hà Nội, có chức năng tham mưu và giúp việc cho Hiệu trưởng trong tổ chức, quản lý công tác xây dựng, phát triển chương trình đào tạo, tuyển sinh và đào tạo trình độ đại học, trình độ cao đẳng trong Nhà trường.* Nhiệm vụ- Tham mưu hoạch định chiến lược phát triển đào tạo;- Phối hợp với các đơn vị quản lý đào tạo trong Trường nghiên cứu và đề xuất với Hiệu trưởng và lãnh đạo Nhà trường về các mục tiêu và định hướng phát triển các chương trình đào tạo và các nguồn lực phục vụ đào tạo;- Tổ chức xây dựng và thực hiện các chương trình đào tạo chính quy, không chính quy;- Tham mưu và giúp Hiệu trưởng xây dựng chỉ tiêu, kế hoạch và tổ chức tuyển sinh đại học, cao đẳng theo quy định của Bộ Giáo dục và Đào tạo, Bộ Lao động - Thương binh và Xã hội.- Xây dựng kế hoạch năm học, thời khóa biểu cho các lớp học;- Tham mưu và giúp việc Hiệu trưởng xây dựng và tổ chức thực hiện các quy chế hoạt động, các thủ tục quy trình quản lý thuộc lĩnh vực giáo dục và đào tạo;III. Nhân sự* Ban lãnh đạoTrưởng phòng: TS. Thân Thanh SơnPhó trưởng Phòng: TS. Lê Anh ĐứcPhó trưởng phòng: TS. Vũ Việt ThắngIV. Những thành tích nổi bật- Đội ngũ cán bộ, nhân viên của Phòng có tinh thần trách nhiệm cao, năng lực chuyên môn vững vàng, nhiệt tình trong công tác, luôn hoàn thành tốt nhiệm vụ.- Nhiều năm đạt danh hiệu đơn vị lao động xuất sắc và được tặng thưởng nhiều giấy khen, bằng khen của Bộ Trưởng Bộ Công nghiệp, của Công Đoàn ngành Công nghiệp Việt Nam, của Tổng Liên đoàn Lao động Việt Nam.Phần thưởng cao quý bao gồm: 01 Huân chương Lao Động Hạng 3. 01 Bằng khen của Tổng Liên\nnext_contents:\n- Phòng Đào tạo\n', 'content: I. Quá trình hình thành và phát triểnSự hình thành và phát triển của Phòng Đào tạo gắn liền với thành tích hơn 125 năm xây dựng và phát triển Nhà trường về số lượng cán bộ, viên chức, về quy mô đào tạo và uy tín.II. Chức năng, nhiệm vụ* Chức năng- Phòng Đào tạo là đơn vị thuộc Trường Đại học Công nghiệp Hà Nội, có chức năng tham mưu và giúp việc cho Hiệu trưởng trong tổ chức, quản lý công tác xây dựng, phát triển chương trình đào tạo, tuyển sinh và đào tạo trình độ đại học, trình độ cao đẳng trong Nhà trường.* Nhiệm vụ- Tham mưu hoạch định chiến lược phát triển đào tạo;- Phối hợp với các đơn vị quản lý đào tạo trong Trường nghiên cứu và đề xuất với Hiệu trưởng và lãnh đạo Nhà trường về các mục tiêu và định hướng phát triển các chương trình đào tạo và các nguồn lực phục vụ đào tạo;- Tổ chức xây dựng và thực hiện các chương trình đào tạo chính quy, không chính quy;- Tham mưu và giúp Hiệu trưởng xây dựng chỉ tiêu, kế hoạch và tổ chức tuyển sinh đại học, cao đẳng theo quy định của Bộ Giáo dục và Đào tạo, Bộ Lao động - Thương binh và Xã hội.- Xây dựng kế hoạch năm học, thời khóa biểu cho các lớp học;- Tham mưu và giúp việc Hiệu trưởng xây dựng và tổ chức thực hiện các quy chế hoạt động, các thủ tục quy trình quản lý thuộc lĩnh vực giáo dục và đào tạo;III. Nhân sự* Ban lãnh đạoTrưởng phòng: TS. Thân Thanh SơnPhó trưởng Phòng: TS. Lê Anh ĐứcPhó trưởng phòng: TS. Vũ Việt ThắngIV. Những thành tích nổi bật- Đội ngũ cán bộ, nhân viên của Phòng có tinh thần trách nhiệm cao, năng lực chuyên môn vững vàng, nhiệt tình trong công tác, luôn hoàn thành tốt nhiệm vụ.- Nhiều năm đạt danh hiệu đơn vị lao động xuất sắc và được tặng thưởng nhiều giấy khen, bằng khen của Bộ Trưởng Bộ Công nghiệp, của Công Đoàn ngành Công nghiệp Việt Nam, của Tổng Liên đoàn Lao động Việt Nam.Phần thưởng cao quý bao gồm: 01 Huân chương Lao Động Hạng 3. 01 Bằng khen của Tổng Liên\nnext_contents:\n- Phòng Đào tạo\n', 'content: tác với doanh nghiệp;+ 20% học phần chuyên ngành có chuyên gia từ doanh nghiệp, giảng viên nước ngoài giảng dạy.+ Hàng năm tổ chức tối thiểu 10 hội thảo chuyên môn, định hướng nghề nghiệp và kỹ năng làm việc cho sinh viên.+ Kết nối tìm kiếm các cơ hội thực tập, việc làm cho sinh viên: 100 thông báo tuyển dụng, 1000 vị trí việc làm hàng năm.Đa dạng hóa, từng bước nâng cao chất lượng hoạt động hỗ trợ người học:+ Có 8-10 câu lạc bộ sinh viên, trong đó 6-8 câu lạc bộ học thuật.+ 100% SV được tư vấn nghề nghiệp từ năm 2 bởi chuyên gia ngoài doanh nghiệp.+ Duy trì và đổi mới các hoạt động của tuần lễ CNTT – IT Festival để thu hút sinh viên và doanh nghiệp tham gia.Giải phápGiải pháp hoạt động đào tạo- Áp dụng quy trình CDIO trong hoạt động phát triển và vận hành CTĐT. Nhân rộng và áp dụng đồng bộ các kết quả của đề án ABET cho các chương trình đào tạo khác trong Khoa. Triển khai thường xuyên các hoạt động tự đánh giá CTĐT và điều chỉnh CTĐT đảm bảo đáp ứng các yêu cầu của các tiêu chuẩn kiểm định chất lượng CTĐT trong nước và quốc tế.- Đẩy mạnh áp dụng phương pháp dạy học kết hợp, dạy học trực tuyến, dạy học theo dự án, dạy học có sự chia sẻ kinh nghiệm thực tiễn của các chuyên gia… nhằm phát huy vai trò chủ động tích cực của người học;- Triển khai có hiệu quả các hoạt động khảo thí trong đánh giá năng lực người học theo chuẩn đầu ra.- Ứng dụng công nghệ thông tin trong thu thập, phân tích dữ liệu phục vụ quản lý đào tạo, nghiên cứu khoa học, phát triển thương hiệu.- Đẩy mạnh hoạt động hợp tác với doanh nghiệp trong phát triển và vận hành chương trình đào tạo. Tăng cường hoạt động của giảng viên và sinh viên ra ngoài doanh nghiệp, thúc đầy doanh nghiệp cùng tham gia quá trình đào tạo.Giải pháp hoạt động khoa học và công nghệ- Xây dựng các lab chủ chốt với quy mô tối thiểu 3 nhân sự giảng viên, 3-5 SV, HV và NCS, có cùng mục tiêu và động lực phát triển về khoa học và công nghệ.- Tăng cường kết nối các nhà khoa học của Khoa với các Khoa khác trong Trường, các cơ sở đào\nnext_contents:\n- hàng năm;+ 100% đề tài NCKH được ứng dụng trong quản lý và đào tạo;+ 40% đề tài NCKH có sinh viên, học viên cao học tham gia;+ 20% đề tài NCKH được chuyển giao cho các doanh nghiệp;+ Đến năm 2025 có 5 lab, trong đó có 2-3 lab với các nhóm nghiên cứu mạnh hoạt động trong các lĩnh vực liên ngành.Đội ngũ và cơ cấu tổ chức- Phát triển nguồn nhân lực đủ về số lượng, đảm bảo chất lượng đáp ứng các yêu cầu hoạt động đào tạo, nghiên cứu khoa học và phục vụ cộng đồng:+ >30% giảng viên có trình độ tiến sỹ.+ >75% giảng viên thực giảng được đào tạo, bồi dưỡng hàng năm.+ 100% giảng viên thực giảng tham gia thực tế tại doanh nghiệp 01 lần/năm.+ 100% giảng viên có báo cáo chuyên đề hàng năm.+ 100% giảng viên cơ hữu đạt yêu cầu về khối lượng giờ NCKH.Hình thành đội ngũ chuyên gia trong các ngành đào tạo: 02 giảng viên có học hàm PGS, 2-3 nhóm nghiên cứu mạnh.Cơ sở vật chất- 100% phòng thực hành của Khoa được quản lý tập trung, được quản trị qua máy chủ và cơ chế ảo hóa.- Có phòng máy chủ lưu trữ bài tập lớn, đồ án tốt nghiệp và các công trình nghiên cứu của giảng viên và sinh viên. Các sản phẩm có thể truy cập được từ xa, cho phép khai thác hiệu quả các tài nguyên số của Khoa.- Các phòng lab đáp ứng đủ nhu cầu nghiên cứu khoa học của giảng viên, tiến tới mỗi bộ môn sẽ có ít nhất 1 phòng lab chuyên sâu. Chất lượng máy móc, trang thiết bị và phần mềm đáp ứng tốt nhu cầu học tập, nghiên cứu của giảng viên và sinh viên.Các hoạt động khácĐẩy mạnh các họat động hợp tác và phát triển:+ Hợp tác thường xuyên với 50 doanh nghiệp, 50% có quy mô > 300 nhân sự;+ 50% sinh viên năm thứ 3, 4 đi tham quan, thực tập tại các doanh nghiệp;+ 40% GV tham gia các hội nghề nghiệp, 90% GV thực hiện kết nối, hợp tác với doanh nghiệp;+ 20% học phần chuyên ngành có chuyên gia từ doanh nghiệp, giảng viên nước ngoài giảng dạy.+ Hàng năm tổ chức tối thiểu 10 hội thảo chuyên môn, định hướng nghề nghiệp và kỹ năng làm việc cho sinh viên.+ Kết nối tìm kiếm các cơ hội thực tập, việc làm cho sinh viên: 100 thông báo\n']","['Ngành Khoa học máy tính - ĐẠI HỌC CÔNG NGHIỆP HÀ NỘI || HaUI Trang HaUI Phòng Phòng Tổ chức hành chính Phòng Đào tạo Phòng Công tác sinh viên Phòng Khoa học công nghệ Phòng hợp tác đối ngoại Phòng Tài chính kế toán Phòng Quản trị Phòng Thanh tra Giáo dục Khoa Khoa Công nghệ Hoá Khoa Công nghệ may & TKTT Khoa Công nghệ thông tin Khoa Điện Khoa Điện tử Khoa Khoa học cơ bản Khoa Lý luận chính trị - Pháp luật Trung tâm Đào tạo Trung tâm Đào tạo Sau đại học Trung tâm Giáo dục thể chất và Thể thao Trung tâm Công nghệ Ô tô và Đào tạo lái xe Trung tâm Công nghệ thông tin Trung tâm Việt Nhật Trung tâm Giáo dục Quốc phòng An ninh Trung tâm Dịch vụ Trung tâm Truyền thông & Quan hệ Công chúng Trạm Y tế Trung tâm Hỗ trợ Sinh viên Trung tâm Đảm bảo chất lượng Trung tâm Thông tin Thư viện Trung tâm khảo thí Viện nghiên cứu Công ty Letco Thư điện tử Sitemap Liên hệ Toggle navigation GIỚI THIỆU THÔNG TIN CHUNG CƠ CẤU TỔ CHỨC CHIẾN LƯỢC PHÁT TRIỂN CÁN BỘ GIẢNG VIÊN CƠ SỞ VẬT CHẤT LIÊN HỆ ĐÀO TẠO ĐẠI HỌC KHOA HỌC MÁY TÍNH KỸ THUẬT PHẦN MỀM HỆ THỐNG THÔNG TIN CÔNG NGHỆ THÔNG TIN CÔNG NGHỆ ĐA PHƯƠNG TIỆN AN TOÀN THÔNG TIN SAU ĐẠI HỌC HỆ THỐNG THÔNG TIN KẾ HOẠCH TIẾN ĐỘ QUY CHẾ, BIỂU MẪU NGHIÊN CỨU KHOA HỌC CÔNG TRÌNH CÔNG BỐ ĐỀ TÀI, DỰ ÁN SINH VIÊN NCKH TIN KHCN ']","Tôi không có thông tin này và khuyến nghị bạn tham khảo nguồn khác. Nếu bạn có câu hỏi nào khác liên quan đến khoa công nghệ thông tin hoặc các hoạt động, chương trình đào tạo, đời sống sinh viên tại trường, hãy cho tôi biết!","Khoa Điện tại Đại học Công nghiệp Hà Nội là một trong những khoa chuyên ngành quan trọng, cung cấp chương trình đào tạo chất lượng cao. Sinh viên tốt nghiệp từ khoa này thường có nhiều cơ hội việc làm trong các lĩnh vực liên quan đến điện và điện tử, nhờ vào sự kết hợp giữa lý thuyết và thực hành trong quá trình học tập.",0.999999999975,1.0,0.25,0.0,0.8362498602290598,0.5561730861663818,2.078956127166748
3,Khoa Công nghệ Hoá tại Đại học Công nghiệp Hà Nội có những chương trình đào tạo và cơ hội nghề nghiệp nào cho sinh viên?,"['content: thu nhập cao"". Theo Tiến sĩ, Khoa Công nghệ thông tin Trường ĐH Công Nghiệp Hà Nội có 4 chuyên ngành công nghệ thông tin, khoa học máy tính, hệ thống thông tin, kỹ thuật phần mềm, nếu sinh viên năm thứ 3 có học lực khá thì ngay năm này có việc làm và có lương. Khoa có mục tiêu giúp sinh viên tiếp cận thực tế càng sớm càng tốt, tham gia nhiều dự án ngay ở năm 2.Về phía doanh nghiệp và cựu sinh viên chia sẻ: “Khoa CNTT Trường ĐH Công Nghiệp Hà Nội hướng đến đào tạo sinh viên có tính kỷ luật cao để có thể làm việc trong môi trường chuyên nghiệp. Bên cạnh đó là năng lực sáng tạo, các em được khuyến khích sáng tạo trong quá trình học tập. Trường gắn kết với doanh nghiệp, tạo cơ hội cho các em tiếp cận với thực tế”.Đại diện Doanh nghiệp chia sẻ về nhu cầu và cơ hội việc làm CNTT\nnext_contents:\n- Công nghệ thông tin là nhóm ngành đang có xu hướng phát triển, nhu cầu nhân lực rất cao và các chuyên gia lưu ý sinh viên học tốt, có năng lực sẽ được doanh nghiệp săn đón ngay khi còn ngồi ở ghế nhà trường. Đại dịch Covid 19 đang bước vào năm thứ 3, gây ảnh hưởng tất cả mọi lĩnh vực trong đời sống. Tuy nhiên, công nghệ thông tin (CNTT) lại là một trong những lĩnh vực phát triển mạnh với nhiều đột phá góp phần đổi thay cuộc sống.Vào tối ngày 8/6/2022, Khoa Công nghệ thông tin Trường Đại học Công Nghiệp Hà Nội kết hợp với một số doanh nghiệp đã tổ chức buổi livestream tư vấn trực tuyến nhóm ngành CNTT năm 2022. Tham dự buổi tư vấn có TS. Lê Văn Thái – Phó Trưởng phòng đào tạo Trường ĐH Công Nghiệp Hà Nội, TS. Đặng Trọng Hợp – Trưởng Khoa CNTT và đại diện doanh nghiệp FPT Software, cựu sinh viên Nguyễn Huy Du, các chuyên gia cung cấp cho thí sinh nhiều thông tin cụ thể về ngành học này khi trong giai đoạn sắp tới.Thí sinh có rất nhiều câu hỏi đặt ra cho Ban tổ chứcTiến sĩ Lê Văn Thái – Phó Trưởng phòng Đào tạo Trường ĐH Công Nghiệp Hà Nội, chia sẻ: ""CNTT là nhóm ngành hot và được dự đoán là ngành lâu dài trong tương lai, để đào tạo nhân lực chất lượng cao phục vụ cho các ngành nghề khác. Chẳng hạn, lập trình viên phải biết cách phát triển các sản phẩm CNTT để phục vụ những ngành nghề khác"". Tiến sỹ khẳng định sinh viên học tốt chắc chắn ra trường sẽ có việc làm. Tuy nhiên, lĩnh vực này khó nên sinh viên phải học chăm chỉ và cố gắng thì mới thành công, đòi hòi có năng lực thật sự và có kỹ năng nghề nghiệp.TS. Đặng Trọng Hợp – Trưởng khoa CNTT chia sẻ: ""CNTT là nhóm ngành đang có xu hướng phát triển và nhu cầu nhân lực rất cao và luôn nằm trong tốp đầu những ngành có lương và thu nhập cao"". Theo Tiến sĩ, Khoa Công nghệ thông tin Trường ĐH Công Nghiệp Hà Nội có 4 chuyên ngành công nghệ thông tin, khoa học máy tính, hệ thống thông tin, kỹ thuật phần mềm, nếu sinh viên năm thứ 3 có học lực khá thì ngay năm này có việc làm và có lương. Khoa có mục tiêu giúp sinh viên tiếp\n', 'content: thu nhập cao"". Theo Tiến sĩ, Khoa Công nghệ thông tin Trường ĐH Công Nghiệp Hà Nội có 4 chuyên ngành công nghệ thông tin, khoa học máy tính, hệ thống thông tin, kỹ thuật phần mềm, nếu sinh viên năm thứ 3 có học lực khá thì ngay năm này có việc làm và có lương. Khoa có mục tiêu giúp sinh viên tiếp cận thực tế càng sớm càng tốt, tham gia nhiều dự án ngay ở năm 2.Về phía doanh nghiệp và cựu sinh viên chia sẻ: “Khoa CNTT Trường ĐH Công Nghiệp Hà Nội hướng đến đào tạo sinh viên có tính kỷ luật cao để có thể làm việc trong môi trường chuyên nghiệp. Bên cạnh đó là năng lực sáng tạo, các em được khuyến khích sáng tạo trong quá trình học tập. Trường gắn kết với doanh nghiệp, tạo cơ hội cho các em tiếp cận với thực tế”.Đại diện Doanh nghiệp chia sẻ về nhu cầu và cơ hội việc làm CNTT\nnext_contents:\n- Công nghệ thông tin là nhóm ngành đang có xu hướng phát triển, nhu cầu nhân lực rất cao và các chuyên gia lưu ý sinh viên học tốt, có năng lực sẽ được doanh nghiệp săn đón ngay khi còn ngồi ở ghế nhà trường. Đại dịch Covid 19 đang bước vào năm thứ 3, gây ảnh hưởng tất cả mọi lĩnh vực trong đời sống. Tuy nhiên, công nghệ thông tin (CNTT) lại là một trong những lĩnh vực phát triển mạnh với nhiều đột phá góp phần đổi thay cuộc sống.Vào tối ngày 8/6/2022, Khoa Công nghệ thông tin Trường Đại học Công Nghiệp Hà Nội kết hợp với một số doanh nghiệp đã tổ chức buổi livestream tư vấn trực tuyến nhóm ngành CNTT năm 2022. Tham dự buổi tư vấn có TS. Lê Văn Thái – Phó Trưởng phòng đào tạo Trường ĐH Công Nghiệp Hà Nội, TS. Đặng Trọng Hợp – Trưởng Khoa CNTT và đại diện doanh nghiệp FPT Software, cựu sinh viên Nguyễn Huy Du, các chuyên gia cung cấp cho thí sinh nhiều thông tin cụ thể về ngành học này khi trong giai đoạn sắp tới.Thí sinh có rất nhiều câu hỏi đặt ra cho Ban tổ chứcTiến sĩ Lê Văn Thái – Phó Trưởng phòng Đào tạo Trường ĐH Công Nghiệp Hà Nội, chia sẻ: ""CNTT là nhóm ngành hot và được dự đoán là ngành lâu dài trong tương lai, để đào tạo nhân lực chất lượng cao phục vụ cho các ngành nghề khác. Chẳng hạn, lập trình viên phải biết cách phát triển các sản phẩm CNTT để phục vụ những ngành nghề khác"". Tiến sỹ khẳng định sinh viên học tốt chắc chắn ra trường sẽ có việc làm. Tuy nhiên, lĩnh vực này khó nên sinh viên phải học chăm chỉ và cố gắng thì mới thành công, đòi hòi có năng lực thật sự và có kỹ năng nghề nghiệp.TS. Đặng Trọng Hợp – Trưởng khoa CNTT chia sẻ: ""CNTT là nhóm ngành đang có xu hướng phát triển và nhu cầu nhân lực rất cao và luôn nằm trong tốp đầu những ngành có lương và thu nhập cao"". Theo Tiến sĩ, Khoa Công nghệ thông tin Trường ĐH Công Nghiệp Hà Nội có 4 chuyên ngành công nghệ thông tin, khoa học máy tính, hệ thống thông tin, kỹ thuật phần mềm, nếu sinh viên năm thứ 3 có học lực khá thì ngay năm này có việc làm và có lương. Khoa có mục tiêu giúp sinh viên tiếp\n', 'content: tháng đào tạo 🔸 Nâng cao trình độ tiếng Anh và phát triển các kỹ năng mềm.🔸 Môi trường làm việc chuyên nghiệp, cởi mở, khuyến khích nhân viên phát triển và sáng tạo 🔸 Được hỗ trợ chi phí đi lại và ăn trưa trong suốt quá trình đào tạo 🔸 Được cấp giấy chứng nhận sau khi hoàn thành khóa học Đối tượng tham gia: 🔸 Sinh viên năm cuối hoặc vừa mới tốt nghiệp Đại học, Cao đẳng, các viện đào tạo chuyên môn trong lĩnh vực Công nghệ thông tin/Khoa học Máy tính/Phần mềm/Kiểm thử Phần mềm/Hệ thống thông tin/…🔸 Tham gia đào tạo toàn thời gian trong vòng 3 tháng. Ưu tiên các ứng viên có thể bắt đầu làm việc toàn thời gian sau quá trình đào tạo🔸 Có kĩ năng giao tiếp Tiếng Anh khá 🔸 Ham học hỏi, thích nghiên cứu, tìm tòi, tìm hiểu công nghệ mới 🔸 Cam kết tuân thủ các quy định của chương trình đào tạo 🔸 Độc lập, chủ động trong công việc Địa điểm: tòa HiTC, 239 Xuân Thủy, Cầu Giấy, Hà NộiCòn chờ đợi gì mà không đăng ký ngay chỉ với 3 bước:1. Đăng ký tại đây: Link2. Làm bài kiểm tra năng lực và Phỏng vấn3. Nhận kết quảXem chi tiết về Rookie To Engineer: https://careers.nashtechglobal.com/fresher-program/Contact (Zalo): 0947834762 _ Ms. Nhu Pham _ Senior Talent Acquisition Executive at NashTech\nnext_contents:\n- [NASHTECH VIETNAM] CHƯƠNG TRÌNH ĐÀO TẠO IT FRESHERTHE ROOKIE TO ENGINEER 2025(.NET, AUTOMATIN TEST) – UPTO 17 TRIỆU ĐỒNGGiới thiệu công ty: NashTech là công ty thuộc tập đoàn NashSquared, có trụ sở chính tại Anh. NashTech là một trong những công ty công nghệ hàng đầu tại Việt Nam với bề dày kinh nghiệm trong việc tư vấn, cung ứng giải pháp công nghệ có quy mô toàn cầu cho nhiều khách hàng là những tập đoàn lớn như Ford, Google, Nestle, Honda, Prudential,…Với lịch sử hơn 24 năm phát triển tại Việt Nam cùng đội ngũ nhân lực hơn 2000 kỹ sư tài năm ở 03 trụ sở chính tại TP.Hồ Chí Minh, Hà Nội, Đà Nẵng; NashTech là một trong những doanh nghiệp góp phần thúc đẩy vị thế của Việt Nam trên bản đồ công nghệ thế giới, với 06 mảng kinh doanh chủ chốt, bao gồm:Dịch vụ Phát triển Xuất khẩu Phần mềm; Dịch vụ Tư vấn Giải pháp; Dịch vụ Giải pháp Quy trình Doanh nghiệp; Dịch vụ Bảo trì Phần mềm và Hỗ trợ Kỹ thuật; Dịch vụ Dữ liệu; Dịch vụ trải nghiệm kỹ thuật số. Giới thiệu về chương trình ROOKIE TO ENGINEER 2025 - BE READY TO EXCELRookie To Engineer 2025: Be ready to excel - Chương trình phát triển tài năng công nghệ dành riêng cho các sinh viên năm cuối hoặc mới tốt nghiệp đã khởi động mùa mới. Hãy nhanh tay nắm bắt cơ hội trở thành Software Engineer được chứng nhận bởi NashTech chỉ sau 3 tháng với offer lên đến 17 triệu đồng.Bạn quan tâm đến các vị trí chuyên môn:🔸.NET🔸 AUTE (Automation Test)Bạn đang tìm kiếm cơ hội:🔸 Trở thành Software Engineer/ Automation Test được chứng nhận bởi NashTech với offer hấp dẫn🔸 Được đào tạo kiến thức chuyên sâu từ các chuyên gia công nghệ tại NashTech với định hướng sự nghiệp rõ ràng.🔸 Được làm việc trong các dự án thực tế toàn cầu tại NashTech trong 3 tháng đào tạo 🔸 Nâng cao trình độ tiếng Anh và phát triển các kỹ năng mềm.🔸 Môi trường làm việc chuyên nghiệp, cởi mở, khuyến khích nhân viên phát triển và sáng tạo 🔸 Được hỗ trợ chi phí đi lại và ăn trưa trong suốt quá trình đào tạo 🔸 Được cấp giấy chứng nhận sau khi hoàn thành khóa học Đối tượng\n', 'content: tháng đào tạo 🔸 Nâng cao trình độ tiếng Anh và phát triển các kỹ năng mềm.🔸 Môi trường làm việc chuyên nghiệp, cởi mở, khuyến khích nhân viên phát triển và sáng tạo 🔸 Được hỗ trợ chi phí đi lại và ăn trưa trong suốt quá trình đào tạo 🔸 Được cấp giấy chứng nhận sau khi hoàn thành khóa học Đối tượng tham gia: 🔸 Sinh viên năm cuối hoặc vừa mới tốt nghiệp Đại học, Cao đẳng, các viện đào tạo chuyên môn trong lĩnh vực Công nghệ thông tin/Khoa học Máy tính/Phần mềm/Kiểm thử Phần mềm/Hệ thống thông tin/…🔸 Tham gia đào tạo toàn thời gian trong vòng 3 tháng. Ưu tiên các ứng viên có thể bắt đầu làm việc toàn thời gian sau quá trình đào tạo🔸 Có kĩ năng giao tiếp Tiếng Anh khá 🔸 Ham học hỏi, thích nghiên cứu, tìm tòi, tìm hiểu công nghệ mới 🔸 Cam kết tuân thủ các quy định của chương trình đào tạo 🔸 Độc lập, chủ động trong công việc Địa điểm: tòa HiTC, 239 Xuân Thủy, Cầu Giấy, Hà NộiCòn chờ đợi gì mà không đăng ký ngay chỉ với 3 bước:1. Đăng ký tại đây: Link2. Làm bài kiểm tra năng lực và Phỏng vấn3. Nhận kết quảXem chi tiết về Rookie To Engineer: https://careers.nashtechglobal.com/fresher-program/Contact (Zalo): 0947834762 _ Ms. Nhu Pham _ Senior Talent Acquisition Executive at NashTech\nnext_contents:\n- [NASHTECH VIETNAM] CHƯƠNG TRÌNH ĐÀO TẠO IT FRESHERTHE ROOKIE TO ENGINEER 2025(.NET, AUTOMATIN TEST) – UPTO 17 TRIỆU ĐỒNGGiới thiệu công ty: NashTech là công ty thuộc tập đoàn NashSquared, có trụ sở chính tại Anh. NashTech là một trong những công ty công nghệ hàng đầu tại Việt Nam với bề dày kinh nghiệm trong việc tư vấn, cung ứng giải pháp công nghệ có quy mô toàn cầu cho nhiều khách hàng là những tập đoàn lớn như Ford, Google, Nestle, Honda, Prudential,…Với lịch sử hơn 24 năm phát triển tại Việt Nam cùng đội ngũ nhân lực hơn 2000 kỹ sư tài năm ở 03 trụ sở chính tại TP.Hồ Chí Minh, Hà Nội, Đà Nẵng; NashTech là một trong những doanh nghiệp góp phần thúc đẩy vị thế của Việt Nam trên bản đồ công nghệ thế giới, với 06 mảng kinh doanh chủ chốt, bao gồm:Dịch vụ Phát triển Xuất khẩu Phần mềm; Dịch vụ Tư vấn Giải pháp; Dịch vụ Giải pháp Quy trình Doanh nghiệp; Dịch vụ Bảo trì Phần mềm và Hỗ trợ Kỹ thuật; Dịch vụ Dữ liệu; Dịch vụ trải nghiệm kỹ thuật số. Giới thiệu về chương trình ROOKIE TO ENGINEER 2025 - BE READY TO EXCELRookie To Engineer 2025: Be ready to excel - Chương trình phát triển tài năng công nghệ dành riêng cho các sinh viên năm cuối hoặc mới tốt nghiệp đã khởi động mùa mới. Hãy nhanh tay nắm bắt cơ hội trở thành Software Engineer được chứng nhận bởi NashTech chỉ sau 3 tháng với offer lên đến 17 triệu đồng.Bạn quan tâm đến các vị trí chuyên môn:🔸.NET🔸 AUTE (Automation Test)Bạn đang tìm kiếm cơ hội:🔸 Trở thành Software Engineer/ Automation Test được chứng nhận bởi NashTech với offer hấp dẫn🔸 Được đào tạo kiến thức chuyên sâu từ các chuyên gia công nghệ tại NashTech với định hướng sự nghiệp rõ ràng.🔸 Được làm việc trong các dự án thực tế toàn cầu tại NashTech trong 3 tháng đào tạo 🔸 Nâng cao trình độ tiếng Anh và phát triển các kỹ năng mềm.🔸 Môi trường làm việc chuyên nghiệp, cởi mở, khuyến khích nhân viên phát triển và sáng tạo 🔸 Được hỗ trợ chi phí đi lại và ăn trưa trong suốt quá trình đào tạo 🔸 Được cấp giấy chứng nhận sau khi hoàn thành khóa học Đối tượng\n']","['Khoa học máy tính - ĐẠI HỌC CÔNG NGHIỆP HÀ NỘI || HaUI Trang HaUI Phòng Phòng Tổ chức hành chính Phòng Đào tạo Phòng Công tác sinh viên Phòng Khoa học công nghệ Phòng hợp tác đối ngoại Phòng Tài chính kế toán Phòng Quản trị Phòng Thanh tra Giáo dục Khoa Khoa Công nghệ Hoá Khoa Công nghệ may & TKTT Khoa Công nghệ thông tin Khoa Điện Khoa Điện tử Khoa Khoa học cơ bản Khoa Lý luận chính trị - Pháp luật Trung tâm Đào tạo Trung tâm Đào tạo Sau đại học Trung tâm Giáo dục thể chất và Thể thao Trung tâm Công nghệ Ô tô và Đào tạo lái xe Trung tâm Công nghệ thông tin Trung tâm Việt Nhật Trung tâm Giáo dục Quốc phòng An ninh Trung tâm Dịch vụ Trung tâm Truyền thông & Quan hệ Công chúng Trạm Y tế Trung tâm Hỗ trợ Sinh viên Trung tâm Đảm bảo chất lượng Trung tâm Thông tin Thư viện Trung tâm khảo thí Viện nghiên cứu Công ty Letco Thư điện tử Sitemap Liên hệ Toggle navigation GIỚI THIỆU THÔNG TIN CHUNG CƠ CẤU TỔ CHỨC CHIẾN LƯỢC PHÁT TRIỂN CÁN BỘ GIẢNG VIÊN CƠ SỞ VẬT CHẤT LIÊN HỆ ĐÀO TẠO ĐẠI HỌC KHOA HỌC MÁY TÍNH KỸ THUẬT PHẦN MỀM HỆ THỐNG THÔNG TIN CÔNG NGHỆ THÔNG TIN CÔNG NGHỆ ĐA PHƯƠNG TIỆN AN TOÀN THÔNG TIN SAU ĐẠI HỌC HỆ THỐNG THÔNG TIN KẾ HOẠCH TIẾN ĐỘ QUY CHẾ, BIỂU MẪU NGHIÊN CỨU KHOA HỌC CÔNG TRÌNH CÔNG BỐ ĐỀ TÀI, DỰ ÁN SINH VIÊN NCKH TIN KHCN CÔNG TÁC SINH VIÊN QUY CHẾ GƯƠNG SÁNG SINH VIÊN HỌC BỔNG CÂU LẠC BỘ THƯ VIỆN ẢNH TUYỂN DỤNG Khoa học máy tính Tin tiêu điểm Sinh viên Khóa 19 Khoa Công nghệ thông tin đạt Học bổng HaUI 100% toàn khóa học. Thứ Sáu, 11:07 20/09/2024 Đội bóng khoa Công nghệ thông tin cùng những trận cầu đáng nhớ Thứ Bảy, 10:00 23/07/2022 Đại hội đại biểu Liên chi Đoàn khoa Công nghệ thông tin lần thứ X, nhiệm kỳ 2022 - 2024 Thứ Hai, 15:00 18/04/2022 Gặp mặt tân Sinh viên K15 khoa Công nghệ thông tin Thứ Tư, 08:17 28/10/2020 Chương trình thực tập tại SVMC ""SVMC Internship Program 2020"" Thứ Sáu, 14:02 22/05/2020 Lịch giảng dạy môn Pháp Luật tuần từ 20/4 đến 26/4/2020 Hệ Cao đẳng khóa 21 Thứ Sáu, 15:05 17/04/2020 Danh sách các lớp học trực tuyến từ ngày 06/4/2020 đến ngày 19/4/2020 Thứ Bảy, 12:42 04/04/2020 Danh sách các lớp học trực tuyến từ ngày 30/3/2020 đến ngày 5/4/2020 Thứ Bảy, 14:46 28/03/2020 Kế hoạch tổ chức hoạt động dạy học tuần từ 23/03/2020 đến 05/04/2020 khoa CNTT Thứ Hai, 09:03 23/03/2020 Đội HaUI.NotTrashCar đạt giải nhì vòng sơ loại, giành quyền bước vào vòng bán kết cuộc đua số khu vực miền Bắc năm 2020 Thứ Sáu, 08:02 06/03/2020 Ngành Khoa học máy tính 1. Mục tiêu Sinh viên tốt nghiệp từ chương trình Khoa học Máy tính có thể:- PEO 1: Phát triển các giải pháp kỹ thuật để thực hiện các công việc xây dựng, vận hành và quản lý trong lĩnh vực phát triển phần mềm;- PEO 2: Có kỹ năng giao tiếp, làm việc nhóm chuyên nghiệp cũng như khả năng giải quyết vấn đề trong môi trường làm việc đa quốc gia;- PEO 3: Thực hiện sự liêm chính và cam kết không ngừng cải tiến trong sáng tạo, nghiên cứu và phát triển nghề nghiệp.2. Chuẩn đầu ra chương trình đào tạo - SO1: Có khả năng phân tích vấn đề điện toán phức tạp và áp dụng các nguyên lý điện toán cũng như các lĩnh vực liên quan khác để xác định giải pháp- SO2: Có khả năng thiết kế, triển khai và đánh giá một giải pháp dựa trên nền tảng điện toán để đáp ứng các yêu cầu phù hợp với ngành khoa học máy tính- SO3: Có khả năng giao tiếp hiệu quả trong các môi trường làm việc khác nhau.- SO4: Nhận thức được trách nhiệm nghề nghiệp và đưa ra các đánh giá sáng suốt trong thực hành máy tính dựa trên các nguyên tắc pháp lý và đạo đức.- SO5: Có khả năng làm việc hiệu quả với vai trò là một thành viên hoặc người đứng đầu trong các nhóm kỹ thuật.- SO6: Có khả năng áp dụng lý thuyết khoa học máy tính và các nguyên tắc cơ bản về phát triển phần mềm để đề ra các giải pháp dựa trên điện toán.3. Chương trình khung các khóa ngành Khoa học máy tính- Chương trình khung ngành Khoa học máy tính khóa 19- Chương trình khung ngành Khoa học máy tính khóa 18- Chương trình khung ngành Khoa học máy tính khóa 17- Chương trình khung ngành Khoa học máy tính khóa 16- Chương trình khung ngành Khoa học máy tính khóa 15- Chương trình khung ngành Khoa học máy tính khóa 14- Chương trình khung ngành Khoa học máy tính khóa 13- Chương trình khung ngành Khoa học máy tính khóa 124. Bảng tổng hợp số liệu sinh viên nhập học và tốt nghiệp hằng nămNămNăm họcTuyển sinhCử nhân tốt nghiệp12022-20231306922021-202213710532020-20211529442019-202013912552018-2019125185 Bản đồ chỉ dẫn Trường Đại học Công nghiệp Hà Nội Trụ sở chính Số 298 đường Cầu Diễn, quận Bắc Từ Liêm, Hà Nội +84 243 765 5121 Email: dhcnhn@haui.edu.vn Các cơ sở khác Cơ sở 2: Phường Tây Tựu, quận Bắc Từ Liêm, Hà Nội Cơ sở 3: Phường Lê Hồng Phong, thành phố Phủ Lý, Hà Nam Liên kết site Trường Đại học Công nghiệp Hà Nội Thông tin tuyển sinh Hành chính điện tử Đào tạo trực tuyến Cổng thông tin đào tạo Copyright © 2018 Hanoi University of Industry.']","Tôi không có thông tin này và khuyến nghị bạn tham khảo nguồn khác để biết thêm chi tiết về chương trình đào tạo và cơ hội nghề nghiệp của Khoa Công nghệ Hóa tại Đại học Công nghiệp Hà Nội. Nếu bạn có câu hỏi khác liên quan đến Khoa Công nghệ Thông tin, tôi sẵn sàng hỗ trợ!","Khoa Công nghệ Hoá thuộc Đại học Công nghiệp Hà Nội là một trong những khoa đào tạo chuyên sâu về lĩnh vực công nghệ. Tuy nhiên, thông tin chi tiết về chương trình đào tạo và cơ hội nghề nghiệp cụ thể cho sinh viên Khoa Công nghệ Hoá không được đề cập trong ngữ cảnh đã cho.",0.0,0.5,0.3333333333333333,0.0,0.924840680127277,0.6647310256958008,3.266158103942871
4,Đội HaUI.NotTrashCar đã đạt được thành tích gì trong cuộc đua số khu vực miền Bắc năm 2020?,"['content: Đội bóng khoa Công nghệ thông tin cùng những trận cầu đáng nhớ\nThứ Bảy, 10:00 23/07/2022\nĐại hội đại biểu Liên chi Đoàn khoa Công nghệ thông tin lần thứ X, nhiệm kỳ 2022 - 2024\nThứ Hai, 15:00 18/04/2022\nGặp mặt tân Sinh viên K15 khoa Công nghệ thông tin\nThứ Tư, 08:17 28/10/2020\nChương trình thực tập tại SVMC ""SVMC Internship Program 2020""\nThứ Sáu, 14:02 22/05/2020\nLịch giảng dạy môn Pháp Luật tuần từ 20/4 đến 26/4/2020 Hệ Cao đẳng khóa 21\nThứ Sáu, 15:05 17/04/2020\nDanh sách các lớp học trực tuyến từ ngày 06/4/2020 đến ngày 19/4/2020\nThứ Bảy, 12:42 04/04/2020\nDanh sách các lớp học trực tuyến từ ngày 30/3/2020 đến ngày 5/4/2020\nThứ Bảy, 14:46 28/03/2020\nKế hoạch tổ chức hoạt động dạy học tuần từ 23/03/2020 đến 05/04/2020 khoa CNTT\nThứ Hai, 09:03 23/03/2020\nĐội HaUI.NotTrashCar đạt giải nhì vòng sơ loại, giành quyền bước vào vòng bán kết cuộc đua số khu vực miền Bắc năm 2020\nThứ Sáu, 08:02 06/03/2020\nnext_contents:\n- Ngành Khoa học máy tính - ĐẠI HỌC CÔNG NGHIỆP HÀ NỘI || HaUI\nTrang HaUI\nPhòng\nPhòng Tổ chức hành chính\nPhòng Đào tạo\nPhòng Công tác sinh viên\nPhòng Khoa học công nghệ\nPhòng hợp tác đối ngoại\nPhòng Tài chính kế toán\nPhòng Quản trị\nPhòng Thanh tra Giáo dục\nKhoa\nKhoa Công nghệ Hoá\nKhoa Công nghệ may & TKTT\nKhoa Công nghệ thông tin\nKhoa Điện\nKhoa Điện tử\nKhoa Khoa học cơ bản\nKhoa Lý luận chính trị - Pháp luật\nTrung tâm Đào tạo\nTrung tâm Đào tạo Sau đại học\nTrung tâm Giáo dục thể chất và Thể thao\nTrung tâm Công nghệ Ô tô và Đào tạo lái xe\nTrung tâm Công nghệ thông tin\nTrung tâm Việt Nhật\nTrung tâm Giáo dục Quốc phòng An ninh\nTrung tâm Dịch vụ\nTrung tâm Truyền thông & Quan hệ Công chúng\nTrạm Y tế\nTrung tâm Hỗ trợ Sinh viên\nTrung tâm Đảm bảo chất lượng\nTrung tâm Thông tin Thư viện\nTrung tâm khảo thí\nViện nghiên cứu\nCông ty Letco\nThư điện tử\nSitemap\nLiên hệ\nToggle navigation\nGIỚI THIỆU\nTHÔNG TIN CHUNG\nCƠ CẤU TỔ CHỨC\nCHIẾN LƯỢC PHÁT TRIỂN\nCÁN BỘ GIẢNG VIÊN\nCƠ SỞ VẬT CHẤT\nLIÊN HỆ\nĐÀO TẠO\nĐẠI HỌC\nKHOA HỌC MÁY TÍNH\nKỸ THUẬT PHẦN MỀM\nHỆ THỐNG THÔNG TIN\nCÔNG NGHỆ THÔNG TIN\nCÔNG NGHỆ ĐA PHƯƠNG TIỆN\nAN TOÀN THÔNG TIN\nSAU ĐẠI HỌC\nHỆ THỐNG THÔNG TIN\nKẾ HOẠCH\nTIẾN ĐỘ\nQUY CHẾ, BIỂU MẪU\nNGHIÊN CỨU KHOA HỌC\nCÔNG TRÌNH CÔNG BỐ\nĐỀ TÀI, DỰ ÁN\nSINH VIÊN NCKH\nTIN KHCN\nCÔNG TÁC SINH VIÊN\nQUY CHẾ\nGƯƠNG SÁNG SINH VIÊN\nHỌC BỔNG\nCÂU LẠC BỘ\nTHƯ VIỆN ẢNH\nTUYỂN DỤNG\nKhoa học máy tính\nTin tiêu điểm\nSinh viên Khóa 19 Khoa Công nghệ thông tin đạt Học bổng HaUI 100% toàn khóa học.\nThứ Sáu, 11:07 20/09/2024\nĐội bóng khoa Công nghệ thông tin cùng những trận cầu đáng nhớ\nThứ Bảy, 10:00 23/07/2022\nĐại hội đại biểu Liên chi Đoàn khoa Công nghệ thông tin lần thứ X, nhiệm kỳ 2022 - 2024\nThứ Hai, 15:00 18/04/2022\nGặp mặt tân Sinh viên K15 khoa Công nghệ thông tin\n', 'content: Đội bóng khoa Công nghệ thông tin cùng những trận cầu đáng nhớ\nThứ Bảy, 10:00 23/07/2022\nĐại hội đại biểu Liên chi Đoàn khoa Công nghệ thông tin lần thứ X, nhiệm kỳ 2022 - 2024\nThứ Hai, 15:00 18/04/2022\nGặp mặt tân Sinh viên K15 khoa Công nghệ thông tin\nThứ Tư, 08:17 28/10/2020\nChương trình thực tập tại SVMC ""SVMC Internship Program 2020""\nThứ Sáu, 14:02 22/05/2020\nLịch giảng dạy môn Pháp Luật tuần từ 20/4 đến 26/4/2020 Hệ Cao đẳng khóa 21\nThứ Sáu, 15:05 17/04/2020\nDanh sách các lớp học trực tuyến từ ngày 06/4/2020 đến ngày 19/4/2020\nThứ Bảy, 12:42 04/04/2020\nDanh sách các lớp học trực tuyến từ ngày 30/3/2020 đến ngày 5/4/2020\nThứ Bảy, 14:46 28/03/2020\nKế hoạch tổ chức hoạt động dạy học tuần từ 23/03/2020 đến 05/04/2020 khoa CNTT\nThứ Hai, 09:03 23/03/2020\nĐội HaUI.NotTrashCar đạt giải nhì vòng sơ loại, giành quyền bước vào vòng bán kết cuộc đua số khu vực miền Bắc năm 2020\nThứ Sáu, 08:02 06/03/2020\nnext_contents:\n- Ngành Công nghệ đa phương tiện - ĐẠI HỌC CÔNG NGHIỆP HÀ NỘI || HaUI\nTrang HaUI\nPhòng\nPhòng Tổ chức hành chính\nPhòng Đào tạo\nPhòng Công tác sinh viên\nPhòng Khoa học công nghệ\nPhòng hợp tác đối ngoại\nPhòng Tài chính kế toán\nPhòng Quản trị\nPhòng Thanh tra Giáo dục\nKhoa\nKhoa Công nghệ Hoá\nKhoa Công nghệ may & TKTT\nKhoa Công nghệ thông tin\nKhoa Điện\nKhoa Điện tử\nKhoa Khoa học cơ bản\nKhoa Lý luận chính trị - Pháp luật\nTrung tâm Đào tạo\nTrung tâm Đào tạo Sau đại học\nTrung tâm Giáo dục thể chất và Thể thao\nTrung tâm Công nghệ Ô tô và Đào tạo lái xe\nTrung tâm Công nghệ thông tin\nTrung tâm Việt Nhật\nTrung tâm Giáo dục Quốc phòng An ninh\nTrung tâm Dịch vụ\nTrung tâm Truyền thông & Quan hệ Công chúng\nTrạm Y tế\nTrung tâm Hỗ trợ Sinh viên\nTrung tâm Đảm bảo chất lượng\nTrung tâm Thông tin Thư viện\nTrung tâm khảo thí\nViện nghiên cứu\nCông ty Letco\nThư điện tử\nSitemap\nLiên hệ\nToggle navigation\nGIỚI THIỆU\nTHÔNG TIN CHUNG\nCƠ CẤU TỔ CHỨC\nCHIẾN LƯỢC PHÁT TRIỂN\nCÁN BỘ GIẢNG VIÊN\nCƠ SỞ VẬT CHẤT\nLIÊN HỆ\nĐÀO TẠO\nĐẠI HỌC\nKHOA HỌC MÁY TÍNH\nKỸ THUẬT PHẦN MỀM\nHỆ THỐNG THÔNG TIN\nCÔNG NGHỆ THÔNG TIN\nCÔNG NGHỆ ĐA PHƯƠNG TIỆN\nAN TOÀN THÔNG TIN\nSAU ĐẠI HỌC\nHỆ THỐNG THÔNG TIN\nKẾ HOẠCH\nTIẾN ĐỘ\nQUY CHẾ, BIỂU MẪU\nNGHIÊN CỨU KHOA HỌC\nCÔNG TRÌNH CÔNG BỐ\nĐỀ TÀI, DỰ ÁN\nSINH VIÊN NCKH\nTIN KHCN\nCÔNG TÁC SINH VIÊN\nQUY CHẾ\nGƯƠNG SÁNG SINH VIÊN\nHỌC BỔNG\nCÂU LẠC BỘ\nTHƯ VIỆN ẢNH\nTUYỂN DỤNG\nCông nghệ đa phương tiện\nTin tiêu điểm\nSinh viên Khóa 19 Khoa Công nghệ thông tin đạt Học bổng HaUI 100% toàn khóa học.\nThứ Sáu, 11:07 20/09/2024\nĐội bóng khoa Công nghệ thông tin cùng những trận cầu đáng nhớ\nThứ Bảy, 10:00 23/07/2022\nĐại hội đại biểu Liên chi Đoàn khoa Công nghệ thông tin lần thứ X, nhiệm kỳ 2022 - 2024\nThứ Hai, 15:00 18/04/2022\nGặp mặt tân Sinh viên K15 khoa Công nghệ thông tin\n', 'content: Đội bóng khoa Công nghệ thông tin cùng những trận cầu đáng nhớ\nThứ Bảy, 10:00 23/07/2022\nĐại hội đại biểu Liên chi Đoàn khoa Công nghệ thông tin lần thứ X, nhiệm kỳ 2022 - 2024\nThứ Hai, 15:00 18/04/2022\nGặp mặt tân Sinh viên K15 khoa Công nghệ thông tin\nThứ Tư, 08:17 28/10/2020\nChương trình thực tập tại SVMC ""SVMC Internship Program 2020""\nThứ Sáu, 14:02 22/05/2020\nLịch giảng dạy môn Pháp Luật tuần từ 20/4 đến 26/4/2020 Hệ Cao đẳng khóa 21\nThứ Sáu, 15:05 17/04/2020\nDanh sách các lớp học trực tuyến từ ngày 06/4/2020 đến ngày 19/4/2020\nThứ Bảy, 12:42 04/04/2020\nDanh sách các lớp học trực tuyến từ ngày 30/3/2020 đến ngày 5/4/2020\nThứ Bảy, 14:46 28/03/2020\nKế hoạch tổ chức hoạt động dạy học tuần từ 23/03/2020 đến 05/04/2020 khoa CNTT\nThứ Hai, 09:03 23/03/2020\nĐội HaUI.NotTrashCar đạt giải nhì vòng sơ loại, giành quyền bước vào vòng bán kết cuộc đua số khu vực miền Bắc năm 2020\nThứ Sáu, 08:02 06/03/2020\nnext_contents:\n- CƠ SỞ VẬT CHẤT KHOA CÔNG NGHỆ THÔNG TIN - ĐẠI HỌC CÔNG NGHIỆP HÀ NỘI || HaUI\nTrang HaUI\nPhòng\nPhòng Tổ chức hành chính\nPhòng Đào tạo\nPhòng Công tác sinh viên\nPhòng Khoa học công nghệ\nPhòng hợp tác đối ngoại\nPhòng Tài chính kế toán\nPhòng Quản trị\nPhòng Thanh tra Giáo dục\nKhoa\nKhoa Công nghệ Hoá\nKhoa Công nghệ may & TKTT\nKhoa Công nghệ thông tin\nKhoa Điện\nKhoa Điện tử\nKhoa Khoa học cơ bản\nKhoa Lý luận chính trị - Pháp luật\nTrung tâm Đào tạo\nTrung tâm Đào tạo Sau đại học\nTrung tâm Giáo dục thể chất và Thể thao\nTrung tâm Công nghệ Ô tô và Đào tạo lái xe\nTrung tâm Công nghệ thông tin\nTrung tâm Việt Nhật\nTrung tâm Giáo dục Quốc phòng An ninh\nTrung tâm Dịch vụ\nTrung tâm Truyền thông & Quan hệ Công chúng\nTrạm Y tế\nTrung tâm Hỗ trợ Sinh viên\nTrung tâm Đảm bảo chất lượng\nTrung tâm Thông tin Thư viện\nTrung tâm khảo thí\nViện nghiên cứu\nCông ty Letco\nThư điện tử\nSitemap\nLiên hệ\nToggle navigation\nGIỚI THIỆU\nTHÔNG TIN CHUNG\nCƠ CẤU TỔ CHỨC\nCHIẾN LƯỢC PHÁT TRIỂN\nCÁN BỘ GIẢNG VIÊN\nCƠ SỞ VẬT CHẤT\nLIÊN HỆ\nĐÀO TẠO\nĐẠI HỌC\nKHOA HỌC MÁY TÍNH\nKỸ THUẬT PHẦN MỀM\nHỆ THỐNG THÔNG TIN\nCÔNG NGHỆ THÔNG TIN\nCÔNG NGHỆ ĐA PHƯƠNG TIỆN\nAN TOÀN THÔNG TIN\nSAU ĐẠI HỌC\nHỆ THỐNG THÔNG TIN\nKẾ HOẠCH\nTIẾN ĐỘ\nQUY CHẾ, BIỂU MẪU\nNGHIÊN CỨU KHOA HỌC\nCÔNG TRÌNH CÔNG BỐ\nĐỀ TÀI, DỰ ÁN\nSINH VIÊN NCKH\nTIN KHCN\nCÔNG TÁC SINH VIÊN\nQUY CHẾ\nGƯƠNG SÁNG SINH VIÊN\nHỌC BỔNG\nCÂU LẠC BỘ\nTHƯ VIỆN ẢNH\nTUYỂN DỤNG\nCơ sở vật chất\nTin tiêu điểm\nSinh viên Khóa 19 Khoa Công nghệ thông tin đạt Học bổng HaUI 100% toàn khóa học.\nThứ Sáu, 11:07 20/09/2024\nĐội bóng khoa Công nghệ thông tin cùng những trận cầu đáng nhớ\nThứ Bảy, 10:00 23/07/2022\nĐại hội đại biểu Liên chi Đoàn khoa Công nghệ thông tin lần thứ X, nhiệm kỳ 2022 - 2024\nThứ Hai, 15:00 18/04/2022\nGặp mặt tân Sinh viên K15 khoa Công nghệ thông tin\n', 'content: Đội bóng khoa Công nghệ thông tin cùng những trận cầu đáng nhớ\nThứ Bảy, 10:00 23/07/2022\nĐại hội đại biểu Liên chi Đoàn khoa Công nghệ thông tin lần thứ X, nhiệm kỳ 2022 - 2024\nThứ Hai, 15:00 18/04/2022\nGặp mặt tân Sinh viên K15 khoa Công nghệ thông tin\nThứ Tư, 08:17 28/10/2020\nChương trình thực tập tại SVMC ""SVMC Internship Program 2020""\nThứ Sáu, 14:02 22/05/2020\nLịch giảng dạy môn Pháp Luật tuần từ 20/4 đến 26/4/2020 Hệ Cao đẳng khóa 21\nThứ Sáu, 15:05 17/04/2020\nDanh sách các lớp học trực tuyến từ ngày 06/4/2020 đến ngày 19/4/2020\nThứ Bảy, 12:42 04/04/2020\nDanh sách các lớp học trực tuyến từ ngày 30/3/2020 đến ngày 5/4/2020\nThứ Bảy, 14:46 28/03/2020\nKế hoạch tổ chức hoạt động dạy học tuần từ 23/03/2020 đến 05/04/2020 khoa CNTT\nThứ Hai, 09:03 23/03/2020\nĐội HaUI.NotTrashCar đạt giải nhì vòng sơ loại, giành quyền bước vào vòng bán kết cuộc đua số khu vực miền Bắc năm 2020\nThứ Sáu, 08:02 06/03/2020\nnext_contents:\n- Ngành Hệ thống thông tin - ĐẠI HỌC CÔNG NGHIỆP HÀ NỘI || HaUI\nTrang HaUI\nPhòng\nPhòng Tổ chức hành chính\nPhòng Đào tạo\nPhòng Công tác sinh viên\nPhòng Khoa học công nghệ\nPhòng hợp tác đối ngoại\nPhòng Tài chính kế toán\nPhòng Quản trị\nPhòng Thanh tra Giáo dục\nKhoa\nKhoa Công nghệ Hoá\nKhoa Công nghệ may & TKTT\nKhoa Công nghệ thông tin\nKhoa Điện\nKhoa Điện tử\nKhoa Khoa học cơ bản\nKhoa Lý luận chính trị - Pháp luật\nTrung tâm Đào tạo\nTrung tâm Đào tạo Sau đại học\nTrung tâm Giáo dục thể chất và Thể thao\nTrung tâm Công nghệ Ô tô và Đào tạo lái xe\nTrung tâm Công nghệ thông tin\nTrung tâm Việt Nhật\nTrung tâm Giáo dục Quốc phòng An ninh\nTrung tâm Dịch vụ\nTrung tâm Truyền thông & Quan hệ Công chúng\nTrạm Y tế\nTrung tâm Hỗ trợ Sinh viên\nTrung tâm Đảm bảo chất lượng\nTrung tâm Thông tin Thư viện\nTrung tâm khảo thí\nViện nghiên cứu\nCông ty Letco\nThư điện tử\nSitemap\nLiên hệ\nToggle navigation\nGIỚI THIỆU\nTHÔNG TIN CHUNG\nCƠ CẤU TỔ CHỨC\nCHIẾN LƯỢC PHÁT TRIỂN\nCÁN BỘ GIẢNG VIÊN\nCƠ SỞ VẬT CHẤT\nLIÊN HỆ\nĐÀO TẠO\nĐẠI HỌC\nKHOA HỌC MÁY TÍNH\nKỸ THUẬT PHẦN MỀM\nHỆ THỐNG THÔNG TIN\nCÔNG NGHỆ THÔNG TIN\nCÔNG NGHỆ ĐA PHƯƠNG TIỆN\nAN TOÀN THÔNG TIN\nSAU ĐẠI HỌC\nHỆ THỐNG THÔNG TIN\nKẾ HOẠCH\nTIẾN ĐỘ\nQUY CHẾ, BIỂU MẪU\nNGHIÊN CỨU KHOA HỌC\nCÔNG TRÌNH CÔNG BỐ\nĐỀ TÀI, DỰ ÁN\nSINH VIÊN NCKH\nTIN KHCN\nCÔNG TÁC SINH VIÊN\nQUY CHẾ\nGƯƠNG SÁNG SINH VIÊN\nHỌC BỔNG\nCÂU LẠC BỘ\nTHƯ VIỆN ẢNH\nTUYỂN DỤNG\nĐại học Hệ thống thông tin\nTin tiêu điểm\nSinh viên Khóa 19 Khoa Công nghệ thông tin đạt Học bổng HaUI 100% toàn khóa học.\nThứ Sáu, 11:07 20/09/2024\nĐội bóng khoa Công nghệ thông tin cùng những trận cầu đáng nhớ\nThứ Bảy, 10:00 23/07/2022\nĐại hội đại biểu Liên chi Đoàn khoa Công nghệ thông tin lần thứ X, nhiệm kỳ 2022 - 2024\nThứ Hai, 15:00 18/04/2022\nGặp mặt tân Sinh viên K15 khoa Công nghệ thông tin\n']","['Kỹ thuật phần mềm - ĐẠI HỌC CÔNG NGHIỆP HÀ NỘI || HaUI Trang HaUI Phòng Phòng Tổ chức hành chính Phòng Đào tạo Phòng Công tác sinh viên Phòng Khoa học công nghệ Phòng hợp tác đối ngoại Phòng Tài chính kế toán Phòng Quản trị Phòng Thanh tra Giáo dục Khoa Khoa Công nghệ Hoá Khoa Công nghệ may & TKTT Khoa Công nghệ thông tin Khoa Điện Khoa Điện tử Khoa Khoa học cơ bản Khoa Lý luận chính trị - Pháp luật Trung tâm Đào tạo Trung tâm Đào tạo Sau đại học Trung tâm Giáo dục thể chất và Thể thao Trung tâm Công nghệ Ô tô và Đào tạo lái xe Trung tâm Công nghệ thông tin Trung tâm Việt Nhật Trung tâm Giáo dục Quốc phòng An ninh Trung tâm Dịch vụ Trung tâm Truyền thông & Quan hệ Công chúng Trạm Y tế Trung tâm Hỗ trợ Sinh viên Trung tâm Đảm bảo chất lượng Trung tâm Thông tin Thư viện Trung tâm khảo thí Viện nghiên cứu Công ty Letco Thư điện tử Sitemap Liên hệ Toggle navigation GIỚI THIỆU THÔNG TIN CHUNG CƠ CẤU TỔ CHỨC CHIẾN LƯỢC PHÁT TRIỂN CÁN BỘ GIẢNG VIÊN CƠ SỞ VẬT CHẤT LIÊN HỆ ĐÀO TẠO ĐẠI HỌC KHOA HỌC MÁY TÍNH KỸ THUẬT PHẦN MỀM HỆ THỐNG THÔNG TIN CÔNG NGHỆ THÔNG TIN CÔNG NGHỆ ĐA PHƯƠNG TIỆN AN TOÀN THÔNG TIN SAU ĐẠI HỌC HỆ THỐNG THÔNG TIN KẾ HOẠCH TIẾN ĐỘ QUY CHẾ, BIỂU MẪU NGHIÊN CỨU KHOA HỌC CÔNG TRÌNH CÔNG BỐ ĐỀ TÀI, DỰ ÁN SINH VIÊN NCKH TIN KHCN CÔNG TÁC SINH VIÊN QUY CHẾ GƯƠNG SÁNG SINH VIÊN HỌC BỔNG CÂU LẠC BỘ THƯ VIỆN ẢNH TUYỂN DỤNG Kỹ thuật phần mềm Tin tiêu điểm Sinh viên Khóa 19 Khoa Công nghệ thông tin đạt Học bổng HaUI 100% toàn khóa học. Thứ Sáu, 11:07 20/09/2024 Đội bóng khoa Công nghệ thông tin cùng những trận cầu đáng nhớ Thứ Bảy, 10:00 23/07/2022 Đại hội đại biểu Liên chi Đoàn khoa Công nghệ thông tin lần thứ X, nhiệm kỳ 2022 - 2024 Thứ Hai, 15:00 18/04/2022 Gặp mặt tân Sinh viên K15 khoa Công nghệ thông tin Thứ Tư, 08:17 28/10/2020 Chương trình thực tập tại SVMC ""SVMC Internship Program 2020"" Thứ Sáu, 14:02 22/05/2020 Lịch giảng dạy môn Pháp Luật tuần từ 20/4 đến 26/4/2020 Hệ Cao đẳng khóa 21 Thứ Sáu, 15:05 17/04/2020 Danh sách các lớp học trực tuyến từ ngày 06/4/2020 đến ngày 19/4/2020 Thứ Bảy, 12:42 04/04/2020 Danh sách các lớp học trực tuyến từ ngày 30/3/2020 đến ngày 5/4/2020 Thứ Bảy, 14:46 28/03/2020 Kế hoạch tổ chức hoạt động dạy học tuần từ 23/03/2020 đến 05/04/2020 khoa CNTT Thứ Hai, 09:03 23/03/2020 Đội HaUI.NotTrashCar đạt giải nhì vòng sơ loại, giành quyền bước vào vòng bán kết cuộc đua số khu vực miền Bắc năm 2020 Thứ Sáu, 08:02 06/03/2020 Ngành Kỹ thuật phần mềm 1. Mục tiêu Sinh viên tốt nghiệp từ chương trình Kỹ thuật phần mềm có thể: - MT1: Có hiểu biết về kinh tế, chính trị: có các kiến thức cơ bản trong lĩnh vực khoa học xã hội và nhân văn phù hợp với chuyên ngành được đào tạo để đóng góp hữu hiệu vào sự phát triển bền vững của xã hội, cộng đồng; - MT2: Có kiến thức cơ bản về toán học, khoa học tự nhiên, đáp ứng cho việc tiếp thu các kiến thức giáo dục chuyên nghiệp và khả năng học tập ở trình độ cao hơn; - MT3: Có hiểu biết sâu về kiến thức cơ sở nhóm ngành Máy tính và Công nghệ Thông tin, tạo điều kiện thuận lợi cho việc học tập các môn chuyên ngành, nghiên cứu chuyên sâu, tiếp cận dễ dàng với các công nghệ mới; - MT4: Có kiến thức chuyên ngành đáp ứng được nhu cầu của xã hội về lĩnh vực công nghệ phần mềm: Quy trình phát triển phần mềm; Quản lý dự án phần mềm; Đảm bảo chất lượng phần mềm. Có khả năng thiết kế, xây dựng, vận hành, kiểm soát và bảo trì hệ thống thông tin bằng các phương pháp, công cụ, môi trường hiện đại; - MT5: Có kỹ năng cá nhân và kỹ năng nghề nghiệp đáp ứng được yêu cầu trong môi trường làm việc liên ngành, đa quốc gia.2. Chuẩn đầu ra chương trình đào tạo (theo năng lực) - Giải quyết được các bài toán cơ bản liên quan đến Toán giải tích, Đại số và Xác suất thống kê; các bài toán cơ bản thuộc cơ sở khối ngành Kỹ thuật phần mềm. - Vận dụng các kiến thức cơ bản thuộc khối kiến thức cơ sở ngành và chuyên ngành Kỹ thuật phần mềm vào việc xây dựng, phát triển phần mềm và quản lý các dự án phần mềm - Trình bày được các vấn đề về lý luận chính trị, khoa học xã hội, nhân văn; Sử dụng ngoại ngữ ở trình độ bậc 3/6 theo khung năng lực ngoại ngữ (tương ứng với B1 khung Châu Âu). - Xác định và phát biểu được bài toán, mô hình hóa bài toán, xác định phân tích các yếu tố định tính, định lượng, không chắc chắn và đề xuất giải pháp phù hợp. - Phác thảo, nêu giả thiết, chọn lọc phương án khảo sát, triển khai thực nghiệm và thẩm định kết quả. - Có tư duy bao quát về hệ thống phần mềm, xác định được nhiệm vụ trọng tâm, thứ tự ưu tiên, vấn đề nảy sinh và tương tác trong hệ thống phần mềm, từ đó đưa ra các phương án tối ưu hóa giải pháp. - Hình thành và thể hiện đức tính cá nhân và nghề nghiệp như: kiên trì, linh hoạt trong công việc; tiên phong, chấp nhận đương đầu rủi ro; giải quyết vấn đề một cách']","Đội HaUI.NotTrashCar đã đạt giải nhì vòng sơ loại và giành quyền bước vào vòng bán kết cuộc đua số khu vực miền Bắc năm 2020. 

Nếu bạn cần thêm thông tin hoặc có câu hỏi khác, hãy cho tôi biết!  
[Tài liệu KHOA HỌC MÁY TÍNH] - [**Link tham khảo**](https://fit.haui.edu.vn/vn/html/khoa-hoc-may-tinh).","Đội HaUI.NotTrashCar đã đạt giải nhì vòng sơ loại, giành quyền bước vào vòng bán kết cuộc đua số khu vực miền Bắc năm 2020.",0.999999999975,1.0,0.4,0.8604375728300684,0.9800558076508847,0.5446140766143799,5.4160850048065186
5,Ngành Hệ thống thông tin tại Đại học Công nghiệp Hà Nội có những mục tiêu và chuẩn đầu ra nào cho sinh viên?,"['content: thu nhập cao"". Theo Tiến sĩ, Khoa Công nghệ thông tin Trường ĐH Công Nghiệp Hà Nội có 4 chuyên ngành công nghệ thông tin, khoa học máy tính, hệ thống thông tin, kỹ thuật phần mềm, nếu sinh viên năm thứ 3 có học lực khá thì ngay năm này có việc làm và có lương. Khoa có mục tiêu giúp sinh viên tiếp cận thực tế càng sớm càng tốt, tham gia nhiều dự án ngay ở năm 2.Về phía doanh nghiệp và cựu sinh viên chia sẻ: “Khoa CNTT Trường ĐH Công Nghiệp Hà Nội hướng đến đào tạo sinh viên có tính kỷ luật cao để có thể làm việc trong môi trường chuyên nghiệp. Bên cạnh đó là năng lực sáng tạo, các em được khuyến khích sáng tạo trong quá trình học tập. Trường gắn kết với doanh nghiệp, tạo cơ hội cho các em tiếp cận với thực tế”.Đại diện Doanh nghiệp chia sẻ về nhu cầu và cơ hội việc làm CNTT\nnext_contents:\n- Công nghệ thông tin là nhóm ngành đang có xu hướng phát triển, nhu cầu nhân lực rất cao và các chuyên gia lưu ý sinh viên học tốt, có năng lực sẽ được doanh nghiệp săn đón ngay khi còn ngồi ở ghế nhà trường. Đại dịch Covid 19 đang bước vào năm thứ 3, gây ảnh hưởng tất cả mọi lĩnh vực trong đời sống. Tuy nhiên, công nghệ thông tin (CNTT) lại là một trong những lĩnh vực phát triển mạnh với nhiều đột phá góp phần đổi thay cuộc sống.Vào tối ngày 8/6/2022, Khoa Công nghệ thông tin Trường Đại học Công Nghiệp Hà Nội kết hợp với một số doanh nghiệp đã tổ chức buổi livestream tư vấn trực tuyến nhóm ngành CNTT năm 2022. Tham dự buổi tư vấn có TS. Lê Văn Thái – Phó Trưởng phòng đào tạo Trường ĐH Công Nghiệp Hà Nội, TS. Đặng Trọng Hợp – Trưởng Khoa CNTT và đại diện doanh nghiệp FPT Software, cựu sinh viên Nguyễn Huy Du, các chuyên gia cung cấp cho thí sinh nhiều thông tin cụ thể về ngành học này khi trong giai đoạn sắp tới.Thí sinh có rất nhiều câu hỏi đặt ra cho Ban tổ chứcTiến sĩ Lê Văn Thái – Phó Trưởng phòng Đào tạo Trường ĐH Công Nghiệp Hà Nội, chia sẻ: ""CNTT là nhóm ngành hot và được dự đoán là ngành lâu dài trong tương lai, để đào tạo nhân lực chất lượng cao phục vụ cho các ngành nghề khác. Chẳng hạn, lập trình viên phải biết cách phát triển các sản phẩm CNTT để phục vụ những ngành nghề khác"". Tiến sỹ khẳng định sinh viên học tốt chắc chắn ra trường sẽ có việc làm. Tuy nhiên, lĩnh vực này khó nên sinh viên phải học chăm chỉ và cố gắng thì mới thành công, đòi hòi có năng lực thật sự và có kỹ năng nghề nghiệp.TS. Đặng Trọng Hợp – Trưởng khoa CNTT chia sẻ: ""CNTT là nhóm ngành đang có xu hướng phát triển và nhu cầu nhân lực rất cao và luôn nằm trong tốp đầu những ngành có lương và thu nhập cao"". Theo Tiến sĩ, Khoa Công nghệ thông tin Trường ĐH Công Nghiệp Hà Nội có 4 chuyên ngành công nghệ thông tin, khoa học máy tính, hệ thống thông tin, kỹ thuật phần mềm, nếu sinh viên năm thứ 3 có học lực khá thì ngay năm này có việc làm và có lương. Khoa có mục tiêu giúp sinh viên tiếp\n', 'content: Công nghệ thông tin là nhóm ngành đang có xu hướng phát triển, nhu cầu nhân lực rất cao và các chuyên gia lưu ý sinh viên học tốt, có năng lực sẽ được doanh nghiệp săn đón ngay khi còn ngồi ở ghế nhà trường. Đại dịch Covid 19 đang bước vào năm thứ 3, gây ảnh hưởng tất cả mọi lĩnh vực trong đời sống. Tuy nhiên, công nghệ thông tin (CNTT) lại là một trong những lĩnh vực phát triển mạnh với nhiều đột phá góp phần đổi thay cuộc sống.Vào tối ngày 8/6/2022, Khoa Công nghệ thông tin Trường Đại học Công Nghiệp Hà Nội kết hợp với một số doanh nghiệp đã tổ chức buổi livestream tư vấn trực tuyến nhóm ngành CNTT năm 2022. Tham dự buổi tư vấn có TS. Lê Văn Thái – Phó Trưởng phòng đào tạo Trường ĐH Công Nghiệp Hà Nội, TS. Đặng Trọng Hợp – Trưởng Khoa CNTT và đại diện doanh nghiệp FPT Software, cựu sinh viên Nguyễn Huy Du, các chuyên gia cung cấp cho thí sinh nhiều thông tin cụ thể về ngành học này khi trong giai đoạn sắp tới.Thí sinh có rất nhiều câu hỏi đặt ra cho Ban tổ chứcTiến sĩ Lê Văn Thái – Phó Trưởng phòng Đào tạo Trường ĐH Công Nghiệp Hà Nội, chia sẻ: ""CNTT là nhóm ngành hot và được dự đoán là ngành lâu dài trong tương lai, để đào tạo nhân lực chất lượng cao phục vụ cho các ngành nghề khác. Chẳng hạn, lập trình viên phải biết cách phát triển các sản phẩm CNTT để phục vụ những ngành nghề khác"". Tiến sỹ khẳng định sinh viên học tốt chắc chắn ra trường sẽ có việc làm. Tuy nhiên, lĩnh vực này khó nên sinh viên phải học chăm chỉ và cố gắng thì mới thành công, đòi hòi có năng lực thật sự và có kỹ năng nghề nghiệp.TS. Đặng Trọng Hợp – Trưởng khoa CNTT chia sẻ: ""CNTT là nhóm ngành đang có xu hướng phát triển và nhu cầu nhân lực rất cao và luôn nằm trong tốp đầu những ngành có lương và thu nhập cao"". Theo Tiến sĩ, Khoa Công nghệ thông tin Trường ĐH Công Nghiệp Hà Nội có 4 chuyên ngành công nghệ thông tin, khoa học máy tính, hệ thống thông tin, kỹ thuật phần mềm, nếu sinh viên năm thứ 3 có học lực khá thì ngay năm này có việc làm và có lương. Khoa có mục tiêu giúp sinh viên tiếp\nnext_contents:\n- Tư vấn tuyển sinh trực tuyến nhóm ngành Công nghệ thông tin năm 2022\nTrang HaUI\nPhòng\nPhòng Tổ chức hành chính\nPhòng Đào tạo\nPhòng Công tác sinh viên\nPhòng Khoa học công nghệ\nPhòng hợp tác đối ngoại\nPhòng Tài chính kế toán\nPhòng Quản trị\nPhòng Thanh tra Giáo dục\nKhoa\nKhoa Công nghệ Hoá\nKhoa Công nghệ may & TKTT\nKhoa Công nghệ thông tin\nKhoa Điện\nKhoa Điện tử\nKhoa Khoa học cơ bản\nKhoa Lý luận chính trị - Pháp luật\nTrung tâm Đào tạo\nTrung tâm Đào tạo Sau đại học\nTrung tâm Giáo dục thể chất và Thể thao\nTrung tâm Công nghệ Ô tô và Đào tạo lái xe\nTrung tâm Công nghệ thông tin\nTrung tâm Việt Nhật\nTrung tâm Giáo dục Quốc phòng An ninh\nTrung tâm Dịch vụ\nTrung tâm Truyền thông & Quan hệ Công chúng\nTrạm Y tế\nTrung tâm Hỗ trợ Sinh viên\nTrung tâm Đảm bảo chất lượng\nTrung tâm Thông tin Thư viện\nTrung tâm khảo thí\nViện nghiên cứu\nCông ty Letco\nThư điện tử\nSitemap\nLiên hệ\nToggle navigation\nGIỚI THIỆU\nTHÔNG TIN CHUNG\nCƠ CẤU TỔ CHỨC\nCHIẾN LƯỢC PHÁT TRIỂN\nCÁN BỘ GIẢNG VIÊN\nCƠ SỞ VẬT CHẤT\nLIÊN HỆ\nĐÀO TẠO\nĐẠI HỌC\nKHOA HỌC MÁY TÍNH\nKỸ THUẬT PHẦN MỀM\nHỆ THỐNG THÔNG TIN\nCÔNG NGHỆ THÔNG TIN\nCÔNG NGHỆ ĐA PHƯƠNG TIỆN\nAN TOÀN THÔNG TIN\nSAU ĐẠI HỌC\nHỆ THỐNG THÔNG TIN\nKẾ HOẠCH\nTIẾN ĐỘ\nQUY CHẾ, BIỂU MẪU\nNGHIÊN CỨU KHOA HỌC\nCÔNG TRÌNH CÔNG BỐ\nĐỀ TÀI, DỰ ÁN\nSINH VIÊN NCKH\nTIN KHCN\nCÔNG TÁC SINH VIÊN\nQUY CHẾ\nGƯƠNG SÁNG SINH VIÊN\nHỌC BỔNG\nCÂU LẠC BỘ\nTHƯ VIỆN ẢNH\nTUYỂN DỤNG\nTIN TỨC\nTRANG CHỦ > TIN TỨC\nTư vấn tuyển sinh trực tuyến nhóm ngành Công nghệ thông tin năm 2022\n', 'content: 1. Mục tiêu Sinh viên tốt nghiệp từ chương trình Hệ thống thông tin có thể: - MT1: Có hiểu biết về kinh tế, chính trị: có các kiến thức cơ bản trong lĩnh vực khoa học xã hội và nhân văn phù hợp với chuyên ngành được đào tạo để đóng góp hữu hiệu vào sự phát triển bền vững của xã hội, cộng đồng; - MT2: Có kiến thức cơ bản về toán học, khoa học tự nhiên, đáp ứng cho việc tiếp thu các kiến thức giáo dục chuyên nghiệp và khả năng học tập ở trình độ cao hơn; - MT3: Có hiểu biết sâu về kiến thức cơ sở nhóm ngành Máy tính và Công nghệ Thông tin, tạo điều kiện thuận lợi cho việc học tập các môn chuyên ngành, nghiên cứu chuyên sâu, tiếp cận dễ dàng với các công nghệ mới; - MT4: Có kiến thức chuyên ngành đáp ứng được nhu cầu của xã hội về lĩnh vực hệ thống thông tin: thương mại điện tử, hệ quản trị doanh nghiệp điện tử, hệ hỗ trợ quyết định, hệ thống nhúng, công nghệ đa phương tiện, tích hợp hệ thống... Có khả năng phân tích, thiết kế, xây dựng, tích hợp, triển khai, vận hành và nâng cấp hệ thống thông tin hay các thành phần của hệ thống thông tin bằng các phương pháp, công cụ, môi trường hiện đại; - MT5: Có kỹ năng cá nhân và kỹ năng nghề nghiệp đáp ứng được yêu cầu trong môi trường làm việc liên ngành, đa quốc gia.2. Chuẩn đầu ra chương trình đào tạo (theo năng lực) - Giải quyết được các bài toán cơ bản liên quan đến Toán giải tích, Đại số và Xác suất thống kê; các bài toán cơ bản thuộc cơ sở khối ngành Máy tính và Công nghệ thông tin. - Vận dụng các kiến thức cơ bản thuộc khối kiến thức cơ sở ngành và chuyên ngành Hệ thống thông tin vào việc thiết kế, xây dựng, tích hợp và vận hành các hệ thống thông tin - Trình bày được các vấn đề về lý luận chính trị, khoa học xã hội, nhân văn; Sử dụng ngoại ngữ ở trình độ bậc 3/6 theo khung năng lực ngoại ngữ (tương ứng với B1 khung Châu Âu). - Xác định và phát biểu được bài toán, mô hình hóa bài toán, xác định phân tích các yếu tố định tính, định lượng, không chắc chắn và đề xuất giải pháp phù hợp. - Phác thảo, nêu giả thiết, chọn lọc\nnext_contents:\n- Ngành Hệ thống thông tin\n', 'content: Chàng trai ngành Công nghệ thông tin là tấm gương sáng cho sinh viên\nTrang HaUI\nPhòng\nPhòng Tổ chức hành chính\nPhòng Đào tạo\nPhòng Công tác sinh viên\nPhòng Khoa học công nghệ\nPhòng hợp tác đối ngoại\nPhòng Tài chính kế toán\nPhòng Quản trị\nPhòng Thanh tra Giáo dục\nKhoa\nKhoa Công nghệ Hoá\nKhoa Công nghệ may & TKTT\nKhoa Công nghệ thông tin\nKhoa Điện\nKhoa Điện tử\nKhoa Khoa học cơ bản\nKhoa Lý luận chính trị - Pháp luật\nTrung tâm Đào tạo\nTrung tâm Đào tạo Sau đại học\nTrung tâm Giáo dục thể chất và Thể thao\nTrung tâm Công nghệ Ô tô và Đào tạo lái xe\nTrung tâm Công nghệ thông tin\nTrung tâm Việt Nhật\nTrung tâm Giáo dục Quốc phòng An ninh\nTrung tâm Dịch vụ\nTrung tâm Truyền thông & Quan hệ Công chúng\nTrạm Y tế\nTrung tâm Hỗ trợ Sinh viên\nTrung tâm Đảm bảo chất lượng\nTrung tâm Thông tin Thư viện\nTrung tâm khảo thí\nViện nghiên cứu\nCông ty Letco\nThư điện tử\nSitemap\nLiên hệ\nToggle navigation\nGIỚI THIỆU\nTHÔNG TIN CHUNG\nCƠ CẤU TỔ CHỨC\nCHIẾN LƯỢC PHÁT TRIỂN\nCÁN BỘ GIẢNG VIÊN\nCƠ SỞ VẬT CHẤT\nLIÊN HỆ\nĐÀO TẠO\nĐẠI HỌC\nKHOA HỌC MÁY TÍNH\nKỸ THUẬT PHẦN MỀM\nHỆ THỐNG THÔNG TIN\nCÔNG NGHỆ THÔNG TIN\nCÔNG NGHỆ ĐA PHƯƠNG TIỆN\nAN TOÀN THÔNG TIN\nSAU ĐẠI HỌC\nHỆ THỐNG THÔNG TIN\nKẾ HOẠCH\nTIẾN ĐỘ\nQUY CHẾ, BIỂU MẪU\nNGHIÊN CỨU KHOA HỌC\nCÔNG TRÌNH CÔNG BỐ\nĐỀ TÀI, DỰ ÁN\nSINH VIÊN NCKH\nTIN KHCN\nCÔNG TÁC SINH VIÊN\nQUY CHẾ\nGƯƠNG SÁNG SINH VIÊN\nHỌC BỔNG\nCÂU LẠC BỘ\nTHƯ VIỆN ẢNH\nTUYỂN DỤNG\nGƯƠNG SÁNG SINH VIÊN\nTRANG CHỦ > GƯƠNG SÁNG SINH VIÊN\nChàng trai ngành Công nghệ thông tin là tấm gương sáng cho sinh viên\nnext_contents:\n']","['THƯ VIỆN ẢNH TUYỂN DỤNG Đại học Hệ thống thông tin Tin tiêu điểm Sinh viên Khóa 19 Khoa Công nghệ thông tin đạt Học bổng HaUI 100% toàn khóa học. Thứ Sáu, 11:07 20/09/2024 Đội bóng khoa Công nghệ thông tin cùng những trận cầu đáng nhớ Thứ Bảy, 10:00 23/07/2022 Đại hội đại biểu Liên chi Đoàn khoa Công nghệ thông tin lần thứ X, nhiệm kỳ 2022 - 2024 Thứ Hai, 15:00 18/04/2022 Gặp mặt tân Sinh viên K15 khoa Công nghệ thông tin Thứ Tư, 08:17 28/10/2020 Chương trình thực tập tại SVMC ""SVMC Internship Program 2020"" Thứ Sáu, 14:02 22/05/2020 Lịch giảng dạy môn Pháp Luật tuần từ 20/4 đến 26/4/2020 Hệ Cao đẳng khóa 21 Thứ Sáu, 15:05 17/04/2020 Danh sách các lớp học trực tuyến từ ngày 06/4/2020 đến ngày 19/4/2020 Thứ Bảy, 12:42 04/04/2020 Danh sách các lớp học trực tuyến từ ngày 30/3/2020 đến ngày 5/4/2020 Thứ Bảy, 14:46 28/03/2020 Kế hoạch tổ chức hoạt động dạy học tuần từ 23/03/2020 đến 05/04/2020 khoa CNTT Thứ Hai, 09:03 23/03/2020 Đội HaUI.NotTrashCar đạt giải nhì vòng sơ loại, giành quyền bước vào vòng bán kết cuộc đua số khu vực miền Bắc năm 2020 Thứ Sáu, 08:02 06/03/2020 Ngành Hệ thống thông tin 1. Mục tiêu Sinh viên tốt nghiệp từ chương trình Hệ thống thông tin có thể: - MT1: Có hiểu biết về kinh tế, chính trị: có các kiến thức cơ bản trong lĩnh vực khoa học xã hội và nhân văn phù hợp với chuyên ngành được đào tạo để đóng góp hữu hiệu vào sự phát triển bền vững của xã hội, cộng đồng; - MT2: Có kiến thức cơ bản về toán học, khoa học tự nhiên, đáp ứng cho việc tiếp thu các kiến thức giáo dục chuyên nghiệp và khả năng học tập ở trình độ cao hơn; - MT3: Có hiểu biết sâu về kiến thức cơ sở nhóm ngành Máy tính và Công nghệ Thông tin, tạo điều kiện thuận lợi cho việc học tập các môn chuyên ngành, nghiên cứu chuyên sâu, tiếp cận dễ dàng với các công nghệ mới; - MT4: Có kiến thức chuyên ngành đáp ứng được nhu cầu của xã hội về lĩnh vực hệ thống thông tin: thương mại điện tử, hệ quản trị doanh nghiệp điện tử, hệ hỗ trợ quyết định, hệ thống nhúng, công nghệ đa phương tiện, tích hợp hệ thống... Có khả năng phân tích, thiết kế, xây dựng, tích hợp, triển khai, vận hành và nâng cấp hệ thống thông tin hay các thành phần của hệ thống thông tin bằng các phương pháp, công cụ, môi trường hiện đại; - MT5: Có kỹ năng cá nhân và kỹ năng nghề nghiệp đáp ứng được yêu cầu trong môi trường làm việc liên ngành, đa quốc gia.2. Chuẩn đầu ra chương trình đào tạo (theo năng lực) - Giải quyết được các bài toán cơ bản liên quan đến Toán giải tích, Đại số và Xác suất thống kê; các bài toán cơ bản thuộc cơ sở khối ngành Máy tính và Công nghệ thông tin. - Vận dụng các kiến thức cơ bản thuộc khối kiến thức cơ sở ngành và chuyên ngành Hệ thống thông tin vào việc thiết kế, xây dựng, tích hợp và vận hành các hệ thống thông tin - Trình bày được các vấn đề về lý luận chính trị, khoa học xã hội, nhân văn; Sử dụng ngoại ngữ ở trình độ bậc 3/6 theo khung năng lực ngoại ngữ (tương ứng với B1 khung Châu Âu). - Xác định và phát biểu được bài toán, mô hình hóa bài toán, xác định phân tích các yếu tố định tính, định lượng, không chắc chắn và đề xuất giải pháp phù hợp. - Phác thảo, nêu giả thiết, chọn lọc phương án khảo sát, triển khai thực nghiệm và thẩm định được kết quả. - Có tư duy hệ thống: tư duy bao quát về hệ thống thông tin, xác định được nhiệm vụ trọng tâm, thứ tự ưu tiên, vấn đề nảy sinh và tương tác trong hệ thống thông tin, từ đó đưa ra các phương án tối ưu hóa giải pháp. - Hình thành và thể hiện đức tính cá nhân và nghề nghiệp như: kiên trì, linh hoạt trong công việc; tiên phong, chấp nhận đương đầu rủi ro; giải quyết vấn đề một cách sáng tạo; tự đánh giá và có ý thức tự học tập, rèn luyện suốt đời. - Xác định và thực hiện tốt các trách nhiệm đạo đức và nghề nghiệp. - Hình thành và xây dựng được chiến lược giao tiếp cũng như thuyết trình hiệu quả thông qua các phương tiện: văn bản, điện tử, đa truyền thông - Có năng lực hình thành ý tưởng, thiết kế, triển khai và vận hành trong bối cảnh doanh nghiệp và xã hội.2. Chương trình khung các khóa ngành Hệ thống thông tin- Chương trình khung ngành Hệ thống thông tin khóa 19- Chương trình khung ngành Hệ thống thông tin khóa 18- Chương trình khung ngành Hệ thống thông tin khóa 17- Chương trình khung ngành Hệ thống thông tin khóa 16- Chương trình khung ngành Hệ thống thông tin khóa 15- Chương trình khung ngành Hệ thống thông tin khóa 14- Chương trình khung ngành Hệ thống thông tin khóa 13- Chương trình khung ngành Hệ thống thông tin khóa 12 Bản đồ chỉ dẫn Trường Đại học Công nghiệp Hà Nội Trụ sở chính Số 298 đường Cầu Diễn, quận Bắc Từ Liêm, Hà Nội +84 243 765 5121 Email: dhcnhn@haui.edu.vn Các cơ sở khác Cơ sở 2: Phường Tây Tựu, quận Bắc Từ Liêm, Hà Nội Cơ sở 3: Phường Lê Hồng Phong, thành phố Phủ Lý, Hà Nam Liên kết site Trường Đại học Công nghiệp Hà Nội Thông tin tuyển sinh Hành chính điện tử Đào tạo']","Ngành Hệ thống thông tin tại Đại học Công nghiệp Hà Nội có các mục tiêu và chuẩn đầu ra như sau:

### Mục tiêu
1. **Kiến thức cơ bản**:
   - Hiểu biết về kinh tế, chính trị và các kiến thức cơ bản trong lĩnh vực khoa học xã hội và nhân văn.
   - Kiến thức cơ bản về toán học và khoa học tự nhiên để tiếp thu các kiến thức giáo dục chuyên nghiệp.

2. **Kiến thức chuyên ngành**:
   - Kiến thức sâu về cơ sở nhóm ngành Máy tính và Công nghệ Thông tin.
   - Kiến thức chuyên ngành đáp ứng nhu cầu xã hội về hệ thống thông tin, bao gồm thương mại điện tử, hệ quản trị doanh nghiệp điện tử, và các công nghệ liên quan.

3. **Kỹ năng**:
   - Kỹ năng cá nhân và nghề nghiệp đáp ứng yêu cầu trong môi trường làm việc liên ngành, đa quốc gia.

### Chuẩn đầu ra
1. **Giải quyết bài toán**:
   - Giải quyết các bài toán cơ bản liên quan đến Toán giải tích, Đại số và Xác suất thống kê.

2. **Vận dụng kiến thức**:
   - Vận dụng kiến thức cơ bản vào thiết kế, xây dựng, tích hợp và vận hành các hệ thống thông tin.

3. **Trình bày và sử dụng ngoại ngữ**:
   - Trình bày các vấn đề lý luận chính trị, khoa học xã hội và sử dụng ngoại ngữ ở trình độ bậc 3/6.

4. **Mô hình hóa bài toán**:
   - Xác định và mô hình hóa bài toán, phân tích các yếu tố định tính, định lượng và đề xuất giải pháp phù hợp.

Thông tin này giúp sinh viên hiểu rõ hơn về những gì họ cần đạt được trong quá trình học tập và phát triển nghề nghiệp trong lĩnh vực Hệ thống thông tin.

[HỆ THỐNG THÔNG TIN] - [**Link tham khảo**](https://fit.haui.edu.vn/vn/html/dai-hoc-he-thong-thong-tin). 

Nếu bạn có thêm câu hỏi nào khác liên quan đến ngành học hoặc các hoạt động tại trường, hãy cho tôi biết!","Ngành Hệ thống thông tin tại Đại học Công nghiệp Hà Nội có các mục tiêu như sau: Sinh viên tốt nghiệp có hiểu biết về kinh tế, chính trị, kiến thức cơ bản về toán học và khoa học tự nhiên, hiểu biết sâu về kiến thức cơ sở nhóm ngành Máy tính và Công nghệ Thông tin, và có kiến thức chuyên ngành đáp ứng nhu cầu xã hội. Chuẩn đầu ra chương trình đào tạo bao gồm khả năng giải quyết các bài toán cơ bản liên quan đến Toán giải tích, Đại số và Xác suất thống kê, vận dụng kiến thức vào thiết kế và vận hành hệ thống thông tin, sử dụng ngoại ngữ ở trình độ bậc 3/6, và có tư duy hệ thống để tối ưu hóa giải pháp.",0.9999999999666667,1.0,0.9230769230769231,0.9038820939933939,0.9663070581993846,0.6183838844299316,11.667294979095459
6,Khoa Khoa học cơ bản có vai trò gì trong chương trình đào tạo tại Đại học Công nghiệp Hà Nội?,"['content: Phòng Đào tạo - ĐẠI HỌC CÔNG NGHIỆP HÀ NỘI || HaUI\nToggle navigation\nLãnh đạo\nĐảng Uỷ\nHội đồng trường\nBan Giám Hiệu\nPhòng\nPhòng Tổ chức hành chính\nPhòng Đào tạo\nPhòng Khoa học công nghệ\nPhòng Công tác sinh viên\nPhòng Tài chính kế toán\nPhòng Quản trị\nPhòng Thanh tra Giáo dục\nPhòng hợp tác đối ngoại\nKhoa\nKhoa Điện\nKhoa Điện tử\nKhoa Công nghệ thông tin\nKhoa Công nghệ may & TKTT\nKhoa Công nghệ Hoá\nKhoa Lý luận chính trị - Pháp luật\nKhoa Khoa học cơ bản\nTT Đào tạo\nTrung tâm Đào tạo Sau đại học\nTrung tâm Việt Nhật\nTrung tâm Công nghệ thông tin\nTrung tâm Công nghệ ô tô và Đào tạo lái xe\nTrung tâm Giáo dục thể chất và Thể thao\nTrung tâm Giáo dục Quốc phòng An ninh\nTT Dịch vụ\nTrung tâm Đảm bảo chất lượng\nTrung tâm khảo thí\nTrung tâm Thông tin Thư viện\nTrung tâm Hỗ trợ Sinh viên\nTrung tâm Truyền thông & Quan hệ Công chúng\nTrạm Y tế\nViện nghiên cứu\nLetco\nTrường thuộc HaUI\nTrường Ngoại ngữ - Du lịch\nTrường Cơ khí - Ô tô\nTrường Kinh tế\nĐoàn thể\nCông đoàn\nĐoàn thanh niên\nHội sinh viên\nTạp chí KH&CN\nGiới thiệu\nThể lệ viết và gửi bài\nTạp chí đã xuất bản\nLiên hệ\nThư viện\nThư điện tử\nSitemap\nToggle navigation\nGiới thiệu\nTổng quan\nLịch sử\nQuy mô đào tạo\nĐội ngũ Cán bộ\nCơ sở vật chất\nNghiên cứu khoa học\nDanh hiệu thi đua\nChiến lược phát triển\nCơ cấu tổ chức\nSơ đồ tổ chức\nBCH Đảng bộ Trường\nHội đồng trường\nBan giám hiệu\nCác tổ chức đoàn thể\nViện - Khoa đào tạo\nPhòng - Ban - Trung tâm\nBa công khai\nKết quả khảo sát khách hàng\nBáo cáo khảo sát CBVC\nBáo cáo khảo sát sinh viên\nNhận diện thương hiệu\nLiên hệ\nTuyển sinh\nĐào tạo\nSau đại học\nĐại học\nTra cứu thông tin\nKhoa học công nghệ\nTuyển dụng\nEgov\nPhòng Đào tạo\nnext_contents:\n', 'content: Phòng Đào tạo - ĐẠI HỌC CÔNG NGHIỆP HÀ NỘI || HaUI\nToggle navigation\nLãnh đạo\nĐảng Uỷ\nHội đồng trường\nBan Giám Hiệu\nPhòng\nPhòng Tổ chức hành chính\nPhòng Đào tạo\nPhòng Khoa học công nghệ\nPhòng Công tác sinh viên\nPhòng Tài chính kế toán\nPhòng Quản trị\nPhòng Thanh tra Giáo dục\nPhòng hợp tác đối ngoại\nKhoa\nKhoa Điện\nKhoa Điện tử\nKhoa Công nghệ thông tin\nKhoa Công nghệ may & TKTT\nKhoa Công nghệ Hoá\nKhoa Lý luận chính trị - Pháp luật\nKhoa Khoa học cơ bản\nTT Đào tạo\nTrung tâm Đào tạo Sau đại học\nTrung tâm Việt Nhật\nTrung tâm Công nghệ thông tin\nTrung tâm Công nghệ ô tô và Đào tạo lái xe\nTrung tâm Giáo dục thể chất và Thể thao\nTrung tâm Giáo dục Quốc phòng An ninh\nTT Dịch vụ\nTrung tâm Đảm bảo chất lượng\nTrung tâm khảo thí\nTrung tâm Thông tin Thư viện\nTrung tâm Hỗ trợ Sinh viên\nTrung tâm Truyền thông & Quan hệ Công chúng\nTrạm Y tế\nViện nghiên cứu\nLetco\nTrường thuộc HaUI\nTrường Ngoại ngữ - Du lịch\nTrường Cơ khí - Ô tô\nTrường Kinh tế\nĐoàn thể\nCông đoàn\nĐoàn thanh niên\nHội sinh viên\nTạp chí KH&CN\nGiới thiệu\nThể lệ viết và gửi bài\nTạp chí đã xuất bản\nLiên hệ\nThư viện\nThư điện tử\nSitemap\nToggle navigation\nGiới thiệu\nTổng quan\nLịch sử\nQuy mô đào tạo\nĐội ngũ Cán bộ\nCơ sở vật chất\nNghiên cứu khoa học\nDanh hiệu thi đua\nChiến lược phát triển\nCơ cấu tổ chức\nSơ đồ tổ chức\nBCH Đảng bộ Trường\nHội đồng trường\nBan giám hiệu\nCác tổ chức đoàn thể\nViện - Khoa đào tạo\nPhòng - Ban - Trung tâm\nBa công khai\nKết quả khảo sát khách hàng\nBáo cáo khảo sát CBVC\nBáo cáo khảo sát sinh viên\nNhận diện thương hiệu\nLiên hệ\nTuyển sinh\nĐào tạo\nSau đại học\nĐại học\nTra cứu thông tin\nKhoa học công nghệ\nTuyển dụng\nEgov\nPhòng Đào tạo\nnext_contents:\n', 'content: tháng đào tạo 🔸 Nâng cao trình độ tiếng Anh và phát triển các kỹ năng mềm.🔸 Môi trường làm việc chuyên nghiệp, cởi mở, khuyến khích nhân viên phát triển và sáng tạo 🔸 Được hỗ trợ chi phí đi lại và ăn trưa trong suốt quá trình đào tạo 🔸 Được cấp giấy chứng nhận sau khi hoàn thành khóa học Đối tượng tham gia: 🔸 Sinh viên năm cuối hoặc vừa mới tốt nghiệp Đại học, Cao đẳng, các viện đào tạo chuyên môn trong lĩnh vực Công nghệ thông tin/Khoa học Máy tính/Phần mềm/Kiểm thử Phần mềm/Hệ thống thông tin/…🔸 Tham gia đào tạo toàn thời gian trong vòng 3 tháng. Ưu tiên các ứng viên có thể bắt đầu làm việc toàn thời gian sau quá trình đào tạo🔸 Có kĩ năng giao tiếp Tiếng Anh khá 🔸 Ham học hỏi, thích nghiên cứu, tìm tòi, tìm hiểu công nghệ mới 🔸 Cam kết tuân thủ các quy định của chương trình đào tạo 🔸 Độc lập, chủ động trong công việc Địa điểm: tòa HiTC, 239 Xuân Thủy, Cầu Giấy, Hà NộiCòn chờ đợi gì mà không đăng ký ngay chỉ với 3 bước:1. Đăng ký tại đây: Link2. Làm bài kiểm tra năng lực và Phỏng vấn3. Nhận kết quảXem chi tiết về Rookie To Engineer: https://careers.nashtechglobal.com/fresher-program/Contact (Zalo): 0947834762 _ Ms. Nhu Pham _ Senior Talent Acquisition Executive at NashTech\nnext_contents:\n- [NASHTECH VIETNAM] CHƯƠNG TRÌNH ĐÀO TẠO IT FRESHERTHE ROOKIE TO ENGINEER 2025(.NET, AUTOMATIN TEST) – UPTO 17 TRIỆU ĐỒNGGiới thiệu công ty: NashTech là công ty thuộc tập đoàn NashSquared, có trụ sở chính tại Anh. NashTech là một trong những công ty công nghệ hàng đầu tại Việt Nam với bề dày kinh nghiệm trong việc tư vấn, cung ứng giải pháp công nghệ có quy mô toàn cầu cho nhiều khách hàng là những tập đoàn lớn như Ford, Google, Nestle, Honda, Prudential,…Với lịch sử hơn 24 năm phát triển tại Việt Nam cùng đội ngũ nhân lực hơn 2000 kỹ sư tài năm ở 03 trụ sở chính tại TP.Hồ Chí Minh, Hà Nội, Đà Nẵng; NashTech là một trong những doanh nghiệp góp phần thúc đẩy vị thế của Việt Nam trên bản đồ công nghệ thế giới, với 06 mảng kinh doanh chủ chốt, bao gồm:Dịch vụ Phát triển Xuất khẩu Phần mềm; Dịch vụ Tư vấn Giải pháp; Dịch vụ Giải pháp Quy trình Doanh nghiệp; Dịch vụ Bảo trì Phần mềm và Hỗ trợ Kỹ thuật; Dịch vụ Dữ liệu; Dịch vụ trải nghiệm kỹ thuật số. Giới thiệu về chương trình ROOKIE TO ENGINEER 2025 - BE READY TO EXCELRookie To Engineer 2025: Be ready to excel - Chương trình phát triển tài năng công nghệ dành riêng cho các sinh viên năm cuối hoặc mới tốt nghiệp đã khởi động mùa mới. Hãy nhanh tay nắm bắt cơ hội trở thành Software Engineer được chứng nhận bởi NashTech chỉ sau 3 tháng với offer lên đến 17 triệu đồng.Bạn quan tâm đến các vị trí chuyên môn:🔸.NET🔸 AUTE (Automation Test)Bạn đang tìm kiếm cơ hội:🔸 Trở thành Software Engineer/ Automation Test được chứng nhận bởi NashTech với offer hấp dẫn🔸 Được đào tạo kiến thức chuyên sâu từ các chuyên gia công nghệ tại NashTech với định hướng sự nghiệp rõ ràng.🔸 Được làm việc trong các dự án thực tế toàn cầu tại NashTech trong 3 tháng đào tạo 🔸 Nâng cao trình độ tiếng Anh và phát triển các kỹ năng mềm.🔸 Môi trường làm việc chuyên nghiệp, cởi mở, khuyến khích nhân viên phát triển và sáng tạo 🔸 Được hỗ trợ chi phí đi lại và ăn trưa trong suốt quá trình đào tạo 🔸 Được cấp giấy chứng nhận sau khi hoàn thành khóa học Đối tượng\n', 'content: Phòng Tổ chức Hành Chính - ĐẠI HỌC CÔNG NGHIỆP HÀ NỘI || HaUI\nToggle navigation\nLãnh đạo\nĐảng Uỷ\nHội đồng trường\nBan Giám Hiệu\nPhòng\nPhòng Tổ chức hành chính\nPhòng Đào tạo\nPhòng Khoa học công nghệ\nPhòng Công tác sinh viên\nPhòng Tài chính kế toán\nPhòng Quản trị\nPhòng Thanh tra Giáo dục\nPhòng hợp tác đối ngoại\nKhoa\nKhoa Điện\nKhoa Điện tử\nKhoa Công nghệ thông tin\nKhoa Công nghệ may & TKTT\nKhoa Công nghệ Hoá\nKhoa Lý luận chính trị - Pháp luật\nKhoa Khoa học cơ bản\nTT Đào tạo\nTrung tâm Đào tạo Sau đại học\nTrung tâm Việt Nhật\nTrung tâm Công nghệ thông tin\nTrung tâm Công nghệ ô tô và Đào tạo lái xe\nTrung tâm Giáo dục thể chất và Thể thao\nTrung tâm Giáo dục Quốc phòng An ninh\nTT Dịch vụ\nTrung tâm Đảm bảo chất lượng\nTrung tâm khảo thí\nTrung tâm Thông tin Thư viện\nTrung tâm Hỗ trợ Sinh viên\nTrung tâm Truyền thông & Quan hệ Công chúng\nTrạm Y tế\nViện nghiên cứu\nLetco\nTrường thuộc HaUI\nTrường Ngoại ngữ - Du lịch\nTrường Cơ khí - Ô tô\nTrường Kinh tế\nĐoàn thể\nCông đoàn\nĐoàn thanh niên\nHội sinh viên\nTạp chí KH&CN\nGiới thiệu\nThể lệ viết và gửi bài\nTạp chí đã xuất bản\nLiên hệ\nThư viện\nThư điện tử\nSitemap\nToggle navigation\nGiới thiệu\nTổng quan\nLịch sử\nQuy mô đào tạo\nĐội ngũ Cán bộ\nCơ sở vật chất\nNghiên cứu khoa học\nDanh hiệu thi đua\nChiến lược phát triển\nCơ cấu tổ chức\nSơ đồ tổ chức\nBCH Đảng bộ Trường\nHội đồng trường\nBan giám hiệu\nCác tổ chức đoàn thể\nViện - Khoa đào tạo\nPhòng - Ban - Trung tâm\nBa công khai\nKết quả khảo sát khách hàng\nBáo cáo khảo sát CBVC\nBáo cáo khảo sát sinh viên\nNhận diện thương hiệu\nLiên hệ\nTuyển sinh\nĐào tạo\nSau đại học\nĐại học\nTra cứu thông tin\nKhoa học công nghệ\nTuyển dụng\nEgov\nPhòng Tổ chức hành chính\nnext_contents:\n']","['Công nghệ thông tin - ĐẠI HỌC CÔNG NGHIỆP HÀ NỘI || HaUI Trang HaUI Phòng Phòng Tổ chức hành chính Phòng Đào tạo Phòng Công tác sinh viên Phòng Khoa học công nghệ Phòng hợp tác đối ngoại Phòng Tài chính kế toán Phòng Quản trị Phòng Thanh tra Giáo dục Khoa Khoa Công nghệ Hoá Khoa Công nghệ may & TKTT Khoa Công nghệ thông tin Khoa Điện Khoa Điện tử Khoa Khoa học cơ bản Khoa Lý luận chính trị - Pháp luật Trung tâm Đào tạo Trung tâm Đào tạo Sau đại học Trung tâm Giáo dục thể chất và Thể thao Trung tâm Công nghệ Ô tô và Đào tạo lái xe Trung tâm Công nghệ thông tin Trung tâm Việt Nhật Trung tâm Giáo dục Quốc phòng An ninh Trung tâm Dịch vụ Trung tâm Truyền thông & Quan hệ Công chúng Trạm Y tế Trung tâm Hỗ trợ Sinh viên Trung tâm Đảm bảo chất lượng Trung tâm Thông tin Thư viện Trung tâm khảo thí Viện nghiên cứu Công ty Letco Thư điện tử Sitemap Liên hệ Toggle navigation GIỚI THIỆU THÔNG TIN CHUNG CƠ CẤU TỔ CHỨC CHIẾN LƯỢC PHÁT TRIỂN CÁN BỘ GIẢNG VIÊN CƠ SỞ VẬT CHẤT LIÊN HỆ ĐÀO TẠO ĐẠI HỌC KHOA HỌC MÁY TÍNH KỸ THUẬT PHẦN MỀM HỆ THỐNG THÔNG TIN CÔNG NGHỆ THÔNG TIN CÔNG NGHỆ ĐA PHƯƠNG TIỆN AN TOÀN THÔNG TIN SAU ĐẠI HỌC HỆ THỐNG THÔNG TIN KẾ HOẠCH TIẾN ĐỘ QUY CHẾ, BIỂU MẪU NGHIÊN CỨU KHOA HỌC CÔNG TRÌNH CÔNG BỐ ĐỀ TÀI, DỰ ÁN SINH VIÊN NCKH TIN KHCN CÔNG TÁC SINH VIÊN QUY CHẾ GƯƠNG SÁNG SINH VIÊN HỌC BỔNG CÂU LẠC BỘ THƯ VIỆN ẢNH TUYỂN DỤNG Công nghệ thông tin Tin tiêu điểm Sinh viên Khóa 19 Khoa Công nghệ thông tin đạt Học bổng HaUI 100% toàn khóa học. Thứ Sáu, 11:07 20/09/2024 Đội bóng khoa Công nghệ thông tin cùng những trận cầu đáng nhớ Thứ Bảy, 10:00 23/07/2022 Đại hội đại biểu Liên chi Đoàn khoa Công nghệ thông tin lần thứ X, nhiệm kỳ 2022 - 2024 Thứ Hai, 15:00 18/04/2022 Gặp mặt tân Sinh viên K15 khoa Công nghệ thông tin Thứ Tư, 08:17 28/10/2020 Chương trình thực tập tại SVMC ""SVMC Internship Program 2020"" Thứ Sáu, 14:02 22/05/2020 Lịch giảng dạy môn Pháp Luật tuần từ 20/4 đến 26/4/2020 Hệ Cao đẳng khóa 21 Thứ Sáu, 15:05 17/04/2020 Danh sách các lớp học trực tuyến từ ngày 06/4/2020 đến ngày 19/4/2020 Thứ Bảy, 12:42 04/04/2020 Danh sách các lớp học trực tuyến từ ngày 30/3/2020 đến ngày 5/4/2020 Thứ Bảy, 14:46 28/03/2020 Kế hoạch tổ chức hoạt động dạy học tuần từ 23/03/2020 đến 05/04/2020 khoa CNTT Thứ Hai, 09:03 23/03/2020 Đội HaUI.NotTrashCar đạt giải nhì vòng sơ loại, giành quyền bước vào vòng bán kết cuộc đua số khu vực miền Bắc năm 2020 Thứ Sáu, 08:02 06/03/2020 Ngành Công nghệ thông tin 1. Mục tiêu- PEO1: Có hiểu biết về kinh tế, chính trị: có các kiến thức cơ bản trong lĩnh vực khoa học xã hội và nhân văn phù hợp với chuyên ngành được đào tạo để đóng góp hữu hiệu vào sự phát triển bền vững của xã hội, cộng đồng;- PEO2: Có kiến thức cơ bản về toán học, khoa học tự nhiên, đáp ứng cho việc tiếp thu các kiến thức giáo dục chuyên nghiệp và khả năng học tập ở trình độ cao hơn;- PEO3: Có hiểu biết sâu rộng về kiến thức cơ sở nhóm ngành máy tính và công nghệ thông tin, tạo điều kiện thuận lợi cho việc học tập các môn chuyên ngành, nghiên cứu chuyên sâu, tiếp cận dễ dàng với các công nghệ mới;- PEO4: Có kiến thức chuyên ngành đáp ứng được nhu cầu của xã hội về lĩnh vực công nghệ thông tin: quy trình và công cụ phát triển phần mềm, quản lý dự án công nghệ thông tin, đảm bảo chất lượng phần mềm, công nghệ đa phương tiện, thương mại điện tử, mạng máy tính, an toàn bảo mật thông tin... Có khả năng khảo sát, thiết kế, xây dựng, vận hành và bảo trì hệ thống mạng máy tính, phần mềm ứng dụng; quản trị hệ thống thông tin.- PEO5: Có kỹ năng cá nhân, nghề nghiệp, giao tiếp, làm việc nhóm đủ để làm việc trong môi trường làm việc liên ngành, đa văn hóa, đa quốc gia.2. Chuẩn đầu ra chương trình đào tạo (theo năng lực)- SO1: Phân tích được một vấn đề điện toán phức tạp, áp dụng các nguyên lý điện toán và các lĩnh vực liên quan khác để xác định giải pháp;- SO2: Thiết kế, triển khai và đánh giá được một giải pháp dựa trên máy tính để đáp ứng các yêu cầu điện toán phù hợp với ngành công nghệ thông tin;- SO3: Có khả năng giao tiếp hiệu quả trong các môi trường làm việc khác nhau;- SO4: Có khả năng làm việc hiệu quả với vai trò là một thành viên hoặc người đứng đầu trong các nhóm kỹ thuật;- SO5: Có khả năng sử dụng các phương pháp tiếp cận có hệ thống để lựa chọn, phát triển, áp dụng, tích hợp và quản trị các công nghệ điện toán an toàn nhằm đáp ứng mục tiêu của người dùng;- SO6: Nhận thức được về trách nhiệm nghề nghiệp, đánh giá được sự phù hợp của các hoạt động chuyên môn với các quy định pháp luật và nguyên tắc đạo đức;- SO7: Có khả năng học tập suốt đời; có nhận thức cơ bản về khoa học xã hội, chính trị và pháp luật và sử dụng ngoại ngữ.3. Chuẩn đầu ra cấp độ 3/ chỉ số đánh giá hiệu năng:- PI1.1 Phân tích được một số vấn đề điện toán phức tạp.- PI1.2 Vận dụng được các nguyên lý tính toán và các chuyên ngành']","Tôi không có thông tin này và khuyến nghị bạn tham khảo nguồn khác. Nếu bạn có câu hỏi khác liên quan đến khoa công nghệ thông tin hoặc các hoạt động, chương trình đào tạo tại Đại học Công nghiệp Hà Nội, hãy cho tôi biết!","Khoa Khoa học cơ bản là một phần trong cơ cấu tổ chức của Đại học Công nghiệp Hà Nội, đóng vai trò quan trọng trong việc cung cấp kiến thức nền tảng cho sinh viên, giúp họ phát triển các kỹ năng cần thiết cho việc học tập và nghiên cứu trong các lĩnh vực chuyên ngành.",0.0,1.0,0.3333333333333333,0.0,0.8443244879396412,0.958867073059082,2.6199381351470947
7,HaUI có những chương trình gì cho sinh viên ngành công nghệ đa phương tiện?,"['content: CÔNG TÁC SINH VIÊN\nQUY CHẾ\nGƯƠNG SÁNG SINH VIÊN\nHỌC BỔNG\nCÂU LẠC BỘ\nTHƯ VIỆN ẢNH\nTUYỂN DỤNG\nTIN TỨC\nTRANG CHỦ > TIN TỨC\nHaUI Orientation - Hướng đi đúng cho sinh viên IT\nTối ngày 08/4/2022 Khoa Công nghệ thông tin Trường Đại học Công Nghiệp Hà Nội kết hợp với công ty FPT Software tổ chức hội thảo HaUI Orientation - Hướng đi nào đúng cho sinh viên IT. Hội thảo được tổ chức online trên nền tảng zoom và live stream đã thu hút được đông đảo sinh viên tham gia.Chương trình đã giúp SV tìm hiểu và đánh giá đúng năng lực của bản thân hiện tại để tìm ra định hướng nghề nghiệp cho mình trong tương lai, lắng nghe những kinh nghiệm để lựa chọn môi trường phù hợp, phát huy tối đa năng lực của bản thân. Ngoài ra các bạn còn có cơ hội rinh về những phần quà vô cùng giá trị từ FPT Software, giúp các bạn có thể hiểu rõ về bản thân và hoạch định cho mình những hướng đi phù hợp trong tương lai.\nThứ Bảy, 10:15 09/04/2022\nTags:\nTweet\nCác bài đã đăng\n» Lễ bảo vệ Luận văn Thạc sĩ ngành Hệ thống Thông tin Khóa 12 đợt 1&2 (20/12/2024)\n» Seminar ""Chuỗi bài giảng về Hệ mờ và ứng dụng"" (18/12/2024)\n» Chúc mừng Ban chủ nhiệm khóa 14 Câu lạc bộ Tin học HIT (17/12/2024)\n» Chúc mừng thành công Kỳ thi Olympic Tin học Sinh viên Việt Nam lần thứ 33 (OLP’24), Procon và Kỳ thi lập trình sinh viên quốc tế ICPC Asia Hanoi 2024 (17/12/2024)\n» Việt Nam xuất sắc giành 2 Huy chương Vàng tại ICPC Asia Hanoi 2024 (15/12/2024)\n» Sinh viên Khoa CNTT hào hứng tham gia hội thảo Cyber Security của công ty HCL Việt Nam (01/04/2022)\n» DUCAPITAL Holding trao tặng đèn học thông minh cho sinh viên Đại học Công nghiệp Hà Nội (31/03/2022)\n» Sinh viên HaUI đạt thành tích cao tại Cuộc thi Olympic Tin học sinh viên Việt Nam lần thứ 30 (27/03/2022)\nnext_contents:\n- HaUI Orientation - Hướng đi đúng cho sinh viên IT\nTrang HaUI\nPhòng\nPhòng Tổ chức hành chính\nPhòng Đào tạo\nPhòng Công tác sinh viên\nPhòng Khoa học công nghệ\nPhòng hợp tác đối ngoại\nPhòng Tài chính kế toán\nPhòng Quản trị\nPhòng Thanh tra Giáo dục\nKhoa\nKhoa Công nghệ Hoá\nKhoa Công nghệ may & TKTT\nKhoa Công nghệ thông tin\nKhoa Điện\nKhoa Điện tử\nKhoa Khoa học cơ bản\nKhoa Lý luận chính trị - Pháp luật\nTrung tâm Đào tạo\nTrung tâm Đào tạo Sau đại học\nTrung tâm Giáo dục thể chất và Thể thao\nTrung tâm Công nghệ Ô tô và Đào tạo lái xe\nTrung tâm Công nghệ thông tin\nTrung tâm Việt Nhật\nTrung tâm Giáo dục Quốc phòng An ninh\nTrung tâm Dịch vụ\nTrung tâm Truyền thông & Quan hệ Công chúng\nTrạm Y tế\nTrung tâm Hỗ trợ Sinh viên\nTrung tâm Đảm bảo chất lượng\nTrung tâm Thông tin Thư viện\nTrung tâm khảo thí\nViện nghiên cứu\nCông ty Letco\nThư điện tử\nSitemap\nLiên hệ\nToggle navigation\nGIỚI THIỆU\nTHÔNG TIN CHUNG\nCƠ CẤU TỔ CHỨC\nCHIẾN LƯỢC PHÁT TRIỂN\nCÁN BỘ GIẢNG VIÊN\nCƠ SỞ VẬT CHẤT\nLIÊN HỆ\nĐÀO TẠO\nĐẠI HỌC\nKHOA HỌC MÁY TÍNH\nKỸ THUẬT PHẦN MỀM\nHỆ THỐNG THÔNG TIN\nCÔNG NGHỆ THÔNG TIN\nCÔNG NGHỆ ĐA PHƯƠNG TIỆN\nAN TOÀN THÔNG TIN\nSAU ĐẠI HỌC\nHỆ THỐNG THÔNG TIN\nKẾ HOẠCH\nTIẾN ĐỘ\nQUY CHẾ, BIỂU MẪU\nNGHIÊN CỨU KHOA HỌC\nCÔNG TRÌNH CÔNG BỐ\nĐỀ TÀI, DỰ ÁN\nSINH VIÊN NCKH\nTIN KHCN\nCÔNG TÁC SINH VIÊN\nQUY CHẾ\nGƯƠNG SÁNG SINH VIÊN\nHỌC BỔNG\nCÂU LẠC BỘ\nTHƯ VIỆN ẢNH\nTUYỂN DỤNG\nTIN TỨC\nTRANG CHỦ > TIN TỨC\nHaUI Orientation - Hướng đi đúng cho sinh viên IT\n', 'content: HaUI Orientation - Hướng đi đúng cho sinh viên IT\nTrang HaUI\nPhòng\nPhòng Tổ chức hành chính\nPhòng Đào tạo\nPhòng Công tác sinh viên\nPhòng Khoa học công nghệ\nPhòng hợp tác đối ngoại\nPhòng Tài chính kế toán\nPhòng Quản trị\nPhòng Thanh tra Giáo dục\nKhoa\nKhoa Công nghệ Hoá\nKhoa Công nghệ may & TKTT\nKhoa Công nghệ thông tin\nKhoa Điện\nKhoa Điện tử\nKhoa Khoa học cơ bản\nKhoa Lý luận chính trị - Pháp luật\nTrung tâm Đào tạo\nTrung tâm Đào tạo Sau đại học\nTrung tâm Giáo dục thể chất và Thể thao\nTrung tâm Công nghệ Ô tô và Đào tạo lái xe\nTrung tâm Công nghệ thông tin\nTrung tâm Việt Nhật\nTrung tâm Giáo dục Quốc phòng An ninh\nTrung tâm Dịch vụ\nTrung tâm Truyền thông & Quan hệ Công chúng\nTrạm Y tế\nTrung tâm Hỗ trợ Sinh viên\nTrung tâm Đảm bảo chất lượng\nTrung tâm Thông tin Thư viện\nTrung tâm khảo thí\nViện nghiên cứu\nCông ty Letco\nThư điện tử\nSitemap\nLiên hệ\nToggle navigation\nGIỚI THIỆU\nTHÔNG TIN CHUNG\nCƠ CẤU TỔ CHỨC\nCHIẾN LƯỢC PHÁT TRIỂN\nCÁN BỘ GIẢNG VIÊN\nCƠ SỞ VẬT CHẤT\nLIÊN HỆ\nĐÀO TẠO\nĐẠI HỌC\nKHOA HỌC MÁY TÍNH\nKỸ THUẬT PHẦN MỀM\nHỆ THỐNG THÔNG TIN\nCÔNG NGHỆ THÔNG TIN\nCÔNG NGHỆ ĐA PHƯƠNG TIỆN\nAN TOÀN THÔNG TIN\nSAU ĐẠI HỌC\nHỆ THỐNG THÔNG TIN\nKẾ HOẠCH\nTIẾN ĐỘ\nQUY CHẾ, BIỂU MẪU\nNGHIÊN CỨU KHOA HỌC\nCÔNG TRÌNH CÔNG BỐ\nĐỀ TÀI, DỰ ÁN\nSINH VIÊN NCKH\nTIN KHCN\nCÔNG TÁC SINH VIÊN\nQUY CHẾ\nGƯƠNG SÁNG SINH VIÊN\nHỌC BỔNG\nCÂU LẠC BỘ\nTHƯ VIỆN ẢNH\nTUYỂN DỤNG\nTIN TỨC\nTRANG CHỦ > TIN TỨC\nHaUI Orientation - Hướng đi đúng cho sinh viên IT\nnext_contents:\n', 'content: Xem thêm\nNhiệm vụ khoa học công nghệ\nThứ Sáu, 13:55 10/12/2021\nXem thêm\n1\nTin tiêu điểm\nSinh viên Khóa 19 Khoa Công nghệ thông tin đạt Học bổng HaUI 100% toàn khóa học.\nThứ Sáu, 11:07 20/09/2024\nĐội bóng khoa Công nghệ thông tin cùng những trận cầu đáng nhớ\nThứ Bảy, 10:00 23/07/2022\nĐại hội đại biểu Liên chi Đoàn khoa Công nghệ thông tin lần thứ X, nhiệm kỳ 2022 - 2024\nThứ Hai, 15:00 18/04/2022\nGặp mặt tân Sinh viên K15 khoa Công nghệ thông tin\nThứ Tư, 08:17 28/10/2020\nChương trình thực tập tại SVMC ""SVMC Internship Program 2020""\nThứ Sáu, 14:02 22/05/2020\nLịch giảng dạy môn Pháp Luật tuần từ 20/4 đến 26/4/2020 Hệ Cao đẳng khóa 21\nThứ Sáu, 15:05 17/04/2020\nDanh sách các lớp học trực tuyến từ ngày 06/4/2020 đến ngày 19/4/2020\nThứ Bảy, 12:42 04/04/2020\nDanh sách các lớp học trực tuyến từ ngày 30/3/2020 đến ngày 5/4/2020\nThứ Bảy, 14:46 28/03/2020\nKế hoạch tổ chức hoạt động dạy học tuần từ 23/03/2020 đến 05/04/2020 khoa CNTT\nThứ Hai, 09:03 23/03/2020\nĐội HaUI.NotTrashCar đạt giải nhì vòng sơ loại, giành quyền bước vào vòng bán kết cuộc đua số khu vực miền Bắc năm 2020\nThứ Sáu, 08:02 06/03/2020\nBản đồ chỉ dẫn\nTrường Đại học Công nghiệp Hà Nội\nTrụ sở chính\nSố 298 đường Cầu Diễn, quận Bắc Từ Liêm, Hà Nội\n+84 243 765 5121\nEmail: dhcnhn@haui.edu.vn\nCác cơ sở khác\nCơ sở 2: Phường Tây Tựu, quận Bắc Từ Liêm, Hà Nội\nCơ sở 3: Phường Lê Hồng Phong, thành phố Phủ Lý, Hà Nam\nLiên kết site\nTrường Đại học Công nghiệp Hà Nội\nThông tin tuyển sinh\nHành chính điện tử\nĐào tạo trực tuyến\nCổng thông tin đào tạo\nCopyright © 2018 Hanoi University of Industry.\nnext_contents:\n- Đề tài, dự án- KHOA CÔNG NGHỆ THÔNG TIN - ĐẠI HỌC CÔNG NGHIỆP HÀ NỘI || HaUI\nTrang HaUI\nPhòng\nPhòng Tổ chức hành chính\nPhòng Đào tạo\nPhòng Công tác sinh viên\nPhòng Khoa học công nghệ\nPhòng hợp tác đối ngoại\nPhòng Tài chính kế toán\nPhòng Quản trị\nPhòng Thanh tra Giáo dục\nKhoa\nKhoa Công nghệ Hoá\nKhoa Công nghệ may & TKTT\nKhoa Công nghệ thông tin\nKhoa Điện\nKhoa Điện tử\nKhoa Khoa học cơ bản\nKhoa Lý luận chính trị - Pháp luật\nTrung tâm Đào tạo\nTrung tâm Đào tạo Sau đại học\nTrung tâm Giáo dục thể chất và Thể thao\nTrung tâm Công nghệ Ô tô và Đào tạo lái xe\nTrung tâm Công nghệ thông tin\nTrung tâm Việt Nhật\nTrung tâm Giáo dục Quốc phòng An ninh\nTrung tâm Dịch vụ\nTrung tâm Truyền thông & Quan hệ Công chúng\nTrạm Y tế\nTrung tâm Hỗ trợ Sinh viên\nTrung tâm Đảm bảo chất lượng\nTrung tâm Thông tin Thư viện\nTrung tâm khảo thí\nViện nghiên cứu\nCông ty Letco\nThư điện tử\nSitemap\nLiên hệ\nToggle navigation\nGIỚI THIỆU\nTHÔNG TIN CHUNG\nCƠ CẤU TỔ CHỨC\nCHIẾN LƯỢC PHÁT TRIỂN\nCÁN BỘ GIẢNG VIÊN\nCƠ SỞ VẬT CHẤT\nLIÊN HỆ\nĐÀO TẠO\nĐẠI HỌC\nKHOA HỌC MÁY TÍNH\nKỸ THUẬT PHẦN MỀM\nHỆ THỐNG THÔNG TIN\nCÔNG NGHỆ THÔNG TIN\nCÔNG NGHỆ ĐA PHƯƠNG TIỆN\nAN TOÀN THÔNG TIN\nSAU ĐẠI HỌC\nHỆ THỐNG THÔNG TIN\nKẾ HOẠCH\nTIẾN ĐỘ\nQUY CHẾ, BIỂU MẪU\nNGHIÊN CỨU KHOA HỌC\nCÔNG TRÌNH CÔNG BỐ\nĐỀ TÀI, DỰ ÁN\nSINH VIÊN NCKH\nTIN KHCN\nCÔNG TÁC SINH VIÊN\nQUY CHẾ\nGƯƠNG SÁNG SINH VIÊN\nHỌC BỔNG\nCÂU LẠC BỘ\nTHƯ VIỆN ẢNH\nTUYỂN DỤNG\nĐỀ TÀI, DỰ ÁN\nTRANG CHỦ > ĐỀ TÀI, DỰ ÁN\nGiáo trình\nThứ Bảy, 21:22 11/12/2021\nXem thêm\nNhiệm vụ khoa học công nghệ\nThứ Sáu, 13:55 10/12/2021\nXem thêm\n1\nTin tiêu điểm\nSinh viên Khóa 19 Khoa Công nghệ thông tin đạt Học bổng HaUI 100% toàn khóa học.\nThứ Sáu, 11:07 20/09/2024\n', 'content: Xem thêm\nNhiệm vụ khoa học công nghệ\nThứ Sáu, 13:55 10/12/2021\nXem thêm\n1\nTin tiêu điểm\nSinh viên Khóa 19 Khoa Công nghệ thông tin đạt Học bổng HaUI 100% toàn khóa học.\nThứ Sáu, 11:07 20/09/2024\nĐội bóng khoa Công nghệ thông tin cùng những trận cầu đáng nhớ\nThứ Bảy, 10:00 23/07/2022\nĐại hội đại biểu Liên chi Đoàn khoa Công nghệ thông tin lần thứ X, nhiệm kỳ 2022 - 2024\nThứ Hai, 15:00 18/04/2022\nGặp mặt tân Sinh viên K15 khoa Công nghệ thông tin\nThứ Tư, 08:17 28/10/2020\nChương trình thực tập tại SVMC ""SVMC Internship Program 2020""\nThứ Sáu, 14:02 22/05/2020\nLịch giảng dạy môn Pháp Luật tuần từ 20/4 đến 26/4/2020 Hệ Cao đẳng khóa 21\nThứ Sáu, 15:05 17/04/2020\nDanh sách các lớp học trực tuyến từ ngày 06/4/2020 đến ngày 19/4/2020\nThứ Bảy, 12:42 04/04/2020\nDanh sách các lớp học trực tuyến từ ngày 30/3/2020 đến ngày 5/4/2020\nThứ Bảy, 14:46 28/03/2020\nKế hoạch tổ chức hoạt động dạy học tuần từ 23/03/2020 đến 05/04/2020 khoa CNTT\nThứ Hai, 09:03 23/03/2020\nĐội HaUI.NotTrashCar đạt giải nhì vòng sơ loại, giành quyền bước vào vòng bán kết cuộc đua số khu vực miền Bắc năm 2020\nThứ Sáu, 08:02 06/03/2020\nBản đồ chỉ dẫn\nTrường Đại học Công nghiệp Hà Nội\nTrụ sở chính\nSố 298 đường Cầu Diễn, quận Bắc Từ Liêm, Hà Nội\n+84 243 765 5121\nEmail: dhcnhn@haui.edu.vn\nCác cơ sở khác\nCơ sở 2: Phường Tây Tựu, quận Bắc Từ Liêm, Hà Nội\nCơ sở 3: Phường Lê Hồng Phong, thành phố Phủ Lý, Hà Nam\nLiên kết site\nTrường Đại học Công nghiệp Hà Nội\nThông tin tuyển sinh\nHành chính điện tử\nĐào tạo trực tuyến\nCổng thông tin đào tạo\nCopyright © 2018 Hanoi University of Industry.\nnext_contents:\n- Đề tài, dự án- KHOA CÔNG NGHỆ THÔNG TIN - ĐẠI HỌC CÔNG NGHIỆP HÀ NỘI || HaUI\nTrang HaUI\nPhòng\nPhòng Tổ chức hành chính\nPhòng Đào tạo\nPhòng Công tác sinh viên\nPhòng Khoa học công nghệ\nPhòng hợp tác đối ngoại\nPhòng Tài chính kế toán\nPhòng Quản trị\nPhòng Thanh tra Giáo dục\nKhoa\nKhoa Công nghệ Hoá\nKhoa Công nghệ may & TKTT\nKhoa Công nghệ thông tin\nKhoa Điện\nKhoa Điện tử\nKhoa Khoa học cơ bản\nKhoa Lý luận chính trị - Pháp luật\nTrung tâm Đào tạo\nTrung tâm Đào tạo Sau đại học\nTrung tâm Giáo dục thể chất và Thể thao\nTrung tâm Công nghệ Ô tô và Đào tạo lái xe\nTrung tâm Công nghệ thông tin\nTrung tâm Việt Nhật\nTrung tâm Giáo dục Quốc phòng An ninh\nTrung tâm Dịch vụ\nTrung tâm Truyền thông & Quan hệ Công chúng\nTrạm Y tế\nTrung tâm Hỗ trợ Sinh viên\nTrung tâm Đảm bảo chất lượng\nTrung tâm Thông tin Thư viện\nTrung tâm khảo thí\nViện nghiên cứu\nCông ty Letco\nThư điện tử\nSitemap\nLiên hệ\nToggle navigation\nGIỚI THIỆU\nTHÔNG TIN CHUNG\nCƠ CẤU TỔ CHỨC\nCHIẾN LƯỢC PHÁT TRIỂN\nCÁN BỘ GIẢNG VIÊN\nCƠ SỞ VẬT CHẤT\nLIÊN HỆ\nĐÀO TẠO\nĐẠI HỌC\nKHOA HỌC MÁY TÍNH\nKỸ THUẬT PHẦN MỀM\nHỆ THỐNG THÔNG TIN\nCÔNG NGHỆ THÔNG TIN\nCÔNG NGHỆ ĐA PHƯƠNG TIỆN\nAN TOÀN THÔNG TIN\nSAU ĐẠI HỌC\nHỆ THỐNG THÔNG TIN\nKẾ HOẠCH\nTIẾN ĐỘ\nQUY CHẾ, BIỂU MẪU\nNGHIÊN CỨU KHOA HỌC\nCÔNG TRÌNH CÔNG BỐ\nĐỀ TÀI, DỰ ÁN\nSINH VIÊN NCKH\nTIN KHCN\nCÔNG TÁC SINH VIÊN\nQUY CHẾ\nGƯƠNG SÁNG SINH VIÊN\nHỌC BỔNG\nCÂU LẠC BỘ\nTHƯ VIỆN ẢNH\nTUYỂN DỤNG\nĐỀ TÀI, DỰ ÁN\nTRANG CHỦ > ĐỀ TÀI, DỰ ÁN\nGiáo trình\nThứ Bảy, 21:22 11/12/2021\nXem thêm\nNhiệm vụ khoa học công nghệ\nThứ Sáu, 13:55 10/12/2021\nXem thêm\n1\nTin tiêu điểm\nSinh viên Khóa 19 Khoa Công nghệ thông tin đạt Học bổng HaUI 100% toàn khóa học.\nThứ Sáu, 11:07 20/09/2024\n']","['Công nghệ đa phương tiện - ĐẠI HỌC CÔNG NGHIỆP HÀ NỘI || HaUI Trang HaUI Phòng Phòng Tổ chức hành chính Phòng Đào tạo Phòng Công tác sinh viên Phòng Khoa học công nghệ Phòng hợp tác đối ngoại Phòng Tài chính kế toán Phòng Quản trị Phòng Thanh tra Giáo dục Khoa Khoa Công nghệ Hoá Khoa Công nghệ may & TKTT Khoa Công nghệ thông tin Khoa Điện Khoa Điện tử Khoa Khoa học cơ bản Khoa Lý luận chính trị - Pháp luật Trung tâm Đào tạo Trung tâm Đào tạo Sau đại học Trung tâm Giáo dục thể chất và Thể thao Trung tâm Công nghệ Ô tô và Đào tạo lái xe Trung tâm Công nghệ thông tin Trung tâm Việt Nhật Trung tâm Giáo dục Quốc phòng An ninh Trung tâm Dịch vụ Trung tâm Truyền thông & Quan hệ Công chúng Trạm Y tế Trung tâm Hỗ trợ Sinh viên Trung tâm Đảm bảo chất lượng Trung tâm Thông tin Thư viện Trung tâm khảo thí Viện nghiên cứu Công ty Letco Thư điện tử Sitemap Liên hệ Toggle navigation GIỚI THIỆU THÔNG TIN CHUNG CƠ CẤU TỔ CHỨC CHIẾN LƯỢC PHÁT TRIỂN CÁN BỘ GIẢNG VIÊN CƠ SỞ VẬT CHẤT LIÊN HỆ ĐÀO TẠO ĐẠI HỌC KHOA HỌC MÁY TÍNH KỸ THUẬT PHẦN MỀM HỆ THỐNG THÔNG TIN CÔNG NGHỆ THÔNG TIN CÔNG NGHỆ ĐA PHƯƠNG TIỆN AN TOÀN THÔNG TIN SAU ĐẠI HỌC HỆ THỐNG THÔNG TIN KẾ HOẠCH TIẾN ĐỘ QUY CHẾ, BIỂU MẪU NGHIÊN CỨU KHOA HỌC CÔNG TRÌNH CÔNG BỐ ĐỀ TÀI, DỰ ÁN SINH VIÊN NCKH TIN KHCN CÔNG TÁC SINH VIÊN QUY CHẾ GƯƠNG SÁNG SINH VIÊN HỌC BỔNG CÂU LẠC BỘ THƯ VIỆN ẢNH TUYỂN DỤNG Công nghệ đa phương tiện Tin tiêu điểm Sinh viên Khóa 19 Khoa Công nghệ thông tin đạt Học bổng HaUI 100% toàn khóa học. Thứ Sáu, 11:07 20/09/2024 Đội bóng khoa Công nghệ thông tin cùng những trận cầu đáng nhớ Thứ Bảy, 10:00 23/07/2022 Đại hội đại biểu Liên chi Đoàn khoa Công nghệ thông tin lần thứ X, nhiệm kỳ 2022 - 2024 Thứ Hai, 15:00 18/04/2022 Gặp mặt tân Sinh viên K15 khoa Công nghệ thông tin Thứ Tư, 08:17 28/10/2020 Chương trình thực tập tại SVMC ""SVMC Internship Program 2020"" Thứ Sáu, 14:02 22/05/2020 Lịch giảng dạy môn Pháp Luật tuần từ 20/4 đến 26/4/2020 Hệ Cao đẳng khóa 21 Thứ Sáu, 15:05 17/04/2020 Danh sách các lớp học trực tuyến từ ngày 06/4/2020 đến ngày 19/4/2020 Thứ Bảy, 12:42 04/04/2020 Danh sách các lớp học trực tuyến từ ngày 30/3/2020 đến ngày 5/4/2020 Thứ Bảy, 14:46 28/03/2020 Kế hoạch tổ chức hoạt động dạy học tuần từ 23/03/2020 đến 05/04/2020 khoa CNTT Thứ Hai, 09:03 23/03/2020 Đội HaUI.NotTrashCar đạt giải nhì vòng sơ loại, giành quyền bước vào vòng bán kết cuộc đua số khu vực miền Bắc năm 2020 Thứ Sáu, 08:02 06/03/2020 Ngành Công nghệ đa phương tiện 1. Mục tiêuSinh viên tốt nghiệp từ chương trình Công nghệ Đa phương tiện có thể:- PEO1: Có hiểu biết về kinh tế, chính trị: có các kiến thức cơ bản trong lĩnh vực khoa học xã hội và nhân văn phù hợp với chuyên ngành được đào tạo để đóng góp hữu hiệu vào sự phát triển bền vững của xã hội, cộng đồng.- PEO2: Có kiến thức cơ bản về toán học, khoa học tự nhiên, đáp ứng cho việc tiếp thu các kiến thức giáo dục chuyên nghiệp và khả năng học tập ở trình độ cao hơn.- PEO3: Có hiểu biết sâu rộng về kiến thức cơ sở của ngành học công nghệ đa phương tiện bao gồm kỹ thuật xử lý dữ liệu đa phương tiện và dữ liệu truyền thông, thiết kế đa phương tiện, lập trình tích hợp các thành phần đa phương tiện.- PEO4: Có kiến thức chuyên ngành đáp ứng được nhu cầu của xã hội về lĩnh vực đa phương tiện: Thiết kế các sản phẩm đa phương tiện. Tích hợp các tài nguyên đa phương tiện. Phát triển sản phẩm phần mềm sử dụng tài nguyên đa phương tiện.- PEO5: Có kỹ năng cá nhân, nghề nghiệp, giao tiếp, làm việc nhóm đủ để làm việc trong môi trường làm việc liên ngành, đa văn hóa, đa quốc gia.2. Chuẩn đầu ra chương trình đào tạo- SO1: Phân tích được một vấn đề điện toán phức tạp, áp dụng các nguyên lý điện toán và các lĩnh vực liên quan khác để xác định giải pháp.- SO2: Thiết kế, triển khai và đánh giá được một giải pháp sử dụng công nghệ đa phương tiện, công nghệ thông tin và truyền thông để đáp ứng yêu cầu xác định.- SO3: Giao tiếp hiệu quả trong các ngữ cảnh khác nhau.- SO4: Làm việc hiệu quả với vai trò là một thành viên hoặc người đứng đầu trong các nhóm kỹ thuật.- SO5: Thiết kế, triển khai, đánh giá phần mềm đáp ứng các yêu cầu điện toán cho trước bằng các công cụ và kỹ thuật của công nghệ thông tin.- SO6: Nhận thức được về trách nhiệm nghề nghiệp, đánh giá được sự phù hợp của các hoạt động chuyên môn với các quy định pháp luật và nguyên tắc đạo đức.- SO7: Có khả năng học tập suốt đời, có nhận thức cơ bản về khoa học xã hội, chính trị và pháp luật và sử dụng ngoại ngữ.3. Chuẩn đầu ra cấp độ 3/ chỉ số đánh giá hiệu năng:- PI1.1: Phân tích được một số bài toán tính toán phức tạp.- PI1.2: Vận dụng được các nguyên lý tính toán và các chuyên ngành liên quan khác để xác định giải pháp cho các vấn đề điện toán phức tạp.- PI2.1: Xây dựng được sản phẩm đa phương tiện đáp ứng yêu cầu cho trước sử dụng công nghệ thông tin và truyền thông.- PI2.2: Triển khai']","Tại Trường Đại học Công nghiệp Hà Nội (HaUI), sinh viên ngành Công nghệ Đa phương tiện có thể tham gia vào nhiều chương trình và hoạt động phong phú, bao gồm:

1. **Chương trình thực tập**: Sinh viên có cơ hội tham gia các chương trình thực tập như ""SVMC Internship Program 2020"", giúp họ tích lũy kinh nghiệm thực tế và áp dụng kiến thức đã học vào công việc.

2. **Học bổng**: Sinh viên có thể nhận học bổng HaUI 100% toàn khóa học, như trường hợp của sinh viên Khóa 19 Khoa Công nghệ thông tin.

3. **Hoạt động ngoại khóa**: Các hoạt động thể thao, văn hóa, và các sự kiện giao lưu giữa các sinh viên, như đội bóng khoa Công nghệ thông tin tham gia các giải đấu.

4. **Nghiên cứu khoa học**: Sinh viên có thể tham gia vào các đề tài, dự án nghiên cứu khoa học, giúp phát triển kỹ năng nghiên cứu và sáng tạo.

5. **Câu lạc bộ**: Tham gia các câu lạc bộ sinh viên để phát triển kỹ năng mềm và mở rộng mối quan hệ.

Thông tin chi tiết về các chương trình có thể được tìm thấy trên trang web chính thức của Khoa Công nghệ thông tin tại HaUI. 

Nguồn: [ĐỀ TÀI, DỰ ÁN] - [**Link tham khảo**](https://fit.haui.edu.vn/vn/de-tai-du-an). 

Nếu bạn cần thêm thông tin hoặc có câu hỏi khác, hãy cho tôi biết!","Ngành Công nghệ đa phương tiện tại HaUI có mục tiêu giúp sinh viên tốt nghiệp có hiểu biết về kinh tế, chính trị, kiến thức cơ bản về toán học và khoa học tự nhiên, cũng như kiến thức sâu rộng về kỹ thuật xử lý dữ liệu đa phương tiện và thiết kế đa phương tiện. Sinh viên cũng được trang bị kỹ năng cá nhân, nghề nghiệp, giao tiếp và làm việc nhóm để làm việc trong môi trường đa văn hóa.",0.0,0.0,0.5,0.8697523833962308,0.9324831711721971,0.7988579273223877,9.65865683555603
8,Khoa Công nghệ may & TKTT tại Đại học Công nghiệp Hà Nội có những chương trình đào tạo nào?,"['content: Thông tin công khai đề án mở ngành Công nghệ dệt, may; trình độ tiến sĩ, mã ngành 9540204\nChào mừng Tân sinh viên đại học khóa 19- Khoa Công nghệ May- Thiết kế thời trang\nThông báo\nTHÔNG TIN TUYỂN SINH KHOA CÔNG NGHỆ MAY-TKTT 2019\nCác chương trình hỗ trợ sinh viên trường Đại học Công nghiệp Hà nội - năm học 2018-2019\nThông báo ""Ngày hội việc làm Trường Đại học Công nghiệp Hà Nội năm 2017""\nKế hoạch tổ chức chương trình hội thảo việc làm của tập đoàn dệt TEXHONG.\nThông báo về việc xét tốt nghiệp hệ Đại học chính quy năm 2017\nTUYỂN DỤNG\n» Thông báo tuyển dụng của công ty May mặc Hoa Lợi Đạt\n» Thông báo tuyển dụng của công ty Cổ phần CF Toàn cầu Thái Bình\n» Xem tất cả\nKế hoạch tiến độ đào tạo\nLịch giảng dạy thực hành tuần 16 (HK1) tuần từ 23.12.2024 đến 29.12.2024\nLịch giảng dạy thực hành tuần 15 (HK1) tuần từ 16.12.2024 đến 22.12.2024\nLịch giảng dạy thực hành tuần 14 (HK1) tuần từ 9.12 đến 15.12.2024\nLịch giảng dạy thực hành tuần 13(HK1) tuần từ 2.12 đến 8.12.2024\nBản đồ chỉ dẫn\nTrường Đại học Công nghiệp Hà Nội\nTrụ sở chính\nSố 298 đường Cầu Diễn, quận Bắc Từ Liêm, Hà Nội\n+84 243 765 5121\nEmail: dhcnhn@haui.edu.vn\nCác cơ sở khác\nCơ sở 2: Phường Tây Tựu, quận Bắc Từ Liêm, Hà Nội\nCơ sở 3: Phường Lê Hồng Phong, thành phố Phủ Lý, Hà Nam\nLiên kết site\nTrường Đại học Công nghiệp Hà Nội\nThông tin tuyển sinh\nHành chính điện tử\nĐào tạo trực tuyến\nCổng thông tin đào tạo\nCopyright © 2018 Hanoi University of Industry.\nnext_contents:\n- KHOA CÔNG NGHỆ MAY & TKTT - ĐẠI HỌC CÔNG NGHIỆP HÀ NỘI || HaUI\nTrang HaUI\nPhòng\nPhòng Tổ chức hành chính\nPhòng Đào tạo\nPhòng Công tác sinh viên\nPhòng Khoa học công nghệ\nPhòng hợp tác đối ngoại\nPhòng Tài chính kế toán\nPhòng Quản trị\nPhòng Thanh tra Giáo dục\nKhoa\nKhoa Công nghệ Hoá\nKhoa Công nghệ may & TKTT\nKhoa Công nghệ thông tin\nKhoa Điện\nKhoa Điện tử\nKhoa Khoa học cơ bản\nKhoa Lý luận chính trị - Pháp luật\nTrung tâm Đào tạo\nTrung tâm Đào tạo Sau đại học\nTrung tâm Giáo dục thể chất và Thể thao\nTrung tâm Công nghệ Ô tô và Đào tạo lái xe\nTrung tâm Công nghệ thông tin\nTrung tâm Việt Nhật\nTrung tâm Giáo dục Quốc phòng An ninh\nTrung tâm Dịch vụ\nTrung tâm Truyền thông & Quan hệ Công chúng\nTrạm Y tế\nTrung tâm Hỗ trợ Sinh viên\nTrung tâm Đảm bảo chất lượng\nTrung tâm Thông tin Thư viện\nTrung tâm khảo thí\nViện nghiên cứu\nCông ty Letco\nThư điện tử\nSitemap\nLiên hệ\nToggle navigation\nGiới thiệu\nGiới thiệu\nCơ cấu tổ chức\nNgành nghề đào tạo\nCơ sở vật chất\nCán bộ & Giảng viên\nĐịa chỉ liên hệ\nTuyển sinh\nSau đại học\nĐại học\nĐào tạo\nSau đại học\nĐại học\nNCKH\nNCKH Giảng viên\nNCKH HVSV\nSinh viên\nHoạt động sinh viên\nCựu sinh viên\nTuyển dụng\nHoạt động doanh nghiệp\nHợp tác quốc tế\nHợp tác doanh nghiệp\nHợp tác đào tạo\nHọc bổng doanh nghiệp\nDiễn đàn doanh nghiệp\nPrevious\nNext\nTin tức\nThông báo tuyển dụng của công ty May mặc Hoa Lợi Đạt\nThông báo tuyển dụng của công ty Cổ phần CF Toàn cầu Thái Bình\nThông tin công khai đề án mở ngành Công nghệ dệt, may; trình độ tiến sĩ, mã ngành 9540204\nChào mừng Tân sinh viên đại học khóa 19- Khoa Công nghệ May- Thiết kế thời trang\nThông báo\nTHÔNG TIN TUYỂN SINH KHOA CÔNG NGHỆ MAY-TKTT 2019\n', 'content: Thông tin công khai đề án mở ngành Công nghệ dệt, may; trình độ tiến sĩ, mã ngành 9540204\nChào mừng Tân sinh viên đại học khóa 19- Khoa Công nghệ May- Thiết kế thời trang\nThông báo\nTHÔNG TIN TUYỂN SINH KHOA CÔNG NGHỆ MAY-TKTT 2019\nCác chương trình hỗ trợ sinh viên trường Đại học Công nghiệp Hà nội - năm học 2018-2019\nThông báo ""Ngày hội việc làm Trường Đại học Công nghiệp Hà Nội năm 2017""\nKế hoạch tổ chức chương trình hội thảo việc làm của tập đoàn dệt TEXHONG.\nThông báo về việc xét tốt nghiệp hệ Đại học chính quy năm 2017\nTUYỂN DỤNG\n» Thông báo tuyển dụng của công ty May mặc Hoa Lợi Đạt\n» Thông báo tuyển dụng của công ty Cổ phần CF Toàn cầu Thái Bình\n» Xem tất cả\nKế hoạch tiến độ đào tạo\nLịch giảng dạy thực hành tuần 16 (HK1) tuần từ 23.12.2024 đến 29.12.2024\nLịch giảng dạy thực hành tuần 15 (HK1) tuần từ 16.12.2024 đến 22.12.2024\nLịch giảng dạy thực hành tuần 14 (HK1) tuần từ 9.12 đến 15.12.2024\nLịch giảng dạy thực hành tuần 13(HK1) tuần từ 2.12 đến 8.12.2024\nBản đồ chỉ dẫn\nTrường Đại học Công nghiệp Hà Nội\nTrụ sở chính\nSố 298 đường Cầu Diễn, quận Bắc Từ Liêm, Hà Nội\n+84 243 765 5121\nEmail: dhcnhn@haui.edu.vn\nCác cơ sở khác\nCơ sở 2: Phường Tây Tựu, quận Bắc Từ Liêm, Hà Nội\nCơ sở 3: Phường Lê Hồng Phong, thành phố Phủ Lý, Hà Nam\nLiên kết site\nTrường Đại học Công nghiệp Hà Nội\nThông tin tuyển sinh\nHành chính điện tử\nĐào tạo trực tuyến\nCổng thông tin đào tạo\nCopyright © 2018 Hanoi University of Industry.\nnext_contents:\n- KHOA CÔNG NGHỆ MAY & TKTT - ĐẠI HỌC CÔNG NGHIỆP HÀ NỘI || HaUI\nTrang HaUI\nPhòng\nPhòng Tổ chức hành chính\nPhòng Đào tạo\nPhòng Công tác sinh viên\nPhòng Khoa học công nghệ\nPhòng hợp tác đối ngoại\nPhòng Tài chính kế toán\nPhòng Quản trị\nPhòng Thanh tra Giáo dục\nKhoa\nKhoa Công nghệ Hoá\nKhoa Công nghệ may & TKTT\nKhoa Công nghệ thông tin\nKhoa Điện\nKhoa Điện tử\nKhoa Khoa học cơ bản\nKhoa Lý luận chính trị - Pháp luật\nTrung tâm Đào tạo\nTrung tâm Đào tạo Sau đại học\nTrung tâm Giáo dục thể chất và Thể thao\nTrung tâm Công nghệ Ô tô và Đào tạo lái xe\nTrung tâm Công nghệ thông tin\nTrung tâm Việt Nhật\nTrung tâm Giáo dục Quốc phòng An ninh\nTrung tâm Dịch vụ\nTrung tâm Truyền thông & Quan hệ Công chúng\nTrạm Y tế\nTrung tâm Hỗ trợ Sinh viên\nTrung tâm Đảm bảo chất lượng\nTrung tâm Thông tin Thư viện\nTrung tâm khảo thí\nViện nghiên cứu\nCông ty Letco\nThư điện tử\nSitemap\nLiên hệ\nToggle navigation\nGiới thiệu\nGiới thiệu\nCơ cấu tổ chức\nNgành nghề đào tạo\nCơ sở vật chất\nCán bộ & Giảng viên\nĐịa chỉ liên hệ\nTuyển sinh\nSau đại học\nĐại học\nĐào tạo\nSau đại học\nĐại học\nNCKH\nNCKH Giảng viên\nNCKH HVSV\nSinh viên\nHoạt động sinh viên\nCựu sinh viên\nTuyển dụng\nHoạt động doanh nghiệp\nHợp tác quốc tế\nHợp tác doanh nghiệp\nHợp tác đào tạo\nHọc bổng doanh nghiệp\nDiễn đàn doanh nghiệp\nPrevious\nNext\nTin tức\nThông báo tuyển dụng của công ty May mặc Hoa Lợi Đạt\nThông báo tuyển dụng của công ty Cổ phần CF Toàn cầu Thái Bình\nThông tin công khai đề án mở ngành Công nghệ dệt, may; trình độ tiến sĩ, mã ngành 9540204\nChào mừng Tân sinh viên đại học khóa 19- Khoa Công nghệ May- Thiết kế thời trang\nThông báo\nTHÔNG TIN TUYỂN SINH KHOA CÔNG NGHỆ MAY-TKTT 2019\n', 'content: KHOA CÔNG NGHỆ MAY & TKTT - ĐẠI HỌC CÔNG NGHIỆP HÀ NỘI || HaUI\nTrang HaUI\nPhòng\nPhòng Tổ chức hành chính\nPhòng Đào tạo\nPhòng Công tác sinh viên\nPhòng Khoa học công nghệ\nPhòng hợp tác đối ngoại\nPhòng Tài chính kế toán\nPhòng Quản trị\nPhòng Thanh tra Giáo dục\nKhoa\nKhoa Công nghệ Hoá\nKhoa Công nghệ may & TKTT\nKhoa Công nghệ thông tin\nKhoa Điện\nKhoa Điện tử\nKhoa Khoa học cơ bản\nKhoa Lý luận chính trị - Pháp luật\nTrung tâm Đào tạo\nTrung tâm Đào tạo Sau đại học\nTrung tâm Giáo dục thể chất và Thể thao\nTrung tâm Công nghệ Ô tô và Đào tạo lái xe\nTrung tâm Công nghệ thông tin\nTrung tâm Việt Nhật\nTrung tâm Giáo dục Quốc phòng An ninh\nTrung tâm Dịch vụ\nTrung tâm Truyền thông & Quan hệ Công chúng\nTrạm Y tế\nTrung tâm Hỗ trợ Sinh viên\nTrung tâm Đảm bảo chất lượng\nTrung tâm Thông tin Thư viện\nTrung tâm khảo thí\nViện nghiên cứu\nCông ty Letco\nThư điện tử\nSitemap\nLiên hệ\nToggle navigation\nGiới thiệu\nGiới thiệu\nCơ cấu tổ chức\nNgành nghề đào tạo\nCơ sở vật chất\nCán bộ & Giảng viên\nĐịa chỉ liên hệ\nTuyển sinh\nSau đại học\nĐại học\nĐào tạo\nSau đại học\nĐại học\nNCKH\nNCKH Giảng viên\nNCKH HVSV\nSinh viên\nHoạt động sinh viên\nCựu sinh viên\nTuyển dụng\nHoạt động doanh nghiệp\nHợp tác quốc tế\nHợp tác doanh nghiệp\nHợp tác đào tạo\nHọc bổng doanh nghiệp\nDiễn đàn doanh nghiệp\nPrevious\nNext\nTin tức\nThông báo tuyển dụng của công ty May mặc Hoa Lợi Đạt\nThông báo tuyển dụng của công ty Cổ phần CF Toàn cầu Thái Bình\nThông tin công khai đề án mở ngành Công nghệ dệt, may; trình độ tiến sĩ, mã ngành 9540204\nChào mừng Tân sinh viên đại học khóa 19- Khoa Công nghệ May- Thiết kế thời trang\nThông báo\nTHÔNG TIN TUYỂN SINH KHOA CÔNG NGHỆ MAY-TKTT 2019\nnext_contents:\n', 'content: KHOA CÔNG NGHỆ MAY & TKTT - ĐẠI HỌC CÔNG NGHIỆP HÀ NỘI || HaUI\nTrang HaUI\nPhòng\nPhòng Tổ chức hành chính\nPhòng Đào tạo\nPhòng Công tác sinh viên\nPhòng Khoa học công nghệ\nPhòng hợp tác đối ngoại\nPhòng Tài chính kế toán\nPhòng Quản trị\nPhòng Thanh tra Giáo dục\nKhoa\nKhoa Công nghệ Hoá\nKhoa Công nghệ may & TKTT\nKhoa Công nghệ thông tin\nKhoa Điện\nKhoa Điện tử\nKhoa Khoa học cơ bản\nKhoa Lý luận chính trị - Pháp luật\nTrung tâm Đào tạo\nTrung tâm Đào tạo Sau đại học\nTrung tâm Giáo dục thể chất và Thể thao\nTrung tâm Công nghệ Ô tô và Đào tạo lái xe\nTrung tâm Công nghệ thông tin\nTrung tâm Việt Nhật\nTrung tâm Giáo dục Quốc phòng An ninh\nTrung tâm Dịch vụ\nTrung tâm Truyền thông & Quan hệ Công chúng\nTrạm Y tế\nTrung tâm Hỗ trợ Sinh viên\nTrung tâm Đảm bảo chất lượng\nTrung tâm Thông tin Thư viện\nTrung tâm khảo thí\nViện nghiên cứu\nCông ty Letco\nThư điện tử\nSitemap\nLiên hệ\nToggle navigation\nGiới thiệu\nGiới thiệu\nCơ cấu tổ chức\nNgành nghề đào tạo\nCơ sở vật chất\nCán bộ & Giảng viên\nĐịa chỉ liên hệ\nTuyển sinh\nSau đại học\nĐại học\nĐào tạo\nSau đại học\nĐại học\nNCKH\nNCKH Giảng viên\nNCKH HVSV\nSinh viên\nHoạt động sinh viên\nCựu sinh viên\nTuyển dụng\nHoạt động doanh nghiệp\nHợp tác quốc tế\nHợp tác doanh nghiệp\nHợp tác đào tạo\nHọc bổng doanh nghiệp\nDiễn đàn doanh nghiệp\nPrevious\nNext\nTin tức\nThông báo tuyển dụng của công ty May mặc Hoa Lợi Đạt\nThông báo tuyển dụng của công ty Cổ phần CF Toàn cầu Thái Bình\nThông tin công khai đề án mở ngành Công nghệ dệt, may; trình độ tiến sĩ, mã ngành 9540204\nChào mừng Tân sinh viên đại học khóa 19- Khoa Công nghệ May- Thiết kế thời trang\nThông báo\nTHÔNG TIN TUYỂN SINH KHOA CÔNG NGHỆ MAY-TKTT 2019\nnext_contents:\n']","['An toàn thông tin - ĐẠI HỌC CÔNG NGHIỆP HÀ NỘI || HaUI Trang HaUI Phòng Phòng Tổ chức hành chính Phòng Đào tạo Phòng Công tác sinh viên Phòng Khoa học công nghệ Phòng hợp tác đối ngoại Phòng Tài chính kế toán Phòng Quản trị Phòng Thanh tra Giáo dục Khoa Khoa Công nghệ Hoá Khoa Công nghệ may & TKTT Khoa Công nghệ thông tin Khoa Điện Khoa Điện tử Khoa Khoa học cơ bản Khoa Lý luận chính trị - Pháp luật Trung tâm Đào tạo Trung tâm Đào tạo Sau đại học Trung tâm Giáo dục thể chất và Thể thao Trung tâm Công nghệ Ô tô và Đào tạo lái xe Trung tâm Công nghệ thông tin Trung tâm Việt Nhật Trung tâm Giáo dục Quốc phòng An ninh Trung tâm Dịch vụ Trung tâm Truyền thông & Quan hệ Công chúng Trạm Y tế Trung tâm Hỗ trợ Sinh viên Trung tâm Đảm bảo chất lượng Trung tâm Thông tin Thư viện Trung tâm khảo thí Viện nghiên cứu Công ty Letco Thư điện tử Sitemap Liên hệ Toggle navigation GIỚI THIỆU THÔNG TIN CHUNG CƠ CẤU TỔ CHỨC CHIẾN LƯỢC PHÁT TRIỂN CÁN BỘ GIẢNG VIÊN CƠ SỞ VẬT CHẤT LIÊN HỆ ĐÀO TẠO ĐẠI HỌC KHOA HỌC MÁY TÍNH KỸ THUẬT PHẦN MỀM HỆ THỐNG THÔNG TIN CÔNG NGHỆ THÔNG TIN CÔNG NGHỆ ĐA PHƯƠNG TIỆN AN TOÀN THÔNG TIN SAU ĐẠI HỌC HỆ THỐNG THÔNG TIN KẾ HOẠCH TIẾN ĐỘ QUY CHẾ, BIỂU MẪU NGHIÊN CỨU KHOA HỌC CÔNG TRÌNH CÔNG BỐ ĐỀ TÀI, DỰ ÁN SINH VIÊN NCKH TIN KHCN CÔNG TÁC SINH VIÊN QUY CHẾ GƯƠNG SÁNG SINH VIÊN HỌC BỔNG CÂU LẠC BỘ THƯ VIỆN ẢNH TUYỂN DỤNG An toàn thông tin Tin tiêu điểm Sinh viên Khóa 19 Khoa Công nghệ thông tin đạt Học bổng HaUI 100% toàn khóa học. Thứ Sáu, 11:07 20/09/2024 Đội bóng khoa Công nghệ thông tin cùng những trận cầu đáng nhớ Thứ Bảy, 10:00 23/07/2022 Đại hội đại biểu Liên chi Đoàn khoa Công nghệ thông tin lần thứ X, nhiệm kỳ 2022 - 2024 Thứ Hai, 15:00 18/04/2022 Gặp mặt tân Sinh viên K15 khoa Công nghệ thông tin Thứ Tư, 08:17 28/10/2020 Chương trình thực tập tại SVMC ""SVMC Internship Program 2020"" Thứ Sáu, 14:02 22/05/2020 Lịch giảng dạy môn Pháp Luật tuần từ 20/4 đến 26/4/2020 Hệ Cao đẳng khóa 21 Thứ Sáu, 15:05 17/04/2020 Danh sách các lớp học trực tuyến từ ngày 06/4/2020 đến ngày 19/4/2020 Thứ Bảy, 12:42 04/04/2020 Danh sách các lớp học trực tuyến từ ngày 30/3/2020 đến ngày 5/4/2020 Thứ Bảy, 14:46 28/03/2020 Kế hoạch tổ chức hoạt động dạy học tuần từ 23/03/2020 đến 05/04/2020 khoa CNTT Thứ Hai, 09:03 23/03/2020 Đội HaUI.NotTrashCar đạt giải nhì vòng sơ loại, giành quyền bước vào vòng bán kết cuộc đua số khu vực miền Bắc năm 2020 Thứ Sáu, 08:02 06/03/2020 Ngành An toàn thông tin Ngành An toàn thông tin1. Mục tiêu:Sinh viên tốt nghiệp từ chương trình An toàn thông tin có thể:- PEO 1:+ Phân tích được một số vấn đề an toàn thông tin trong thực tiễn.+ Vận dụng được các nguyên lý tính toán và các chuyên ngành liên quan khác để xác định giải pháp cho các vấn đề an toàn thông tin trong thực tiễn.- PEO 2:+ Thiết kế được giải pháp an toàn thông tin đáp ứng yêu cầu cho trước.+ Triển khai được các giải pháp an toàn thông tin đáp ứng yêu cầu cho trước.+ Đánh giá được giải pháp an toàn thông tin- PEO 3:+ Khả năng giao tiếp hiệu quả trong môi trường kỹ thuật+ Khả năng giao tiếp hiệu quả trong môi trường phi kỹ thuật+ Khả năng thuyết trình hiệu quả- PEO 4:+ Khả năng nhận định trách nhiệm nghề nghiệp trong thực hành điện toán+ Khả năng đánh giá các tình huống trong thực hành điện toán dựa trên các nguyên tắc pháp luật+ Khả năng đánh giá các tình huống trong thực hành điện toán dựa trên đạo đức nghề nghiệp- PEO 5:+ Khả năng thành lập nhóm làm việc+ Khả năng triển khai hiệu quả kế hoạch làm việc nhóm và đóng góp vào công việc nhóm+ Khả năng điều phối nhóm làm việc hiệu quả với vai trò người đứng đầu- PEO 6:+ Vận dụng lý thuyết đảm bảo an toàn thông tin để duy trì hoạt động của hệ thống khi xuất hiện rủi ro và các mối đe dọa+ Thực hiện các biện pháp đảm bảo an toàn thông tin để duy trì hoạt động của hệ thống khi xuất hiện rủi ro và các mối đe dọa- PEO 7:+ Lập và thực hiện được kế hoạch tự học, tự nghiên cứu để nâng cao trình độ chuyên môn, nghiệp vụ+ Giải thích được các khái niệm, nguyên lý, quy luật cơ bản của khoa học xã hội, khoa học chính trị và pháp luật2. Chuẩn đầu ra chương trình đào tạo:- SO1: Có khả năng phân tích một số vấn đề an toàn thông tin và áp dụng các nguyên lý tính toán cũng như các lĩnh vực liên quan khác để xác định giải pháp.- SO2: Có khả năng thiết kế, triển khai và đánh giá một giải pháp dựa trên nền tảng điện toán để đáp ứng các yêu cầu về an toàn thông tin.- SO3: Có khả năng giao tiếp hiệu quả trong các môi trường làm việc khác nhau- SO4: Nhận thức được trách nhiệm nghề nghiệp và đưa ra các đánh giá sáng suốt trong thực hành máy tính dựa trên các nguyên tắc pháp lý và đạo đức.- SO5: Có khả năng làm việc hiệu quả với vai trò là một thành viên hoặc người đứng đầu trong các nhóm kỹ thuật.- SO6: Vận dụng lý thuyết và thực hiện các biện pháp đảm bảo an toàn thông tin để duy trì hoạt động']","Khoa Công nghệ May & Thiết kế Thời trang tại Đại học Công nghiệp Hà Nội có các chương trình đào tạo như sau:

1. **Ngành Công nghệ Dệt, May**:
   - Đào tạo trình độ tiến sĩ, mã ngành 9540204.

2. **Chương trình hỗ trợ sinh viên**:
   - Các chương trình hỗ trợ sinh viên trong năm học 2018-2019.

Ngoài ra, khoa cũng tổ chức các hoạt động như hội thảo việc làm và ngày hội việc làm để kết nối sinh viên với doanh nghiệp.

Nếu bạn cần thêm thông tin chi tiết về các chương trình cụ thể hoặc các hoạt động khác của khoa, vui lòng cho tôi biết!

[Thông tin Khoa Công nghệ may & TKTT] - [**Link tham khảo**](https://fgd.haui.edu.vn).","Trong bối cảnh của Đại học Công nghiệp Hà Nội, Khoa Công nghệ may & TKTT không được đề cập cụ thể về các chương trình đào tạo trong thông tin hiện có. Tuy nhiên, trường có nhiều khoa khác như Khoa Công nghệ thông tin, Khoa Điện, và Khoa Điện tử, cho thấy sự đa dạng trong các lĩnh vực đào tạo.",0.0,1.0,0.75,0.8536144794342881,0.9097864258013298,1.005932092666626,6.708914041519165
9,Trường Đại học Công nghiệp Hà Nội có những chương trình đào tạo nào cho sinh viên?,"['content: Năm 2025, Đại học Công nghiệp Hà Nội dự kiến tuyển 7.990 chỉ tiêu cho 62 ngành/chương trình đào tạo đại học chính quy theo 5 phương thức tuyển sinh (trong đó có 10 chương trình đào tạo bằng Tiếng Anh).* Các phương thức tuyển sinh:- Phương thức 1 (PT1): Xét tuyển thẳng theo quy định của BGDĐT. (Không giới hạn chỉ tiêu).- Phương thức 2 (PT2): Xét tuyển theo điểm chứng chỉ quốc tế/giải học sinh giỏi kết hợp với điểm tổng kết học bạ cả năm lớp 10,11,12 của 3 môn theo tổ hợp xét tuyển. (Chỉ tiêu dự kiến 10%).- Phương thức 3 (PT3): Xét tuyển dựa trên kết quả thi tốt nghiệp THPT năm 2025. (Chỉ tiêu dự kiến 80%).- Phương thức 4 (PT4): Xét tuyển dựa trên kết quả thi đánh giá năng lực năm 2025 do Đại học Quốc gia Hà Nội tổ chức kết hợp với điểm tổng kết học bạ cả năm lớp 10,11,12 của 3 môn theo tổ hợp xét tuyển. (Chỉ tiêu dự kiến 5%).- Phương thức 5 (PT5): Xét tuyển dựa trên kết quả thi đánh giá tư duy năm 2025 do Đại học Bách khoa Hà Nội tổ chức kết hợp với điểm tổng kết học bạ cả năm lớp 10,11,12 của 3 môn theo tổ hợp xét tuyển. (Chỉ tiêu dự kiến 5%).Đối với phương thức 2, 4, 5 thí sinh đăng ký trên cổng https://xettuyen.haui.edu.vn dự kiến từ tháng 5/2025 để có dữ liệu đưa vào hệ thống xét tuyển và lọc ảo theo kế hoạch chung của Bộ GD&ĐT.Thông tin chi tiết sẽ được công bố trong Đề án tuyển sinh đại học năm 2025 (dự kiến trước ngày 15/03/2025).* Danh mục ngành/chương trình đào tạo tuyển sinh năm 2025:- Chương trình đào tạo Đại học chính quy theo thời gian chuẩn 4 năm, tuyển sinh đối với thí sinh tốt nghiệp THPT, chỉ tiêu 7.990, cấp bằng Cử nhân; từ năm thứ 2 sinh viên có thể đăng ký học thêm chương trình thứ 2 nếu đủ điều kiện, sinh viên có thể được công nhận tốt nghiệp cùng một lúc 2 chương trình.Dự kiến chỉ tiêu và phương thức xét tuyển các ngành thuộc Khoa CNTT - Trường Đại học Công Nghiệp Hà Nội năm 2025Dự kiến tổ hợp mới:*A0C: Toán, Vật lý, Công nghệ. *A0T: Toán, Vật lý, Tin học. *B0C: Toán, Hóa học, Công nghệ. *D0C: Toán, Tiếng Anh, Công nghệ. *D0G: Toán, Tiếng Anh,\nnext_contents:\n- Dự kiến chỉ tiêu và phương thức xét tuyển các ngành thuộc Khoa CNTT - Trường Đại học Công Nghiệp Hà Nội năm 2025\nTrang HaUI\nPhòng\nPhòng Tổ chức hành chính\nPhòng Đào tạo\nPhòng Công tác sinh viên\nPhòng Khoa học công nghệ\nPhòng hợp tác đối ngoại\nPhòng Tài chính kế toán\nPhòng Quản trị\nPhòng Thanh tra Giáo dục\nKhoa\nKhoa Công nghệ Hoá\nKhoa Công nghệ may & TKTT\nKhoa Công nghệ thông tin\nKhoa Điện\nKhoa Điện tử\nKhoa Khoa học cơ bản\nKhoa Lý luận chính trị - Pháp luật\nTrung tâm Đào tạo\nTrung tâm Đào tạo Sau đại học\nTrung tâm Giáo dục thể chất và Thể thao\nTrung tâm Công nghệ Ô tô và Đào tạo lái xe\nTrung tâm Công nghệ thông tin\nTrung tâm Việt Nhật\nTrung tâm Giáo dục Quốc phòng An ninh\nTrung tâm Dịch vụ\nTrung tâm Truyền thông & Quan hệ Công chúng\nTrạm Y tế\nTrung tâm Hỗ trợ Sinh viên\nTrung tâm Đảm bảo chất lượng\nTrung tâm Thông tin Thư viện\nTrung tâm khảo thí\nViện nghiên cứu\nCông ty Letco\nThư điện tử\nSitemap\nLiên hệ\nToggle navigation\nGIỚI THIỆU\nTHÔNG TIN CHUNG\nCƠ CẤU TỔ CHỨC\nCHIẾN LƯỢC PHÁT TRIỂN\nCÁN BỘ GIẢNG VIÊN\nCƠ SỞ VẬT CHẤT\nLIÊN HỆ\nĐÀO TẠO\nĐẠI HỌC\nKHOA HỌC MÁY TÍNH\nKỸ THUẬT PHẦN MỀM\nHỆ THỐNG THÔNG TIN\nCÔNG NGHỆ THÔNG TIN\nCÔNG NGHỆ ĐA PHƯƠNG TIỆN\nAN TOÀN THÔNG TIN\nSAU ĐẠI HỌC\nHỆ THỐNG THÔNG TIN\nKẾ HOẠCH\nTIẾN ĐỘ\nQUY CHẾ, BIỂU MẪU\nNGHIÊN CỨU KHOA HỌC\nCÔNG TRÌNH CÔNG BỐ\nĐỀ TÀI, DỰ ÁN\nSINH VIÊN NCKH\nTIN KHCN\nCÔNG TÁC SINH VIÊN\nQUY CHẾ\nGƯƠNG SÁNG SINH VIÊN\nHỌC BỔNG\nCÂU LẠC BỘ\nTHƯ VIỆN ẢNH\nTUYỂN DỤNG\nTHÔNG BÁO\nTRANG CHỦ > THÔNG BÁO\nDự kiến chỉ tiêu và phương thức xét tuyển các ngành thuộc Khoa CNTT - Trường Đại học Công Nghiệp Hà Nội năm 2025\n', 'content: Năm 2025, Đại học Công nghiệp Hà Nội dự kiến tuyển 7.990 chỉ tiêu cho 62 ngành/chương trình đào tạo đại học chính quy theo 5 phương thức tuyển sinh (trong đó có 10 chương trình đào tạo bằng Tiếng Anh).* Các phương thức tuyển sinh:- Phương thức 1 (PT1): Xét tuyển thẳng theo quy định của BGDĐT. (Không giới hạn chỉ tiêu).- Phương thức 2 (PT2): Xét tuyển theo điểm chứng chỉ quốc tế/giải học sinh giỏi kết hợp với điểm tổng kết học bạ cả năm lớp 10,11,12 của 3 môn theo tổ hợp xét tuyển. (Chỉ tiêu dự kiến 10%).- Phương thức 3 (PT3): Xét tuyển dựa trên kết quả thi tốt nghiệp THPT năm 2025. (Chỉ tiêu dự kiến 80%).- Phương thức 4 (PT4): Xét tuyển dựa trên kết quả thi đánh giá năng lực năm 2025 do Đại học Quốc gia Hà Nội tổ chức kết hợp với điểm tổng kết học bạ cả năm lớp 10,11,12 của 3 môn theo tổ hợp xét tuyển. (Chỉ tiêu dự kiến 5%).- Phương thức 5 (PT5): Xét tuyển dựa trên kết quả thi đánh giá tư duy năm 2025 do Đại học Bách khoa Hà Nội tổ chức kết hợp với điểm tổng kết học bạ cả năm lớp 10,11,12 của 3 môn theo tổ hợp xét tuyển. (Chỉ tiêu dự kiến 5%).Đối với phương thức 2, 4, 5 thí sinh đăng ký trên cổng https://xettuyen.haui.edu.vn dự kiến từ tháng 5/2025 để có dữ liệu đưa vào hệ thống xét tuyển và lọc ảo theo kế hoạch chung của Bộ GD&ĐT.Thông tin chi tiết sẽ được công bố trong Đề án tuyển sinh đại học năm 2025 (dự kiến trước ngày 15/03/2025).* Danh mục ngành/chương trình đào tạo tuyển sinh năm 2025:- Chương trình đào tạo Đại học chính quy theo thời gian chuẩn 4 năm, tuyển sinh đối với thí sinh tốt nghiệp THPT, chỉ tiêu 7.990, cấp bằng Cử nhân; từ năm thứ 2 sinh viên có thể đăng ký học thêm chương trình thứ 2 nếu đủ điều kiện, sinh viên có thể được công nhận tốt nghiệp cùng một lúc 2 chương trình.Dự kiến chỉ tiêu và phương thức xét tuyển các ngành thuộc Khoa CNTT - Trường Đại học Công Nghiệp Hà Nội năm 2025Dự kiến tổ hợp mới:*A0C: Toán, Vật lý, Công nghệ. *A0T: Toán, Vật lý, Tin học. *B0C: Toán, Hóa học, Công nghệ. *D0C: Toán, Tiếng Anh, Công nghệ. *D0G: Toán, Tiếng Anh,\nnext_contents:\n- Dự kiến chỉ tiêu và phương thức xét tuyển các ngành thuộc Khoa CNTT - Trường Đại học Công Nghiệp Hà Nội năm 2025\nTrang HaUI\nPhòng\nPhòng Tổ chức hành chính\nPhòng Đào tạo\nPhòng Công tác sinh viên\nPhòng Khoa học công nghệ\nPhòng hợp tác đối ngoại\nPhòng Tài chính kế toán\nPhòng Quản trị\nPhòng Thanh tra Giáo dục\nKhoa\nKhoa Công nghệ Hoá\nKhoa Công nghệ may & TKTT\nKhoa Công nghệ thông tin\nKhoa Điện\nKhoa Điện tử\nKhoa Khoa học cơ bản\nKhoa Lý luận chính trị - Pháp luật\nTrung tâm Đào tạo\nTrung tâm Đào tạo Sau đại học\nTrung tâm Giáo dục thể chất và Thể thao\nTrung tâm Công nghệ Ô tô và Đào tạo lái xe\nTrung tâm Công nghệ thông tin\nTrung tâm Việt Nhật\nTrung tâm Giáo dục Quốc phòng An ninh\nTrung tâm Dịch vụ\nTrung tâm Truyền thông & Quan hệ Công chúng\nTrạm Y tế\nTrung tâm Hỗ trợ Sinh viên\nTrung tâm Đảm bảo chất lượng\nTrung tâm Thông tin Thư viện\nTrung tâm khảo thí\nViện nghiên cứu\nCông ty Letco\nThư điện tử\nSitemap\nLiên hệ\nToggle navigation\nGIỚI THIỆU\nTHÔNG TIN CHUNG\nCƠ CẤU TỔ CHỨC\nCHIẾN LƯỢC PHÁT TRIỂN\nCÁN BỘ GIẢNG VIÊN\nCƠ SỞ VẬT CHẤT\nLIÊN HỆ\nĐÀO TẠO\nĐẠI HỌC\nKHOA HỌC MÁY TÍNH\nKỸ THUẬT PHẦN MỀM\nHỆ THỐNG THÔNG TIN\nCÔNG NGHỆ THÔNG TIN\nCÔNG NGHỆ ĐA PHƯƠNG TIỆN\nAN TOÀN THÔNG TIN\nSAU ĐẠI HỌC\nHỆ THỐNG THÔNG TIN\nKẾ HOẠCH\nTIẾN ĐỘ\nQUY CHẾ, BIỂU MẪU\nNGHIÊN CỨU KHOA HỌC\nCÔNG TRÌNH CÔNG BỐ\nĐỀ TÀI, DỰ ÁN\nSINH VIÊN NCKH\nTIN KHCN\nCÔNG TÁC SINH VIÊN\nQUY CHẾ\nGƯƠNG SÁNG SINH VIÊN\nHỌC BỔNG\nCÂU LẠC BỘ\nTHƯ VIỆN ẢNH\nTUYỂN DỤNG\nTHÔNG BÁO\nTRANG CHỦ > THÔNG BÁO\nDự kiến chỉ tiêu và phương thức xét tuyển các ngành thuộc Khoa CNTT - Trường Đại học Công Nghiệp Hà Nội năm 2025\n', 'content: lúc 2 chương trình.Dự kiến chỉ tiêu và phương thức xét tuyển các ngành thuộc Khoa CNTT - Trường Đại học Công Nghiệp Hà Nội năm 2025Dự kiến tổ hợp mới:*A0C: Toán, Vật lý, Công nghệ. *A0T: Toán, Vật lý, Tin học. *B0C: Toán, Hóa học, Công nghệ. *D0C: Toán, Tiếng Anh, Công nghệ. *D0G: Toán, Tiếng Anh, Giáo dục kinh tế và pháp luật.Chương trình đào tạo liên thông Đại học chính quy: tuyển sinh đối với người tốt nghiệp Cao đẳng, đăng ký xét tuyển và hoàn thành các học phần còn lại của chương trình đào tạo trình độ Đại học trong khoảng từ 2 - 2,5 năm; Chỉ tiêu dự kiến 250, gồm các ngành/CTĐT: Công nghệ kỹ thuật cơ khí; Công nghệ kỹ thuật ô tô; Công nghệ kỹ thuật điện, điện tử; Công nghệ kỹ thuật điện tử - viễn thông; Công nghệ thông tin.Chương trình đào tạo cấp bằng Kỹ sư: tuyển sinh đối với người có bằng Cử nhân, đăng ký xét tuyển vào chương trình đào tạo Đại học chuyên sâu đặc thù trong khoảng 1 năm; Chỉ tiêu dự kiến 120, gồm các ngành/CTĐT: Công nghệ kỹ thuật cơ khí; Công nghệ kỹ thuật điện, điện tử; Công nghệ kỹ thuật điện tử - viễn thông.Chương trình đào tạo liên kết quốc tế: Sinh viên trúng tuyển nhập học ngành Marketing, ngành Quản trị kinh doanh, ngành Quản trị khách sạn có thể đăng ký theo chương trình liên kết đào tạo 2+2 giữa Đại học Công nghiệp Hà Nội với Đại học Bách khoa Quế Lâm - Trung Quốc, học 2 năm tại Đại học Công nghiệp Hà Nội và 2 năm tại Đại học Bách khoa Quế Lâm. Sinh viên hoàn thành chương trình đào tạo và đủ điều kiện tốt nghiệp được cấp 2 bằng của Đại học Công nghiệp Hà Nội và Đại học Bách khoa Quế Lâm.Họcbổng: Năm 2025, Đại học Công nghiệp Hà Nội dự kiến cấp học bổng cho sinh viên đại học chính quy có kết quả xét tuyển đầu vào xuất sắc với số tiền khoảng 2 tỷ đồng; học bổng cho sinh viên có thành tích học tập xuất sắc với số tiền khoảng 10 tỷ đồng; ngoài ra còn có các loại học bổng doanh nghiệp với số tiền khoảng 30 tỷ đồng.* Tuyển sinh Đại học từ xa:Dự kiến tuyển 750 chỉ tiêu tuyển sinh đại học từ xa gồm các ngành: Ngôn ngữ Anh, Ngôn ngữ Trung\nnext_contents:\n- Năm 2025, Đại học Công nghiệp Hà Nội dự kiến tuyển 7.990 chỉ tiêu cho 62 ngành/chương trình đào tạo đại học chính quy theo 5 phương thức tuyển sinh (trong đó có 10 chương trình đào tạo bằng Tiếng Anh).* Các phương thức tuyển sinh:- Phương thức 1 (PT1): Xét tuyển thẳng theo quy định của BGDĐT. (Không giới hạn chỉ tiêu).- Phương thức 2 (PT2): Xét tuyển theo điểm chứng chỉ quốc tế/giải học sinh giỏi kết hợp với điểm tổng kết học bạ cả năm lớp 10,11,12 của 3 môn theo tổ hợp xét tuyển. (Chỉ tiêu dự kiến 10%).- Phương thức 3 (PT3): Xét tuyển dựa trên kết quả thi tốt nghiệp THPT năm 2025. (Chỉ tiêu dự kiến 80%).- Phương thức 4 (PT4): Xét tuyển dựa trên kết quả thi đánh giá năng lực năm 2025 do Đại học Quốc gia Hà Nội tổ chức kết hợp với điểm tổng kết học bạ cả năm lớp 10,11,12 của 3 môn theo tổ hợp xét tuyển. (Chỉ tiêu dự kiến 5%).- Phương thức 5 (PT5): Xét tuyển dựa trên kết quả thi đánh giá tư duy năm 2025 do Đại học Bách khoa Hà Nội tổ chức kết hợp với điểm tổng kết học bạ cả năm lớp 10,11,12 của 3 môn theo tổ hợp xét tuyển. (Chỉ tiêu dự kiến 5%).Đối với phương thức 2, 4, 5 thí sinh đăng ký trên cổng https://xettuyen.haui.edu.vn dự kiến từ tháng 5/2025 để có dữ liệu đưa vào hệ thống xét tuyển và lọc ảo theo kế hoạch chung của Bộ GD&ĐT.Thông tin chi tiết sẽ được công bố trong Đề án tuyển sinh đại học năm 2025 (dự kiến trước ngày 15/03/2025).* Danh mục ngành/chương trình đào tạo tuyển sinh năm 2025:- Chương trình đào tạo Đại học chính quy theo thời gian chuẩn 4 năm, tuyển sinh đối với thí sinh tốt nghiệp THPT, chỉ tiêu 7.990, cấp bằng Cử nhân; từ năm thứ 2 sinh viên có thể đăng ký học thêm chương trình thứ 2 nếu đủ điều kiện, sinh viên có thể được công nhận tốt nghiệp cùng một lúc 2 chương trình.Dự kiến chỉ tiêu và phương thức xét tuyển các ngành thuộc Khoa CNTT - Trường Đại học Công Nghiệp Hà Nội năm 2025Dự kiến tổ hợp mới:*A0C: Toán, Vật lý, Công nghệ. *A0T: Toán, Vật lý, Tin học. *B0C: Toán, Hóa học, Công nghệ. *D0C: Toán, Tiếng Anh, Công nghệ. *D0G: Toán, Tiếng Anh,\n', 'content: lúc 2 chương trình.Dự kiến chỉ tiêu và phương thức xét tuyển các ngành thuộc Khoa CNTT - Trường Đại học Công Nghiệp Hà Nội năm 2025Dự kiến tổ hợp mới:*A0C: Toán, Vật lý, Công nghệ. *A0T: Toán, Vật lý, Tin học. *B0C: Toán, Hóa học, Công nghệ. *D0C: Toán, Tiếng Anh, Công nghệ. *D0G: Toán, Tiếng Anh, Giáo dục kinh tế và pháp luật.Chương trình đào tạo liên thông Đại học chính quy: tuyển sinh đối với người tốt nghiệp Cao đẳng, đăng ký xét tuyển và hoàn thành các học phần còn lại của chương trình đào tạo trình độ Đại học trong khoảng từ 2 - 2,5 năm; Chỉ tiêu dự kiến 250, gồm các ngành/CTĐT: Công nghệ kỹ thuật cơ khí; Công nghệ kỹ thuật ô tô; Công nghệ kỹ thuật điện, điện tử; Công nghệ kỹ thuật điện tử - viễn thông; Công nghệ thông tin.Chương trình đào tạo cấp bằng Kỹ sư: tuyển sinh đối với người có bằng Cử nhân, đăng ký xét tuyển vào chương trình đào tạo Đại học chuyên sâu đặc thù trong khoảng 1 năm; Chỉ tiêu dự kiến 120, gồm các ngành/CTĐT: Công nghệ kỹ thuật cơ khí; Công nghệ kỹ thuật điện, điện tử; Công nghệ kỹ thuật điện tử - viễn thông.Chương trình đào tạo liên kết quốc tế: Sinh viên trúng tuyển nhập học ngành Marketing, ngành Quản trị kinh doanh, ngành Quản trị khách sạn có thể đăng ký theo chương trình liên kết đào tạo 2+2 giữa Đại học Công nghiệp Hà Nội với Đại học Bách khoa Quế Lâm - Trung Quốc, học 2 năm tại Đại học Công nghiệp Hà Nội và 2 năm tại Đại học Bách khoa Quế Lâm. Sinh viên hoàn thành chương trình đào tạo và đủ điều kiện tốt nghiệp được cấp 2 bằng của Đại học Công nghiệp Hà Nội và Đại học Bách khoa Quế Lâm.Họcbổng: Năm 2025, Đại học Công nghiệp Hà Nội dự kiến cấp học bổng cho sinh viên đại học chính quy có kết quả xét tuyển đầu vào xuất sắc với số tiền khoảng 2 tỷ đồng; học bổng cho sinh viên có thành tích học tập xuất sắc với số tiền khoảng 10 tỷ đồng; ngoài ra còn có các loại học bổng doanh nghiệp với số tiền khoảng 30 tỷ đồng.* Tuyển sinh Đại học từ xa:Dự kiến tuyển 750 chỉ tiêu tuyển sinh đại học từ xa gồm các ngành: Ngôn ngữ Anh, Ngôn ngữ Trung\nnext_contents:\n- Năm 2025, Đại học Công nghiệp Hà Nội dự kiến tuyển 7.990 chỉ tiêu cho 62 ngành/chương trình đào tạo đại học chính quy theo 5 phương thức tuyển sinh (trong đó có 10 chương trình đào tạo bằng Tiếng Anh).* Các phương thức tuyển sinh:- Phương thức 1 (PT1): Xét tuyển thẳng theo quy định của BGDĐT. (Không giới hạn chỉ tiêu).- Phương thức 2 (PT2): Xét tuyển theo điểm chứng chỉ quốc tế/giải học sinh giỏi kết hợp với điểm tổng kết học bạ cả năm lớp 10,11,12 của 3 môn theo tổ hợp xét tuyển. (Chỉ tiêu dự kiến 10%).- Phương thức 3 (PT3): Xét tuyển dựa trên kết quả thi tốt nghiệp THPT năm 2025. (Chỉ tiêu dự kiến 80%).- Phương thức 4 (PT4): Xét tuyển dựa trên kết quả thi đánh giá năng lực năm 2025 do Đại học Quốc gia Hà Nội tổ chức kết hợp với điểm tổng kết học bạ cả năm lớp 10,11,12 của 3 môn theo tổ hợp xét tuyển. (Chỉ tiêu dự kiến 5%).- Phương thức 5 (PT5): Xét tuyển dựa trên kết quả thi đánh giá tư duy năm 2025 do Đại học Bách khoa Hà Nội tổ chức kết hợp với điểm tổng kết học bạ cả năm lớp 10,11,12 của 3 môn theo tổ hợp xét tuyển. (Chỉ tiêu dự kiến 5%).Đối với phương thức 2, 4, 5 thí sinh đăng ký trên cổng https://xettuyen.haui.edu.vn dự kiến từ tháng 5/2025 để có dữ liệu đưa vào hệ thống xét tuyển và lọc ảo theo kế hoạch chung của Bộ GD&ĐT.Thông tin chi tiết sẽ được công bố trong Đề án tuyển sinh đại học năm 2025 (dự kiến trước ngày 15/03/2025).* Danh mục ngành/chương trình đào tạo tuyển sinh năm 2025:- Chương trình đào tạo Đại học chính quy theo thời gian chuẩn 4 năm, tuyển sinh đối với thí sinh tốt nghiệp THPT, chỉ tiêu 7.990, cấp bằng Cử nhân; từ năm thứ 2 sinh viên có thể đăng ký học thêm chương trình thứ 2 nếu đủ điều kiện, sinh viên có thể được công nhận tốt nghiệp cùng một lúc 2 chương trình.Dự kiến chỉ tiêu và phương thức xét tuyển các ngành thuộc Khoa CNTT - Trường Đại học Công Nghiệp Hà Nội năm 2025Dự kiến tổ hợp mới:*A0C: Toán, Vật lý, Công nghệ. *A0T: Toán, Vật lý, Tin học. *B0C: Toán, Hóa học, Công nghệ. *D0C: Toán, Tiếng Anh, Công nghệ. *D0G: Toán, Tiếng Anh,\n']","['Cao học Hệ thống thông tin Tin tiêu điểm Sinh viên Khóa 19 Khoa Công nghệ thông tin đạt Học bổng HaUI 100% toàn khóa học. Thứ Sáu, 11:07 20/09/2024 Đội bóng khoa Công nghệ thông tin cùng những trận cầu đáng nhớ Thứ Bảy, 10:00 23/07/2022 Đại hội đại biểu Liên chi Đoàn khoa Công nghệ thông tin lần thứ X, nhiệm kỳ 2022 - 2024 Thứ Hai, 15:00 18/04/2022 Gặp mặt tân Sinh viên K15 khoa Công nghệ thông tin Thứ Tư, 08:17 28/10/2020 Chương trình thực tập tại SVMC ""SVMC Internship Program 2020"" Thứ Sáu, 14:02 22/05/2020 Lịch giảng dạy môn Pháp Luật tuần từ 20/4 đến 26/4/2020 Hệ Cao đẳng khóa 21 Thứ Sáu, 15:05 17/04/2020 Danh sách các lớp học trực tuyến từ ngày 06/4/2020 đến ngày 19/4/2020 Thứ Bảy, 12:42 04/04/2020 Danh sách các lớp học trực tuyến từ ngày 30/3/2020 đến ngày 5/4/2020 Thứ Bảy, 14:46 28/03/2020 Kế hoạch tổ chức hoạt động dạy học tuần từ 23/03/2020 đến 05/04/2020 khoa CNTT Thứ Hai, 09:03 23/03/2020 Đội HaUI.NotTrashCar đạt giải nhì vòng sơ loại, giành quyền bước vào vòng bán kết cuộc đua số khu vực miền Bắc năm 2020 Thứ Sáu, 08:02 06/03/2020 Thạc sỹ Hệ thống thông tin NGÀNH THẠC SỸ HỆ THỐNG THÔNG TINGiấy chứng nhận Kiểm định Thạc sỹ Ngành Hệ thống thông tin1. Mục tiêuSinh viên tốt nghiệp từ chương trình Thạc sỹ Hệ thống thông tin có thể:+ Kiến thức:PEO 1: Có kiến thức nền tảng trong lĩnh vực hệ thống thông tin cũng như các kỹ năng thực hành phù hợp để có thể tiếp tục học tập, nghiên cứu chuyên sâu.PEO 2: Có kiến thức và kỹ năng thực hành tiên tiến mang tính chất chuyên sâu, được cập nhật các chủ đề mang tính thời sự, các hướng nghiên cứu mũi nhọn trong lĩnh vực hệ thống thông tin.+ Kỹ năng:PEO 3: Có khả năng nghiên cứu khoa học, hợp tác trong nghiên cứu khoa học và công bố kết quả nghiên cứu, sử dụng được ngoại ngữ đáp ứng yêu cầu thực tế.+ Mức tự chủ và trách nhiệm:PEO 4: Có khả năng hướng dẫn người khác thực hiện nhiệm vụ và khả năng quản lý, đánh giá, cải tiến hệ thống thông tin để nâng cao hiệu quả hoạt động nghề nghiệp.2. Chuẩn đầu ra chương trình đào tạo- SO1: Có khả năng vận dụng các kiến thức cơ sở ngành Hệ thống thông tin về dữ liệu, tri thức, mô hình hóa và thiết kế hệ thống để giải quyết vấn đề cơ bản trong lĩnh vực chuyên môn.- SO2: Có khả năng vận dụng các kiến thức chuyên sâu của ngành Hệ thống thông tin trong: quản trị hệ thống thông tin; đảm bảo an toàn, an ninh hệ thống thông tin; phát triển hệ thống thông tin.- SO3: Có khả năng phát hiện vấn đề trong khoa học và thực tiễn cũng như vận dụng tích hợp các kiến thức, kỹ năng, công cụ hiện đại của ngành Hệ thống thông tin và các phương pháp nghiên cứu khoa học để giải quyết vấn đề và công bố kết quả.- SO4: Có khả năng hướng dẫn người khác thực hiện nhiệm vụ và khả năng quản lý, đánh giá, cải tiến hệ thống thông tin.3. Tiêu chí đánh giá- PI1.1: Khả năng phân tích, thiết kế hệ thống thông tin ở mức chuyên sâu.- PI1.2: Khả năng quản trị và phân tích dữ liệu.- PI1.3: Khả năng biểu diễn, xử lý và quản trị tri thức.- PI2.1: Khả năng quản trị hệ thống thông tin.- PI2.2: Khả năng đảm bảo an toàn cho hệ thống thông tin.- PI2.3: Khả năng phát triển hệ thống thông tin theo một trong các hướng: Hệ thống thông minh, Hệ thống phân tán, Hệ thống nhúng.- PI3.1: Khả năng phát hiện vấn đề trong khoa học và thực tiễn.- PI3.2: Khả năng vận dụng tích hợp các kiến thức, kỹ năng, công cụ hiện đại của ngành Hệ thống thông tin và các phương pháp nghiên cứu khoa học để giải quyết vấn đề và công bố kết quả.- PI4.1: Khả năng hướng dẫn người khác thực hiện nhiệm vụ.- PI4.2: Khả năng quản lý, đánh giá, cải tiến hệ thống thông tin.4. Chương trình khung ngành Thạc sỹ Hệ thống thông tinChương trình khung ngành Thạc sỹ Hệ thống thông tin. Bản đồ chỉ dẫn Trường Đại học Công nghiệp Hà Nội Trụ sở chính Số 298 đường Cầu Diễn, quận Bắc Từ Liêm, Hà Nội +84 243 765 5121 Email: dhcnhn@haui.edu.vn Các cơ sở khác Cơ sở 2: Phường Tây Tựu, quận Bắc Từ Liêm, Hà Nội Cơ sở 3: Phường Lê Hồng Phong, thành phố Phủ Lý, Hà Nam Liên kết site Trường Đại học Công nghiệp Hà Nội Thông tin tuyển sinh Hành chính điện tử Đào tạo trực tuyến Cổng thông tin đào tạo Copyright © 2018 Hanoi University of Industry.']","Trường Đại học Công nghiệp Hà Nội dự kiến tuyển sinh 62 ngành/chương trình đào tạo đại học chính quy vào năm 2025, trong đó có 10 chương trình đào tạo bằng tiếng Anh. Dưới đây là một số thông tin chi tiết về các chương trình đào tạo:

1. **Chương trình đào tạo đại học chính quy**:
   - Thời gian học: 4 năm.
   - Cấp bằng: Cử nhân.
   - Sinh viên có thể đăng ký học thêm chương trình thứ hai từ năm thứ hai nếu đủ điều kiện.

2. **Chương trình đào tạo liên thông**:
   - Dành cho người tốt nghiệp Cao đẳng, thời gian học từ 2 - 2,5 năm.
   - Các ngành đào tạo: Công nghệ kỹ thuật cơ khí, Công nghệ kỹ thuật ô tô, Công nghệ kỹ thuật điện, điện tử, Công nghệ thông tin.

3. **Chương trình đào tạo cấp bằng Kỹ sư**:
   - Dành cho người có bằng Cử nhân, thời gian học khoảng 1 năm.
   - Các ngành đào tạo: Công nghệ kỹ thuật cơ khí, Công nghệ kỹ thuật điện, điện tử.

4. **Chương trình đào tạo liên kết quốc tế**:
   - Sinh viên ngành Marketing, Quản trị kinh doanh, Quản trị khách sạn có thể tham gia chương trình 2+2 với Đại học Bách khoa Quế Lâm - Trung Quốc.

5. **Tuyển sinh đại học từ xa**:
   - Dự kiến tuyển sinh cho các ngành như Ngôn ngữ Anh, Ngôn ngữ Trung.

Thông tin chi tiết về các ngành và phương thức tuyển sinh sẽ được công bố trong Đề án tuyển sinh đại học năm 2025.

Nguồn: [Thông báo tuyển sinh 2025](https://fit.haui.edu.vn/vn/thong-bao/du-kien-chi-tieu-va-phuong-thuc-xet-tuyen-cac-nganh-thuoc-khoa-cntt-truong-dai-hoc-cong-nghiep-ha-noi-nam-2025/71207).","Trường Đại học Công nghiệp Hà Nội cung cấp chương trình Thạc sỹ Hệ thống thông tin, trong đó sinh viên được trang bị kiến thức nền tảng và kỹ năng thực hành phù hợp để có thể tiếp tục học tập, nghiên cứu chuyên sâu. Chương trình cũng bao gồm các tiêu chí đánh giá khả năng phân tích, thiết kế hệ thống thông tin, quản trị và phân tích dữ liệu, cũng như phát triển hệ thống thông tin theo nhiều hướng khác nhau.",0.99999999995,0.0,1.0,0.8623059401624418,0.8917998219536025,0.5687968730926514,9.573314905166626
10,Chương trình đào tạo ngành Công nghệ thông tin tại Hà Nội có những đặc điểm gì nổi bật?,"['content: thực tập, tuyển dụng, tham gia vào quá trình phát triển chương trình đào tạo.- Khoa có 7 câu lạc bộ sinh viên với nhiều hoạt động bổ ích, tạo phong trào học tập và hỗ trợ cho hoạt động đào tạo, truyền thông của Khoa.- Đoàn thanh niên và Công đoàn Khoa luôn đi đầu trong các hoạt động phong trào cũng như hỗ trợ triển khai các hoạt động chuyên môn trong Khoa.Kết luậnThế mạnhNhóm ngành CNTT có vai trò quan trọng, nhu cầu nhân lực cao, được cả xã hội quan tâm trong cuộc CMCN 4.0;Phương thức tổ chức dạy - học được đổi mới theo hướng tích cực và có ứng dụng công nghệ, là nhóm ngành phù hợp cho các hình thức đào tạo kết hợp;Chương trình đào tạo luôn được cập nhật, đổi mới, phù hợp cao với xu hướng công nghệ và nhu cầu của xã hội. Công tác kiểm định chất lượng chương trình đào tạo triển khai có hệ thống, lộ trình đảm bảo hết năm 2023 khoa có 100% CTĐT đủ thời gian đã được kiểm định;Cơ sở vật chất phục vụ cho đào tạo được Nhà trường quan tâm đầu tư đồng bộ, hiện đại, chi phí đầu tư không cao trong khối ngành kỹ thuật;Khoa có mối quan hệ gắn kết với mạng lưới hầu hết các doanh nghiệp trong lĩnh vực CNTT như Samsung, LG, HCL, VNPT, Viettel, FPT, Sun*, VTI, …Tập thể lãnh đạo Khoa và giảng viên có tinh thần trách nhiệm cao, nhiệt tình, đoàn kết trong thực hiện các nhiệm vụ của Khoa.Điểm yếuChất lượng giảng viên chưa đồng đều, thiếu các chuyên gia hàng đầu trong các ngành đào tạo.Hoạt động nghiên cứu khoa học chưa tương xứng với tiềm năng và yêu cầu.Đội ngũ giảng viên trên 40 tuổi chiếm ~73%, có những hạn chế trong các lĩnh vực công nghệ mới, học tập nâng cao trình độ.Cơ sở vật chất phục vụ các hoạt động nghiên cứu chuyên sâu còn hạn chế.Cơ hộiNhu cầu nhân lực về CNTT tăng mạnh, xu hướng các trung tâm outsourcing chuyển về Việt Nam ngày càng nhiều.Xu hướng liên ngành, xuyên ngành, đa ngành ngày càng phổ biến mà trong đó có ứng dụng và đào tạo thuộc nhóm ngành CNTT.Đại dịch covid đã làm thay đổi cách con người làm việc và giao tiếp, trong đó sẽ có nhiều hoạt động được thực hiện\nnext_contents:\n- lượngBình quânGVcơ hữuKhối lượngBình quânCông nghệ phần mềm6478079786144768Khoa học máytính1611100694141209086446,541.470892Hệ thống thông tin108310831108480848Kỹ thuật & Mạng máy tính9,569896999,58700870Công nghệ đa phương tiện6551892054730946Tổng:47,53669777346,540.150854Cơ sở vật chất- Văn phòng Khoa Công nghệ thông tin tại tầng 6 nhà A1, tổng diện tích các phòng chức năng 475 m2, bao gồm 9 phòng làm việc và 1 phòng họp.- 14 phòng máy dùng cho giảng dạy cơ sở ngành và chuyên ngành (11 phòng tại cơ sở 1 và 3 phòng tại cơ sở 3). Mỗi phòng thực hành được trang bị từ 35 đến 40 máy tính cho sinh viên và 1 máy tính cho giảng viên. Các Phòng được cài đặt các phần mềm để giảng dạy cho tất cả các học phần của các chương trình đào tạo của Khoa.- Các trang thiết bị chuyên dụng phục vụ cho một số học phần đặc thù. Các thiết bị này được đặt trong phòng thực hành và sử dụng theo nhu cầu của từng học phần.- Để phục vụ cho các hoạt động nghiên cứu chuyên sâu, Khoa CNTT trang bị 3 phòng Lab về các lĩnh vực: “Computer Vision & Artificial Intelligence”, “Modeling, Simulation and Optimization” và “Intelligent systems and IoT”.- Để quản trị các phòng máy tính và phục vụ NCKH, Khoa có 4 máy chủ và 4 máy HPC có GPU đặt tại các phòng Lab. Trong năm học 2021 Khoa sẽ xây dựng hệ thống máy chủ trong đó bổ sung máy chủ và hệ thống phần mềm của VMWare để ảo hóa và quản trị, cấp tài nguyên cho giảng viên và sinh viên sử dụng.Hoạt động khác- Hoạt động hợp tác doanh nghiệp luôn được Khoa quan tâm. Khoa có quan hệ với hầu hết các doanh nghiệp lớn về CNTT ở khu vực phía Bắc (Samsung, LG, FPT, Viettel, VNPT, MISA, Sun*,…), các doanh nghiệp luôn sẵn sàng hỗ trợ Khoa trong các hoạt động tham quan trải nghiệm, thực tập, tuyển dụng, tham gia vào quá trình phát triển chương trình đào tạo.- Khoa có 7 câu lạc bộ sinh viên với nhiều hoạt động bổ ích, tạo phong trào học tập và hỗ trợ cho hoạt động đào tạo, truyền thông của Khoa.- Đoàn thanh niên và Công đoàn Khoa luôn đi đầu trong các hoạt động phong trào\n', 'content: Công nghệ thông tin là nhóm ngành đang có xu hướng phát triển, nhu cầu nhân lực rất cao và các chuyên gia lưu ý sinh viên học tốt, có năng lực sẽ được doanh nghiệp săn đón ngay khi còn ngồi ở ghế nhà trường. Đại dịch Covid 19 đang bước vào năm thứ 3, gây ảnh hưởng tất cả mọi lĩnh vực trong đời sống. Tuy nhiên, công nghệ thông tin (CNTT) lại là một trong những lĩnh vực phát triển mạnh với nhiều đột phá góp phần đổi thay cuộc sống.Vào tối ngày 8/6/2022, Khoa Công nghệ thông tin Trường Đại học Công Nghiệp Hà Nội kết hợp với một số doanh nghiệp đã tổ chức buổi livestream tư vấn trực tuyến nhóm ngành CNTT năm 2022. Tham dự buổi tư vấn có TS. Lê Văn Thái – Phó Trưởng phòng đào tạo Trường ĐH Công Nghiệp Hà Nội, TS. Đặng Trọng Hợp – Trưởng Khoa CNTT và đại diện doanh nghiệp FPT Software, cựu sinh viên Nguyễn Huy Du, các chuyên gia cung cấp cho thí sinh nhiều thông tin cụ thể về ngành học này khi trong giai đoạn sắp tới.Thí sinh có rất nhiều câu hỏi đặt ra cho Ban tổ chứcTiến sĩ Lê Văn Thái – Phó Trưởng phòng Đào tạo Trường ĐH Công Nghiệp Hà Nội, chia sẻ: ""CNTT là nhóm ngành hot và được dự đoán là ngành lâu dài trong tương lai, để đào tạo nhân lực chất lượng cao phục vụ cho các ngành nghề khác. Chẳng hạn, lập trình viên phải biết cách phát triển các sản phẩm CNTT để phục vụ những ngành nghề khác"". Tiến sỹ khẳng định sinh viên học tốt chắc chắn ra trường sẽ có việc làm. Tuy nhiên, lĩnh vực này khó nên sinh viên phải học chăm chỉ và cố gắng thì mới thành công, đòi hòi có năng lực thật sự và có kỹ năng nghề nghiệp.TS. Đặng Trọng Hợp – Trưởng khoa CNTT chia sẻ: ""CNTT là nhóm ngành đang có xu hướng phát triển và nhu cầu nhân lực rất cao và luôn nằm trong tốp đầu những ngành có lương và thu nhập cao"". Theo Tiến sĩ, Khoa Công nghệ thông tin Trường ĐH Công Nghiệp Hà Nội có 4 chuyên ngành công nghệ thông tin, khoa học máy tính, hệ thống thông tin, kỹ thuật phần mềm, nếu sinh viên năm thứ 3 có học lực khá thì ngay năm này có việc làm và có lương. Khoa có mục tiêu giúp sinh viên tiếp\nnext_contents:\n- Tư vấn tuyển sinh trực tuyến nhóm ngành Công nghệ thông tin năm 2022\nTrang HaUI\nPhòng\nPhòng Tổ chức hành chính\nPhòng Đào tạo\nPhòng Công tác sinh viên\nPhòng Khoa học công nghệ\nPhòng hợp tác đối ngoại\nPhòng Tài chính kế toán\nPhòng Quản trị\nPhòng Thanh tra Giáo dục\nKhoa\nKhoa Công nghệ Hoá\nKhoa Công nghệ may & TKTT\nKhoa Công nghệ thông tin\nKhoa Điện\nKhoa Điện tử\nKhoa Khoa học cơ bản\nKhoa Lý luận chính trị - Pháp luật\nTrung tâm Đào tạo\nTrung tâm Đào tạo Sau đại học\nTrung tâm Giáo dục thể chất và Thể thao\nTrung tâm Công nghệ Ô tô và Đào tạo lái xe\nTrung tâm Công nghệ thông tin\nTrung tâm Việt Nhật\nTrung tâm Giáo dục Quốc phòng An ninh\nTrung tâm Dịch vụ\nTrung tâm Truyền thông & Quan hệ Công chúng\nTrạm Y tế\nTrung tâm Hỗ trợ Sinh viên\nTrung tâm Đảm bảo chất lượng\nTrung tâm Thông tin Thư viện\nTrung tâm khảo thí\nViện nghiên cứu\nCông ty Letco\nThư điện tử\nSitemap\nLiên hệ\nToggle navigation\nGIỚI THIỆU\nTHÔNG TIN CHUNG\nCƠ CẤU TỔ CHỨC\nCHIẾN LƯỢC PHÁT TRIỂN\nCÁN BỘ GIẢNG VIÊN\nCƠ SỞ VẬT CHẤT\nLIÊN HỆ\nĐÀO TẠO\nĐẠI HỌC\nKHOA HỌC MÁY TÍNH\nKỸ THUẬT PHẦN MỀM\nHỆ THỐNG THÔNG TIN\nCÔNG NGHỆ THÔNG TIN\nCÔNG NGHỆ ĐA PHƯƠNG TIỆN\nAN TOÀN THÔNG TIN\nSAU ĐẠI HỌC\nHỆ THỐNG THÔNG TIN\nKẾ HOẠCH\nTIẾN ĐỘ\nQUY CHẾ, BIỂU MẪU\nNGHIÊN CỨU KHOA HỌC\nCÔNG TRÌNH CÔNG BỐ\nĐỀ TÀI, DỰ ÁN\nSINH VIÊN NCKH\nTIN KHCN\nCÔNG TÁC SINH VIÊN\nQUY CHẾ\nGƯƠNG SÁNG SINH VIÊN\nHỌC BỔNG\nCÂU LẠC BỘ\nTHƯ VIỆN ẢNH\nTUYỂN DỤNG\nTIN TỨC\nTRANG CHỦ > TIN TỨC\nTư vấn tuyển sinh trực tuyến nhóm ngành Công nghệ thông tin năm 2022\n', 'content: Đội bóng khoa Công nghệ thông tin cùng những trận cầu đáng nhớ\nThứ Bảy, 10:00 23/07/2022\nĐại hội đại biểu Liên chi Đoàn khoa Công nghệ thông tin lần thứ X, nhiệm kỳ 2022 - 2024\nThứ Hai, 15:00 18/04/2022\nGặp mặt tân Sinh viên K15 khoa Công nghệ thông tin\nThứ Tư, 08:17 28/10/2020\nChương trình thực tập tại SVMC ""SVMC Internship Program 2020""\nThứ Sáu, 14:02 22/05/2020\nLịch giảng dạy môn Pháp Luật tuần từ 20/4 đến 26/4/2020 Hệ Cao đẳng khóa 21\nThứ Sáu, 15:05 17/04/2020\nDanh sách các lớp học trực tuyến từ ngày 06/4/2020 đến ngày 19/4/2020\nThứ Bảy, 12:42 04/04/2020\nDanh sách các lớp học trực tuyến từ ngày 30/3/2020 đến ngày 5/4/2020\nThứ Bảy, 14:46 28/03/2020\nKế hoạch tổ chức hoạt động dạy học tuần từ 23/03/2020 đến 05/04/2020 khoa CNTT\nThứ Hai, 09:03 23/03/2020\nĐội HaUI.NotTrashCar đạt giải nhì vòng sơ loại, giành quyền bước vào vòng bán kết cuộc đua số khu vực miền Bắc năm 2020\nThứ Sáu, 08:02 06/03/2020\nĐội ngũ giảng viênHiện nay đội ngũ cán bộ giáo viên Khoa Công nghệ thông tin gồm có các Giảng viên có trình độ Tiến sỹ, Thạc sỹ và kỹ sư. Các cán bộ giáo viên trong đơn vị đều có kiến thức chuyên ngành vững vàng, có khả năng nghiên cứu khoa học, viết báo, và thực hiện các đề tài, dự án...Trong những năm qua tập thể cán bộ giáo viên Khoa Công nghệ thông tin đều được đánh giá là một tập vững mạnh, đoàn kết và giành được nhiều các giải thưởng trong hoạt động thi giáo viên dạy giỏi, các cuộc thi tay nghề và các hoạt động phong trào thể dục, thể thao, văn hóa văn nghệ do nhà trường tổ chức...\nBản đồ chỉ dẫn\nTrường Đại học Công nghiệp Hà Nội\nTrụ sở chính\nSố 298 đường Cầu Diễn, quận Bắc Từ Liêm, Hà Nội\n+84 243 765 5121\nEmail: dhcnhn@haui.edu.vn\nCác cơ sở khác\nCơ sở 2: Phường Tây Tựu, quận Bắc Từ Liêm, Hà Nội\nnext_contents:\n- Đội ngũ giảng viên - ĐẠI HỌC CÔNG NGHIỆP HÀ NỘI || HaUI\nTrang HaUI\nPhòng\nPhòng Tổ chức hành chính\nPhòng Đào tạo\nPhòng Công tác sinh viên\nPhòng Khoa học công nghệ\nPhòng hợp tác đối ngoại\nPhòng Tài chính kế toán\nPhòng Quản trị\nPhòng Thanh tra Giáo dục\nKhoa\nKhoa Công nghệ Hoá\nKhoa Công nghệ may & TKTT\nKhoa Công nghệ thông tin\nKhoa Điện\nKhoa Điện tử\nKhoa Khoa học cơ bản\nKhoa Lý luận chính trị - Pháp luật\nTrung tâm Đào tạo\nTrung tâm Đào tạo Sau đại học\nTrung tâm Giáo dục thể chất và Thể thao\nTrung tâm Công nghệ Ô tô và Đào tạo lái xe\nTrung tâm Công nghệ thông tin\nTrung tâm Việt Nhật\nTrung tâm Giáo dục Quốc phòng An ninh\nTrung tâm Dịch vụ\nTrung tâm Truyền thông & Quan hệ Công chúng\nTrạm Y tế\nTrung tâm Hỗ trợ Sinh viên\nTrung tâm Đảm bảo chất lượng\nTrung tâm Thông tin Thư viện\nTrung tâm khảo thí\nViện nghiên cứu\nCông ty Letco\nThư điện tử\nSitemap\nLiên hệ\nToggle navigation\nGIỚI THIỆU\nTHÔNG TIN CHUNG\nCƠ CẤU TỔ CHỨC\nCHIẾN LƯỢC PHÁT TRIỂN\nCÁN BỘ GIẢNG VIÊN\nCƠ SỞ VẬT CHẤT\nLIÊN HỆ\nĐÀO TẠO\nĐẠI HỌC\nKHOA HỌC MÁY TÍNH\nKỸ THUẬT PHẦN MỀM\nHỆ THỐNG THÔNG TIN\nCÔNG NGHỆ THÔNG TIN\nCÔNG NGHỆ ĐA PHƯƠNG TIỆN\nAN TOÀN THÔNG TIN\nSAU ĐẠI HỌC\nHỆ THỐNG THÔNG TIN\nKẾ HOẠCH\nTIẾN ĐỘ\nQUY CHẾ, BIỂU MẪU\nNGHIÊN CỨU KHOA HỌC\nCÔNG TRÌNH CÔNG BỐ\nĐỀ TÀI, DỰ ÁN\nSINH VIÊN NCKH\nTIN KHCN\nCÔNG TÁC SINH VIÊN\nQUY CHẾ\nGƯƠNG SÁNG SINH VIÊN\nHỌC BỔNG\nCÂU LẠC BỘ\nTHƯ VIỆN ẢNH\nTUYỂN DỤNG\nCán bộ và Giảng Viên\nTin tiêu điểm\nSinh viên Khóa 19 Khoa Công nghệ thông tin đạt Học bổng HaUI 100% toàn khóa học.\nThứ Sáu, 11:07 20/09/2024\nĐội bóng khoa Công nghệ thông tin cùng những trận cầu đáng nhớ\nThứ Bảy, 10:00 23/07/2022\nĐại hội đại biểu Liên chi Đoàn khoa Công nghệ thông tin lần thứ X, nhiệm kỳ 2022 - 2024\nThứ Hai, 15:00 18/04/2022\nGặp mặt tân Sinh viên K15 khoa Công nghệ thông tin\n', 'content: Đội bóng khoa Công nghệ thông tin cùng những trận cầu đáng nhớ\nThứ Bảy, 10:00 23/07/2022\nĐại hội đại biểu Liên chi Đoàn khoa Công nghệ thông tin lần thứ X, nhiệm kỳ 2022 - 2024\nThứ Hai, 15:00 18/04/2022\nGặp mặt tân Sinh viên K15 khoa Công nghệ thông tin\nThứ Tư, 08:17 28/10/2020\nChương trình thực tập tại SVMC ""SVMC Internship Program 2020""\nThứ Sáu, 14:02 22/05/2020\nLịch giảng dạy môn Pháp Luật tuần từ 20/4 đến 26/4/2020 Hệ Cao đẳng khóa 21\nThứ Sáu, 15:05 17/04/2020\nDanh sách các lớp học trực tuyến từ ngày 06/4/2020 đến ngày 19/4/2020\nThứ Bảy, 12:42 04/04/2020\nDanh sách các lớp học trực tuyến từ ngày 30/3/2020 đến ngày 5/4/2020\nThứ Bảy, 14:46 28/03/2020\nKế hoạch tổ chức hoạt động dạy học tuần từ 23/03/2020 đến 05/04/2020 khoa CNTT\nThứ Hai, 09:03 23/03/2020\nĐội HaUI.NotTrashCar đạt giải nhì vòng sơ loại, giành quyền bước vào vòng bán kết cuộc đua số khu vực miền Bắc năm 2020\nThứ Sáu, 08:02 06/03/2020\nĐội ngũ giảng viênHiện nay đội ngũ cán bộ giáo viên Khoa Công nghệ thông tin gồm có các Giảng viên có trình độ Tiến sỹ, Thạc sỹ và kỹ sư. Các cán bộ giáo viên trong đơn vị đều có kiến thức chuyên ngành vững vàng, có khả năng nghiên cứu khoa học, viết báo, và thực hiện các đề tài, dự án...Trong những năm qua tập thể cán bộ giáo viên Khoa Công nghệ thông tin đều được đánh giá là một tập vững mạnh, đoàn kết và giành được nhiều các giải thưởng trong hoạt động thi giáo viên dạy giỏi, các cuộc thi tay nghề và các hoạt động phong trào thể dục, thể thao, văn hóa văn nghệ do nhà trường tổ chức...\nBản đồ chỉ dẫn\nTrường Đại học Công nghiệp Hà Nội\nTrụ sở chính\nSố 298 đường Cầu Diễn, quận Bắc Từ Liêm, Hà Nội\n+84 243 765 5121\nEmail: dhcnhn@haui.edu.vn\nCác cơ sở khác\nCơ sở 2: Phường Tây Tựu, quận Bắc Từ Liêm, Hà Nội\nnext_contents:\n- Đội ngũ giảng viên - ĐẠI HỌC CÔNG NGHIỆP HÀ NỘI || HaUI\nTrang HaUI\nPhòng\nPhòng Tổ chức hành chính\nPhòng Đào tạo\nPhòng Công tác sinh viên\nPhòng Khoa học công nghệ\nPhòng hợp tác đối ngoại\nPhòng Tài chính kế toán\nPhòng Quản trị\nPhòng Thanh tra Giáo dục\nKhoa\nKhoa Công nghệ Hoá\nKhoa Công nghệ may & TKTT\nKhoa Công nghệ thông tin\nKhoa Điện\nKhoa Điện tử\nKhoa Khoa học cơ bản\nKhoa Lý luận chính trị - Pháp luật\nTrung tâm Đào tạo\nTrung tâm Đào tạo Sau đại học\nTrung tâm Giáo dục thể chất và Thể thao\nTrung tâm Công nghệ Ô tô và Đào tạo lái xe\nTrung tâm Công nghệ thông tin\nTrung tâm Việt Nhật\nTrung tâm Giáo dục Quốc phòng An ninh\nTrung tâm Dịch vụ\nTrung tâm Truyền thông & Quan hệ Công chúng\nTrạm Y tế\nTrung tâm Hỗ trợ Sinh viên\nTrung tâm Đảm bảo chất lượng\nTrung tâm Thông tin Thư viện\nTrung tâm khảo thí\nViện nghiên cứu\nCông ty Letco\nThư điện tử\nSitemap\nLiên hệ\nToggle navigation\nGIỚI THIỆU\nTHÔNG TIN CHUNG\nCƠ CẤU TỔ CHỨC\nCHIẾN LƯỢC PHÁT TRIỂN\nCÁN BỘ GIẢNG VIÊN\nCƠ SỞ VẬT CHẤT\nLIÊN HỆ\nĐÀO TẠO\nĐẠI HỌC\nKHOA HỌC MÁY TÍNH\nKỸ THUẬT PHẦN MỀM\nHỆ THỐNG THÔNG TIN\nCÔNG NGHỆ THÔNG TIN\nCÔNG NGHỆ ĐA PHƯƠNG TIỆN\nAN TOÀN THÔNG TIN\nSAU ĐẠI HỌC\nHỆ THỐNG THÔNG TIN\nKẾ HOẠCH\nTIẾN ĐỘ\nQUY CHẾ, BIỂU MẪU\nNGHIÊN CỨU KHOA HỌC\nCÔNG TRÌNH CÔNG BỐ\nĐỀ TÀI, DỰ ÁN\nSINH VIÊN NCKH\nTIN KHCN\nCÔNG TÁC SINH VIÊN\nQUY CHẾ\nGƯƠNG SÁNG SINH VIÊN\nHỌC BỔNG\nCÂU LẠC BỘ\nTHƯ VIỆN ẢNH\nTUYỂN DỤNG\nCán bộ và Giảng Viên\nTin tiêu điểm\nSinh viên Khóa 19 Khoa Công nghệ thông tin đạt Học bổng HaUI 100% toàn khóa học.\nThứ Sáu, 11:07 20/09/2024\nĐội bóng khoa Công nghệ thông tin cùng những trận cầu đáng nhớ\nThứ Bảy, 10:00 23/07/2022\nĐại hội đại biểu Liên chi Đoàn khoa Công nghệ thông tin lần thứ X, nhiệm kỳ 2022 - 2024\nThứ Hai, 15:00 18/04/2022\nGặp mặt tân Sinh viên K15 khoa Công nghệ thông tin\n']","['Quy chế Đào tạo Tin tiêu điểm Sinh viên Khóa 19 Khoa Công nghệ thông tin đạt Học bổng HaUI 100% toàn khóa học. Thứ Sáu, 11:07 20/09/2024 Đội bóng khoa Công nghệ thông tin cùng những trận cầu đáng nhớ Thứ Bảy, 10:00 23/07/2022 Đại hội đại biểu Liên chi Đoàn khoa Công nghệ thông tin lần thứ X, nhiệm kỳ 2022 - 2024 Thứ Hai, 15:00 18/04/2022 Gặp mặt tân Sinh viên K15 khoa Công nghệ thông tin Thứ Tư, 08:17 28/10/2020 Chương trình thực tập tại SVMC ""SVMC Internship Program 2020"" Thứ Sáu, 14:02 22/05/2020 Lịch giảng dạy môn Pháp Luật tuần từ 20/4 đến 26/4/2020 Hệ Cao đẳng khóa 21 Thứ Sáu, 15:05 17/04/2020 Danh sách các lớp học trực tuyến từ ngày 06/4/2020 đến ngày 19/4/2020 Thứ Bảy, 12:42 04/04/2020 Danh sách các lớp học trực tuyến từ ngày 30/3/2020 đến ngày 5/4/2020 Thứ Bảy, 14:46 28/03/2020 Kế hoạch tổ chức hoạt động dạy học tuần từ 23/03/2020 đến 05/04/2020 khoa CNTT Thứ Hai, 09:03 23/03/2020 Đội HaUI.NotTrashCar đạt giải nhì vòng sơ loại, giành quyền bước vào vòng bán kết cuộc đua số khu vực miền Bắc năm 2020 Thứ Sáu, 08:02 06/03/2020 Nhà trường ban hành quy chế đào tạo: Nhà trường ban hành quy chế đào tạo:- Quy chế đào tạo Đại học và Cao đẳng chính quy theo học chế tín chỉ: Tải về tại đây- Quy chế đào tạo Cao đẳng giáo dục nghề nghiệp: Tải về tại đây- Quy định tuyển sinh và đào tạo trình độ Thạc sỹ tại Trường ĐH Công Nghiệp Hà Nội: Tải về tại đây.- Quy định làm Đồ án, khóa luận Tốt nghiệp: Tải về tại đây- Quy định chuẩn đầu ra ngoại ngữ: Tải về tại đây.- Quyết định 721/QĐ-ĐHCN ban hành quy định tổ chức đánh giá kết quả học tập của người học tại trường ĐHCNHN: Tải về tại đây.- Mẫu đơn trong đào tạo tín chỉ: Tải về tại đây.- Danh sách các học phần/ môn học thay thế năm 2022: Tải về tại đây.- Quy định quản lý, tổ chức thực tập doanh nghiệp và các biểu mẫu cập nhật năm 2023- Qui định chuẩn đầu ra KNSD CNTT- Qui định đảm bảo an toàn, vệ sinh lao động và an toàn điện kèm theo Sổ tay an toàn- Quy định tổ chức dạy học CTĐT bằng tiếng nước ngoài năm 2022- Qui định tổ chức hoạt động ĐGKQHT của sinh viên sửa đổi và bổ sung 2023 (File QĐ)- Quy chế quản lý văn bằng, chứng chỉ- Quy định tổ chức hoạt động đánh giá kết quả học tập QĐ 245 ngày 06/03/2023- 336_Quy định tạm thời Công nhận KQHT và chuyển đổi tín chỉ trình độ đại học tại Trường ĐHCN HN- Tiến độ đào tạo năm học 2024 - 2025 chính thức- Quyết định Trưởng chương trình và giảng viên điều phối chương trình đào tạo trình độ đại học- Quyết định Trưởng chương trình và giảng viên điều phối chương trình đào tạo trình độ thạc sỹ, tiến sỹ.- Sổ tay sinh viên HaUI năm học 2024-2025. Bản đồ chỉ dẫn Trường Đại học Công nghiệp Hà Nội Trụ sở chính Số 298 đường Cầu Diễn, quận Bắc Từ Liêm, Hà Nội +84 243 765 5121 Email: dhcnhn@haui.edu.vn Các cơ sở khác Cơ sở 2: Phường Tây Tựu, quận Bắc Từ Liêm, Hà Nội Cơ sở 3: Phường Lê Hồng Phong, thành phố Phủ Lý, Hà Nam Liên kết site Trường Đại học Công nghiệp Hà Nội Thông tin tuyển sinh Hành chính điện tử Đào tạo trực tuyến Cổng thông tin đào tạo Copyright © 2018 Hanoi University of Industry.']","Chương trình đào tạo ngành Công nghệ thông tin tại Trường Đại học Công nghiệp Hà Nội có những đặc điểm nổi bật như sau:

1. **Cập nhật và đổi mới**: Chương trình đào tạo luôn được cập nhật và đổi mới để phù hợp với xu hướng công nghệ và nhu cầu của xã hội.

2. **Chất lượng đào tạo**: Khoa có phương thức tổ chức dạy - học đổi mới theo hướng tích cực, ứng dụng công nghệ, và phù hợp cho các hình thức đào tạo kết hợp.

3. **Kiểm định chất lượng**: Công tác kiểm định chất lượng chương trình đào tạo được triển khai có hệ thống, với mục tiêu 100% chương trình đào tạo đủ thời gian đã được kiểm định vào năm 2023.

4. **Cơ sở vật chất hiện đại**: Khoa được đầu tư cơ sở vật chất đồng bộ, hiện đại, với nhiều phòng máy tính và trang thiết bị chuyên dụng phục vụ cho việc giảng dạy và nghiên cứu.

5. **Mối quan hệ với doanh nghiệp**: Khoa có mối quan hệ gắn kết với nhiều doanh nghiệp lớn trong lĩnh vực CNTT, như Samsung, LG, FPT, Viettel, VNPT, tạo cơ hội cho sinh viên thực tập và tuyển dụng.

6. **Hoạt động sinh viên phong phú**: Khoa có 7 câu lạc bộ sinh viên với nhiều hoạt động bổ ích, tạo phong trào học tập và hỗ trợ cho hoạt động đào tạo.

7. **Nhu cầu nhân lực cao**: Ngành Công nghệ thông tin đang có nhu cầu nhân lực rất cao, với nhiều cơ hội việc làm cho sinh viên ngay khi còn học.

Chương trình đào tạo này không chỉ giúp sinh viên có kiến thức chuyên môn vững vàng mà còn trang bị kỹ năng thực tiễn cần thiết để đáp ứng yêu cầu của thị trường lao động.

[Nguồn: CHIẾN LƯỢC PHÁT TRIỂN] - [**Link tham khảo**](https://fit.haui.edu.vn/vn/html/chien-luoc-phat-trien). 

Nếu bạn cần thêm thông tin hoặc có câu hỏi khác, hãy cho tôi biết!","Chương trình đào tạo ngành Công nghệ thông tin tại Hà Nội được thiết kế theo học chế tín chỉ, với quy chế đào tạo rõ ràng và các quy định về chuẩn đầu ra ngoại ngữ. Sinh viên có cơ hội nhận học bổng HaUI 100% toàn khóa học và tham gia các hoạt động thực tập tại các doanh nghiệp.",0.99999999995,0.6666666666666666,0.8695652173913043,0.9189035072668418,0.9301158354534185,1.3443200588226318,11.519777059555054
11,Có thông tin gì về các đề tài nghiên cứu khoa học của sinh viên năm 2022 không?,"['content: Tổng hợp đề tài sinh viên nghiên cứu khoa học năm 2022\nTrang HaUI\nPhòng\nPhòng Tổ chức hành chính\nPhòng Đào tạo\nPhòng Công tác sinh viên\nPhòng Khoa học công nghệ\nPhòng hợp tác đối ngoại\nPhòng Tài chính kế toán\nPhòng Quản trị\nPhòng Thanh tra Giáo dục\nKhoa\nKhoa Công nghệ Hoá\nKhoa Công nghệ may & TKTT\nKhoa Công nghệ thông tin\nKhoa Điện\nKhoa Điện tử\nKhoa Khoa học cơ bản\nKhoa Lý luận chính trị - Pháp luật\nTrung tâm Đào tạo\nTrung tâm Đào tạo Sau đại học\nTrung tâm Giáo dục thể chất và Thể thao\nTrung tâm Công nghệ Ô tô và Đào tạo lái xe\nTrung tâm Công nghệ thông tin\nTrung tâm Việt Nhật\nTrung tâm Giáo dục Quốc phòng An ninh\nTrung tâm Dịch vụ\nTrung tâm Truyền thông & Quan hệ Công chúng\nTrạm Y tế\nTrung tâm Hỗ trợ Sinh viên\nTrung tâm Đảm bảo chất lượng\nTrung tâm Thông tin Thư viện\nTrung tâm khảo thí\nViện nghiên cứu\nCông ty Letco\nThư điện tử\nSitemap\nLiên hệ\nToggle navigation\nGIỚI THIỆU\nTHÔNG TIN CHUNG\nCƠ CẤU TỔ CHỨC\nCHIẾN LƯỢC PHÁT TRIỂN\nCÁN BỘ GIẢNG VIÊN\nCƠ SỞ VẬT CHẤT\nLIÊN HỆ\nĐÀO TẠO\nĐẠI HỌC\nKHOA HỌC MÁY TÍNH\nKỸ THUẬT PHẦN MỀM\nHỆ THỐNG THÔNG TIN\nCÔNG NGHỆ THÔNG TIN\nCÔNG NGHỆ ĐA PHƯƠNG TIỆN\nAN TOÀN THÔNG TIN\nSAU ĐẠI HỌC\nHỆ THỐNG THÔNG TIN\nKẾ HOẠCH\nTIẾN ĐỘ\nQUY CHẾ, BIỂU MẪU\nNGHIÊN CỨU KHOA HỌC\nCÔNG TRÌNH CÔNG BỐ\nĐỀ TÀI, DỰ ÁN\nSINH VIÊN NCKH\nTIN KHCN\nCÔNG TÁC SINH VIÊN\nQUY CHẾ\nGƯƠNG SÁNG SINH VIÊN\nHỌC BỔNG\nCÂU LẠC BỘ\nTHƯ VIỆN ẢNH\nTUYỂN DỤNG\nSINH VIÊN NCKH\nTRANG CHỦ > SINH VIÊN NCKH\nTổng hợp đề tài sinh viên nghiên cứu khoa học năm 2022\nnext_contents:\n', 'content: Tổng hợp đề tài sinh viên nghiên cứu khoa học năm 2022\nTrang HaUI\nPhòng\nPhòng Tổ chức hành chính\nPhòng Đào tạo\nPhòng Công tác sinh viên\nPhòng Khoa học công nghệ\nPhòng hợp tác đối ngoại\nPhòng Tài chính kế toán\nPhòng Quản trị\nPhòng Thanh tra Giáo dục\nKhoa\nKhoa Công nghệ Hoá\nKhoa Công nghệ may & TKTT\nKhoa Công nghệ thông tin\nKhoa Điện\nKhoa Điện tử\nKhoa Khoa học cơ bản\nKhoa Lý luận chính trị - Pháp luật\nTrung tâm Đào tạo\nTrung tâm Đào tạo Sau đại học\nTrung tâm Giáo dục thể chất và Thể thao\nTrung tâm Công nghệ Ô tô và Đào tạo lái xe\nTrung tâm Công nghệ thông tin\nTrung tâm Việt Nhật\nTrung tâm Giáo dục Quốc phòng An ninh\nTrung tâm Dịch vụ\nTrung tâm Truyền thông & Quan hệ Công chúng\nTrạm Y tế\nTrung tâm Hỗ trợ Sinh viên\nTrung tâm Đảm bảo chất lượng\nTrung tâm Thông tin Thư viện\nTrung tâm khảo thí\nViện nghiên cứu\nCông ty Letco\nThư điện tử\nSitemap\nLiên hệ\nToggle navigation\nGIỚI THIỆU\nTHÔNG TIN CHUNG\nCƠ CẤU TỔ CHỨC\nCHIẾN LƯỢC PHÁT TRIỂN\nCÁN BỘ GIẢNG VIÊN\nCƠ SỞ VẬT CHẤT\nLIÊN HỆ\nĐÀO TẠO\nĐẠI HỌC\nKHOA HỌC MÁY TÍNH\nKỸ THUẬT PHẦN MỀM\nHỆ THỐNG THÔNG TIN\nCÔNG NGHỆ THÔNG TIN\nCÔNG NGHỆ ĐA PHƯƠNG TIỆN\nAN TOÀN THÔNG TIN\nSAU ĐẠI HỌC\nHỆ THỐNG THÔNG TIN\nKẾ HOẠCH\nTIẾN ĐỘ\nQUY CHẾ, BIỂU MẪU\nNGHIÊN CỨU KHOA HỌC\nCÔNG TRÌNH CÔNG BỐ\nĐỀ TÀI, DỰ ÁN\nSINH VIÊN NCKH\nTIN KHCN\nCÔNG TÁC SINH VIÊN\nQUY CHẾ\nGƯƠNG SÁNG SINH VIÊN\nHỌC BỔNG\nCÂU LẠC BỘ\nTHƯ VIỆN ẢNH\nTUYỂN DỤNG\nSINH VIÊN NCKH\nTRANG CHỦ > SINH VIÊN NCKH\nTổng hợp đề tài sinh viên nghiên cứu khoa học năm 2022\nnext_contents:\n', 'content: Tổng hợp đề tài sinh viên nghiên cứu khoa học năm 2023\nTrang HaUI\nPhòng\nPhòng Tổ chức hành chính\nPhòng Đào tạo\nPhòng Công tác sinh viên\nPhòng Khoa học công nghệ\nPhòng hợp tác đối ngoại\nPhòng Tài chính kế toán\nPhòng Quản trị\nPhòng Thanh tra Giáo dục\nKhoa\nKhoa Công nghệ Hoá\nKhoa Công nghệ may & TKTT\nKhoa Công nghệ thông tin\nKhoa Điện\nKhoa Điện tử\nKhoa Khoa học cơ bản\nKhoa Lý luận chính trị - Pháp luật\nTrung tâm Đào tạo\nTrung tâm Đào tạo Sau đại học\nTrung tâm Giáo dục thể chất và Thể thao\nTrung tâm Công nghệ Ô tô và Đào tạo lái xe\nTrung tâm Công nghệ thông tin\nTrung tâm Việt Nhật\nTrung tâm Giáo dục Quốc phòng An ninh\nTrung tâm Dịch vụ\nTrung tâm Truyền thông & Quan hệ Công chúng\nTrạm Y tế\nTrung tâm Hỗ trợ Sinh viên\nTrung tâm Đảm bảo chất lượng\nTrung tâm Thông tin Thư viện\nTrung tâm khảo thí\nViện nghiên cứu\nCông ty Letco\nThư điện tử\nSitemap\nLiên hệ\nToggle navigation\nGIỚI THIỆU\nTHÔNG TIN CHUNG\nCƠ CẤU TỔ CHỨC\nCHIẾN LƯỢC PHÁT TRIỂN\nCÁN BỘ GIẢNG VIÊN\nCƠ SỞ VẬT CHẤT\nLIÊN HỆ\nĐÀO TẠO\nĐẠI HỌC\nKHOA HỌC MÁY TÍNH\nKỸ THUẬT PHẦN MỀM\nHỆ THỐNG THÔNG TIN\nCÔNG NGHỆ THÔNG TIN\nCÔNG NGHỆ ĐA PHƯƠNG TIỆN\nAN TOÀN THÔNG TIN\nSAU ĐẠI HỌC\nHỆ THỐNG THÔNG TIN\nKẾ HOẠCH\nTIẾN ĐỘ\nQUY CHẾ, BIỂU MẪU\nNGHIÊN CỨU KHOA HỌC\nCÔNG TRÌNH CÔNG BỐ\nĐỀ TÀI, DỰ ÁN\nSINH VIÊN NCKH\nTIN KHCN\nCÔNG TÁC SINH VIÊN\nQUY CHẾ\nGƯƠNG SÁNG SINH VIÊN\nHỌC BỔNG\nCÂU LẠC BỘ\nTHƯ VIỆN ẢNH\nTUYỂN DỤNG\nSINH VIÊN NCKH\nTRANG CHỦ > SINH VIÊN NCKH\nTổng hợp đề tài sinh viên nghiên cứu khoa học năm 2023\nTổng hợp đề tài sinh viên nghiên cứu khoa học năm 2023: Tải về tại đây\nThứ Sáu, 09:05 25/08/2023\nTags:\nTweet\nCác bài đã đăng\nnext_contents:\n', 'content: Tổng hợp đề tài sinh viên nghiên cứu khoa học năm 2023\nTrang HaUI\nPhòng\nPhòng Tổ chức hành chính\nPhòng Đào tạo\nPhòng Công tác sinh viên\nPhòng Khoa học công nghệ\nPhòng hợp tác đối ngoại\nPhòng Tài chính kế toán\nPhòng Quản trị\nPhòng Thanh tra Giáo dục\nKhoa\nKhoa Công nghệ Hoá\nKhoa Công nghệ may & TKTT\nKhoa Công nghệ thông tin\nKhoa Điện\nKhoa Điện tử\nKhoa Khoa học cơ bản\nKhoa Lý luận chính trị - Pháp luật\nTrung tâm Đào tạo\nTrung tâm Đào tạo Sau đại học\nTrung tâm Giáo dục thể chất và Thể thao\nTrung tâm Công nghệ Ô tô và Đào tạo lái xe\nTrung tâm Công nghệ thông tin\nTrung tâm Việt Nhật\nTrung tâm Giáo dục Quốc phòng An ninh\nTrung tâm Dịch vụ\nTrung tâm Truyền thông & Quan hệ Công chúng\nTrạm Y tế\nTrung tâm Hỗ trợ Sinh viên\nTrung tâm Đảm bảo chất lượng\nTrung tâm Thông tin Thư viện\nTrung tâm khảo thí\nViện nghiên cứu\nCông ty Letco\nThư điện tử\nSitemap\nLiên hệ\nToggle navigation\nGIỚI THIỆU\nTHÔNG TIN CHUNG\nCƠ CẤU TỔ CHỨC\nCHIẾN LƯỢC PHÁT TRIỂN\nCÁN BỘ GIẢNG VIÊN\nCƠ SỞ VẬT CHẤT\nLIÊN HỆ\nĐÀO TẠO\nĐẠI HỌC\nKHOA HỌC MÁY TÍNH\nKỸ THUẬT PHẦN MỀM\nHỆ THỐNG THÔNG TIN\nCÔNG NGHỆ THÔNG TIN\nCÔNG NGHỆ ĐA PHƯƠNG TIỆN\nAN TOÀN THÔNG TIN\nSAU ĐẠI HỌC\nHỆ THỐNG THÔNG TIN\nKẾ HOẠCH\nTIẾN ĐỘ\nQUY CHẾ, BIỂU MẪU\nNGHIÊN CỨU KHOA HỌC\nCÔNG TRÌNH CÔNG BỐ\nĐỀ TÀI, DỰ ÁN\nSINH VIÊN NCKH\nTIN KHCN\nCÔNG TÁC SINH VIÊN\nQUY CHẾ\nGƯƠNG SÁNG SINH VIÊN\nHỌC BỔNG\nCÂU LẠC BỘ\nTHƯ VIỆN ẢNH\nTUYỂN DỤNG\nSINH VIÊN NCKH\nTRANG CHỦ > SINH VIÊN NCKH\nTổng hợp đề tài sinh viên nghiên cứu khoa học năm 2023\nTổng hợp đề tài sinh viên nghiên cứu khoa học năm 2023: Tải về tại đây\nThứ Sáu, 09:05 25/08/2023\nTags:\nTweet\nCác bài đã đăng\nnext_contents:\n']","['THƯ VIỆN ẢNH TUYỂN DỤNG NGHIÊN CỨU KHOA HỌC TRANG CHỦ > NGHIÊN CỨU KHOA HỌC Quyết định giao nhiệm vụ NCKH cho sinh viên năm học 2024-2025 Thứ Năm, 16:11 26/09/2024 Xem thêm 61 công trình khoa học Khoa CNTT được khen thưởng tại lễ trao giải sinh viên nghiên cứu khoa học năm học 2023-2024 Thứ Năm, 13:41 27/06/2024 Xem thêm Tổng hợp đề tài sinh viên nghiên cứu khoa học năm 2023 Thứ Sáu, 09:05 25/08/2023 Xem thêm Tổng hợp đề tài sinh viên nghiên cứu khoa học năm 2022 Thứ Tư, 14:09 08/06/2022 Xem thêm Sinh viên Khoa Công nghệ thông tin đạt giải cao tại hội nghị tổng kết và trao giải SV NCKH lần thứ XII Thứ Năm, 14:06 23/12/2021 Phát huy tinh thần sáng tạo nghiện cứu, nhiều đề tài của SV khoa CNTT năm 2021 được đánh giá có ý nghĩa khoa học và thực tiễn, được SV đầu tư nghiêm túc, chu đáo và có nội dung bám sát nhu cầu ứng dụng từ thực tế. Xem thêm Giáo trình Thứ Bảy, 21:22 11/12/2021 Xem thêm Báo cáo khoa học Thứ Bảy, 15:42 11/12/2021 Xem thêm Bài báo khoa học Thứ Sáu, 15:52 10/12/2021 Xem thêm Nhiệm vụ khoa học công nghệ Thứ Sáu, 13:55 10/12/2021 Xem thêm Tổng hợp đề tài sinh viên nghiên cứu khoa học năm 2021 Thứ Hai, 12:58 06/12/2021 Xem thêm 1 2 » Tin tiêu điểm Sinh viên Khóa 19 Khoa Công nghệ thông tin đạt Học bổng HaUI 100% toàn khóa học. Thứ Sáu, 11:07 20/09/2024 Đội bóng khoa Công nghệ thông tin cùng những trận cầu đáng nhớ Thứ Bảy, 10:00 23/07/2022 Đại hội đại biểu Liên chi Đoàn khoa Công nghệ thông tin lần thứ X, nhiệm kỳ 2022 - 2024 Thứ Hai, 15:00 18/04/2022 Gặp mặt tân Sinh viên K15 khoa Công nghệ thông tin Thứ Tư, 08:17 28/10/2020 Chương trình thực tập tại SVMC ""SVMC Internship Program 2020"" Thứ Sáu, 14:02 22/05/2020 Lịch giảng dạy môn Pháp Luật tuần từ 20/4 đến 26/4/2020 Hệ Cao đẳng khóa 21 Thứ Sáu, 15:05 17/04/2020 Danh sách các lớp học trực tuyến từ ngày 06/4/2020 đến ngày 19/4/2020 Thứ Bảy, 12:42 04/04/2020 Danh sách các lớp học trực tuyến từ ngày 30/3/2020 đến ngày 5/4/2020 Thứ Bảy, 14:46 28/03/2020 Kế hoạch tổ chức hoạt động dạy học tuần từ 23/03/2020 đến 05/04/2020 khoa CNTT Thứ Hai, 09:03 23/03/2020 Đội HaUI.NotTrashCar đạt giải nhì vòng sơ loại, giành quyền bước vào vòng bán kết cuộc đua số khu vực miền Bắc năm 2020 Thứ Sáu, 08:02 06/03/2020 Bản đồ chỉ dẫn Trường Đại học Công nghiệp Hà Nội Trụ sở chính Số 298 đường Cầu Diễn, quận Bắc Từ Liêm, Hà Nội +84 243 765 5121 Email: dhcnhn@haui.edu.vn Các cơ sở khác Cơ sở 2: Phường Tây Tựu, quận Bắc Từ Liêm, Hà Nội Cơ sở 3: Phường Lê Hồng Phong, thành phố Phủ Lý, Hà Nam Liên kết site Trường Đại học Công nghiệp Hà Nội Thông tin tuyển sinh Hành chính điện tử Đào tạo trực tuyến Cổng thông tin đào tạo Copyright © 2018 Hanoi University of Industry.']","Tôi không có thông tin chi tiết về các đề tài nghiên cứu khoa học của sinh viên năm 2022. Tuy nhiên, bạn có thể tham khảo tổng hợp đề tài nghiên cứu khoa học của sinh viên năm 2022 tại trang web của Trường Đại học Công nghiệp Hà Nội qua liên kết sau: [Tổng hợp đề tài sinh viên nghiên cứu khoa học năm 2022](https://fit.haui.edu.vn/vn/sinh-vien-nckh/tong-hop-de-tai-sinh-vien-nghien-cuu-khoa-hoc-nam-2022/70614).

Nếu bạn cần thêm thông tin hoặc có câu hỏi khác, hãy cho tôi biết!",Tổng hợp đề tài sinh viên nghiên cứu khoa học năm 2022 đã được công bố vào ngày 08/06/2022.,0.99999999995,0.0,0.25,0.0,0.9151938521965158,0.9706323146820068,5.6417460441589355
12,Khoa Công nghệ thông tin tại Đại học Công nghiệp Hà Nội có những chương trình đào tạo và cơ hội nghề nghiệp nào cho sinh viên sau khi tốt nghiệp?,"['content: thu nhập cao"". Theo Tiến sĩ, Khoa Công nghệ thông tin Trường ĐH Công Nghiệp Hà Nội có 4 chuyên ngành công nghệ thông tin, khoa học máy tính, hệ thống thông tin, kỹ thuật phần mềm, nếu sinh viên năm thứ 3 có học lực khá thì ngay năm này có việc làm và có lương. Khoa có mục tiêu giúp sinh viên tiếp cận thực tế càng sớm càng tốt, tham gia nhiều dự án ngay ở năm 2.Về phía doanh nghiệp và cựu sinh viên chia sẻ: “Khoa CNTT Trường ĐH Công Nghiệp Hà Nội hướng đến đào tạo sinh viên có tính kỷ luật cao để có thể làm việc trong môi trường chuyên nghiệp. Bên cạnh đó là năng lực sáng tạo, các em được khuyến khích sáng tạo trong quá trình học tập. Trường gắn kết với doanh nghiệp, tạo cơ hội cho các em tiếp cận với thực tế”.Đại diện Doanh nghiệp chia sẻ về nhu cầu và cơ hội việc làm CNTT\nnext_contents:\n- Công nghệ thông tin là nhóm ngành đang có xu hướng phát triển, nhu cầu nhân lực rất cao và các chuyên gia lưu ý sinh viên học tốt, có năng lực sẽ được doanh nghiệp săn đón ngay khi còn ngồi ở ghế nhà trường. Đại dịch Covid 19 đang bước vào năm thứ 3, gây ảnh hưởng tất cả mọi lĩnh vực trong đời sống. Tuy nhiên, công nghệ thông tin (CNTT) lại là một trong những lĩnh vực phát triển mạnh với nhiều đột phá góp phần đổi thay cuộc sống.Vào tối ngày 8/6/2022, Khoa Công nghệ thông tin Trường Đại học Công Nghiệp Hà Nội kết hợp với một số doanh nghiệp đã tổ chức buổi livestream tư vấn trực tuyến nhóm ngành CNTT năm 2022. Tham dự buổi tư vấn có TS. Lê Văn Thái – Phó Trưởng phòng đào tạo Trường ĐH Công Nghiệp Hà Nội, TS. Đặng Trọng Hợp – Trưởng Khoa CNTT và đại diện doanh nghiệp FPT Software, cựu sinh viên Nguyễn Huy Du, các chuyên gia cung cấp cho thí sinh nhiều thông tin cụ thể về ngành học này khi trong giai đoạn sắp tới.Thí sinh có rất nhiều câu hỏi đặt ra cho Ban tổ chứcTiến sĩ Lê Văn Thái – Phó Trưởng phòng Đào tạo Trường ĐH Công Nghiệp Hà Nội, chia sẻ: ""CNTT là nhóm ngành hot và được dự đoán là ngành lâu dài trong tương lai, để đào tạo nhân lực chất lượng cao phục vụ cho các ngành nghề khác. Chẳng hạn, lập trình viên phải biết cách phát triển các sản phẩm CNTT để phục vụ những ngành nghề khác"". Tiến sỹ khẳng định sinh viên học tốt chắc chắn ra trường sẽ có việc làm. Tuy nhiên, lĩnh vực này khó nên sinh viên phải học chăm chỉ và cố gắng thì mới thành công, đòi hòi có năng lực thật sự và có kỹ năng nghề nghiệp.TS. Đặng Trọng Hợp – Trưởng khoa CNTT chia sẻ: ""CNTT là nhóm ngành đang có xu hướng phát triển và nhu cầu nhân lực rất cao và luôn nằm trong tốp đầu những ngành có lương và thu nhập cao"". Theo Tiến sĩ, Khoa Công nghệ thông tin Trường ĐH Công Nghiệp Hà Nội có 4 chuyên ngành công nghệ thông tin, khoa học máy tính, hệ thống thông tin, kỹ thuật phần mềm, nếu sinh viên năm thứ 3 có học lực khá thì ngay năm này có việc làm và có lương. Khoa có mục tiêu giúp sinh viên tiếp\n', 'content: Công nghệ thông tin là nhóm ngành đang có xu hướng phát triển, nhu cầu nhân lực rất cao và các chuyên gia lưu ý sinh viên học tốt, có năng lực sẽ được doanh nghiệp săn đón ngay khi còn ngồi ở ghế nhà trường. Đại dịch Covid 19 đang bước vào năm thứ 3, gây ảnh hưởng tất cả mọi lĩnh vực trong đời sống. Tuy nhiên, công nghệ thông tin (CNTT) lại là một trong những lĩnh vực phát triển mạnh với nhiều đột phá góp phần đổi thay cuộc sống.Vào tối ngày 8/6/2022, Khoa Công nghệ thông tin Trường Đại học Công Nghiệp Hà Nội kết hợp với một số doanh nghiệp đã tổ chức buổi livestream tư vấn trực tuyến nhóm ngành CNTT năm 2022. Tham dự buổi tư vấn có TS. Lê Văn Thái – Phó Trưởng phòng đào tạo Trường ĐH Công Nghiệp Hà Nội, TS. Đặng Trọng Hợp – Trưởng Khoa CNTT và đại diện doanh nghiệp FPT Software, cựu sinh viên Nguyễn Huy Du, các chuyên gia cung cấp cho thí sinh nhiều thông tin cụ thể về ngành học này khi trong giai đoạn sắp tới.Thí sinh có rất nhiều câu hỏi đặt ra cho Ban tổ chứcTiến sĩ Lê Văn Thái – Phó Trưởng phòng Đào tạo Trường ĐH Công Nghiệp Hà Nội, chia sẻ: ""CNTT là nhóm ngành hot và được dự đoán là ngành lâu dài trong tương lai, để đào tạo nhân lực chất lượng cao phục vụ cho các ngành nghề khác. Chẳng hạn, lập trình viên phải biết cách phát triển các sản phẩm CNTT để phục vụ những ngành nghề khác"". Tiến sỹ khẳng định sinh viên học tốt chắc chắn ra trường sẽ có việc làm. Tuy nhiên, lĩnh vực này khó nên sinh viên phải học chăm chỉ và cố gắng thì mới thành công, đòi hòi có năng lực thật sự và có kỹ năng nghề nghiệp.TS. Đặng Trọng Hợp – Trưởng khoa CNTT chia sẻ: ""CNTT là nhóm ngành đang có xu hướng phát triển và nhu cầu nhân lực rất cao và luôn nằm trong tốp đầu những ngành có lương và thu nhập cao"". Theo Tiến sĩ, Khoa Công nghệ thông tin Trường ĐH Công Nghiệp Hà Nội có 4 chuyên ngành công nghệ thông tin, khoa học máy tính, hệ thống thông tin, kỹ thuật phần mềm, nếu sinh viên năm thứ 3 có học lực khá thì ngay năm này có việc làm và có lương. Khoa có mục tiêu giúp sinh viên tiếp\nnext_contents:\n- Tư vấn tuyển sinh trực tuyến nhóm ngành Công nghệ thông tin năm 2022\nTrang HaUI\nPhòng\nPhòng Tổ chức hành chính\nPhòng Đào tạo\nPhòng Công tác sinh viên\nPhòng Khoa học công nghệ\nPhòng hợp tác đối ngoại\nPhòng Tài chính kế toán\nPhòng Quản trị\nPhòng Thanh tra Giáo dục\nKhoa\nKhoa Công nghệ Hoá\nKhoa Công nghệ may & TKTT\nKhoa Công nghệ thông tin\nKhoa Điện\nKhoa Điện tử\nKhoa Khoa học cơ bản\nKhoa Lý luận chính trị - Pháp luật\nTrung tâm Đào tạo\nTrung tâm Đào tạo Sau đại học\nTrung tâm Giáo dục thể chất và Thể thao\nTrung tâm Công nghệ Ô tô và Đào tạo lái xe\nTrung tâm Công nghệ thông tin\nTrung tâm Việt Nhật\nTrung tâm Giáo dục Quốc phòng An ninh\nTrung tâm Dịch vụ\nTrung tâm Truyền thông & Quan hệ Công chúng\nTrạm Y tế\nTrung tâm Hỗ trợ Sinh viên\nTrung tâm Đảm bảo chất lượng\nTrung tâm Thông tin Thư viện\nTrung tâm khảo thí\nViện nghiên cứu\nCông ty Letco\nThư điện tử\nSitemap\nLiên hệ\nToggle navigation\nGIỚI THIỆU\nTHÔNG TIN CHUNG\nCƠ CẤU TỔ CHỨC\nCHIẾN LƯỢC PHÁT TRIỂN\nCÁN BỘ GIẢNG VIÊN\nCƠ SỞ VẬT CHẤT\nLIÊN HỆ\nĐÀO TẠO\nĐẠI HỌC\nKHOA HỌC MÁY TÍNH\nKỸ THUẬT PHẦN MỀM\nHỆ THỐNG THÔNG TIN\nCÔNG NGHỆ THÔNG TIN\nCÔNG NGHỆ ĐA PHƯƠNG TIỆN\nAN TOÀN THÔNG TIN\nSAU ĐẠI HỌC\nHỆ THỐNG THÔNG TIN\nKẾ HOẠCH\nTIẾN ĐỘ\nQUY CHẾ, BIỂU MẪU\nNGHIÊN CỨU KHOA HỌC\nCÔNG TRÌNH CÔNG BỐ\nĐỀ TÀI, DỰ ÁN\nSINH VIÊN NCKH\nTIN KHCN\nCÔNG TÁC SINH VIÊN\nQUY CHẾ\nGƯƠNG SÁNG SINH VIÊN\nHỌC BỔNG\nCÂU LẠC BỘ\nTHƯ VIỆN ẢNH\nTUYỂN DỤNG\nTIN TỨC\nTRANG CHỦ > TIN TỨC\nTư vấn tuyển sinh trực tuyến nhóm ngành Công nghệ thông tin năm 2022\n', 'content: Chàng trai ngành Công nghệ thông tin là tấm gương sáng cho sinh viên\nTrang HaUI\nPhòng\nPhòng Tổ chức hành chính\nPhòng Đào tạo\nPhòng Công tác sinh viên\nPhòng Khoa học công nghệ\nPhòng hợp tác đối ngoại\nPhòng Tài chính kế toán\nPhòng Quản trị\nPhòng Thanh tra Giáo dục\nKhoa\nKhoa Công nghệ Hoá\nKhoa Công nghệ may & TKTT\nKhoa Công nghệ thông tin\nKhoa Điện\nKhoa Điện tử\nKhoa Khoa học cơ bản\nKhoa Lý luận chính trị - Pháp luật\nTrung tâm Đào tạo\nTrung tâm Đào tạo Sau đại học\nTrung tâm Giáo dục thể chất và Thể thao\nTrung tâm Công nghệ Ô tô và Đào tạo lái xe\nTrung tâm Công nghệ thông tin\nTrung tâm Việt Nhật\nTrung tâm Giáo dục Quốc phòng An ninh\nTrung tâm Dịch vụ\nTrung tâm Truyền thông & Quan hệ Công chúng\nTrạm Y tế\nTrung tâm Hỗ trợ Sinh viên\nTrung tâm Đảm bảo chất lượng\nTrung tâm Thông tin Thư viện\nTrung tâm khảo thí\nViện nghiên cứu\nCông ty Letco\nThư điện tử\nSitemap\nLiên hệ\nToggle navigation\nGIỚI THIỆU\nTHÔNG TIN CHUNG\nCƠ CẤU TỔ CHỨC\nCHIẾN LƯỢC PHÁT TRIỂN\nCÁN BỘ GIẢNG VIÊN\nCƠ SỞ VẬT CHẤT\nLIÊN HỆ\nĐÀO TẠO\nĐẠI HỌC\nKHOA HỌC MÁY TÍNH\nKỸ THUẬT PHẦN MỀM\nHỆ THỐNG THÔNG TIN\nCÔNG NGHỆ THÔNG TIN\nCÔNG NGHỆ ĐA PHƯƠNG TIỆN\nAN TOÀN THÔNG TIN\nSAU ĐẠI HỌC\nHỆ THỐNG THÔNG TIN\nKẾ HOẠCH\nTIẾN ĐỘ\nQUY CHẾ, BIỂU MẪU\nNGHIÊN CỨU KHOA HỌC\nCÔNG TRÌNH CÔNG BỐ\nĐỀ TÀI, DỰ ÁN\nSINH VIÊN NCKH\nTIN KHCN\nCÔNG TÁC SINH VIÊN\nQUY CHẾ\nGƯƠNG SÁNG SINH VIÊN\nHỌC BỔNG\nCÂU LẠC BỘ\nTHƯ VIỆN ẢNH\nTUYỂN DỤNG\nGƯƠNG SÁNG SINH VIÊN\nTRANG CHỦ > GƯƠNG SÁNG SINH VIÊN\nChàng trai ngành Công nghệ thông tin là tấm gương sáng cho sinh viên\nnext_contents:\n', 'content: Sinh viên Khoa Công nghệ thông tin Trường Đại học Công Nghiệp Hà Nội đạt học bổng sinh viên xuất sắc Chương trình SIC 2023-2024\nTrang HaUI\nPhòng\nPhòng Tổ chức hành chính\nPhòng Đào tạo\nPhòng Công tác sinh viên\nPhòng Khoa học công nghệ\nPhòng hợp tác đối ngoại\nPhòng Tài chính kế toán\nPhòng Quản trị\nPhòng Thanh tra Giáo dục\nKhoa\nKhoa Công nghệ Hoá\nKhoa Công nghệ may & TKTT\nKhoa Công nghệ thông tin\nKhoa Điện\nKhoa Điện tử\nKhoa Khoa học cơ bản\nKhoa Lý luận chính trị - Pháp luật\nTrung tâm Đào tạo\nTrung tâm Đào tạo Sau đại học\nTrung tâm Giáo dục thể chất và Thể thao\nTrung tâm Công nghệ Ô tô và Đào tạo lái xe\nTrung tâm Công nghệ thông tin\nTrung tâm Việt Nhật\nTrung tâm Giáo dục Quốc phòng An ninh\nTrung tâm Dịch vụ\nTrung tâm Truyền thông & Quan hệ Công chúng\nTrạm Y tế\nTrung tâm Hỗ trợ Sinh viên\nTrung tâm Đảm bảo chất lượng\nTrung tâm Thông tin Thư viện\nTrung tâm khảo thí\nViện nghiên cứu\nCông ty Letco\nThư điện tử\nSitemap\nLiên hệ\nToggle navigation\nGIỚI THIỆU\nTHÔNG TIN CHUNG\nCƠ CẤU TỔ CHỨC\nCHIẾN LƯỢC PHÁT TRIỂN\nCÁN BỘ GIẢNG VIÊN\nCƠ SỞ VẬT CHẤT\nLIÊN HỆ\nĐÀO TẠO\nĐẠI HỌC\nKHOA HỌC MÁY TÍNH\nKỸ THUẬT PHẦN MỀM\nHỆ THỐNG THÔNG TIN\nCÔNG NGHỆ THÔNG TIN\nCÔNG NGHỆ ĐA PHƯƠNG TIỆN\nAN TOÀN THÔNG TIN\nSAU ĐẠI HỌC\nHỆ THỐNG THÔNG TIN\nKẾ HOẠCH\nTIẾN ĐỘ\nQUY CHẾ, BIỂU MẪU\nNGHIÊN CỨU KHOA HỌC\nCÔNG TRÌNH CÔNG BỐ\nĐỀ TÀI, DỰ ÁN\nSINH VIÊN NCKH\nTIN KHCN\nCÔNG TÁC SINH VIÊN\nQUY CHẾ\nGƯƠNG SÁNG SINH VIÊN\nHỌC BỔNG\nCÂU LẠC BỘ\nTHƯ VIỆN ẢNH\nTUYỂN DỤNG\nGƯƠNG SÁNG SINH VIÊN\nTRANG CHỦ > GƯƠNG SÁNG SINH VIÊN\nSinh viên Khoa Công nghệ thông tin Trường Đại học Công Nghiệp Hà Nội đạt học bổng sinh viên xuất sắc Chương trình SIC 2023-2024\nnext_contents:\n']","['Công trình công bố- KHOA CÔNG NGHỆ THÔNG TIN - ĐẠI HỌC CÔNG NGHIỆP HÀ NỘI || HaUI Trang HaUI Phòng Phòng Tổ chức hành chính Phòng Đào tạo Phòng Công tác sinh viên Phòng Khoa học công nghệ Phòng hợp tác đối ngoại Phòng Tài chính kế toán Phòng Quản trị Phòng Thanh tra Giáo dục Khoa Khoa Công nghệ Hoá Khoa Công nghệ may & TKTT Khoa Công nghệ thông tin Khoa Điện Khoa Điện tử Khoa Khoa học cơ bản Khoa Lý luận chính trị - Pháp luật Trung tâm Đào tạo Trung tâm Đào tạo Sau đại học Trung tâm Giáo dục thể chất và Thể thao Trung tâm Công nghệ Ô tô và Đào tạo lái xe Trung tâm Công nghệ thông tin Trung tâm Việt Nhật Trung tâm Giáo dục Quốc phòng An ninh Trung tâm Dịch vụ Trung tâm Truyền thông & Quan hệ Công chúng Trạm Y tế Trung tâm Hỗ trợ Sinh viên Trung tâm Đảm bảo chất lượng Trung tâm Thông tin Thư viện Trung tâm khảo thí Viện nghiên cứu Công ty Letco Thư điện tử Sitemap Liên hệ Toggle navigation GIỚI THIỆU THÔNG TIN CHUNG CƠ CẤU TỔ CHỨC CHIẾN LƯỢC PHÁT TRIỂN CÁN BỘ GIẢNG VIÊN CƠ SỞ VẬT CHẤT LIÊN HỆ ĐÀO TẠO ĐẠI HỌC KHOA HỌC MÁY TÍNH KỸ THUẬT PHẦN MỀM HỆ THỐNG THÔNG TIN CÔNG NGHỆ THÔNG TIN CÔNG NGHỆ ĐA PHƯƠNG TIỆN AN TOÀN THÔNG TIN SAU ĐẠI HỌC HỆ THỐNG THÔNG TIN KẾ HOẠCH TIẾN ĐỘ QUY CHẾ, BIỂU MẪU NGHIÊN CỨU KHOA HỌC CÔNG TRÌNH CÔNG BỐ ĐỀ TÀI, DỰ ÁN SINH VIÊN NCKH TIN KHCN CÔNG TÁC SINH VIÊN QUY CHẾ GƯƠNG SÁNG SINH VIÊN HỌC BỔNG CÂU LẠC BỘ']","Khoa Công nghệ thông tin tại Đại học Công nghiệp Hà Nội cung cấp các chương trình đào tạo đa dạng và có nhiều cơ hội nghề nghiệp cho sinh viên sau khi tốt nghiệp. Dưới đây là một số thông tin chi tiết:

### Chương trình đào tạo
Khoa có 4 chuyên ngành chính:
1. **Công nghệ thông tin**
2. **Khoa học máy tính**
3. **Hệ thống thông tin**
4. **Kỹ thuật phần mềm**

### Cơ hội nghề nghiệp
- **Nhu cầu nhân lực cao**: Ngành công nghệ thông tin đang phát triển mạnh mẽ với nhu cầu nhân lực rất cao. Sinh viên có năng lực tốt có thể được doanh nghiệp săn đón ngay khi còn học.
- **Việc làm sớm**: Sinh viên năm thứ 3 có học lực khá có thể tìm được việc làm và có thu nhập ngay trong năm học này.
- **Môi trường làm việc chuyên nghiệp**: Khoa chú trọng đào tạo sinh viên có tính kỷ luật và năng lực sáng tạo, giúp họ dễ dàng thích nghi với môi trường làm việc chuyên nghiệp.

### Khuyến nghị
- Sinh viên cần học tập chăm chỉ và phát triển kỹ năng nghề nghiệp để thành công trong lĩnh vực này.

Thông tin này cho thấy rằng Khoa Công nghệ thông tin tại Đại học Công nghiệp Hà Nội không chỉ cung cấp kiến thức mà còn tạo điều kiện cho sinh viên tiếp cận thực tế và phát triển nghề nghiệp ngay từ khi còn học.

[Link tham khảo](https://fit.haui.edu.vn/vn/tin-tuc/tu-van-tuyen-sinh-truc-tuyen-nhom-nganh-cong-nghe-thong-tin-nam-2022/70615)","Thông tin chi tiết về chương trình đào tạo và cơ hội nghề nghiệp của Khoa Công nghệ thông tin tại Đại học Công nghiệp Hà Nội không được cung cấp trong ngữ cảnh. Tuy nhiên, sinh viên có thể tìm hiểu thêm thông qua các phòng ban như Phòng Đào tạo và Phòng Công tác sinh viên để có thông tin cụ thể hơn.",0.9999999999,0.0,0.9333333333333333,0.8773221599380773,0.9489415743208223,0.5271768569946289,8.064497947692871
13,Nguyễn Mạnh Cường là ai?,[],"['THƯ VIỆN ẢNH TUYỂN DỤNG CÔNG TRÌNH CÔNG BỐ TRANG CHỦ > CÔNG TRÌNH CÔNG BỐ Báo cáo khoa học Thứ Bảy, 15:42 11/12/2021 Xem thêm Bài báo khoa học Thứ Sáu, 15:52 10/12/2021 Xem thêm Một tiếp cận trong phát hiện và nhận dạng mặt người dưới sự trợ giúp của camera Thứ Năm, 09:12 04/04/2019 Bài báo này đề xuất một kỹ thuật phát hiện mặt người dựa theo nguyên lý phát hiện đối tượng chuyển động dưới sự trợ giúp của camera và kỹ thuật nhận dạng mặt người. trên cơ sở đó áp dụng các kỹ thuật nhận dạng mặt người dựa theo kỹ thuật phân tích thành phần chính Pca nhằm áp dụng vào các hệ thống giám sát có sử dụng camera. Xem thêm An Algorithm to Partition the field of View camera in automatic Surveillance system Thứ Hai, 09:11 01/04/2019 Ngô Đức Vĩnh, Đỗ Năng Toàn Xem thêm Một kỹ thuật chiếu sáng trong trưng bày ảo dựa và light map Thứ Hai, 08:45 01/04/2019 Đỗ Văn Thiện, Trịnh Hiền Anh, Đỗ Năng Toàn, Trịnh Xuân Hùng, Ngô Đức Vĩnh, Nghiêm Văn Hưng Xem thêm A Method for Reducing the Number of Support Vectors in Fuzzy Support Vector Machine Thứ Sáu, 11:24 27/04/2018 Nguyễn Mạnh Cường, Nguyễn Văn Thiện Xem thêm An Algorithm to Improve Accuracy of Indoor Positioning Thứ Sáu, 11:21 27/04/2018 Ngô Văn Bình, Vương Quang Phương, Đinh Quang Thụ, Hoàng Đỗ Thanh Tùng Xem thêm Một kỹ thuật phát hiện bóng đối tượng kết hợp yếu tố thời gian Thứ Sáu, 11:18 27/04/2018 Đỗ Năng Toàn, Trịnh Hiền Anh, Hà Mạnh Toàn, Ngô Đức Vĩnh, Đặng Vũ Tuấn Xem thêm Anomaly Detection in Video Surveillance: A Novel Approach Based on SubTrajectory Thứ Sáu, 11:17 27/04/2018 Duc Vinh Ngo, Nang Toan Do, Luong Anh Tuan Nguyen Xem thêm Một lược đồ thủy vân thuận nghịch khóa công khai cho cơ sở dữ liệu dựa trên kỹ thuật mở rộng các thuộc tính kiểu thực Thứ Sáu, 11:08 27/04/2018 Đỗ Văn Tuấn Xem thêm 1 2 » Tin tiêu điểm Sinh viên Khóa 19 Khoa Công nghệ thông tin đạt Học bổng HaUI 100% toàn khóa học. Thứ Sáu, 11:07 20/09/2024 Đội bóng khoa Công nghệ thông tin cùng những trận cầu đáng nhớ Thứ Bảy, 10:00 23/07/2022 Đại hội đại biểu Liên chi Đoàn khoa Công nghệ thông tin lần thứ X, nhiệm kỳ 2022 - 2024 Thứ Hai, 15:00 18/04/2022 Gặp mặt tân Sinh viên K15 khoa Công nghệ thông tin Thứ Tư, 08:17 28/10/2020 Chương trình thực tập tại SVMC ""SVMC Internship Program 2020"" Thứ Sáu, 14:02 22/05/2020 Lịch giảng dạy môn Pháp Luật tuần từ 20/4 đến 26/4/2020 Hệ Cao đẳng khóa 21 Thứ Sáu, 15:05 17/04/2020 Danh sách các lớp học trực tuyến từ ngày 06/4/2020 đến ngày 19/4/2020 Thứ Bảy, 12:42 04/04/2020 Danh sách các lớp học trực tuyến từ ngày 30/3/2020 đến ngày 5/4/2020 Thứ Bảy, 14:46 28/03/2020 Kế hoạch tổ chức hoạt động dạy học tuần từ 23/03/2020 đến 05/04/2020 khoa CNTT Thứ Hai, 09:03 23/03/2020 Đội HaUI.NotTrashCar đạt giải nhì vòng sơ loại, giành quyền bước vào vòng bán kết cuộc đua số khu vực miền Bắc năm 2020 Thứ Sáu, 08:02 06/03/2020 Bản đồ chỉ dẫn Trường Đại học Công nghiệp Hà Nội Trụ sở chính Số 298 đường Cầu Diễn, quận Bắc Từ Liêm, Hà Nội +84 243 765 5121 Email: dhcnhn@haui.edu.vn Các cơ sở khác Cơ sở 2: Phường Tây Tựu, quận Bắc Từ Liêm, Hà Nội Cơ sở 3: Phường Lê Hồng Phong, thành phố Phủ Lý, Hà Nam Liên kết site Trường Đại học Công nghiệp Hà Nội Thông tin tuyển sinh Hành chính điện tử Đào tạo trực tuyến Cổng thông tin đào tạo Copyright © 2018 Hanoi University of Industry.']",Tôi không có thông tin này. Tôi khuyến nghị bạn tham khảo nguồn khác để biết thêm chi tiết.,"Nguyễn Mạnh Cường là một trong những tác giả của bài báo khoa học có tiêu đề 'A Method for Reducing the Number of Support Vectors in Fuzzy Support Vector Machine', được công bố vào ngày 27/04/2018.",0.0,0.0,0.5,0.0,0.7889997682569392,1.5636560916900635,2.2391998767852783
14,Công nghệ Internet of Things có vai trò gì trong nghiên cứu khoa học tại Đại học Công nghiệp Hà Nội?,"['content: Chủ Nhật, 14:52 05/09/2021\nNghiên cứu ứng dụng công nghệ Internet of Things xây dựng hệ thống nhà kính thông minh\nThứ Tư, 10:19 25/12/2019\nNghiệm thu đề tài Nghiên cứu khoa học sinh viên cấp trường năm 2019\nThứ Năm, 08:58 09/05/2019\nGiảng viên Đại học Công nghiệp Hà Nội công bố phương pháp xác định các Gene chỉ dấu ung thư từ dữ liệu mạng tín hiệu tế bào người.\nThứ Tư, 10:41 27/02/2019\nNghiệm thu đề tài nghiên cứu khoa học cấp trường\nThứ Năm, 09:13 19/07/2018\nBản đồ chỉ dẫn\nTrường Đại học Công nghiệp Hà Nội\nTrụ sở chính\nSố 298 đường Cầu Diễn, quận Bắc Từ Liêm, Hà Nội\n+84 243 765 5121\nEmail: dhcnhn@haui.edu.vn\nCác cơ sở khác\nCơ sở 2: Phường Tây Tựu, quận Bắc Từ Liêm, Hà Nội\nCơ sở 3: Phường Lê Hồng Phong, thành phố Phủ Lý, Hà Nam\nLiên kết site\nTrường Đại học Công nghiệp Hà Nội\nThông tin tuyển sinh\nHành chính điện tử\nĐào tạo trực tuyến\nCổng thông tin đào tạo\nCopyright © 2018 Hanoi University of Industry.\nnext_contents:\n- Thứ Năm, 14:06 23/12/2021\nTags:\nTweet\nCác bài đã đăng\n» 61 công trình khoa học Khoa CNTT được khen thưởng tại lễ trao giải sinh viên nghiên cứu khoa học năm học 2023-2024 (27/06/2024)\n» Sinh viên Khoa Công nghệ thông tin đạt giải cao Nghiên cứu Khoa học cấp Trường năm 2021 (05/09/2021)\n» Nghiên cứu ứng dụng công nghệ Internet of Things xây dựng hệ thống nhà kính thông minh (25/12/2019)\n» Nghiệm thu đề tài Nghiên cứu khoa học sinh viên cấp trường năm 2019 (09/05/2019)\n» Giảng viên Đại học Công nghiệp Hà Nội công bố phương pháp xác định các Gene chỉ dấu ung thư từ dữ liệu mạng tín hiệu tế bào người. (27/02/2019)\n» Nghiệm thu đề tài nghiên cứu khoa học cấp trường (19/07/2018)\nTin tiêu điểm\nSinh viên Khóa 19 Khoa Công nghệ thông tin đạt Học bổng HaUI 100% toàn khóa học.\nThứ Sáu, 11:07 20/09/2024\nĐội bóng khoa Công nghệ thông tin cùng những trận cầu đáng nhớ\nThứ Bảy, 10:00 23/07/2022\nĐại hội đại biểu Liên chi Đoàn khoa Công nghệ thông tin lần thứ X, nhiệm kỳ 2022 - 2024\nThứ Hai, 15:00 18/04/2022\nGặp mặt tân Sinh viên K15 khoa Công nghệ thông tin\nThứ Tư, 08:17 28/10/2020\nChương trình thực tập tại SVMC ""SVMC Internship Program 2020""\nThứ Sáu, 14:02 22/05/2020\nCác bài đã đăng\n61 công trình khoa học Khoa CNTT được khen thưởng tại lễ trao giải sinh viên nghiên cứu khoa học năm học 2023-2024\nThứ Năm, 13:41 27/06/2024\nSinh viên Khoa Công nghệ thông tin đạt giải cao Nghiên cứu Khoa học cấp Trường năm 2021\nChủ Nhật, 14:52 05/09/2021\nNghiên cứu ứng dụng công nghệ Internet of Things xây dựng hệ thống nhà kính thông minh\nThứ Tư, 10:19 25/12/2019\nNghiệm thu đề tài Nghiên cứu khoa học sinh viên cấp trường năm 2019\nThứ Năm, 08:58 09/05/2019\n', 'content: Chủ Nhật, 14:52 05/09/2021\nNghiên cứu ứng dụng công nghệ Internet of Things xây dựng hệ thống nhà kính thông minh\nThứ Tư, 10:19 25/12/2019\nNghiệm thu đề tài Nghiên cứu khoa học sinh viên cấp trường năm 2019\nThứ Năm, 08:58 09/05/2019\nGiảng viên Đại học Công nghiệp Hà Nội công bố phương pháp xác định các Gene chỉ dấu ung thư từ dữ liệu mạng tín hiệu tế bào người.\nThứ Tư, 10:41 27/02/2019\nNghiệm thu đề tài nghiên cứu khoa học cấp trường\nThứ Năm, 09:13 19/07/2018\nBản đồ chỉ dẫn\nTrường Đại học Công nghiệp Hà Nội\nTrụ sở chính\nSố 298 đường Cầu Diễn, quận Bắc Từ Liêm, Hà Nội\n+84 243 765 5121\nEmail: dhcnhn@haui.edu.vn\nCác cơ sở khác\nCơ sở 2: Phường Tây Tựu, quận Bắc Từ Liêm, Hà Nội\nCơ sở 3: Phường Lê Hồng Phong, thành phố Phủ Lý, Hà Nam\nLiên kết site\nTrường Đại học Công nghiệp Hà Nội\nThông tin tuyển sinh\nHành chính điện tử\nĐào tạo trực tuyến\nCổng thông tin đào tạo\nCopyright © 2018 Hanoi University of Industry.\nnext_contents:\n- Thứ Năm, 14:06 23/12/2021\nTags:\nTweet\nCác bài đã đăng\n» 61 công trình khoa học Khoa CNTT được khen thưởng tại lễ trao giải sinh viên nghiên cứu khoa học năm học 2023-2024 (27/06/2024)\n» Sinh viên Khoa Công nghệ thông tin đạt giải cao Nghiên cứu Khoa học cấp Trường năm 2021 (05/09/2021)\n» Nghiên cứu ứng dụng công nghệ Internet of Things xây dựng hệ thống nhà kính thông minh (25/12/2019)\n» Nghiệm thu đề tài Nghiên cứu khoa học sinh viên cấp trường năm 2019 (09/05/2019)\n» Giảng viên Đại học Công nghiệp Hà Nội công bố phương pháp xác định các Gene chỉ dấu ung thư từ dữ liệu mạng tín hiệu tế bào người. (27/02/2019)\n» Nghiệm thu đề tài nghiên cứu khoa học cấp trường (19/07/2018)\nTin tiêu điểm\nSinh viên Khóa 19 Khoa Công nghệ thông tin đạt Học bổng HaUI 100% toàn khóa học.\nThứ Sáu, 11:07 20/09/2024\nĐội bóng khoa Công nghệ thông tin cùng những trận cầu đáng nhớ\nThứ Bảy, 10:00 23/07/2022\nĐại hội đại biểu Liên chi Đoàn khoa Công nghệ thông tin lần thứ X, nhiệm kỳ 2022 - 2024\nThứ Hai, 15:00 18/04/2022\nGặp mặt tân Sinh viên K15 khoa Công nghệ thông tin\nThứ Tư, 08:17 28/10/2020\nChương trình thực tập tại SVMC ""SVMC Internship Program 2020""\nThứ Sáu, 14:02 22/05/2020\nCác bài đã đăng\n61 công trình khoa học Khoa CNTT được khen thưởng tại lễ trao giải sinh viên nghiên cứu khoa học năm học 2023-2024\nThứ Năm, 13:41 27/06/2024\nSinh viên Khoa Công nghệ thông tin đạt giải cao Nghiên cứu Khoa học cấp Trường năm 2021\nChủ Nhật, 14:52 05/09/2021\nNghiên cứu ứng dụng công nghệ Internet of Things xây dựng hệ thống nhà kính thông minh\nThứ Tư, 10:19 25/12/2019\nNghiệm thu đề tài Nghiên cứu khoa học sinh viên cấp trường năm 2019\nThứ Năm, 08:58 09/05/2019\n', 'content: Nghiên cứu ứng dụng công nghệ Internet of Things xây dựng hệ thống nhà kính thông minh\nTrang HaUI\nPhòng\nPhòng Tổ chức hành chính\nPhòng Đào tạo\nPhòng Công tác sinh viên\nPhòng Khoa học công nghệ\nPhòng hợp tác đối ngoại\nPhòng Tài chính kế toán\nPhòng Quản trị\nPhòng Thanh tra Giáo dục\nKhoa\nKhoa Công nghệ Hoá\nKhoa Công nghệ may & TKTT\nKhoa Công nghệ thông tin\nKhoa Điện\nKhoa Điện tử\nKhoa Khoa học cơ bản\nKhoa Lý luận chính trị - Pháp luật\nTrung tâm Đào tạo\nTrung tâm Đào tạo Sau đại học\nTrung tâm Giáo dục thể chất và Thể thao\nTrung tâm Công nghệ Ô tô và Đào tạo lái xe\nTrung tâm Công nghệ thông tin\nTrung tâm Việt Nhật\nTrung tâm Giáo dục Quốc phòng An ninh\nTrung tâm Dịch vụ\nTrung tâm Truyền thông & Quan hệ Công chúng\nTrạm Y tế\nTrung tâm Hỗ trợ Sinh viên\nTrung tâm Đảm bảo chất lượng\nTrung tâm Thông tin Thư viện\nTrung tâm khảo thí\nViện nghiên cứu\nCông ty Letco\nThư điện tử\nSitemap\nLiên hệ\nToggle navigation\nGIỚI THIỆU\nTHÔNG TIN CHUNG\nCƠ CẤU TỔ CHỨC\nCHIẾN LƯỢC PHÁT TRIỂN\nCÁN BỘ GIẢNG VIÊN\nCƠ SỞ VẬT CHẤT\nLIÊN HỆ\nĐÀO TẠO\nĐẠI HỌC\nKHOA HỌC MÁY TÍNH\nKỸ THUẬT PHẦN MỀM\nHỆ THỐNG THÔNG TIN\nCÔNG NGHỆ THÔNG TIN\nCÔNG NGHỆ ĐA PHƯƠNG TIỆN\nAN TOÀN THÔNG TIN\nSAU ĐẠI HỌC\nHỆ THỐNG THÔNG TIN\nKẾ HOẠCH\nTIẾN ĐỘ\nQUY CHẾ, BIỂU MẪU\nNGHIÊN CỨU KHOA HỌC\nCÔNG TRÌNH CÔNG BỐ\nĐỀ TÀI, DỰ ÁN\nSINH VIÊN NCKH\nTIN KHCN\nCÔNG TÁC SINH VIÊN\nQUY CHẾ\nGƯƠNG SÁNG SINH VIÊN\nHỌC BỔNG\nCÂU LẠC BỘ\nTHƯ VIỆN ẢNH\nTUYỂN DỤNG\nTIN KHCN\nTRANG CHỦ > TIN KHCN\nNghiên cứu ứng dụng công nghệ Internet of Things xây dựng hệ thống nhà kính thông minh\nnext_contents:\n', 'content: Nghiên cứu ứng dụng công nghệ Internet of Things xây dựng hệ thống nhà kính thông minh\nTrang HaUI\nPhòng\nPhòng Tổ chức hành chính\nPhòng Đào tạo\nPhòng Công tác sinh viên\nPhòng Khoa học công nghệ\nPhòng hợp tác đối ngoại\nPhòng Tài chính kế toán\nPhòng Quản trị\nPhòng Thanh tra Giáo dục\nKhoa\nKhoa Công nghệ Hoá\nKhoa Công nghệ may & TKTT\nKhoa Công nghệ thông tin\nKhoa Điện\nKhoa Điện tử\nKhoa Khoa học cơ bản\nKhoa Lý luận chính trị - Pháp luật\nTrung tâm Đào tạo\nTrung tâm Đào tạo Sau đại học\nTrung tâm Giáo dục thể chất và Thể thao\nTrung tâm Công nghệ Ô tô và Đào tạo lái xe\nTrung tâm Công nghệ thông tin\nTrung tâm Việt Nhật\nTrung tâm Giáo dục Quốc phòng An ninh\nTrung tâm Dịch vụ\nTrung tâm Truyền thông & Quan hệ Công chúng\nTrạm Y tế\nTrung tâm Hỗ trợ Sinh viên\nTrung tâm Đảm bảo chất lượng\nTrung tâm Thông tin Thư viện\nTrung tâm khảo thí\nViện nghiên cứu\nCông ty Letco\nThư điện tử\nSitemap\nLiên hệ\nToggle navigation\nGIỚI THIỆU\nTHÔNG TIN CHUNG\nCƠ CẤU TỔ CHỨC\nCHIẾN LƯỢC PHÁT TRIỂN\nCÁN BỘ GIẢNG VIÊN\nCƠ SỞ VẬT CHẤT\nLIÊN HỆ\nĐÀO TẠO\nĐẠI HỌC\nKHOA HỌC MÁY TÍNH\nKỸ THUẬT PHẦN MỀM\nHỆ THỐNG THÔNG TIN\nCÔNG NGHỆ THÔNG TIN\nCÔNG NGHỆ ĐA PHƯƠNG TIỆN\nAN TOÀN THÔNG TIN\nSAU ĐẠI HỌC\nHỆ THỐNG THÔNG TIN\nKẾ HOẠCH\nTIẾN ĐỘ\nQUY CHẾ, BIỂU MẪU\nNGHIÊN CỨU KHOA HỌC\nCÔNG TRÌNH CÔNG BỐ\nĐỀ TÀI, DỰ ÁN\nSINH VIÊN NCKH\nTIN KHCN\nCÔNG TÁC SINH VIÊN\nQUY CHẾ\nGƯƠNG SÁNG SINH VIÊN\nHỌC BỔNG\nCÂU LẠC BỘ\nTHƯ VIỆN ẢNH\nTUYỂN DỤNG\nTIN KHCN\nTRANG CHỦ > TIN KHCN\nNghiên cứu ứng dụng công nghệ Internet of Things xây dựng hệ thống nhà kính thông minh\nnext_contents:\n']","['TIN KHCN CÔNG TÁC SINH VIÊN QUY CHẾ GƯƠNG SÁNG SINH VIÊN HỌC BỔNG CÂU LẠC BỘ THƯ VIỆN ẢNH TUYỂN DỤNG TIN KHCN TRANG CHỦ > TIN KHCN 61 công trình khoa học Khoa CNTT được khen thưởng tại lễ trao giải sinh viên nghiên cứu khoa học năm học 2023-2024 Thứ Năm, 13:41 27/06/2024 Xem thêm Sinh viên Khoa Công nghệ thông tin đạt giải cao tại hội nghị tổng kết và trao giải SV NCKH lần thứ XII Thứ Năm, 14:06 23/12/2021 Phát huy tinh thần sáng tạo nghiện cứu, nhiều đề tài của SV khoa CNTT năm 2021 được đánh giá có ý nghĩa khoa học và thực tiễn, được SV đầu tư nghiêm túc, chu đáo và có nội dung bám sát nhu cầu ứng dụng từ thực tế. Xem thêm Sinh viên Khoa Công nghệ thông tin đạt giải cao Nghiên cứu Khoa học cấp Trường năm 2021 Chủ Nhật, 14:52 05/09/2021 Trong tất cả các đề tài nghiên cứu khoa học, có 19 đề tài được đánh giá hoàn thành một cách xuất sắc với nhiều điểm mới và đột phá trong nghiên cứu. Xem thêm Nghiên cứu ứng dụng công nghệ Internet of Things xây dựng hệ thống nhà kính thông minh Thứ Tư, 10:19 25/12/2019 Đó chính là tên đề tài nghiên cứu khoa học của nhóm sinh viên khoa Công nghệ Thông tin, trường Đại học Công nghiệp Hà Nội đã đạt giải Ba - Giải thưởng “Sinh viên nghiên cứu khoa học năm 2019” do Bộ Giáo dục và Đào tạo phối hợp Bộ Khoa học và Công nghệ, Trung ương Đoàn TNCS Hồ Chí Minh, Liên hiệp các Hội KHKT Việt Nam tổ chức. Xem thêm Nghiệm thu đề tài Nghiên cứu khoa học sinh viên cấp trường năm 2019 Thứ Năm, 08:58 09/05/2019 Xem thêm Giảng viên Đại học Công nghiệp Hà Nội công bố phương pháp xác định các Gene chỉ dấu ung thư từ dữ liệu mạng tín hiệu tế bào người. Thứ Tư, 10:41 27/02/2019 Xem thêm Nghiệm thu đề tài nghiên cứu khoa học cấp trường Thứ Năm, 09:13 19/07/2018 Xem thêm Lễ tổng kết và trao giải Sinh viên Nghiên cứu khoa học lần thứ IX Thứ Hai, 16:10 28/05/2018 Xem thêm Hội thảo về lấy ý kiến chương trình khung ngành Khoa học máy tính và Hệ thống thông tin Thứ Tư, 08:18 24/01/2018 Xem thêm Ấn tượng lễ trao giải Sinh viên Nghiên cứu khoa học lần thứ VIII Thứ Ba, 08:51 23/05/2017 Xem thêm 1 2 » Tin tiêu điểm Sinh viên Khóa 19 Khoa Công nghệ thông tin đạt Học bổng HaUI 100% toàn khóa học. Thứ Sáu, 11:07 20/09/2024 Đội bóng khoa Công nghệ thông tin cùng những trận cầu đáng nhớ Thứ Bảy, 10:00 23/07/2022 Đại hội đại biểu Liên chi Đoàn khoa Công nghệ thông tin lần thứ X, nhiệm kỳ 2022 - 2024 Thứ Hai, 15:00 18/04/2022 Gặp mặt tân Sinh viên K15 khoa Công nghệ thông tin Thứ Tư, 08:17 28/10/2020 Chương trình thực tập tại SVMC ""SVMC Internship Program 2020"" Thứ Sáu, 14:02 22/05/2020 Lịch giảng dạy môn Pháp Luật tuần từ 20/4 đến 26/4/2020 Hệ Cao đẳng khóa 21 Thứ Sáu, 15:05 17/04/2020 Danh sách các lớp học trực tuyến từ ngày 06/4/2020 đến ngày 19/4/2020 Thứ Bảy, 12:42 04/04/2020 Danh sách các lớp học trực tuyến từ ngày 30/3/2020 đến ngày 5/4/2020 Thứ Bảy, 14:46 28/03/2020 Kế hoạch tổ chức hoạt động dạy học tuần từ 23/03/2020 đến 05/04/2020 khoa CNTT Thứ Hai, 09:03 23/03/2020 Đội HaUI.NotTrashCar đạt giải nhì vòng sơ loại, giành quyền bước vào vòng bán kết cuộc đua số khu vực miền Bắc năm 2020 Thứ Sáu, 08:02 06/03/2020 Bản đồ chỉ dẫn Trường Đại học Công nghiệp Hà Nội Trụ sở chính Số 298 đường Cầu Diễn, quận Bắc Từ Liêm, Hà Nội +84 243 765 5121 Email: dhcnhn@haui.edu.vn Các cơ sở khác Cơ sở 2: Phường Tây Tựu, quận Bắc Từ Liêm, Hà Nội Cơ sở 3: Phường Lê Hồng Phong, thành phố Phủ Lý, Hà Nam Liên kết site Trường Đại học Công nghiệp Hà Nội Thông tin tuyển sinh Hành chính điện tử Đào tạo trực tuyến Cổng thông tin đào tạo Copyright © 2018 Hanoi University of Industry.']","Công nghệ Internet of Things (IoT) đóng vai trò quan trọng trong nghiên cứu khoa học tại Đại học Công nghiệp Hà Nội, đặc biệt trong việc phát triển các ứng dụng thực tiễn. Một ví dụ tiêu biểu là nghiên cứu ứng dụng công nghệ IoT để xây dựng hệ thống nhà kính thông minh. Hệ thống này giúp tối ưu hóa quy trình sản xuất nông nghiệp, nâng cao hiệu quả và giảm thiểu chi phí.

Ngoài ra, các nghiên cứu khác liên quan đến IoT cũng được thực hiện, như việc xác định các gene chỉ dấu ung thư từ dữ liệu mạng tín hiệu tế bào người, cho thấy sự đa dạng trong ứng dụng của công nghệ này trong các lĩnh vực khác nhau.

Những nghiên cứu này không chỉ góp phần nâng cao chất lượng đào tạo mà còn thúc đẩy sự phát triển khoa học công nghệ tại trường.

Bạn có thể tham khảo thêm thông tin chi tiết qua các liên kết sau:
- [Nghiên cứu ứng dụng công nghệ Internet of Things xây dựng hệ thống nhà kính thông minh](https://fit.haui.edu.vn/vn/tin-khcn/nghien-cuu-ung-dung-cong-nghe-internet-of-things-xay-dung-he-thong-nha-kinh-thong-minh/64297) - [**Link tham khảo**](https://fit.haui.edu.vn/vn/tin-khcn/nghien-cuu-ung-dung-cong-nghe-internet-of-things-xay-dung-he-thong-nha-kinh-thong-minh/64297).

Nếu bạn có thêm câu hỏi nào khác hoặc cần thông tin chi tiết hơn, hãy cho tôi biết!","Công nghệ Internet of Things đã được ứng dụng trong nghiên cứu khoa học tại Đại học Công nghiệp Hà Nội, với một đề tài nghiên cứu xây dựng hệ thống nhà kính thông minh đạt giải Ba trong Giải thưởng 'Sinh viên nghiên cứu khoa học năm 2019'.",0.999999999975,0.5,0.3076923076923077,0.9385129227804643,0.9388105682275136,1.0652790069580078,8.226115703582764
15,Chủ tịch Thành phố Hà Nội đã khen thưởng sinh viên Khoa Công nghệ thông tin vì lý do gì?,"['content: Sinh viên Khoa Công nghệ thông tin vinh dự đón nhận Bằng khen của Chủ tịch Thành phố Hà Nội vì đã có thành tích tại Kỳ thi Kỹ năng nghề Thành phố Hà Nội năm 2023\nTrang HaUI\nPhòng\nPhòng Tổ chức hành chính\nPhòng Đào tạo\nPhòng Công tác sinh viên\nPhòng Khoa học công nghệ\nPhòng hợp tác đối ngoại\nPhòng Tài chính kế toán\nPhòng Quản trị\nPhòng Thanh tra Giáo dục\nKhoa\nKhoa Công nghệ Hoá\nKhoa Công nghệ may & TKTT\nKhoa Công nghệ thông tin\nKhoa Điện\nKhoa Điện tử\nKhoa Khoa học cơ bản\nKhoa Lý luận chính trị - Pháp luật\nTrung tâm Đào tạo\nTrung tâm Đào tạo Sau đại học\nTrung tâm Giáo dục thể chất và Thể thao\nTrung tâm Công nghệ Ô tô và Đào tạo lái xe\nTrung tâm Công nghệ thông tin\nTrung tâm Việt Nhật\nTrung tâm Giáo dục Quốc phòng An ninh\nTrung tâm Dịch vụ\nTrung tâm Truyền thông & Quan hệ Công chúng\nTrạm Y tế\nTrung tâm Hỗ trợ Sinh viên\nTrung tâm Đảm bảo chất lượng\nTrung tâm Thông tin Thư viện\nTrung tâm khảo thí\nViện nghiên cứu\nCông ty Letco\nThư điện tử\nSitemap\nLiên hệ\nToggle navigation\nGIỚI THIỆU\nTHÔNG TIN CHUNG\nCƠ CẤU TỔ CHỨC\nCHIẾN LƯỢC PHÁT TRIỂN\nCÁN BỘ GIẢNG VIÊN\nCƠ SỞ VẬT CHẤT\nLIÊN HỆ\nĐÀO TẠO\nĐẠI HỌC\nKHOA HỌC MÁY TÍNH\nKỸ THUẬT PHẦN MỀM\nHỆ THỐNG THÔNG TIN\nCÔNG NGHỆ THÔNG TIN\nCÔNG NGHỆ ĐA PHƯƠNG TIỆN\nAN TOÀN THÔNG TIN\nSAU ĐẠI HỌC\nHỆ THỐNG THÔNG TIN\nKẾ HOẠCH\nTIẾN ĐỘ\nQUY CHẾ, BIỂU MẪU\nNGHIÊN CỨU KHOA HỌC\nCÔNG TRÌNH CÔNG BỐ\nĐỀ TÀI, DỰ ÁN\nSINH VIÊN NCKH\nTIN KHCN\nCÔNG TÁC SINH VIÊN\nQUY CHẾ\nGƯƠNG SÁNG SINH VIÊN\nHỌC BỔNG\nCÂU LẠC BỘ\nTHƯ VIỆN ẢNH\nTUYỂN DỤNG\nGƯƠNG SÁNG SINH VIÊN\nTRANG CHỦ > GƯƠNG SÁNG SINH VIÊN\nSinh viên Khoa Công nghệ thông tin vinh dự đón nhận Bằng khen của Chủ tịch Thành phố Hà Nội vì đã có thành tích tại Kỳ thi Kỹ năng nghề Thành phố Hà Nội năm 2023\nnext_contents:\n', 'content: Thứ Ba, 14:18 03/12/2024\nSinh viên Khoa Công nghệ thông tin đạt giải tại Cuộc thi “Sinh viên thông thái 2024”\nThứ Tư, 10:39 27/11/2024\nChi bộ Khoa Công nghệ thông tin tổ chức kết nạp Đảng viên cho 06 sinh viên xuất sắc\nThứ Sáu, 14:48 22/11/2024\nSinh viên Khoa Công nghệ thông tin vinh dự đón nhận Bằng khen của Chủ tịch Thành phố Hà Nội vì đã có thành tích tại Kỳ thi Kỹ năng nghề Thành phố Hà Nội năm 2023\nThứ Tư, 08:04 20/11/2024\nChàng trai ngành Công nghệ thông tin là tấm gương sáng cho sinh viên\nThứ Sáu, 14:11 15/11/2024\nBản đồ chỉ dẫn\nTrường Đại học Công nghiệp Hà Nội\nTrụ sở chính\nSố 298 đường Cầu Diễn, quận Bắc Từ Liêm, Hà Nội\n+84 243 765 5121\nEmail: dhcnhn@haui.edu.vn\nCác cơ sở khác\nCơ sở 2: Phường Tây Tựu, quận Bắc Từ Liêm, Hà Nội\nCơ sở 3: Phường Lê Hồng Phong, thành phố Phủ Lý, Hà Nam\nLiên kết site\nTrường Đại học Công nghiệp Hà Nội\nThông tin tuyển sinh\nHành chính điện tử\nĐào tạo trực tuyến\nCổng thông tin đào tạo\nCopyright © 2018 Hanoi University of Industry.\nnext_contents:\n- Thứ Hai, 11:48 09/12/2024\nTags:\nTweet\nCác bài đã đăng\n» Sinh viên Khoa Công nghệ thông tin ghi thành tích nổi bật tại Olympic Tin học sinh viên Việt Nam lần thứ 33 và Kỳ thi Lập trình ICPC ASIA Hà Nội năm 2024 (16/12/2024)\n» Sinh viên Khoa Công nghệ thông tin nhận học bổng BROTHER năm học 2024-2025 (03/12/2024)\n» Sinh viên Khoa Công nghệ thông tin đạt giải tại Cuộc thi “Sinh viên thông thái 2024” (27/11/2024)\n» Chi bộ Khoa Công nghệ thông tin tổ chức kết nạp Đảng viên cho 06 sinh viên xuất sắc (22/11/2024)\n» Sinh viên Khoa Công nghệ thông tin vinh dự đón nhận Bằng khen của Chủ tịch Thành phố Hà Nội vì đã có thành tích tại Kỳ thi Kỹ năng nghề Thành phố Hà Nội năm 2023 (20/11/2024)\n» Chàng trai ngành Công nghệ thông tin là tấm gương sáng cho sinh viên (15/11/2024)\nTin tiêu điểm\nSinh viên Khóa 19 Khoa Công nghệ thông tin đạt Học bổng HaUI 100% toàn khóa học.\nThứ Sáu, 11:07 20/09/2024\nĐội bóng khoa Công nghệ thông tin cùng những trận cầu đáng nhớ\nThứ Bảy, 10:00 23/07/2022\nĐại hội đại biểu Liên chi Đoàn khoa Công nghệ thông tin lần thứ X, nhiệm kỳ 2022 - 2024\nThứ Hai, 15:00 18/04/2022\nGặp mặt tân Sinh viên K15 khoa Công nghệ thông tin\nThứ Tư, 08:17 28/10/2020\nChương trình thực tập tại SVMC ""SVMC Internship Program 2020""\nThứ Sáu, 14:02 22/05/2020\nCác bài đã đăng\nSinh viên Khoa Công nghệ thông tin ghi thành tích nổi bật tại Olympic Tin học sinh viên Việt Nam lần thứ 33 và Kỳ thi Lập trình ICPC ASIA Hà Nội năm 2024\nThứ Hai, 11:30 16/12/2024\nSinh viên Khoa Công nghệ thông tin nhận học bổng BROTHER năm học 2024-2025\nThứ Ba, 14:18 03/12/2024\nSinh viên Khoa Công nghệ thông tin đạt giải tại Cuộc thi “Sinh viên thông thái 2024”\nThứ Tư, 10:39 27/11/2024\nChi bộ Khoa Công nghệ thông tin tổ chức kết nạp Đảng viên cho 06 sinh viên xuất sắc\nThứ Sáu, 14:48 22/11/2024\n', 'content: Thứ Sáu, 14:48 22/11/2024\nSinh viên Khoa Công nghệ thông tin vinh dự đón nhận Bằng khen của Chủ tịch Thành phố Hà Nội vì đã có thành tích tại Kỳ thi Kỹ năng nghề Thành phố Hà Nội năm 2023\nThứ Tư, 08:04 20/11/2024\nBản đồ chỉ dẫn\nTrường Đại học Công nghiệp Hà Nội\nTrụ sở chính\nSố 298 đường Cầu Diễn, quận Bắc Từ Liêm, Hà Nội\n+84 243 765 5121\nEmail: dhcnhn@haui.edu.vn\nCác cơ sở khác\nCơ sở 2: Phường Tây Tựu, quận Bắc Từ Liêm, Hà Nội\nCơ sở 3: Phường Lê Hồng Phong, thành phố Phủ Lý, Hà Nam\nLiên kết site\nTrường Đại học Công nghiệp Hà Nội\nThông tin tuyển sinh\nHành chính điện tử\nĐào tạo trực tuyến\nCổng thông tin đào tạo\nCopyright © 2018 Hanoi University of Industry.\nnext_contents:\n- Thứ Hai, 11:30 16/12/2024\nTags:\nTweet\nCác bài đã đăng\n» Sinh viên Khoa Công nghệ thông tin xuất sắc nhận học bổng của Doanh nghiệp Hàn Quốc năm 2024 (09/12/2024)\n» Sinh viên Khoa Công nghệ thông tin nhận học bổng BROTHER năm học 2024-2025 (03/12/2024)\n» Sinh viên Khoa Công nghệ thông tin đạt giải tại Cuộc thi “Sinh viên thông thái 2024” (27/11/2024)\n» Chi bộ Khoa Công nghệ thông tin tổ chức kết nạp Đảng viên cho 06 sinh viên xuất sắc (22/11/2024)\n» Sinh viên Khoa Công nghệ thông tin vinh dự đón nhận Bằng khen của Chủ tịch Thành phố Hà Nội vì đã có thành tích tại Kỳ thi Kỹ năng nghề Thành phố Hà Nội năm 2023 (20/11/2024)\nTin tiêu điểm\nSinh viên Khóa 19 Khoa Công nghệ thông tin đạt Học bổng HaUI 100% toàn khóa học.\nThứ Sáu, 11:07 20/09/2024\nĐội bóng khoa Công nghệ thông tin cùng những trận cầu đáng nhớ\nThứ Bảy, 10:00 23/07/2022\nĐại hội đại biểu Liên chi Đoàn khoa Công nghệ thông tin lần thứ X, nhiệm kỳ 2022 - 2024\nThứ Hai, 15:00 18/04/2022\nGặp mặt tân Sinh viên K15 khoa Công nghệ thông tin\nThứ Tư, 08:17 28/10/2020\nChương trình thực tập tại SVMC ""SVMC Internship Program 2020""\nThứ Sáu, 14:02 22/05/2020\nCác bài đã đăng\nSinh viên Khoa Công nghệ thông tin xuất sắc nhận học bổng của Doanh nghiệp Hàn Quốc năm 2024\nThứ Hai, 11:48 09/12/2024\nSinh viên Khoa Công nghệ thông tin nhận học bổng BROTHER năm học 2024-2025\nThứ Ba, 14:18 03/12/2024\nSinh viên Khoa Công nghệ thông tin đạt giải tại Cuộc thi “Sinh viên thông thái 2024”\nThứ Tư, 10:39 27/11/2024\nChi bộ Khoa Công nghệ thông tin tổ chức kết nạp Đảng viên cho 06 sinh viên xuất sắc\nThứ Sáu, 14:48 22/11/2024\nSinh viên Khoa Công nghệ thông tin vinh dự đón nhận Bằng khen của Chủ tịch Thành phố Hà Nội vì đã có thành tích tại Kỳ thi Kỹ năng nghề Thành phố Hà Nội năm 2023\nThứ Tư, 08:04 20/11/2024\n', 'content: Thứ Hai, 11:30 16/12/2024\nSinh viên Khoa Công nghệ thông tin xuất sắc nhận học bổng của Doanh nghiệp Hàn Quốc năm 2024\nThứ Hai, 11:48 09/12/2024\nSinh viên Khoa Công nghệ thông tin đạt giải tại Cuộc thi “Sinh viên thông thái 2024”\nThứ Tư, 10:39 27/11/2024\nChi bộ Khoa Công nghệ thông tin tổ chức kết nạp Đảng viên cho 06 sinh viên xuất sắc\nThứ Sáu, 14:48 22/11/2024\nSinh viên Khoa Công nghệ thông tin vinh dự đón nhận Bằng khen của Chủ tịch Thành phố Hà Nội vì đã có thành tích tại Kỳ thi Kỹ năng nghề Thành phố Hà Nội năm 2023\nThứ Tư, 08:04 20/11/2024\nChàng trai ngành Công nghệ thông tin là tấm gương sáng cho sinh viên\nThứ Sáu, 14:11 15/11/2024\nCựu sinh viên Khoa Công nghệ thông tin thành công từ niềm đam mê\nThứ Năm, 14:43 14/11/2024\nBản đồ chỉ dẫn\nTrường Đại học Công nghiệp Hà Nội\nTrụ sở chính\nSố 298 đường Cầu Diễn, quận Bắc Từ Liêm, Hà Nội\n+84 243 765 5121\nEmail: dhcnhn@haui.edu.vn\nCác cơ sở khác\nCơ sở 2: Phường Tây Tựu, quận Bắc Từ Liêm, Hà Nội\nCơ sở 3: Phường Lê Hồng Phong, thành phố Phủ Lý, Hà Nam\nLiên kết site\nTrường Đại học Công nghiệp Hà Nội\nThông tin tuyển sinh\nHành chính điện tử\nĐào tạo trực tuyến\nCổng thông tin đào tạo\nCopyright © 2018 Hanoi University of Industry.\nnext_contents:\n- Thứ Ba, 14:18 03/12/2024\nTags:\nTweet\nCác bài đã đăng\n» Sinh viên Khoa Công nghệ thông tin ghi thành tích nổi bật tại Olympic Tin học sinh viên Việt Nam lần thứ 33 và Kỳ thi Lập trình ICPC ASIA Hà Nội năm 2024 (16/12/2024)\n» Sinh viên Khoa Công nghệ thông tin xuất sắc nhận học bổng của Doanh nghiệp Hàn Quốc năm 2024 (09/12/2024)\n» Sinh viên Khoa Công nghệ thông tin đạt giải tại Cuộc thi “Sinh viên thông thái 2024” (27/11/2024)\n» Chi bộ Khoa Công nghệ thông tin tổ chức kết nạp Đảng viên cho 06 sinh viên xuất sắc (22/11/2024)\n» Sinh viên Khoa Công nghệ thông tin vinh dự đón nhận Bằng khen của Chủ tịch Thành phố Hà Nội vì đã có thành tích tại Kỳ thi Kỹ năng nghề Thành phố Hà Nội năm 2023 (20/11/2024)\n» Chàng trai ngành Công nghệ thông tin là tấm gương sáng cho sinh viên (15/11/2024)\n» Cựu sinh viên Khoa Công nghệ thông tin thành công từ niềm đam mê (14/11/2024)\nTin tiêu điểm\nSinh viên Khóa 19 Khoa Công nghệ thông tin đạt Học bổng HaUI 100% toàn khóa học.\nThứ Sáu, 11:07 20/09/2024\nĐội bóng khoa Công nghệ thông tin cùng những trận cầu đáng nhớ\nThứ Bảy, 10:00 23/07/2022\nĐại hội đại biểu Liên chi Đoàn khoa Công nghệ thông tin lần thứ X, nhiệm kỳ 2022 - 2024\nThứ Hai, 15:00 18/04/2022\nGặp mặt tân Sinh viên K15 khoa Công nghệ thông tin\nThứ Tư, 08:17 28/10/2020\nChương trình thực tập tại SVMC ""SVMC Internship Program 2020""\nThứ Sáu, 14:02 22/05/2020\nCác bài đã đăng\nSinh viên Khoa Công nghệ thông tin ghi thành tích nổi bật tại Olympic Tin học sinh viên Việt Nam lần thứ 33 và Kỳ thi Lập trình ICPC ASIA Hà Nội năm 2024\nThứ Hai, 11:30 16/12/2024\nSinh viên Khoa Công nghệ thông tin xuất sắc nhận học bổng của Doanh nghiệp Hàn Quốc năm 2024\nThứ Hai, 11:48 09/12/2024\nSinh viên Khoa Công nghệ thông tin đạt giải tại Cuộc thi “Sinh viên thông thái 2024”\nThứ Tư, 10:39 27/11/2024\n']","['THƯ VIỆN ẢNH TUYỂN DỤNG GƯƠNG SÁNG SINH VIÊN TRANG CHỦ > GƯƠNG SÁNG SINH VIÊN Sinh viên Khoa Công nghệ thông tin ghi thành tích nổi bật tại Olympic Tin học sinh viên Việt Nam lần thứ 33 và Kỳ thi Lập trình ICPC ASIA Hà Nội năm 2024 Thứ Hai, 11:30 16/12/2024 Xem thêm Sinh viên Khoa Công nghệ thông tin xuất sắc nhận học bổng của Doanh nghiệp Hàn Quốc năm 2024 Thứ Hai, 11:48 09/12/2024 Xem thêm Sinh viên Khoa Công nghệ thông tin nhận học bổng BROTHER năm học 2024-2025 Thứ Ba, 14:18 03/12/2024 Xem thêm Sinh viên Khoa Công nghệ thông tin đạt giải tại Cuộc thi “Sinh viên thông thái 2024” Thứ Tư, 10:39 27/11/2024 Xem thêm Chi bộ Khoa Công nghệ thông tin tổ chức kết nạp Đảng viên cho 06 sinh viên xuất sắc Thứ Sáu, 14:48 22/11/2024 Xem thêm Sinh viên Khoa Công nghệ thông tin vinh dự đón nhận Bằng khen của Chủ tịch Thành phố Hà Nội vì đã có thành tích tại Kỳ thi Kỹ năng nghề Thành phố Hà Nội năm 2023 Thứ Tư, 08:04 20/11/2024 Xem thêm Chàng trai ngành Công nghệ thông tin là tấm gương sáng cho sinh viên Thứ Sáu, 14:11 15/11/2024 Xem thêm Cựu sinh viên Khoa Công nghệ thông tin thành công từ niềm đam mê Thứ Năm, 14:43 14/11/2024 Xem thêm Sinh viên Khoa Công nghệ thông tin xuất sắc hoàn thành Khóa đào tạo Sỹ quan dự bị năm 2024 Thứ Tư, 11:40 13/11/2024 Xem thêm Sinh viên Khoa Công nghệ thông tin xuất sắc vượt qua vòng Qualifying Round Cuộc thi Lập trình LG Dream Code 2024 Thứ Tư, 15:21 06/11/2024 Xem thêm 1 2 » Tin tiêu điểm Sinh viên Khóa 19 Khoa Công nghệ thông tin đạt Học bổng HaUI 100% toàn khóa học. Thứ Sáu, 11:07 20/09/2024 Đội bóng khoa Công nghệ thông tin cùng những trận cầu đáng nhớ Thứ Bảy, 10:00 23/07/2022 Đại hội đại biểu Liên chi Đoàn khoa Công nghệ thông tin lần thứ X, nhiệm kỳ 2022 - 2024 Thứ Hai, 15:00 18/04/2022 Gặp mặt tân Sinh viên K15 khoa Công nghệ thông tin Thứ Tư, 08:17 28/10/2020 Chương trình thực tập tại SVMC ""SVMC Internship Program 2020"" Thứ Sáu, 14:02 22/05/2020 Lịch giảng dạy môn Pháp Luật tuần từ 20/4 đến 26/4/2020 Hệ Cao đẳng khóa 21 Thứ Sáu, 15:05 17/04/2020 Danh sách các lớp học trực tuyến từ ngày 06/4/2020 đến ngày 19/4/2020 Thứ Bảy, 12:42 04/04/2020 Danh sách các lớp học trực tuyến từ ngày 30/3/2020 đến ngày 5/4/2020 Thứ Bảy, 14:46 28/03/2020 Kế hoạch tổ chức hoạt động dạy học tuần từ 23/03/2020 đến 05/04/2020 khoa CNTT Thứ Hai, 09:03 23/03/2020 Đội HaUI.NotTrashCar đạt giải nhì vòng sơ loại, giành quyền bước vào vòng bán kết cuộc đua số khu vực miền Bắc năm 2020 Thứ Sáu, 08:02 06/03/2020 Bản đồ chỉ dẫn Trường Đại học Công nghiệp Hà Nội Trụ sở chính Số 298 đường Cầu Diễn, quận Bắc Từ Liêm, Hà Nội +84 243 765 5121 Email: dhcnhn@haui.edu.vn Các cơ sở khác Cơ sở 2: Phường Tây Tựu, quận Bắc Từ Liêm, Hà Nội Cơ sở 3: Phường Lê Hồng Phong, thành phố Phủ Lý, Hà Nam Liên kết site Trường Đại học Công nghiệp Hà Nội Thông tin tuyển sinh Hành chính điện tử Đào tạo trực tuyến Cổng thông tin đào tạo Copyright © 2018 Hanoi University of Industry.']","Chủ tịch Thành phố Hà Nội đã khen thưởng sinh viên Khoa Công nghệ thông tin vì đã có thành tích xuất sắc tại Kỳ thi Kỹ năng nghề Thành phố Hà Nội năm 2023. Đây là một sự ghi nhận cho những nỗ lực và thành công của sinh viên trong lĩnh vực nghề nghiệp.

Bạn có thể tham khảo thêm thông tin chi tiết qua liên kết sau: [Sinh viên Khoa Công nghệ thông tin vinh dự đón nhận Bằng khen của Chủ tịch Thành phố Hà Nội](https://fit.haui.edu.vn/vn/guong-sang/sinh-vien-khoa-cong-nghe-thong-tin-vinh-du-don-nhan-bang-khen-cua-chu-tich-thanh-pho-ha-noi-vi-da-co-thanh-tich-tai-ky-thi-ky-nang-nghe-thanh-pho-ha-noi-nam-2023/71156).

Nếu bạn có thêm câu hỏi nào khác, hãy cho tôi biết!",Sinh viên Khoa Công nghệ thông tin vinh dự đón nhận Bằng khen của Chủ tịch Thành phố Hà Nội vì đã có thành tích tại Kỳ thi Kỹ năng nghề Thành phố Hà Nội năm 2023.,0.999999999975,1.0,0.3333333333333333,0.89341589871184,0.9680222390817033,1.393345832824707,7.123544931411743
16,Nguyễn Thành Đạt đến từ đâu và có thành tích gì nổi bật?,"['content: Vừa bước chân vào giảng đường Đại học, chàng sinh viên Nguyễn Tiến Duy đã lọt và đội tuyển Tin học của Trường và ""ẵm” luôn giải giải Đặc biệt Top 4 NAPROCK PROCON Nhật Bản 2023 – Hạng mục Competition. Không chỉ vậy, cậu còn đạt được rất nhiều giải thưởng Olympic cao hàng năm.Thật khó để hình dung cậu sinh viên hiền lành, khiêm tốn này đã đạt giải trong kỳ thi Học sinh Giỏi Quốc gia từ khi học lớp 11. Cậu đã thể hiện năng khiếu với bộ môn Lập trình từ rất sớm và được tuyển chọn vào đội tuyển Tin học từ năm lớp 11 rồi ẵm ngay giải thưởng từ lần thi đầu tiên. Đến năm lớp 12, là thời điểm mà các bạn đều gấp rút ôn luyện cho kỳ thi tốt nghiệp hoặc tập trung ôn luyện trong các đội tuyển thì Duy lại tìm thấy niềm đam mê mới.Nhờ vào quyết định mạo hiểm của mình, Duy đã theo học ngành học yêu thích tại Khoa Công nghệ thông tin Trường Đại học Công Nghiệp Hà Nội. Duy chia sẻ rằng cậu từng cảm thấy đôi chút bỡ ngỡ khi mới bước vào Đại học. Nhưng dưới sự giúp đỡ của thầy cô, bạn bè, cậu đã trở nên hoà đồng, năng nổ hơn và đạt được thành tích cao vượt cả kỳ vọng của bản thân: Giải Nhất HIT Contest Series 2021, Giải Nhất phần thi thuật toán HIT Open Day 2021, Khuyến khích Olympic Tin học Sinh viên 2021 – Khối chuyên tin, Giải Ba PROCON Việt Nam 2021, Đồng Giải Ba ICPC Asia Hanoi 2021, Giải Nhất Olympic Tin học Cấp trường, Giải Nhất ICPC Cấp trường, Giải Ba ICPC Quốc gia 2022, Vô địch PROCON Việt Nam 2022, Giải Nhì Olympic Tin học Sinh viên 2022 – Khối chuyên tin, Khuyến khích ICPC Asia Ho Chi Minh City 2022, Top 9 Cuộc thi Tech Club Championship 2023, Giải đặc biệt – Top 4 NAPROCK PROCON Nhật Bản 2023 – Hạng mục Competition, Giải Ba ICPC Quốc gia 2023, Giải Nhất Cuộc thi sản phẩm công nghệ sáng tạo I-Start – IT Festival 2023, Giải Ba ICPC Asia Hue 2023 – Site VietnamHiện tại Duy đang làm Mobile Developer cho Công ty cổ phần giải pháp công nghệ và phần mềm Toprate và theo học thạc sỹ Hệ thống thông tin tại Trường Đại học Công Nghiệp Hà Nội. Chúc em thành công trên con đường đã\nnext_contents:\n- Nguyễn Tiến Duy - giải Đặc biệt Top 4 NAPROCK PROCON Nhật Bản 2023 – Hạng mục Competition và ước mơ trở thành Lập trình viên chất lượng cao.\nTrang HaUI\nPhòng\nPhòng Tổ chức hành chính\nPhòng Đào tạo\nPhòng Công tác sinh viên\nPhòng Khoa học công nghệ\nPhòng hợp tác đối ngoại\nPhòng Tài chính kế toán\nPhòng Quản trị\nPhòng Thanh tra Giáo dục\nKhoa\nKhoa Công nghệ Hoá\nKhoa Công nghệ may & TKTT\nKhoa Công nghệ thông tin\nKhoa Điện\nKhoa Điện tử\nKhoa Khoa học cơ bản\nKhoa Lý luận chính trị - Pháp luật\nTrung tâm Đào tạo\nTrung tâm Đào tạo Sau đại học\nTrung tâm Giáo dục thể chất và Thể thao\nTrung tâm Công nghệ Ô tô và Đào tạo lái xe\nTrung tâm Công nghệ thông tin\nTrung tâm Việt Nhật\nTrung tâm Giáo dục Quốc phòng An ninh\nTrung tâm Dịch vụ\nTrung tâm Truyền thông & Quan hệ Công chúng\nTrạm Y tế\nTrung tâm Hỗ trợ Sinh viên\nTrung tâm Đảm bảo chất lượng\nTrung tâm Thông tin Thư viện\nTrung tâm khảo thí\nViện nghiên cứu\nCông ty Letco\nThư điện tử\nSitemap\nLiên hệ\nToggle navigation\nGIỚI THIỆU\nTHÔNG TIN CHUNG\nCƠ CẤU TỔ CHỨC\nCHIẾN LƯỢC PHÁT TRIỂN\nCÁN BỘ GIẢNG VIÊN\nCƠ SỞ VẬT CHẤT\nLIÊN HỆ\nĐÀO TẠO\nĐẠI HỌC\nKHOA HỌC MÁY TÍNH\nKỸ THUẬT PHẦN MỀM\nHỆ THỐNG THÔNG TIN\nCÔNG NGHỆ THÔNG TIN\nCÔNG NGHỆ ĐA PHƯƠNG TIỆN\nAN TOÀN THÔNG TIN\nSAU ĐẠI HỌC\nHỆ THỐNG THÔNG TIN\nKẾ HOẠCH\nTIẾN ĐỘ\nQUY CHẾ, BIỂU MẪU\nNGHIÊN CỨU KHOA HỌC\nCÔNG TRÌNH CÔNG BỐ\nĐỀ TÀI, DỰ ÁN\nSINH VIÊN NCKH\nTIN KHCN\nCÔNG TÁC SINH VIÊN\nQUY CHẾ\nGƯƠNG SÁNG SINH VIÊN\nHỌC BỔNG\nCÂU LẠC BỘ\nTHƯ VIỆN ẢNH\nTUYỂN DỤNG\nGƯƠNG SÁNG SINH VIÊN\nTRANG CHỦ > GƯƠNG SÁNG SINH VIÊN\nNguyễn Tiến Duy - giải Đặc biệt Top 4 NAPROCK PROCON Nhật Bản 2023 – Hạng mục Competition và ước mơ trở thành Lập trình viên chất lượng cao.\n', 'content: Nguyễn Thị Lan (SN 2002) đến từ mảnh Đất Sóc Sơn, Hà Nội. Hiện tại là cựu sinh viên K15 ngành Công nghệ thông tin, Khoa Công nghệ thông tin, Trường Đại học Công Nghiệp Hà Nội. Không chỉ năng động, nhiệt huyết, cô gái trẻ còn được biết đến là một gương mặt tiêu biểu trong các hoạt động, phong trào của Đoàn Thanh niên – Hội Sinh viên Nhà trường.Ngay từ năm nhất, Lan đã tham gia nhiệt tình vào các hoạt động ở Khoa mình theo học. Sau một thời gian, cô bạn nhận thấy công tác Đoàn – Hội khiến cho bản thân năng động, học hỏi được nhiều điều, cô bạn đã quyết định tham gia các hoạt động Đoàn – Hội ở trường nhiều hơn. Lan chia sẻ: “Đây cũng là cơ duyên đến với em, khi mới bước chân vào Trường được hơn 5 tháng, em đã được các anh chị tin tưởng giữ chức vụ Ủy viên Ban Chấp hành Liên chi Đoàn Khoa Công nghệ thông tin. Và nếu không có cơ hội ấy, có lẽ sẽ không có em của bây giờ.”Từ những hoạt động có thể giao lưu, gặp gỡ với nhiều bạn bè và các anh, chị khóa trước. Đặc biệt, qua mỗi hoạt động lại có thêm những trải nghiệm thú vị, kỷ niệm đẹp và những bài học quý giá. “Hoạt động Đoàn – Hội đã giúp tôi từ một cô gái nhút nhát, “hướng nội” trở thành một người năng động, tích cực, hoạt bát. Không những thế, các phong trào của Đoàn – Hội còn giống như cái nôi để nuôi dưỡng đam mê, giúp tôi có cơ hội được gặp gỡ, giao lưu mở rộng các mối quan hệ và có thể giúp đỡ được nhiều người. Từ đó, giúp tôi được cống hiến, trưởng thành và hoàn thiện bản thân nhiều hơn”, Lan bộc bạch.Với sự năng động, nhiệt huyết, trách nhiệm trong công việc, Lan được tín nhiệm giữ chức vụ Đội trưởng đội Thanh niên tình nguyện Khoa CNTT. Mặc dù giữ nhiều vai trò, vị trí khác nhau nhưng Lan luôn sắp xếp thời gian hợp lý giữa học tập và tham gia các hoạt động, phong trào. Bằng sự nỗ lực và cống hiến hết mình, Lan đã được nhận nhiều khen thưởng các cấp như: Giấy khen của Hội sinh viên trường Đại học Công nghiệp Hà Nội “SINH VIÊN 5 TỐT” , Tham gia cuộc thi ""Bảo vệ biển đảo"" trường Đại học Công nghiệp Hà Nội, Huy\nnext_contents:\n- Nguyễn Thị Lan – Cán bộ Đoàn tiêu biểu trong các phong trào thanh niên, sinh viên của Khoa\nTrang HaUI\nPhòng\nPhòng Tổ chức hành chính\nPhòng Đào tạo\nPhòng Công tác sinh viên\nPhòng Khoa học công nghệ\nPhòng hợp tác đối ngoại\nPhòng Tài chính kế toán\nPhòng Quản trị\nPhòng Thanh tra Giáo dục\nKhoa\nKhoa Công nghệ Hoá\nKhoa Công nghệ may & TKTT\nKhoa Công nghệ thông tin\nKhoa Điện\nKhoa Điện tử\nKhoa Khoa học cơ bản\nKhoa Lý luận chính trị - Pháp luật\nTrung tâm Đào tạo\nTrung tâm Đào tạo Sau đại học\nTrung tâm Giáo dục thể chất và Thể thao\nTrung tâm Công nghệ Ô tô và Đào tạo lái xe\nTrung tâm Công nghệ thông tin\nTrung tâm Việt Nhật\nTrung tâm Giáo dục Quốc phòng An ninh\nTrung tâm Dịch vụ\nTrung tâm Truyền thông & Quan hệ Công chúng\nTrạm Y tế\nTrung tâm Hỗ trợ Sinh viên\nTrung tâm Đảm bảo chất lượng\nTrung tâm Thông tin Thư viện\nTrung tâm khảo thí\nViện nghiên cứu\nCông ty Letco\nThư điện tử\nSitemap\nLiên hệ\nToggle navigation\nGIỚI THIỆU\nTHÔNG TIN CHUNG\nCƠ CẤU TỔ CHỨC\nCHIẾN LƯỢC PHÁT TRIỂN\nCÁN BỘ GIẢNG VIÊN\nCƠ SỞ VẬT CHẤT\nLIÊN HỆ\nĐÀO TẠO\nĐẠI HỌC\nKHOA HỌC MÁY TÍNH\nKỸ THUẬT PHẦN MỀM\nHỆ THỐNG THÔNG TIN\nCÔNG NGHỆ THÔNG TIN\nCÔNG NGHỆ ĐA PHƯƠNG TIỆN\nAN TOÀN THÔNG TIN\nSAU ĐẠI HỌC\nHỆ THỐNG THÔNG TIN\nKẾ HOẠCH\nTIẾN ĐỘ\nQUY CHẾ, BIỂU MẪU\nNGHIÊN CỨU KHOA HỌC\nCÔNG TRÌNH CÔNG BỐ\nĐỀ TÀI, DỰ ÁN\nSINH VIÊN NCKH\nTIN KHCN\nCÔNG TÁC SINH VIÊN\nQUY CHẾ\nGƯƠNG SÁNG SINH VIÊN\nHỌC BỔNG\nCÂU LẠC BỘ\nTHƯ VIỆN ẢNH\nTUYỂN DỤNG\nGƯƠNG SÁNG SINH VIÊN\nTRANG CHỦ > GƯƠNG SÁNG SINH VIÊN\nNguyễn Thị Lan – Cán bộ Đoàn tiêu biểu trong các phong trào thanh niên, sinh viên của Khoa\n', 'content: Sau những năm tháng miệt mài học tập, trau dồi kiến thức, kỹ năng tại Trường Đại học Công Nghiệp Hà Nội, các thế hệ sinh viên của Khoa Công nghệ thông tin ngày một trưởng thành và từng bước khẳng định được năng lực của mình ở các vị trí công tác. Trong số đó, có nhiều sinh viên thành đạt và tạo dựng được cho mình những vị trí quan trọng trong các doanh nghiệp, tập đoàn lớn, các em luôn mang trong mình sự nhiệt huyết, tinh thần nỗ lực hết mình vì công việc. Tinh thần ấy không chỉ có được do sự rèn luyện của bản thân mà còn có được sự “truyền lửa” từ các thầy, cô khi học tập trên giảng đường. Không ít những tấm gương cựu sinh viên Khoa Công nghệ thông tin đã khẳng định được bản thân và thành công trong công việc. Các em chính là niềm tự hào, là tấm gương sáng tiếp lửa cho các thế hệ sinh viên tiếp theo của nhà trường noi theo. Trong số đó có thể kể đến cựu sinh viên Phạm Văn Cương, hiện đang là Web developer – Software tại Công ty CPĐT và Công nghệ BAP.8/2022: Giải nhất HIT Product về phát triển công nghệ phần mềm11/2022: Giải nhất I-Product về phát triển ứng dụng phần mềm trong khuôn khổ cuộc thi IT-Festival2023: Giải khuyến khích Sinh viên nghiên cứu khoa học Phạm Văn Cương chia sẻ, từ ngày còn đi học mình đã có sở thích tìm hiểu về máy tính, mình luôn theo dõi các hệ thống và phần mềm của Việt Nam và thế giới, mình vô cùng thích thú và từ đó đã quyết định đi theo hướng trở thành một kỹ sư IT với ước mơ tạo ra các sản phẩm có tính ứng dụng cao trong cuộc sống. Vì vậy, ngay khi bước vào ngưỡng cửa Đại học, mình đã quyết định đăng ký và trúng tuyển vào Khoa Công nghệ thông tin, Trường Đại học Công Nghiệp Hà Nội. Học đúng ngành mình yêu thích, đúng sở trường và khả năng của mình kết hợp với sự nỗ lực của bản thân, Cương luôn đạt kết quả cao trong học tập. Với tư duy “chú trọng học lý thuyết, nâng cao năng lực thực hành”, Cương luôn xác định máy tính là người bạn đồng hành với mình, vì vậy luôn cần mẫn trong các giờ học thực hành trên phòng máy, và tìm hiểu thêm kiến\nnext_contents:\n- Cựu sinh viên Khoa Công nghệ thông tin thành công từ niềm đam mê\nTrang HaUI\nPhòng\nPhòng Tổ chức hành chính\nPhòng Đào tạo\nPhòng Công tác sinh viên\nPhòng Khoa học công nghệ\nPhòng hợp tác đối ngoại\nPhòng Tài chính kế toán\nPhòng Quản trị\nPhòng Thanh tra Giáo dục\nKhoa\nKhoa Công nghệ Hoá\nKhoa Công nghệ may & TKTT\nKhoa Công nghệ thông tin\nKhoa Điện\nKhoa Điện tử\nKhoa Khoa học cơ bản\nKhoa Lý luận chính trị - Pháp luật\nTrung tâm Đào tạo\nTrung tâm Đào tạo Sau đại học\nTrung tâm Giáo dục thể chất và Thể thao\nTrung tâm Công nghệ Ô tô và Đào tạo lái xe\nTrung tâm Công nghệ thông tin\nTrung tâm Việt Nhật\nTrung tâm Giáo dục Quốc phòng An ninh\nTrung tâm Dịch vụ\nTrung tâm Truyền thông & Quan hệ Công chúng\nTrạm Y tế\nTrung tâm Hỗ trợ Sinh viên\nTrung tâm Đảm bảo chất lượng\nTrung tâm Thông tin Thư viện\nTrung tâm khảo thí\nViện nghiên cứu\nCông ty Letco\nThư điện tử\nSitemap\nLiên hệ\nToggle navigation\nGIỚI THIỆU\nTHÔNG TIN CHUNG\nCƠ CẤU TỔ CHỨC\nCHIẾN LƯỢC PHÁT TRIỂN\nCÁN BỘ GIẢNG VIÊN\nCƠ SỞ VẬT CHẤT\nLIÊN HỆ\nĐÀO TẠO\nĐẠI HỌC\nKHOA HỌC MÁY TÍNH\nKỸ THUẬT PHẦN MỀM\nHỆ THỐNG THÔNG TIN\nCÔNG NGHỆ THÔNG TIN\nCÔNG NGHỆ ĐA PHƯƠNG TIỆN\nAN TOÀN THÔNG TIN\nSAU ĐẠI HỌC\nHỆ THỐNG THÔNG TIN\nKẾ HOẠCH\nTIẾN ĐỘ\nQUY CHẾ, BIỂU MẪU\nNGHIÊN CỨU KHOA HỌC\nCÔNG TRÌNH CÔNG BỐ\nĐỀ TÀI, DỰ ÁN\nSINH VIÊN NCKH\nTIN KHCN\nCÔNG TÁC SINH VIÊN\nQUY CHẾ\nGƯƠNG SÁNG SINH VIÊN\nHỌC BỔNG\nCÂU LẠC BỘ\nTHƯ VIỆN ẢNH\nTUYỂN DỤNG\nGƯƠNG SÁNG SINH VIÊN\nTRANG CHỦ > GƯƠNG SÁNG SINH VIÊN\nCựu sinh viên Khoa Công nghệ thông tin thành công từ niềm đam mê\n']","['THƯ VIỆN ẢNH TUYỂN DỤNG GƯƠNG SÁNG SINH VIÊN TRANG CHỦ > GƯƠNG SÁNG SINH VIÊN Sinh viên Khóa 19 Khoa Công nghệ thông tin đạt Học bổng HaUI 100% toàn khóa học. Học bổng chính là phần thưởng xứng đáng cho sự nỗ lực cố gắng không ngừng nghỉ. Học bổng HaUI là học bổng toàn khóa học và học bổng năm thứ nhất là cấp 100% học phí và các học phần lần thứ nhất trong học kỳ chính và các học phần học tại học kỳ phụ song song hoặc ngay sau liền (không tính các học phần học lại, học cải thiện điểm, các môn học Kỹ năng sử dụng công nghệ thông tin, Ngoại ngữ và các môn học khác (nếu có) theo chương trình đào tạo).Năm học 2024-2025, Khóa nhập học Khóa 19 Khoa Công nghệ thông tin vinh dự và tuyên dương 03 sinh viên đạt được học bổng 100% toàn khóa học.Nguyễn Thị Lan – Tân sinh viên lớp 2024DHCNTT02 quê ở Tân Yên, Bắc Giang với Thành tích đạt giải Nhì Học sinh giỏi tỉnh môn Tiếng Anh năm lớp 12, Em đã đạt số điểm xét tuyển 27,53 theo Phương thức 3 - Xét tuyển dựa trên kết quả thi tốt nghiệp THPT và ước mơ trở thành Lập trình viên phần mềm trong tương lai.Nguyễn Thành Đạt – Tân sinh viên lớp 2024DHCNTT03 quê ở Yên Bồng, Lạc Thủy, Hòa Bình với Thành tích đạt giải Nhất toán cấp tỉnh, Em đã đạt điểm số xét tuyển 29,29 theo Phương thức 2 - Xét tuyển thí sinh đoạt giải học sinh giỏi cấp tỉnh/thành phố và ước mơ trở thành Kỹ sư phần mềm trong tương lai.Dương Đinh Thượng Hải – Tân sinh viên lớp 2024DHCNTT02 quê ở Thái Bình với Thành tích 12 năm Học sinh giỏi cấp Trường và tham gia Cuộc thi học sinh giỏi cấp tỉnh môn Hóa, Em đạt điểm số xét tuyển 29,37 theo Phương thức 4 - Xét tuyển dựa trên kết quả học tập ở bậc học THPT và ước mơ trở thành Kỹ sư CNTT về lập trình và thiết kế.Với các thành tích đã tích lũy và niềm yêu thích với CNTT, các em đã chọn Khoa Công nghệ thông tin Trường Đại học Công Nghiệp Hà Nội là môi trường học tập lý tưởng và đúng đắn để theo đuổi niềm đam mê của mình và cố gắng học tập trong tương lai.Chúc các em luôn học tập tốt và thành công! Thứ Sáu, 11:07 20/09/2024 Tags: Tweet Các bài đã đăng » Sinh viên Khoa Công nghệ thông tin ghi thành tích nổi bật tại Olympic Tin học sinh viên Việt Nam lần thứ 33 và Kỳ thi Lập trình ICPC ASIA Hà Nội năm 2024 (16/12/2024) » Sinh viên Khoa Công nghệ thông tin xuất sắc nhận học bổng của Doanh nghiệp Hàn Quốc năm 2024 (09/12/2024) » Sinh viên Khoa Công nghệ thông tin nhận học bổng BROTHER năm học 2024-2025 (03/12/2024) » Sinh viên Khoa Công nghệ thông tin đạt giải tại Cuộc thi “Sinh viên thông thái 2024” (27/11/2024) » Chi bộ Khoa Công nghệ thông tin tổ chức kết nạp Đảng viên cho 06 sinh viên xuất sắc (22/11/2024) » Nguyễn Tiến Duy - giải Đặc biệt Top 4 NAPROCK PROCON Nhật Bản 2023 – Hạng mục Competition và ước mơ trở thành Lập trình viên chất lượng cao. (16/09/2024) » Sinh viên Khoa Công nghệ thông tin Trường Đại học Công Nghiệp Hà Nội đạt học bổng sinh viên xuất sắc Chương trình SIC 2023-2024 (31/08/2024) » Nguyễn Thị Lan – Cán bộ Đoàn tiêu biểu trong các phong trào thanh niên, sinh viên của Khoa (19/07/2024) » Sinh viên tiêu biểu Khoa Công nghệ thông tin với Hành trình làm theo lời Bác (11/06/2024) » Học bổng là phần thưởng xứng đáng cho nỗ lực của sinh viên (25/04/2024) Tin tiêu điểm Sinh viên Khóa 19 Khoa Công nghệ thông tin đạt Học bổng HaUI 100% toàn khóa học. Thứ Sáu, 11:07 20/09/2024 Đội bóng khoa Công nghệ thông tin cùng những trận cầu đáng nhớ Thứ Bảy, 10:00 23/07/2022 Đại hội đại biểu Liên chi Đoàn khoa Công nghệ thông tin lần thứ X, nhiệm kỳ 2022 - 2024 Thứ Hai, 15:00 18/04/2022 Gặp mặt tân Sinh viên K15 khoa Công nghệ thông tin Thứ Tư, 08:17 28/10/2020 Chương trình thực tập tại SVMC ""SVMC Internship Program 2020"" Thứ Sáu, 14:02 22/05/2020 Các bài đã đăng Sinh viên Khoa Công nghệ thông tin ghi thành tích nổi bật tại Olympic Tin học sinh viên Việt Nam lần thứ 33 và Kỳ thi Lập trình ICPC ASIA Hà Nội năm 2024 Thứ Hai, 11:30 16/12/2024 Sinh viên Khoa Công nghệ thông tin xuất sắc nhận học bổng của Doanh nghiệp Hàn Quốc năm 2024 Thứ Hai, 11:48 09/12/2024 Sinh viên Khoa Công nghệ thông tin nhận học bổng BROTHER năm học 2024-2025 Thứ Ba, 14:18 03/12/2024 Sinh viên Khoa Công nghệ thông tin đạt giải tại Cuộc thi “Sinh viên thông thái 2024” Thứ Tư, 10:39 27/11/2024 Chi bộ Khoa Công nghệ thông tin tổ chức kết nạp Đảng viên cho 06 sinh viên xuất sắc Thứ Sáu, 14:48 22/11/2024 Nguyễn Tiến Duy - giải Đặc biệt Top 4 NAPROCK PROCON Nhật Bản 2023 – Hạng mục Competition và ước mơ trở thành Lập trình viên chất lượng cao. Thứ Hai, 15:23 16/09/2024 Sinh viên Khoa Công nghệ thông tin Trường Đại học Công Nghiệp Hà Nội đạt học bổng sinh viên xuất sắc Chương trình SIC 2023-2024 Thứ Bảy, 15:03 31/08/2024 Nguyễn Thị Lan – Cán bộ Đoàn tiêu biểu trong các phong trào thanh niên, sinh viên của Khoa Thứ Sáu, 13:25 19/07/2024 Sinh viên tiêu biểu Khoa Công nghệ thông tin với Hành trình làm theo lời Bác Thứ Ba, 13:37 11/06/2024 Học bổng là phần thưởng xứng đáng cho nỗ lực của sinh viên Thứ Năm,']","Tôi không có thông tin này và khuyến nghị bạn tham khảo nguồn khác. Nếu bạn có câu hỏi khác liên quan đến khoa công nghệ thông tin tại trường đại học công nghiệp Hà Nội, vui lòng cho tôi biết!","Nguyễn Thành Đạt là tân sinh viên lớp 2024DHCNTT03, quê ở Yên Bồng, Lạc Thủy, Hòa Bình. Em đã đạt giải Nhất toán cấp tỉnh và có điểm số xét tuyển 29,29 theo Phương thức 2 - Xét tuyển thí sinh đoạt giải học sinh giỏi cấp tỉnh/thành phố.",0.0,0.0,0.0,0.0,0.8120398571223066,0.6738100051879883,3.1335349082946777
17,Trận đấu nào diễn ra vào ngày 21/07/2022 giữa đội bóng khoa Công nghệ thông tin và FC LETCO - HaUI?,"['content: QUY CHẾ\nGƯƠNG SÁNG SINH VIÊN\nHỌC BỔNG\nCÂU LẠC BỘ\nTHƯ VIỆN ẢNH\nTUYỂN DỤNG\nTIN TỨC\nTRANG CHỦ > TIN TỨC\nĐội bóng khoa Công nghệ thông tin cùng những trận cầu đáng nhớ\nVới mục tiêu nâng cao sức khoẻ và tinh thần đoàn kết cho cán bộ, giảng viên, được sự đồng tình và ủng hộ của Lãnh đạo Khoa Công nghệ thông tin, đội bóng đá FC FIT-HaUI được thành lập vào ngày 01/01/2022.Bên cạnh những giờ giảng đầy nhiệt huyết trên giảng đường, đềuđặn hàng tuần, các Thầy giáo với tuổi đời trung bình 35 tích cực ra sân luyện tập với cùngmột mục tiêu ""Vui khoẻ để giảng dạy thật tốt"".Thật tuyệt vời khi năng lượng tích cực ấy còn được lan toả sâu rộng khiến nhiều thầy giáo trong trường cũng xung phong gia nhập đội bóng, điển hình có các thầy giáo Khoa Lý luận Chính trị - Pháp luật, Trường Ngoại ngữ và du lịch.Hơn 07 tháng luyện tập chiến thuật và trải qua nhiều bài tập thể lực cho 15 cầu thủ trong đội, ngày 21/07/2022 trên chảo lửa sân bóng Thành Đô đã diễn ra trận thư hùng giữa chủ nhà FC FIT HaUI và đương kim vô địch giải bóng đá Đại học Công nghiệp Hà Nội là FC LETCO - HaUI.Trong không khí giao hữu vui vẻ nhưng không kém phần quyết liệt, đội bóng đá của Khoa đã liên tục dẫn trước đối thủ và giành kết quả thắng chung cuộc 5-3, đánh dấu một trận thắng tưng bừng, mang lại niềm vui lớn cho toàn bộ khán giả và các cầu thủ trên sân.Nhằm cổ vũ, khích lệ tinh thần cho đội bóng, Thầy Đặng Trọng Hợp - Trưởng khoa Công nghệ thông tin và Cô Vũ Thị Hồng Vân - Trưởng khoa Lý luận Chính trị - Pháp luật đã có mặt và động viên ngay trước giờ bóng lăn.Chúc mừng cho những chiến thắng củaFC FIT-HaUI, tin rằng các thầy sẽ luôn đoàn kết, giữ vững tinh thần thể thao và có sức khoẻ thật tốt để tiếp tục cống hiến cho Khoa và nhà Trường, là tấm gương sáng để các thế hệ sinh viên noi theo.\nThứ Bảy, 10:00 23/07/2022\nnext_contents:\n- Đội bóng khoa Công nghệ thông tin cùng những trận cầu đáng nhớ\nTrang HaUI\nPhòng\nPhòng Tổ chức hành chính\nPhòng Đào tạo\nPhòng Công tác sinh viên\nPhòng Khoa học công nghệ\nPhòng hợp tác đối ngoại\nPhòng Tài chính kế toán\nPhòng Quản trị\nPhòng Thanh tra Giáo dục\nKhoa\nKhoa Công nghệ Hoá\nKhoa Công nghệ may & TKTT\nKhoa Công nghệ thông tin\nKhoa Điện\nKhoa Điện tử\nKhoa Khoa học cơ bản\nKhoa Lý luận chính trị - Pháp luật\nTrung tâm Đào tạo\nTrung tâm Đào tạo Sau đại học\nTrung tâm Giáo dục thể chất và Thể thao\nTrung tâm Công nghệ Ô tô và Đào tạo lái xe\nTrung tâm Công nghệ thông tin\nTrung tâm Việt Nhật\nTrung tâm Giáo dục Quốc phòng An ninh\nTrung tâm Dịch vụ\nTrung tâm Truyền thông & Quan hệ Công chúng\nTrạm Y tế\nTrung tâm Hỗ trợ Sinh viên\nTrung tâm Đảm bảo chất lượng\nTrung tâm Thông tin Thư viện\nTrung tâm khảo thí\nViện nghiên cứu\nCông ty Letco\nThư điện tử\nSitemap\nLiên hệ\nToggle navigation\nGIỚI THIỆU\nTHÔNG TIN CHUNG\nCƠ CẤU TỔ CHỨC\nCHIẾN LƯỢC PHÁT TRIỂN\nCÁN BỘ GIẢNG VIÊN\nCƠ SỞ VẬT CHẤT\nLIÊN HỆ\nĐÀO TẠO\nĐẠI HỌC\nKHOA HỌC MÁY TÍNH\nKỸ THUẬT PHẦN MỀM\nHỆ THỐNG THÔNG TIN\nCÔNG NGHỆ THÔNG TIN\nCÔNG NGHỆ ĐA PHƯƠNG TIỆN\nAN TOÀN THÔNG TIN\nSAU ĐẠI HỌC\nHỆ THỐNG THÔNG TIN\nKẾ HOẠCH\nTIẾN ĐỘ\nQUY CHẾ, BIỂU MẪU\nNGHIÊN CỨU KHOA HỌC\nCÔNG TRÌNH CÔNG BỐ\nĐỀ TÀI, DỰ ÁN\nSINH VIÊN NCKH\nTIN KHCN\nCÔNG TÁC SINH VIÊN\nQUY CHẾ\nGƯƠNG SÁNG SINH VIÊN\nHỌC BỔNG\nCÂU LẠC BỘ\nTHƯ VIỆN ẢNH\nTUYỂN DỤNG\nTIN TỨC\nTRANG CHỦ > TIN TỨC\nĐội bóng khoa Công nghệ thông tin cùng những trận cầu đáng nhớ\n', 'content: Đội bóng khoa Công nghệ thông tin cùng những trận cầu đáng nhớ\nThứ Bảy, 10:00 23/07/2022\nĐại hội đại biểu Liên chi Đoàn khoa Công nghệ thông tin lần thứ X, nhiệm kỳ 2022 - 2024\nThứ Hai, 15:00 18/04/2022\nGặp mặt tân Sinh viên K15 khoa Công nghệ thông tin\nThứ Tư, 08:17 28/10/2020\nChương trình thực tập tại SVMC ""SVMC Internship Program 2020""\nThứ Sáu, 14:02 22/05/2020\nLịch giảng dạy môn Pháp Luật tuần từ 20/4 đến 26/4/2020 Hệ Cao đẳng khóa 21\nThứ Sáu, 15:05 17/04/2020\nDanh sách các lớp học trực tuyến từ ngày 06/4/2020 đến ngày 19/4/2020\nThứ Bảy, 12:42 04/04/2020\nDanh sách các lớp học trực tuyến từ ngày 30/3/2020 đến ngày 5/4/2020\nThứ Bảy, 14:46 28/03/2020\nKế hoạch tổ chức hoạt động dạy học tuần từ 23/03/2020 đến 05/04/2020 khoa CNTT\nThứ Hai, 09:03 23/03/2020\nĐội HaUI.NotTrashCar đạt giải nhì vòng sơ loại, giành quyền bước vào vòng bán kết cuộc đua số khu vực miền Bắc năm 2020\nThứ Sáu, 08:02 06/03/2020\nnext_contents:\n- Ngành Khoa học máy tính - ĐẠI HỌC CÔNG NGHIỆP HÀ NỘI || HaUI\nTrang HaUI\nPhòng\nPhòng Tổ chức hành chính\nPhòng Đào tạo\nPhòng Công tác sinh viên\nPhòng Khoa học công nghệ\nPhòng hợp tác đối ngoại\nPhòng Tài chính kế toán\nPhòng Quản trị\nPhòng Thanh tra Giáo dục\nKhoa\nKhoa Công nghệ Hoá\nKhoa Công nghệ may & TKTT\nKhoa Công nghệ thông tin\nKhoa Điện\nKhoa Điện tử\nKhoa Khoa học cơ bản\nKhoa Lý luận chính trị - Pháp luật\nTrung tâm Đào tạo\nTrung tâm Đào tạo Sau đại học\nTrung tâm Giáo dục thể chất và Thể thao\nTrung tâm Công nghệ Ô tô và Đào tạo lái xe\nTrung tâm Công nghệ thông tin\nTrung tâm Việt Nhật\nTrung tâm Giáo dục Quốc phòng An ninh\nTrung tâm Dịch vụ\nTrung tâm Truyền thông & Quan hệ Công chúng\nTrạm Y tế\nTrung tâm Hỗ trợ Sinh viên\nTrung tâm Đảm bảo chất lượng\nTrung tâm Thông tin Thư viện\nTrung tâm khảo thí\nViện nghiên cứu\nCông ty Letco\nThư điện tử\nSitemap\nLiên hệ\nToggle navigation\nGIỚI THIỆU\nTHÔNG TIN CHUNG\nCƠ CẤU TỔ CHỨC\nCHIẾN LƯỢC PHÁT TRIỂN\nCÁN BỘ GIẢNG VIÊN\nCƠ SỞ VẬT CHẤT\nLIÊN HỆ\nĐÀO TẠO\nĐẠI HỌC\nKHOA HỌC MÁY TÍNH\nKỸ THUẬT PHẦN MỀM\nHỆ THỐNG THÔNG TIN\nCÔNG NGHỆ THÔNG TIN\nCÔNG NGHỆ ĐA PHƯƠNG TIỆN\nAN TOÀN THÔNG TIN\nSAU ĐẠI HỌC\nHỆ THỐNG THÔNG TIN\nKẾ HOẠCH\nTIẾN ĐỘ\nQUY CHẾ, BIỂU MẪU\nNGHIÊN CỨU KHOA HỌC\nCÔNG TRÌNH CÔNG BỐ\nĐỀ TÀI, DỰ ÁN\nSINH VIÊN NCKH\nTIN KHCN\nCÔNG TÁC SINH VIÊN\nQUY CHẾ\nGƯƠNG SÁNG SINH VIÊN\nHỌC BỔNG\nCÂU LẠC BỘ\nTHƯ VIỆN ẢNH\nTUYỂN DỤNG\nKhoa học máy tính\nTin tiêu điểm\nSinh viên Khóa 19 Khoa Công nghệ thông tin đạt Học bổng HaUI 100% toàn khóa học.\nThứ Sáu, 11:07 20/09/2024\nĐội bóng khoa Công nghệ thông tin cùng những trận cầu đáng nhớ\nThứ Bảy, 10:00 23/07/2022\nĐại hội đại biểu Liên chi Đoàn khoa Công nghệ thông tin lần thứ X, nhiệm kỳ 2022 - 2024\nThứ Hai, 15:00 18/04/2022\nGặp mặt tân Sinh viên K15 khoa Công nghệ thông tin\n', 'content: Đội bóng khoa Công nghệ thông tin cùng những trận cầu đáng nhớ\nThứ Bảy, 10:00 23/07/2022\nĐại hội đại biểu Liên chi Đoàn khoa Công nghệ thông tin lần thứ X, nhiệm kỳ 2022 - 2024\nThứ Hai, 15:00 18/04/2022\nGặp mặt tân Sinh viên K15 khoa Công nghệ thông tin\nThứ Tư, 08:17 28/10/2020\nChương trình thực tập tại SVMC ""SVMC Internship Program 2020""\nThứ Sáu, 14:02 22/05/2020\nLịch giảng dạy môn Pháp Luật tuần từ 20/4 đến 26/4/2020 Hệ Cao đẳng khóa 21\nThứ Sáu, 15:05 17/04/2020\nDanh sách các lớp học trực tuyến từ ngày 06/4/2020 đến ngày 19/4/2020\nThứ Bảy, 12:42 04/04/2020\nDanh sách các lớp học trực tuyến từ ngày 30/3/2020 đến ngày 5/4/2020\nThứ Bảy, 14:46 28/03/2020\nKế hoạch tổ chức hoạt động dạy học tuần từ 23/03/2020 đến 05/04/2020 khoa CNTT\nThứ Hai, 09:03 23/03/2020\nĐội HaUI.NotTrashCar đạt giải nhì vòng sơ loại, giành quyền bước vào vòng bán kết cuộc đua số khu vực miền Bắc năm 2020\nThứ Sáu, 08:02 06/03/2020\nnext_contents:\n- Ngành Khoa học máy tính - ĐẠI HỌC CÔNG NGHIỆP HÀ NỘI || HaUI\nTrang HaUI\nPhòng\nPhòng Tổ chức hành chính\nPhòng Đào tạo\nPhòng Công tác sinh viên\nPhòng Khoa học công nghệ\nPhòng hợp tác đối ngoại\nPhòng Tài chính kế toán\nPhòng Quản trị\nPhòng Thanh tra Giáo dục\nKhoa\nKhoa Công nghệ Hoá\nKhoa Công nghệ may & TKTT\nKhoa Công nghệ thông tin\nKhoa Điện\nKhoa Điện tử\nKhoa Khoa học cơ bản\nKhoa Lý luận chính trị - Pháp luật\nTrung tâm Đào tạo\nTrung tâm Đào tạo Sau đại học\nTrung tâm Giáo dục thể chất và Thể thao\nTrung tâm Công nghệ Ô tô và Đào tạo lái xe\nTrung tâm Công nghệ thông tin\nTrung tâm Việt Nhật\nTrung tâm Giáo dục Quốc phòng An ninh\nTrung tâm Dịch vụ\nTrung tâm Truyền thông & Quan hệ Công chúng\nTrạm Y tế\nTrung tâm Hỗ trợ Sinh viên\nTrung tâm Đảm bảo chất lượng\nTrung tâm Thông tin Thư viện\nTrung tâm khảo thí\nViện nghiên cứu\nCông ty Letco\nThư điện tử\nSitemap\nLiên hệ\nToggle navigation\nGIỚI THIỆU\nTHÔNG TIN CHUNG\nCƠ CẤU TỔ CHỨC\nCHIẾN LƯỢC PHÁT TRIỂN\nCÁN BỘ GIẢNG VIÊN\nCƠ SỞ VẬT CHẤT\nLIÊN HỆ\nĐÀO TẠO\nĐẠI HỌC\nKHOA HỌC MÁY TÍNH\nKỸ THUẬT PHẦN MỀM\nHỆ THỐNG THÔNG TIN\nCÔNG NGHỆ THÔNG TIN\nCÔNG NGHỆ ĐA PHƯƠNG TIỆN\nAN TOÀN THÔNG TIN\nSAU ĐẠI HỌC\nHỆ THỐNG THÔNG TIN\nKẾ HOẠCH\nTIẾN ĐỘ\nQUY CHẾ, BIỂU MẪU\nNGHIÊN CỨU KHOA HỌC\nCÔNG TRÌNH CÔNG BỐ\nĐỀ TÀI, DỰ ÁN\nSINH VIÊN NCKH\nTIN KHCN\nCÔNG TÁC SINH VIÊN\nQUY CHẾ\nGƯƠNG SÁNG SINH VIÊN\nHỌC BỔNG\nCÂU LẠC BỘ\nTHƯ VIỆN ẢNH\nTUYỂN DỤNG\nKhoa học máy tính\nTin tiêu điểm\nSinh viên Khóa 19 Khoa Công nghệ thông tin đạt Học bổng HaUI 100% toàn khóa học.\nThứ Sáu, 11:07 20/09/2024\nĐội bóng khoa Công nghệ thông tin cùng những trận cầu đáng nhớ\nThứ Bảy, 10:00 23/07/2022\nĐại hội đại biểu Liên chi Đoàn khoa Công nghệ thông tin lần thứ X, nhiệm kỳ 2022 - 2024\nThứ Hai, 15:00 18/04/2022\nGặp mặt tân Sinh viên K15 khoa Công nghệ thông tin\n', 'content: Đội bóng khoa Công nghệ thông tin cùng những trận cầu đáng nhớ\nThứ Bảy, 10:00 23/07/2022\nĐại hội đại biểu Liên chi Đoàn khoa Công nghệ thông tin lần thứ X, nhiệm kỳ 2022 - 2024\nThứ Hai, 15:00 18/04/2022\nGặp mặt tân Sinh viên K15 khoa Công nghệ thông tin\nThứ Tư, 08:17 28/10/2020\nChương trình thực tập tại SVMC ""SVMC Internship Program 2020""\nThứ Sáu, 14:02 22/05/2020\nLịch giảng dạy môn Pháp Luật tuần từ 20/4 đến 26/4/2020 Hệ Cao đẳng khóa 21\nThứ Sáu, 15:05 17/04/2020\nDanh sách các lớp học trực tuyến từ ngày 06/4/2020 đến ngày 19/4/2020\nThứ Bảy, 12:42 04/04/2020\nDanh sách các lớp học trực tuyến từ ngày 30/3/2020 đến ngày 5/4/2020\nThứ Bảy, 14:46 28/03/2020\nKế hoạch tổ chức hoạt động dạy học tuần từ 23/03/2020 đến 05/04/2020 khoa CNTT\nThứ Hai, 09:03 23/03/2020\nĐội HaUI.NotTrashCar đạt giải nhì vòng sơ loại, giành quyền bước vào vòng bán kết cuộc đua số khu vực miền Bắc năm 2020\nThứ Sáu, 08:02 06/03/2020\nnext_contents:\n- Ngành Hệ thống thông tin - ĐẠI HỌC CÔNG NGHIỆP HÀ NỘI || HaUI\nTrang HaUI\nPhòng\nPhòng Tổ chức hành chính\nPhòng Đào tạo\nPhòng Công tác sinh viên\nPhòng Khoa học công nghệ\nPhòng hợp tác đối ngoại\nPhòng Tài chính kế toán\nPhòng Quản trị\nPhòng Thanh tra Giáo dục\nKhoa\nKhoa Công nghệ Hoá\nKhoa Công nghệ may & TKTT\nKhoa Công nghệ thông tin\nKhoa Điện\nKhoa Điện tử\nKhoa Khoa học cơ bản\nKhoa Lý luận chính trị - Pháp luật\nTrung tâm Đào tạo\nTrung tâm Đào tạo Sau đại học\nTrung tâm Giáo dục thể chất và Thể thao\nTrung tâm Công nghệ Ô tô và Đào tạo lái xe\nTrung tâm Công nghệ thông tin\nTrung tâm Việt Nhật\nTrung tâm Giáo dục Quốc phòng An ninh\nTrung tâm Dịch vụ\nTrung tâm Truyền thông & Quan hệ Công chúng\nTrạm Y tế\nTrung tâm Hỗ trợ Sinh viên\nTrung tâm Đảm bảo chất lượng\nTrung tâm Thông tin Thư viện\nTrung tâm khảo thí\nViện nghiên cứu\nCông ty Letco\nThư điện tử\nSitemap\nLiên hệ\nToggle navigation\nGIỚI THIỆU\nTHÔNG TIN CHUNG\nCƠ CẤU TỔ CHỨC\nCHIẾN LƯỢC PHÁT TRIỂN\nCÁN BỘ GIẢNG VIÊN\nCƠ SỞ VẬT CHẤT\nLIÊN HỆ\nĐÀO TẠO\nĐẠI HỌC\nKHOA HỌC MÁY TÍNH\nKỸ THUẬT PHẦN MỀM\nHỆ THỐNG THÔNG TIN\nCÔNG NGHỆ THÔNG TIN\nCÔNG NGHỆ ĐA PHƯƠNG TIỆN\nAN TOÀN THÔNG TIN\nSAU ĐẠI HỌC\nHỆ THỐNG THÔNG TIN\nKẾ HOẠCH\nTIẾN ĐỘ\nQUY CHẾ, BIỂU MẪU\nNGHIÊN CỨU KHOA HỌC\nCÔNG TRÌNH CÔNG BỐ\nĐỀ TÀI, DỰ ÁN\nSINH VIÊN NCKH\nTIN KHCN\nCÔNG TÁC SINH VIÊN\nQUY CHẾ\nGƯƠNG SÁNG SINH VIÊN\nHỌC BỔNG\nCÂU LẠC BỘ\nTHƯ VIỆN ẢNH\nTUYỂN DỤNG\nĐại học Hệ thống thông tin\nTin tiêu điểm\nSinh viên Khóa 19 Khoa Công nghệ thông tin đạt Học bổng HaUI 100% toàn khóa học.\nThứ Sáu, 11:07 20/09/2024\nĐội bóng khoa Công nghệ thông tin cùng những trận cầu đáng nhớ\nThứ Bảy, 10:00 23/07/2022\nĐại hội đại biểu Liên chi Đoàn khoa Công nghệ thông tin lần thứ X, nhiệm kỳ 2022 - 2024\nThứ Hai, 15:00 18/04/2022\nGặp mặt tân Sinh viên K15 khoa Công nghệ thông tin\n']","['TIN TỨC TRANG CHỦ > TIN TỨC Đội bóng khoa Công nghệ thông tin cùng những trận cầu đáng nhớ Với mục tiêu nâng cao sức khoẻ và tinh thần đoàn kết cho cán bộ, giảng viên, được sự đồng tình và ủng hộ của Lãnh đạo Khoa Công nghệ thông tin, đội bóng đá FC FIT-HaUI được thành lập vào ngày 01/01/2022.Bên cạnh những giờ giảng đầy nhiệt huyết trên giảng đường, đềuđặn hàng tuần, các Thầy giáo với tuổi đời trung bình 35 tích cực ra sân luyện tập với cùngmột mục tiêu ""Vui khoẻ để giảng dạy thật tốt"".Thật tuyệt vời khi năng lượng tích cực ấy còn được lan toả sâu rộng khiến nhiều thầy giáo trong trường cũng xung phong gia nhập đội bóng, điển hình có các thầy giáo Khoa Lý luận Chính trị - Pháp luật, Trường Ngoại ngữ và du lịch.Hơn 07 tháng luyện tập chiến thuật và trải qua nhiều bài tập thể lực cho 15 cầu thủ trong đội, ngày 21/07/2022 trên chảo lửa sân bóng Thành Đô đã diễn ra trận thư hùng giữa chủ nhà FC FIT HaUI và đương kim vô địch giải bóng đá Đại học Công nghiệp Hà Nội là FC LETCO - HaUI.Trong không khí giao hữu vui vẻ nhưng không kém phần quyết liệt, đội bóng đá của Khoa đã liên tục dẫn trước đối thủ và giành kết quả thắng chung cuộc 5-3, đánh dấu một trận thắng tưng bừng, mang lại niềm vui lớn cho toàn bộ khán giả và các cầu thủ trên sân.Nhằm cổ vũ, khích lệ tinh thần cho đội bóng, Thầy Đặng Trọng Hợp - Trưởng khoa Công nghệ thông tin và Cô Vũ Thị Hồng Vân - Trưởng khoa Lý luận Chính trị - Pháp luật đã có mặt và động viên ngay trước giờ bóng lăn.Chúc mừng cho những chiến thắng củaFC FIT-HaUI, tin rằng các thầy sẽ luôn đoàn kết, giữ vững tinh thần thể thao và có sức khoẻ thật tốt để tiếp tục cống hiến cho Khoa và nhà Trường, là tấm gương sáng để các thế hệ sinh viên noi theo. Thứ Bảy, 10:00 23/07/2022 Tags: Tweet Các bài đã đăng » Lễ bảo vệ Luận văn Thạc sĩ ngành Hệ thống Thông tin Khóa 12 đợt 1&2 (20/12/2024) » Seminar ""Chuỗi bài giảng về Hệ mờ và ứng dụng"" (18/12/2024) » Chúc mừng Ban chủ nhiệm khóa 14 Câu lạc bộ Tin học HIT (17/12/2024) » Chúc mừng thành công Kỳ thi Olympic Tin học Sinh viên Việt Nam lần thứ 33 (OLP’24), Procon và Kỳ thi lập trình sinh viên quốc tế ICPC Asia Hanoi 2024 (17/12/2024) » Việt Nam xuất sắc giành 2 Huy chương Vàng tại ICPC Asia Hanoi 2024 (15/12/2024) » Sinh viên Khoa Công nghệ thông tin đạt nhiều giải cao tại Lễ tổng kết và trao giải Hội nghị sinh viên nghiên cứu khoa học lần thứ XIII (năm học 2021-2022). (01/07/2022) » Hội thảo khoa học ""Công nghệ phần mềm & Khoa học dữ liệu"" năm 2022 (29/06/2022) » Chương trình Tình nguyện vì cộng đồng 2022 (20/06/2022) » Thông tin tuyển sinh đào tạo trình độ Thạc sĩ năm 2022 (13/06/2022) » Tư vấn tuyển sinh trực tuyến nhóm ngành Công nghệ thông tin năm 2022 (09/06/2022) Tin tiêu điểm Sinh viên Khóa 19 Khoa Công nghệ thông tin đạt Học bổng HaUI 100% toàn khóa học. Thứ Sáu, 11:07 20/09/2024 Đội bóng khoa Công nghệ thông tin cùng những trận cầu đáng nhớ Thứ Bảy, 10:00 23/07/2022 Đại hội đại biểu Liên chi Đoàn khoa Công nghệ thông tin lần thứ X, nhiệm kỳ 2022 - 2024 Thứ Hai, 15:00 18/04/2022 Gặp mặt tân Sinh viên K15 khoa Công nghệ thông tin Thứ Tư, 08:17 28/10/2020 Chương trình thực tập tại SVMC ""SVMC Internship Program 2020"" Thứ Sáu, 14:02 22/05/2020 Các bài đã đăng Lễ bảo vệ Luận văn Thạc sĩ ngành Hệ thống Thông tin Khóa 12 đợt 1&2 Thứ Sáu, 16:01 20/12/2024 Seminar ""Chuỗi bài giảng về Hệ mờ và ứng dụng"" Thứ Tư, 11:25 18/12/2024 Chúc mừng Ban chủ nhiệm khóa 14 Câu lạc bộ Tin học HIT Thứ Ba, 11:07 17/12/2024 Chúc mừng thành công Kỳ thi Olympic Tin học Sinh viên Việt Nam lần thứ 33 (OLP’24), Procon và Kỳ thi lập trình sinh viên quốc tế ICPC Asia Hanoi 2024 Thứ Ba, 10:00 17/12/2024 Việt Nam xuất sắc giành 2 Huy chương Vàng tại ICPC Asia Hanoi 2024 Chủ Nhật, 05:57 15/12/2024 Sinh viên Khoa Công nghệ thông tin đạt nhiều giải cao tại Lễ tổng kết và trao giải Hội nghị sinh viên nghiên cứu khoa học lần thứ XIII (năm học 2021-2022). Thứ Sáu, 11:33 01/07/2022 Hội thảo khoa học ""Công nghệ phần mềm & Khoa học dữ liệu"" năm 2022 Thứ Tư, 15:28 29/06/2022 Chương trình Tình nguyện vì cộng đồng 2022 Thứ Hai, 16:00 20/06/2022 Thông tin tuyển sinh đào tạo trình độ Thạc sĩ năm 2022 Thứ Hai, 11:16 13/06/2022 Tư vấn tuyển sinh trực tuyến nhóm ngành Công nghệ thông tin năm 2022 Thứ Năm, 09:56 09/06/2022 Bản đồ chỉ dẫn Trường Đại học Công nghiệp Hà Nội Trụ sở chính Số 298 đường Cầu Diễn, quận Bắc Từ Liêm, Hà Nội +84 243 765 5121 Email: dhcnhn@haui.edu.vn Các cơ sở khác Cơ sở 2: Phường Tây Tựu, quận Bắc Từ Liêm, Hà Nội Cơ sở 3: Phường Lê Hồng Phong, thành phố Phủ Lý, Hà Nam Liên kết site Trường Đại học Công nghiệp Hà Nội Thông tin tuyển sinh Hành chính điện tử Đào tạo trực tuyến Cổng thông tin đào tạo Copyright © 2018 Hanoi University of Industry.']","Tôi không có thông tin về trận đấu giữa đội bóng khoa Công nghệ thông tin và FC LETCO - HaUI diễn ra vào ngày 21/07/2022. Tôi khuyến nghị bạn tham khảo các nguồn khác để tìm hiểu thêm về sự kiện này.

Nếu bạn có câu hỏi khác hoặc cần thông tin liên quan, hãy cho tôi biết!","Vào ngày 21/07/2022, trên sân bóng Thành Đô đã diễn ra trận thư hùng giữa chủ nhà FC FIT HaUI và đương kim vô địch giải bóng đá Đại học Công nghiệp Hà Nội là FC LETCO - HaUI. Đội bóng khoa Công nghệ thông tin đã giành chiến thắng với tỷ số 5-3.",0.9999999999,1.0,0.0,0.0,0.9216944336991201,0.6350781917572021,6.331108093261719
18,Nguyễn Trường An là ai trong khoa Công nghệ thông tin?,"['content: Đỗ Sinh Trường26Xây dựng website hỗ trợ học lập trình WebTrần Văn Hoàng2020DHHTTT2 - ĐH K152020603969ThS. Đỗ Sinh Trường26Xây dựng website hỗ trợ học lập trình WebĐinh Khắc Tuấn2020DHKTPM4 - ĐH K152020605847ThS. Đỗ Sinh Trường27Nghiên cứu mạng Resnet và ứng dụng cho bài toán phân loại ảnh.Nguyễn Hồng Phong (CN)2019DHCNTT5 - ĐH K142019605743TS. Trần Hùng Cường27Nghiên cứu mạng Resnet và ứng dụng cho bài toán phân loại ảnh.Đặng Đình Phức2019DHCNTT5 - ĐH K142019605425TS. Trần Hùng Cường27Nghiên cứu mạng Resnet và ứng dụng cho bài toán phân loại ảnh.Vi Văn Oanh2019DHCNTT5 - ĐH K142019605363TS. Trần Hùng Cường27Nghiên cứu mạng Resnet và ứng dụng cho bài toán phân loại ảnh.Hạ Ngọc Nam2019DHCNTT5 - ĐH K142019605908TS. Trần Hùng Cường27Nghiên cứu mạng Resnet và ứng dụng cho bài toán phân loại ảnh.Vũ Thị Bình Yên2019DHKTPM2 - ĐH K142019602188TS. Trần Hùng Cường28Nghiên cứu xây dựng hệ thống đăng nhập tự động bằng nhận diện khuôn mặtNguyễn Lương Hùng (CN)2019DHKTPM1 - ĐH K142019601064ThS. Nguyễn Lan Anh28Nghiên cứu xây dựng hệ thống đăng nhập tự động bằng nhận diện khuôn mặtNguyễn Đình Huân2019DHKTPM2 - ĐH K142019602287ThS. Nguyễn Lan Anh28Nghiên cứu xây dựng hệ thống đăng nhập tự động bằng nhận diện khuôn mặtBùi Việt Hoàng2019DHHTTT2 - ĐH K142019606167ThS. Nguyễn Lan Anh28Nghiên cứu xây dựng hệ thống đăng nhập tự động bằng nhận diện khuôn mặtTrần Khắc Bình Dương2019DHKTPM1 - ĐH K142019600234ThS. Nguyễn Lan Anh29Nghiên cứu và xây dựng hệ thống phát hiện đám đông hỗ trợ cảnh báo nguy cơ lây nhiễm virus CoronaNguyễn Minh Trường (CN)2019DHCNTT3 - ĐH K142019603566ThS. Nguyễn Lan Anh29Nghiên cứu và xây dựng hệ thống phát hiện đám đông hỗ trợ cảnh báo nguy cơ lây nhiễm virus CoronaCù Việt Hưng2019DHCNTT3 - ĐH K142019602993ThS. Nguyễn Lan Anh29Nghiên cứu và xây dựng hệ thống phát hiện đám đông hỗ trợ cảnh báo nguy cơ lây nhiễm virus CoronaĐường Ngọc Khanh2019DHCNTT3 - ĐH K142019603738ThS. Nguyễn Lan Anh29Nghiên cứu và xây dựng hệ thống phát hiện đám đông hỗ trợ cảnh báo nguy cơ lây\nnext_contents:\n- - ĐH K142019607190ThS. Vũ Thị Tuyết Mai23Xây dựng website Quản lý kết quả học tập và trao đổi thông tin giữa giáo viên và phụ huynh học sinh trong học onlineTạ Việt Khang2019DHCNTT6 - ĐH K142019607077ThS. Vũ Thị Tuyết Mai23Xây dựng website Quản lý kết quả học tập và trao đổi thông tin giữa giáo viên và phụ huynh học sinh trong học onlineNguyễn Thi Mời2019DHCNTT6 - ĐH K142019606729ThS. Vũ Thị Tuyết Mai24Xây dựng ứng dụng trải nghiệm của một thanh niên tình nguyện FIT-HAUINguyễn Hoàng Minh (CN)2018DHHTTT2 - ĐH K132018604714ThS. Nguyễn Thị Thanh Huyền24Xây dựng ứng dụng trải nghiệm của một thanh niên tình nguyện FIT-HAUINguyễn Thị Huyền2019DHCNTT2 - ĐH K142019602571ThS. Nguyễn Thị Thanh Huyền24Xây dựng ứng dụng trải nghiệm của một thanh niên tình nguyện FIT-HAUITrần Đức Long2020DHHTTT1 - ĐH K152020600014ThS. Nguyễn Thị Thanh Huyền25Xây dựng ứng dụng di động quản lý hoạt động của các thiết bị điện từ xaTrương Thị Thu Phương (CN)2019DHCNTT5 - ĐH K142019605502ThS. Nguyễn Trung Phú25Xây dựng ứng dụng di động quản lý hoạt động của các thiết bị điện từ xaNguyễn Vũ Chí Tình2019DHCNTT5 - ĐH K142019605521ThS. Nguyễn Trung Phú25Xây dựng ứng dụng di động quản lý hoạt động của các thiết bị điện từ xaHà Thị Phượng2019DHCNTT5 - ĐH K142019605499ThS. Nguyễn Trung Phú2526Xây dựng ứng dụng di động quản lý hoạt động của các thiết bị điện từ xaHà Văn Phòng2019DHCNTT6 - ĐH K142019606680ThS. Nguyễn Trung Phú26Xây dựng website hỗ trợ học lập trình WebVũ Đình Quân (CN)2020DHKTPM4 - ĐH K152020606122ThS. Đỗ Sinh Trường26Xây dựng website hỗ trợ học lập trình WebNguyễn Anh Tú2020DHKTPM1 - ĐH K152020600692ThS. Đỗ Sinh Trường26Xây dựng website hỗ trợ học lập trình WebTrần Huy Thắng2020DHKTPM4 - ĐH K152020607321ThS. Đỗ Sinh Trường26Xây dựng website hỗ trợ học lập trình WebTrần Văn Hoàng2020DHHTTT2 - ĐH K152020603969ThS. Đỗ Sinh Trường26Xây dựng website hỗ trợ học lập trình WebĐinh Khắc Tuấn2020DHKTPM4 - ĐH K152020605847ThS. Đỗ Sinh Trường27Nghiên cứu mạng Resnet và ứng dụng cho bài toán phân loại\n', 'content: Sau những năm tháng miệt mài học tập, trau dồi kiến thức, kỹ năng tại Trường Đại học Công Nghiệp Hà Nội, các thế hệ sinh viên của Khoa Công nghệ thông tin ngày một trưởng thành và từng bước khẳng định được năng lực của mình ở các vị trí công tác. Trong số đó, có nhiều sinh viên thành đạt và tạo dựng được cho mình những vị trí quan trọng trong các doanh nghiệp, tập đoàn lớn, các em luôn mang trong mình sự nhiệt huyết, tinh thần nỗ lực hết mình vì công việc. Tinh thần ấy không chỉ có được do sự rèn luyện của bản thân mà còn có được sự “truyền lửa” từ các thầy, cô khi học tập trên giảng đường. Không ít những tấm gương cựu sinh viên Khoa Công nghệ thông tin đã khẳng định được bản thân và thành công trong công việc. Các em chính là niềm tự hào, là tấm gương sáng tiếp lửa cho các thế hệ sinh viên tiếp theo của nhà trường noi theo. Trong số đó có thể kể đến cựu sinh viên Phạm Văn Cương, hiện đang là Web developer – Software tại Công ty CPĐT và Công nghệ BAP.8/2022: Giải nhất HIT Product về phát triển công nghệ phần mềm11/2022: Giải nhất I-Product về phát triển ứng dụng phần mềm trong khuôn khổ cuộc thi IT-Festival2023: Giải khuyến khích Sinh viên nghiên cứu khoa học Phạm Văn Cương chia sẻ, từ ngày còn đi học mình đã có sở thích tìm hiểu về máy tính, mình luôn theo dõi các hệ thống và phần mềm của Việt Nam và thế giới, mình vô cùng thích thú và từ đó đã quyết định đi theo hướng trở thành một kỹ sư IT với ước mơ tạo ra các sản phẩm có tính ứng dụng cao trong cuộc sống. Vì vậy, ngay khi bước vào ngưỡng cửa Đại học, mình đã quyết định đăng ký và trúng tuyển vào Khoa Công nghệ thông tin, Trường Đại học Công Nghiệp Hà Nội. Học đúng ngành mình yêu thích, đúng sở trường và khả năng của mình kết hợp với sự nỗ lực của bản thân, Cương luôn đạt kết quả cao trong học tập. Với tư duy “chú trọng học lý thuyết, nâng cao năng lực thực hành”, Cương luôn xác định máy tính là người bạn đồng hành với mình, vì vậy luôn cần mẫn trong các giờ học thực hành trên phòng máy, và tìm hiểu thêm kiến\nnext_contents:\n- Cựu sinh viên Khoa Công nghệ thông tin thành công từ niềm đam mê\nTrang HaUI\nPhòng\nPhòng Tổ chức hành chính\nPhòng Đào tạo\nPhòng Công tác sinh viên\nPhòng Khoa học công nghệ\nPhòng hợp tác đối ngoại\nPhòng Tài chính kế toán\nPhòng Quản trị\nPhòng Thanh tra Giáo dục\nKhoa\nKhoa Công nghệ Hoá\nKhoa Công nghệ may & TKTT\nKhoa Công nghệ thông tin\nKhoa Điện\nKhoa Điện tử\nKhoa Khoa học cơ bản\nKhoa Lý luận chính trị - Pháp luật\nTrung tâm Đào tạo\nTrung tâm Đào tạo Sau đại học\nTrung tâm Giáo dục thể chất và Thể thao\nTrung tâm Công nghệ Ô tô và Đào tạo lái xe\nTrung tâm Công nghệ thông tin\nTrung tâm Việt Nhật\nTrung tâm Giáo dục Quốc phòng An ninh\nTrung tâm Dịch vụ\nTrung tâm Truyền thông & Quan hệ Công chúng\nTrạm Y tế\nTrung tâm Hỗ trợ Sinh viên\nTrung tâm Đảm bảo chất lượng\nTrung tâm Thông tin Thư viện\nTrung tâm khảo thí\nViện nghiên cứu\nCông ty Letco\nThư điện tử\nSitemap\nLiên hệ\nToggle navigation\nGIỚI THIỆU\nTHÔNG TIN CHUNG\nCƠ CẤU TỔ CHỨC\nCHIẾN LƯỢC PHÁT TRIỂN\nCÁN BỘ GIẢNG VIÊN\nCƠ SỞ VẬT CHẤT\nLIÊN HỆ\nĐÀO TẠO\nĐẠI HỌC\nKHOA HỌC MÁY TÍNH\nKỸ THUẬT PHẦN MỀM\nHỆ THỐNG THÔNG TIN\nCÔNG NGHỆ THÔNG TIN\nCÔNG NGHỆ ĐA PHƯƠNG TIỆN\nAN TOÀN THÔNG TIN\nSAU ĐẠI HỌC\nHỆ THỐNG THÔNG TIN\nKẾ HOẠCH\nTIẾN ĐỘ\nQUY CHẾ, BIỂU MẪU\nNGHIÊN CỨU KHOA HỌC\nCÔNG TRÌNH CÔNG BỐ\nĐỀ TÀI, DỰ ÁN\nSINH VIÊN NCKH\nTIN KHCN\nCÔNG TÁC SINH VIÊN\nQUY CHẾ\nGƯƠNG SÁNG SINH VIÊN\nHỌC BỔNG\nCÂU LẠC BỘ\nTHƯ VIỆN ẢNH\nTUYỂN DỤNG\nGƯƠNG SÁNG SINH VIÊN\nTRANG CHỦ > GƯƠNG SÁNG SINH VIÊN\nCựu sinh viên Khoa Công nghệ thông tin thành công từ niềm đam mê\n', 'content: Công nghệ thông tin là nhóm ngành đang có xu hướng phát triển, nhu cầu nhân lực rất cao và các chuyên gia lưu ý sinh viên học tốt, có năng lực sẽ được doanh nghiệp săn đón ngay khi còn ngồi ở ghế nhà trường. Đại dịch Covid 19 đang bước vào năm thứ 3, gây ảnh hưởng tất cả mọi lĩnh vực trong đời sống. Tuy nhiên, công nghệ thông tin (CNTT) lại là một trong những lĩnh vực phát triển mạnh với nhiều đột phá góp phần đổi thay cuộc sống.Vào tối ngày 8/6/2022, Khoa Công nghệ thông tin Trường Đại học Công Nghiệp Hà Nội kết hợp với một số doanh nghiệp đã tổ chức buổi livestream tư vấn trực tuyến nhóm ngành CNTT năm 2022. Tham dự buổi tư vấn có TS. Lê Văn Thái – Phó Trưởng phòng đào tạo Trường ĐH Công Nghiệp Hà Nội, TS. Đặng Trọng Hợp – Trưởng Khoa CNTT và đại diện doanh nghiệp FPT Software, cựu sinh viên Nguyễn Huy Du, các chuyên gia cung cấp cho thí sinh nhiều thông tin cụ thể về ngành học này khi trong giai đoạn sắp tới.Thí sinh có rất nhiều câu hỏi đặt ra cho Ban tổ chứcTiến sĩ Lê Văn Thái – Phó Trưởng phòng Đào tạo Trường ĐH Công Nghiệp Hà Nội, chia sẻ: ""CNTT là nhóm ngành hot và được dự đoán là ngành lâu dài trong tương lai, để đào tạo nhân lực chất lượng cao phục vụ cho các ngành nghề khác. Chẳng hạn, lập trình viên phải biết cách phát triển các sản phẩm CNTT để phục vụ những ngành nghề khác"". Tiến sỹ khẳng định sinh viên học tốt chắc chắn ra trường sẽ có việc làm. Tuy nhiên, lĩnh vực này khó nên sinh viên phải học chăm chỉ và cố gắng thì mới thành công, đòi hòi có năng lực thật sự và có kỹ năng nghề nghiệp.TS. Đặng Trọng Hợp – Trưởng khoa CNTT chia sẻ: ""CNTT là nhóm ngành đang có xu hướng phát triển và nhu cầu nhân lực rất cao và luôn nằm trong tốp đầu những ngành có lương và thu nhập cao"". Theo Tiến sĩ, Khoa Công nghệ thông tin Trường ĐH Công Nghiệp Hà Nội có 4 chuyên ngành công nghệ thông tin, khoa học máy tính, hệ thống thông tin, kỹ thuật phần mềm, nếu sinh viên năm thứ 3 có học lực khá thì ngay năm này có việc làm và có lương. Khoa có mục tiêu giúp sinh viên tiếp\nnext_contents:\n- Tư vấn tuyển sinh trực tuyến nhóm ngành Công nghệ thông tin năm 2022\nTrang HaUI\nPhòng\nPhòng Tổ chức hành chính\nPhòng Đào tạo\nPhòng Công tác sinh viên\nPhòng Khoa học công nghệ\nPhòng hợp tác đối ngoại\nPhòng Tài chính kế toán\nPhòng Quản trị\nPhòng Thanh tra Giáo dục\nKhoa\nKhoa Công nghệ Hoá\nKhoa Công nghệ may & TKTT\nKhoa Công nghệ thông tin\nKhoa Điện\nKhoa Điện tử\nKhoa Khoa học cơ bản\nKhoa Lý luận chính trị - Pháp luật\nTrung tâm Đào tạo\nTrung tâm Đào tạo Sau đại học\nTrung tâm Giáo dục thể chất và Thể thao\nTrung tâm Công nghệ Ô tô và Đào tạo lái xe\nTrung tâm Công nghệ thông tin\nTrung tâm Việt Nhật\nTrung tâm Giáo dục Quốc phòng An ninh\nTrung tâm Dịch vụ\nTrung tâm Truyền thông & Quan hệ Công chúng\nTrạm Y tế\nTrung tâm Hỗ trợ Sinh viên\nTrung tâm Đảm bảo chất lượng\nTrung tâm Thông tin Thư viện\nTrung tâm khảo thí\nViện nghiên cứu\nCông ty Letco\nThư điện tử\nSitemap\nLiên hệ\nToggle navigation\nGIỚI THIỆU\nTHÔNG TIN CHUNG\nCƠ CẤU TỔ CHỨC\nCHIẾN LƯỢC PHÁT TRIỂN\nCÁN BỘ GIẢNG VIÊN\nCƠ SỞ VẬT CHẤT\nLIÊN HỆ\nĐÀO TẠO\nĐẠI HỌC\nKHOA HỌC MÁY TÍNH\nKỸ THUẬT PHẦN MỀM\nHỆ THỐNG THÔNG TIN\nCÔNG NGHỆ THÔNG TIN\nCÔNG NGHỆ ĐA PHƯƠNG TIỆN\nAN TOÀN THÔNG TIN\nSAU ĐẠI HỌC\nHỆ THỐNG THÔNG TIN\nKẾ HOẠCH\nTIẾN ĐỘ\nQUY CHẾ, BIỂU MẪU\nNGHIÊN CỨU KHOA HỌC\nCÔNG TRÌNH CÔNG BỐ\nĐỀ TÀI, DỰ ÁN\nSINH VIÊN NCKH\nTIN KHCN\nCÔNG TÁC SINH VIÊN\nQUY CHẾ\nGƯƠNG SÁNG SINH VIÊN\nHỌC BỔNG\nCÂU LẠC BỘ\nTHƯ VIỆN ẢNH\nTUYỂN DỤNG\nTIN TỨC\nTRANG CHỦ > TIN TỨC\nTư vấn tuyển sinh trực tuyến nhóm ngành Công nghệ thông tin năm 2022\n', 'content: Trần Đăng Hưng09046872823Kỹ thuật và Mạng máy tínhTS. Nguyễn Bá Nghiễn016430172204Công nghệ phần mềmTS. Nguyễn Thị Mỹ Bình09779015995Công nghệ đa phương tiệnTS. Đỗ Mạnh Hùng09161133196Hành chínhTS. Đặng Trọng Hợp0983144899* THƯ KÝ KHOA: Cô Vi Thị Huệ – SĐT: 0942346565* CỐ VẤN HỌC TẬP:- Cô Đặng Thị Nhung – SĐT: 0983210286- Cô Trần Mai Linh – SĐT: 0984291823- Cô Nguyễn Thị Kim Tuyến – SĐT: 0974221649- Cô Trần Thị Trinh – SĐT: 0963005376\nnext_contents:\n- tác ISO, công tác 5S.- Phụ trách hoạt động đổi mới phương pháp giảng dạy, công tác thi giảng viên giỏi nghiệp vụ sư phạm, sinh viên giỏi.- Phụ trách các hoạt động phong trào.- Đảm nhiệm các nhiệm vụ khác khi được Trưởng khoa phân công.- Phụ trách các bộ môn: Hệ thống thông tin, Công nghệ Đa phương tiện.- Sinh hoạt tại bộ môn Hệ thống thông tin.Số ĐT: 0948036600Email: phamvanha@gmail.comPhó Trưởng khoa: PGS.TS. Nguyễn Thị Kim Sơn- Phụ trách công tác mở ngành đào tạo, xây dựng và phát triển chương trình đào tạo sau đại học.- Phụ trách công tác biên soạn giáo trình, tài liệu phục vụ dạy và học các CTĐT trình độ sau đại học.- Phụ trách công tác xây dựng, phát triển chương trình chi tiết, hồ sơ đánh giá kết quả học tập, đánh giá cải tiến CTĐT trình độ sau đại học.- Phụ trách triển khai kế hoạch, tiến độ đào tạo sau đại học.- Hoạt động đổi mới sáng tạo, khởi nghiệp dành cho sinh viên.Số ĐT: 0966857328Email: nguyenthikimson.haui@gmail.com* BAN CHI ỦY CHI BỘ KHOA NHIỆM KỲ 2020-20231. Đặng Trọng Hợp – Bí thư2. Phạm Văn Hà – Phó Bí thư3. Phạm Văn Hiệp - Chi ủy* BAN CHẤP HÀNH CÔNG ĐOÀN KHOA NHIỆM KỲ 2022-20251. Nguyễn Đức Lưu – Chủ tịch2. Phạm Văn Hiệp – Phó chủ tịch3. Vũ Thị Tuyết Mai – Ủy viên* BAN CHẤP HÀNH LIÊN CHI ĐOÀN KHOA NHIỆM KỲ 2024 - 20271. Nguyễn Chiến Thắng – Bí thư2. Nguyễn Trường An – Phó bí thư3. Nguyễn Hoàng Trang Anh – Phó bí thư* BAN CHẤP HÀNH LIÊN CHI HỘI NHIỆM KỲ 2023 - 20251. Vũ Thị Huế - Liên chi Hội trưởng2. Lê Đình Quốc - Liên chi Hội phó3. Vũ Thị Thái Hà - Uỷ viên BCH4. Dương Văn Lộc - Uỷ viên BCH5. Phan Việt Anh - Uỷ viên BCH* CÁC TỔ CHUYÊN MÔNSTTTên bộ môn / TổTrưởng bộ mônSố điện thoại1Khoa học máy tínhTS. Trần Hùng Cường09839347862Hệ thống thông tinTS. Trần Đăng Hưng09046872823Kỹ thuật và Mạng máy tínhTS. Nguyễn Bá Nghiễn016430172204Công nghệ phần mềmTS. Nguyễn Thị Mỹ Bình09779015995Công nghệ đa phương tiệnTS. Đỗ Mạnh Hùng09161133196Hành chínhTS. Đặng Trọng Hợp0983144899* THƯ KÝ KHOA: Cô Vi Thị Huệ – SĐT: 0942346565* CỐ VẤN HỌC TẬP:- Cô Đặng Thị\n']","['CÔNG TÁC SINH VIÊN QUY CHẾ GƯƠNG SÁNG SINH VIÊN HỌC BỔNG CÂU LẠC BỘ THƯ VIỆN ẢNH TUYỂN DỤNG TIN TỨC TRANG CHỦ > TIN TỨC Đại hội đại biểu Liên chi Đoàn khoa Công nghệ thông tin lần thứ X, nhiệm kỳ 2022 - 2024 Ngày 16/04/2022, Đại hội đại biểu Liên chi Đoàn khoa Công nghệ thông tin lần thứ X, nhiệm kỳ 2022 - 2024 đã diễn ra thành công tốt đẹp tại hội trường A11, CS1 Trường Đại học Công nghiệp Hà Nội. ĐẠI HỘI ĐẠI BIỂU LIÊN CHI ĐOÀN KHOA CÔNG NGHỆ THÔNG TIN LẦN THỨ X, NHIỆM KỲ 2022 - 2024Ngày 16/04/2022, Đại hội đại biểu Liên chi Đoàn khoa Công nghệ thông tin lần thứ X, nhiệm kỳ 2022 - 2024 đã diễn ra thành công tốt đẹp tại hội trường A11, CS1 Trường Đại học Công nghiệp Hà Nội. Đây là một sự kiện chính trị quan trọng nhằm báo cáo kết quả hoạt động nhiệm kì 2019 - 2022 và bầu ra BCH Liên chi Đoàn khóa mới, nhiệm kì 2022 - 2024. Hướng tới 25 năm thành lập Khoa CNTT và tầm nhìn chiến lược đến năm 2025.Sau 02 phiên làm việc với tinh thần khẩn trương, nghiêm túc và hiệu quả, Đại hội đã đi đến thống nhất và thông qua Báo cáo Tổng kết nhiệm kỳ 2019 – 2022, đề ra phương hướng và nhiệm vụ nhiệm kỳ 2022 – 2024.Đại hội nhất trí bầu đ/c Trịnh Bá Quý giữ chức vụ Bí thư LCĐ khoa CNTT; đ/c Nguyễn Chiến Thắng và đ/c Lưu Thị Thảo giữ chức vụ Phó Bí thư LCĐ khoa CNTT; 8 đồng chí giữ vai trò Uỷ Viên ban chấp hành LCĐ khoa CNTT:1. Nguyễn Trường An2. Lê Thị Thanh Hoa3. Cam Thị Liễu4. Nguyễn Thuỳ Linh5. Trần Hoàng Minh Quang6. Thân Ngọc Thiện7. Trịnh Sỹ Tới8. Dương Trung TúGhi nhận và tuyên dương những đóng góp của Liên chi đoàn khoa CNTT với công tác Đoàn trong nhiệm kỳ vừa qua, Đoàn trường đã trao tặng giấy khen cho các tập thể và cá nhân đạt thành tích xuất sắc trong công tác Đoàn và phong trào thanh niên nhiệm kỳ 2019 - 2022.Thay mặt Chi bộ, TS Đặng Trọng Hợp - Bí thư chi bộ – Trưởng khoa CNTT đã có lẵng hoa chúc mừng đại hội và phát biểu chỉ đạo. Đồng chí ghi nhận những đóng góp của LCĐ trong nhiệm kỳ vừa qua. Đồng thời, cũng nhấn mạnh các công tác và phong trào của Liên chi cần đẩy mạnh hơn nữa tinh thần xung kích trong các chương trình, phong trào nghiên cứu khoa học, các cuộc thi, hoạt động của các câu lạc bộ đội nhóm.Đại hội Đại biểu Liên chi đoàn khoa Công nghệ thông tin nhiệm kỳ 2022 - 2024 đã diễn ra thành công tốt đẹp. Xin chúc mừng tất cả các đồng chí trong BCH khóa mới, chúc các đồng chí sẽ hoàn thành tốt mọi nhiệm vụ, tạo nên nhiều thành công mới, tiếp tục dẫn dắt LCĐ khoa Công nghệ thông tin luôn là điểm sáng trong công tác Đoàn - Hội của trường Đại học Công nghiệp Hà Nội! Thứ Hai, 15:00 18/04/2022 Tags: Tweet Các bài đã đăng » Lễ bảo vệ Luận văn Thạc sĩ ngành Hệ thống Thông tin Khóa 12 đợt 1&2 (20/12/2024) » Seminar ""Chuỗi bài giảng về Hệ mờ và ứng dụng"" (18/12/2024) » Chúc mừng Ban chủ nhiệm khóa 14 Câu lạc bộ Tin học HIT (17/12/2024) » Chúc mừng thành công Kỳ thi Olympic Tin học Sinh viên Việt Nam lần thứ 33 (OLP’24), Procon và Kỳ thi lập trình sinh viên quốc tế ICPC Asia Hanoi 2024 (17/12/2024) » Việt Nam xuất sắc giành 2 Huy chương Vàng tại ICPC Asia Hanoi 2024 (15/12/2024) » HaUI Orientation - Hướng đi đúng cho sinh viên IT (09/04/2022) » Sinh viên Khoa CNTT hào hứng tham gia hội thảo Cyber Security của công ty HCL Việt Nam (01/04/2022) » DUCAPITAL Holding trao tặng đèn học thông minh cho sinh viên Đại học Công nghiệp Hà Nội (31/03/2022) » Sinh viên HaUI đạt thành tích cao tại Cuộc thi Olympic Tin học sinh viên Việt Nam lần thứ 30 (27/03/2022) » Company Tour Online cùng VTI Academy mở mang kiến thức cho sinh viên (12/03/2022) Tin tiêu điểm Sinh viên Khóa 19 Khoa Công nghệ thông tin đạt Học bổng HaUI 100% toàn khóa học. Thứ Sáu, 11:07 20/09/2024 Đội bóng khoa Công nghệ thông tin cùng những trận cầu đáng nhớ Thứ Bảy, 10:00 23/07/2022 Đại hội đại biểu Liên chi Đoàn khoa Công nghệ thông tin lần thứ X, nhiệm kỳ 2022 - 2024 Thứ Hai, 15:00 18/04/2022 Gặp mặt tân Sinh viên K15 khoa Công nghệ thông tin Thứ Tư, 08:17 28/10/2020 Chương trình thực tập tại SVMC ""SVMC Internship Program 2020"" Thứ Sáu, 14:02 22/05/2020 Các bài đã đăng Lễ bảo vệ Luận văn Thạc sĩ ngành Hệ thống Thông tin Khóa 12 đợt 1&2 Thứ Sáu, 16:01 20/12/2024 Seminar ""Chuỗi bài giảng về Hệ mờ và ứng dụng"" Thứ Tư, 11:25 18/12/2024 Chúc mừng Ban chủ nhiệm khóa 14 Câu lạc bộ Tin học HIT Thứ Ba, 11:07 17/12/2024 Chúc mừng thành công Kỳ thi Olympic Tin học Sinh viên Việt Nam lần thứ 33 (OLP’24), Procon và Kỳ thi lập trình sinh viên quốc tế ICPC Asia Hanoi 2024 Thứ Ba, 10:00 17/12/2024 Việt Nam xuất sắc giành 2 Huy chương Vàng tại ICPC Asia Hanoi 2024 Chủ Nhật, 05:57 15/12/2024 HaUI Orientation - Hướng đi đúng cho sinh viên IT Thứ Bảy, 10:15 09/04/2022 Sinh viên Khoa CNTT hào hứng tham gia hội thảo Cyber Security của công ty HCL Việt Nam Thứ Sáu, 09:45 01/04/2022 DUCAPITAL Holding trao tặng đèn học thông minh cho sinh viên Đại học Công nghiệp Hà Nội Thứ Năm, 20:50 31/03/2022 Sinh viên HaUI đạt thành tích cao tại']","Tôi không có thông tin này về Nguyễn Trường An trong khoa Công nghệ thông tin. Tôi khuyến nghị bạn tham khảo nguồn khác để tìm hiểu thêm. 

Nếu bạn có câu hỏi khác liên quan đến khoa Công nghệ thông tin hoặc các hoạt động của trường, hãy cho tôi biết!",Nguyễn Trường An là một trong 8 đồng chí giữ vai trò Uỷ Viên ban chấp hành Liên chi Đoàn khoa Công nghệ thông tin nhiệm kỳ 2022 - 2024.,0.249999999975,1.0,0.3333333333333333,0.0,0.8661260905730388,0.5725061893463135,4.892853021621704
19,Thầy Nguyễn Văn Thắng đã có những đóng góp gì trong buổi gặp mặt tân sinh viên K15 khoa Công nghệ thông tin?,"['content: Gặp mặt tân Sinh viên K15 khoa Công nghệ thông tin\nTrang HaUI\nPhòng\nPhòng Tổ chức hành chính\nPhòng Đào tạo\nPhòng Công tác sinh viên\nPhòng Khoa học công nghệ\nPhòng hợp tác đối ngoại\nPhòng Tài chính kế toán\nPhòng Quản trị\nPhòng Thanh tra Giáo dục\nKhoa\nKhoa Công nghệ Hoá\nKhoa Công nghệ may & TKTT\nKhoa Công nghệ thông tin\nKhoa Điện\nKhoa Điện tử\nKhoa Khoa học cơ bản\nKhoa Lý luận chính trị - Pháp luật\nTrung tâm Đào tạo\nTrung tâm Đào tạo Sau đại học\nTrung tâm Giáo dục thể chất và Thể thao\nTrung tâm Công nghệ Ô tô và Đào tạo lái xe\nTrung tâm Công nghệ thông tin\nTrung tâm Việt Nhật\nTrung tâm Giáo dục Quốc phòng An ninh\nTrung tâm Dịch vụ\nTrung tâm Truyền thông & Quan hệ Công chúng\nTrạm Y tế\nTrung tâm Hỗ trợ Sinh viên\nTrung tâm Đảm bảo chất lượng\nTrung tâm Thông tin Thư viện\nTrung tâm khảo thí\nViện nghiên cứu\nCông ty Letco\nThư điện tử\nSitemap\nLiên hệ\nToggle navigation\nGIỚI THIỆU\nTHÔNG TIN CHUNG\nCƠ CẤU TỔ CHỨC\nCHIẾN LƯỢC PHÁT TRIỂN\nCÁN BỘ GIẢNG VIÊN\nCƠ SỞ VẬT CHẤT\nLIÊN HỆ\nĐÀO TẠO\nĐẠI HỌC\nKHOA HỌC MÁY TÍNH\nKỸ THUẬT PHẦN MỀM\nHỆ THỐNG THÔNG TIN\nCÔNG NGHỆ THÔNG TIN\nCÔNG NGHỆ ĐA PHƯƠNG TIỆN\nAN TOÀN THÔNG TIN\nSAU ĐẠI HỌC\nHỆ THỐNG THÔNG TIN\nKẾ HOẠCH\nTIẾN ĐỘ\nQUY CHẾ, BIỂU MẪU\nNGHIÊN CỨU KHOA HỌC\nCÔNG TRÌNH CÔNG BỐ\nĐỀ TÀI, DỰ ÁN\nSINH VIÊN NCKH\nTIN KHCN\nCÔNG TÁC SINH VIÊN\nQUY CHẾ\nGƯƠNG SÁNG SINH VIÊN\nHỌC BỔNG\nCÂU LẠC BỘ\nTHƯ VIỆN ẢNH\nTUYỂN DỤNG\nTIN TỨC\nTRANG CHỦ > TIN TỨC\nGặp mặt tân Sinh viên K15 khoa Công nghệ thông tin\nnext_contents:\n', 'content: Gặp mặt tân Sinh viên K15 khoa Công nghệ thông tin\nTrang HaUI\nPhòng\nPhòng Tổ chức hành chính\nPhòng Đào tạo\nPhòng Công tác sinh viên\nPhòng Khoa học công nghệ\nPhòng hợp tác đối ngoại\nPhòng Tài chính kế toán\nPhòng Quản trị\nPhòng Thanh tra Giáo dục\nKhoa\nKhoa Công nghệ Hoá\nKhoa Công nghệ may & TKTT\nKhoa Công nghệ thông tin\nKhoa Điện\nKhoa Điện tử\nKhoa Khoa học cơ bản\nKhoa Lý luận chính trị - Pháp luật\nTrung tâm Đào tạo\nTrung tâm Đào tạo Sau đại học\nTrung tâm Giáo dục thể chất và Thể thao\nTrung tâm Công nghệ Ô tô và Đào tạo lái xe\nTrung tâm Công nghệ thông tin\nTrung tâm Việt Nhật\nTrung tâm Giáo dục Quốc phòng An ninh\nTrung tâm Dịch vụ\nTrung tâm Truyền thông & Quan hệ Công chúng\nTrạm Y tế\nTrung tâm Hỗ trợ Sinh viên\nTrung tâm Đảm bảo chất lượng\nTrung tâm Thông tin Thư viện\nTrung tâm khảo thí\nViện nghiên cứu\nCông ty Letco\nThư điện tử\nSitemap\nLiên hệ\nToggle navigation\nGIỚI THIỆU\nTHÔNG TIN CHUNG\nCƠ CẤU TỔ CHỨC\nCHIẾN LƯỢC PHÁT TRIỂN\nCÁN BỘ GIẢNG VIÊN\nCƠ SỞ VẬT CHẤT\nLIÊN HỆ\nĐÀO TẠO\nĐẠI HỌC\nKHOA HỌC MÁY TÍNH\nKỸ THUẬT PHẦN MỀM\nHỆ THỐNG THÔNG TIN\nCÔNG NGHỆ THÔNG TIN\nCÔNG NGHỆ ĐA PHƯƠNG TIỆN\nAN TOÀN THÔNG TIN\nSAU ĐẠI HỌC\nHỆ THỐNG THÔNG TIN\nKẾ HOẠCH\nTIẾN ĐỘ\nQUY CHẾ, BIỂU MẪU\nNGHIÊN CỨU KHOA HỌC\nCÔNG TRÌNH CÔNG BỐ\nĐỀ TÀI, DỰ ÁN\nSINH VIÊN NCKH\nTIN KHCN\nCÔNG TÁC SINH VIÊN\nQUY CHẾ\nGƯƠNG SÁNG SINH VIÊN\nHỌC BỔNG\nCÂU LẠC BỘ\nTHƯ VIỆN ẢNH\nTUYỂN DỤNG\nTIN TỨC\nTRANG CHỦ > TIN TỨC\nGặp mặt tân Sinh viên K15 khoa Công nghệ thông tin\nnext_contents:\n', 'content: Thạc sỹ Hệ thống thông tin - ĐẠI HỌC CÔNG NGHIỆP HÀ NỘI || HaUI\nTrang HaUI\nPhòng\nPhòng Tổ chức hành chính\nPhòng Đào tạo\nPhòng Công tác sinh viên\nPhòng Khoa học công nghệ\nPhòng hợp tác đối ngoại\nPhòng Tài chính kế toán\nPhòng Quản trị\nPhòng Thanh tra Giáo dục\nKhoa\nKhoa Công nghệ Hoá\nKhoa Công nghệ may & TKTT\nKhoa Công nghệ thông tin\nKhoa Điện\nKhoa Điện tử\nKhoa Khoa học cơ bản\nKhoa Lý luận chính trị - Pháp luật\nTrung tâm Đào tạo\nTrung tâm Đào tạo Sau đại học\nTrung tâm Giáo dục thể chất và Thể thao\nTrung tâm Công nghệ Ô tô và Đào tạo lái xe\nTrung tâm Công nghệ thông tin\nTrung tâm Việt Nhật\nTrung tâm Giáo dục Quốc phòng An ninh\nTrung tâm Dịch vụ\nTrung tâm Truyền thông & Quan hệ Công chúng\nTrạm Y tế\nTrung tâm Hỗ trợ Sinh viên\nTrung tâm Đảm bảo chất lượng\nTrung tâm Thông tin Thư viện\nTrung tâm khảo thí\nViện nghiên cứu\nCông ty Letco\nThư điện tử\nSitemap\nLiên hệ\nToggle navigation\nGIỚI THIỆU\nTHÔNG TIN CHUNG\nCƠ CẤU TỔ CHỨC\nCHIẾN LƯỢC PHÁT TRIỂN\nCÁN BỘ GIẢNG VIÊN\nCƠ SỞ VẬT CHẤT\nLIÊN HỆ\nĐÀO TẠO\nĐẠI HỌC\nKHOA HỌC MÁY TÍNH\nKỸ THUẬT PHẦN MỀM\nHỆ THỐNG THÔNG TIN\nCÔNG NGHỆ THÔNG TIN\nCÔNG NGHỆ ĐA PHƯƠNG TIỆN\nAN TOÀN THÔNG TIN\nSAU ĐẠI HỌC\nHỆ THỐNG THÔNG TIN\nKẾ HOẠCH\nTIẾN ĐỘ\nQUY CHẾ, BIỂU MẪU\nNGHIÊN CỨU KHOA HỌC\nCÔNG TRÌNH CÔNG BỐ\nĐỀ TÀI, DỰ ÁN\nSINH VIÊN NCKH\nTIN KHCN\nCÔNG TÁC SINH VIÊN\nQUY CHẾ\nGƯƠNG SÁNG SINH VIÊN\nHỌC BỔNG\nCÂU LẠC BỘ\nTHƯ VIỆN ẢNH\nTUYỂN DỤNG\nCao học Hệ thống thông tin\nTin tiêu điểm\nSinh viên Khóa 19 Khoa Công nghệ thông tin đạt Học bổng HaUI 100% toàn khóa học.\nThứ Sáu, 11:07 20/09/2024\nĐội bóng khoa Công nghệ thông tin cùng những trận cầu đáng nhớ\nThứ Bảy, 10:00 23/07/2022\nĐại hội đại biểu Liên chi Đoàn khoa Công nghệ thông tin lần thứ X, nhiệm kỳ 2022 - 2024\nThứ Hai, 15:00 18/04/2022\nGặp mặt tân Sinh viên K15 khoa Công nghệ thông tin\nnext_contents:\n', 'content: Thạc sỹ Hệ thống thông tin - ĐẠI HỌC CÔNG NGHIỆP HÀ NỘI || HaUI\nTrang HaUI\nPhòng\nPhòng Tổ chức hành chính\nPhòng Đào tạo\nPhòng Công tác sinh viên\nPhòng Khoa học công nghệ\nPhòng hợp tác đối ngoại\nPhòng Tài chính kế toán\nPhòng Quản trị\nPhòng Thanh tra Giáo dục\nKhoa\nKhoa Công nghệ Hoá\nKhoa Công nghệ may & TKTT\nKhoa Công nghệ thông tin\nKhoa Điện\nKhoa Điện tử\nKhoa Khoa học cơ bản\nKhoa Lý luận chính trị - Pháp luật\nTrung tâm Đào tạo\nTrung tâm Đào tạo Sau đại học\nTrung tâm Giáo dục thể chất và Thể thao\nTrung tâm Công nghệ Ô tô và Đào tạo lái xe\nTrung tâm Công nghệ thông tin\nTrung tâm Việt Nhật\nTrung tâm Giáo dục Quốc phòng An ninh\nTrung tâm Dịch vụ\nTrung tâm Truyền thông & Quan hệ Công chúng\nTrạm Y tế\nTrung tâm Hỗ trợ Sinh viên\nTrung tâm Đảm bảo chất lượng\nTrung tâm Thông tin Thư viện\nTrung tâm khảo thí\nViện nghiên cứu\nCông ty Letco\nThư điện tử\nSitemap\nLiên hệ\nToggle navigation\nGIỚI THIỆU\nTHÔNG TIN CHUNG\nCƠ CẤU TỔ CHỨC\nCHIẾN LƯỢC PHÁT TRIỂN\nCÁN BỘ GIẢNG VIÊN\nCƠ SỞ VẬT CHẤT\nLIÊN HỆ\nĐÀO TẠO\nĐẠI HỌC\nKHOA HỌC MÁY TÍNH\nKỸ THUẬT PHẦN MỀM\nHỆ THỐNG THÔNG TIN\nCÔNG NGHỆ THÔNG TIN\nCÔNG NGHỆ ĐA PHƯƠNG TIỆN\nAN TOÀN THÔNG TIN\nSAU ĐẠI HỌC\nHỆ THỐNG THÔNG TIN\nKẾ HOẠCH\nTIẾN ĐỘ\nQUY CHẾ, BIỂU MẪU\nNGHIÊN CỨU KHOA HỌC\nCÔNG TRÌNH CÔNG BỐ\nĐỀ TÀI, DỰ ÁN\nSINH VIÊN NCKH\nTIN KHCN\nCÔNG TÁC SINH VIÊN\nQUY CHẾ\nGƯƠNG SÁNG SINH VIÊN\nHỌC BỔNG\nCÂU LẠC BỘ\nTHƯ VIỆN ẢNH\nTUYỂN DỤNG\nCao học Hệ thống thông tin\nTin tiêu điểm\nSinh viên Khóa 19 Khoa Công nghệ thông tin đạt Học bổng HaUI 100% toàn khóa học.\nThứ Sáu, 11:07 20/09/2024\nĐội bóng khoa Công nghệ thông tin cùng những trận cầu đáng nhớ\nThứ Bảy, 10:00 23/07/2022\nĐại hội đại biểu Liên chi Đoàn khoa Công nghệ thông tin lần thứ X, nhiệm kỳ 2022 - 2024\nThứ Hai, 15:00 18/04/2022\nGặp mặt tân Sinh viên K15 khoa Công nghệ thông tin\nnext_contents:\n']","['CÔNG TÁC SINH VIÊN QUY CHẾ GƯƠNG SÁNG SINH VIÊN HỌC BỔNG CÂU LẠC BỘ THƯ VIỆN ẢNH TUYỂN DỤNG TIN TỨC TRANG CHỦ > TIN TỨC Gặp mặt tân Sinh viên K15 khoa Công nghệ thông tin Chương trình để lại những ấn tượng sâu đậm trong lòng các thầy cô và các sinh viên, đánh dấu sự khởi đầu tốt đẹp cho một năm học hứa hẹn nhiều thành công. Trong không khí vui mừng, rạo rực những ngày đầu nhập học, buổi gặp mặt vừa là dịp để khoa giới thiệu ngành nghề, cơ hội việc làm, vừa là dịp để các em tân sinh viên giao lưu với cựu sinh viên trong khoa, biết được xu thế Công nghệ thông tin và định hướng trong công việc học tập phía trước. Đến tham dự buổi gặp mặt, có TS. Đặng Trọng Hợp – Phụ trách khoa, TS Trần Tiến Dũng – Phó khoa; Bí thư chi đoàn; Các thầy côc chủ nhiệm lớp; đại diện doanh nghiệp học viện IT Plus, cùng toàn thể tân sinh viên Khóa 15. Mở đầu chương trình được chào đón bằng các tiết mục văn nghệ đặc sắc, sôi động do đội văn nghệ của khoa biểu diễn. Tiếp đó, TS Đặng Trọng Hợp – Phụ trách khoa- đại diện cho Ban lãnh đạo khoa phát biểu, chúc mừng hơn 1000 tân sinh viên khóa 15 đã trúng tuyển vào khoa Công nghệ thông tin. Thầy giới thiệu đôi nét về khoa, về ngành nghề và về cơ hội việc làm trong lĩnh vực Công nghệ thông tin.TS Đặng Trọng Hợp - Phụ trách khoa giới thiệu về khoa và cơ hội việc làm Thầy Nguyễn Văn Thắng - Phó khoa CNTT hướng dẫn sinh viên về Quy chế đào tạo tín chỉĐồng chí Trịnh Bá Qúy – Bí thư Chi đoàn Khoa Công nghệ thông tin, giới thiệu về các tổ chức, phong trào tiêu biểu, những thành tích mà các tập thể, cá nhân đạt được trong năm học vừa qua của hoạt động Đoàn với mong muốn trong thời gian tới, hoạt động đoàn hội cũng như hoạt động Nghiên cứu khoa học sẽ thu hút nhiều gương mặt tân sinh viên tham gia. Đặc biệt các em được gặp gỡ và giao lưu với đại diện từ học viện IT Plus, mang đến cho các em Tân sinh viên niềm tự hào, hy vọng và lòng quyết tâm cao khi chọnCông nghệ thông tin.Đại diện Học viện IT Plus chia sẻ về nghề nghiệp và xu hướng Công nghệ thông tin hiện naTại buổi chào mừng, Khoa Công nghệ thông tin kết hợp với Học viện IT Plus tặng giấy khen và trao thưởng cho các em đạt điểm đầu vào cao nhất. Đây là nguồn động viên, khích lệ để các sinh viên tiếp tục cố gắng và đạt thành tích cao hơn nữa trong thời gian tới.Các sinh viên có điểm đầu vào cao nhất được khoa quan tâm, động viên bằng phần thưởng cho sự cố gắng nỗ lực của các emVới sự chuẩn bị chu đáo và không khí cởi mở, buổi gặp mặt đã diễn ra sôi nổi và thành công. Kết thúc chương trình, các bạn tân sinh viên ra về trong sự vui vẻ, tràn đầy năng lượng để tiếp tục gắn bó với khoa 4 năm tới, để lại những ấn tượng sâu đậm trong lòng các thầy cô và các sinh viên, đánh dấu sự khởi đầu tốt đẹp cho một năm học hứa hẹn nhiều thành công.Tập thể lớp chụp ảnh lưu niệm cùng các thầy cô Thứ Tư, 08:17 28/10/2020 Tags: Tweet Các bài đã đăng » Lễ bảo vệ Luận văn Thạc sĩ ngành Hệ thống Thông tin Khóa 12 đợt 1&2 (20/12/2024) » Seminar ""Chuỗi bài giảng về Hệ mờ và ứng dụng"" (18/12/2024) » Chúc mừng Ban chủ nhiệm khóa 14 Câu lạc bộ Tin học HIT (17/12/2024) » Chúc mừng thành công Kỳ thi Olympic Tin học Sinh viên Việt Nam lần thứ 33 (OLP’24), Procon và Kỳ thi lập trình sinh viên quốc tế ICPC Asia Hanoi 2024 (17/12/2024) » Việt Nam xuất sắc giành 2 Huy chương Vàng tại ICPC Asia Hanoi 2024 (15/12/2024) » Sinh viên khoa Công nghệ thông tin dành huy chương Vàng tại kỳ thi Kỹ năng nghề Quốc gia lần thứ XI năm 2020. (28/10/2020) » IT Supporter FIT - HaUI kỷ niệm 6 năm thành lập và phát triển (29/09/2020) » Trao giải Sinh viên nghiên cứu khoa học Năm 2020 (28/08/2020) » FIT NEWS 5+6/2020 (14/07/2020) » Sinh viên khoa Công nghệ thông tin nhận học bổng Sun* Scholarship (06/03/2020) Tin tiêu điểm Sinh viên Khóa 19 Khoa Công nghệ thông tin đạt Học bổng HaUI 100% toàn khóa học. Thứ Sáu, 11:07 20/09/2024 Đội bóng khoa Công nghệ thông tin cùng những trận cầu đáng nhớ Thứ Bảy, 10:00 23/07/2022 Đại hội đại biểu Liên chi Đoàn khoa Công nghệ thông tin lần thứ X, nhiệm kỳ 2022 - 2024 Thứ Hai, 15:00 18/04/2022 Gặp mặt tân Sinh viên K15 khoa Công nghệ thông tin Thứ Tư, 08:17 28/10/2020 Chương trình thực tập tại SVMC ""SVMC Internship Program 2020"" Thứ Sáu, 14:02 22/05/2020 Các bài đã đăng Lễ bảo vệ Luận văn Thạc sĩ ngành Hệ thống Thông tin Khóa 12 đợt 1&2 Thứ Sáu, 16:01 20/12/2024 Seminar ""Chuỗi bài giảng về Hệ mờ và ứng dụng"" Thứ Tư, 11:25 18/12/2024 Chúc mừng Ban chủ nhiệm khóa 14 Câu lạc bộ Tin học HIT Thứ Ba, 11:07 17/12/2024 Chúc mừng thành công Kỳ thi Olympic Tin học Sinh viên Việt Nam lần thứ 33 (OLP’24), Procon và Kỳ thi lập trình sinh viên quốc tế ICPC Asia Hanoi 2024 Thứ Ba, 10:00 17/12/2024 Việt Nam xuất sắc giành 2 Huy chương Vàng tại ICPC Asia Hanoi 2024 Chủ Nhật, 05:57 15/12/2024 Sinh viên khoa Công nghệ thông tin dành huy chương']","Tôi không có thông tin này về những đóng góp cụ thể của thầy Nguyễn Văn Thắng trong buổi gặp mặt tân sinh viên K15 khoa Công nghệ thông tin. Tôi khuyến nghị bạn tham khảo thêm thông tin từ các nguồn khác hoặc trang web chính thức của khoa để có được thông tin chi tiết hơn.

Nếu bạn có câu hỏi khác hoặc cần thêm thông tin, hãy cho tôi biết!","Thầy Nguyễn Văn Thắng, Phó khoa Công nghệ thông tin, đã hướng dẫn sinh viên về Quy chế đào tạo tín chỉ trong buổi gặp mặt tân sinh viên K15. Thầy cũng đã có những chia sẻ về ngành nghề và cơ hội việc làm trong lĩnh vực Công nghệ thông tin, giúp các em tân sinh viên hiểu rõ hơn về định hướng học tập và nghề nghiệp trong tương lai.",0.0,0.0,0.0,0.0,0.9071893687715049,0.6502969264984131,5.651246070861816
20,Chương trình thực tập tại Samsung có những lợi ích gì cho sinh viên?,"['content: QUY CHẾ\nGƯƠNG SÁNG SINH VIÊN\nHỌC BỔNG\nCÂU LẠC BỘ\nTHƯ VIỆN ẢNH\nTUYỂN DỤNG\nTUYỂN DỤNG\nTRANG CHỦ > TUYỂN DỤNG\nChương trình thực tập tại SVMC ""SVMC Internship Program 2020""\nSVMC Internship Program là chương trình ý nghĩa, thiết thực nhằm chuẩn bị hành trang trước khi ra trường cho các bạn sinh viên, cung cấp nền tảng tri thức và kỹ năng vững chắc cần có để trở thành một Kỹ sư Lập trình tài năng theo tiêu chuẩn toàn cầu của Tập đoàn Samsung.1. Thông tin chương trình thực tập Kỳ hè năm 20201.1. Đối tượng xét tuyển:Sinh viên Đại học chính quy dự kiến tốt nghiệp tháng 12/2020, 06/2021 Khoa Công nghệ thông tin Trường ĐH Công nghiệp Hà Nội.Điểm trung bình tích lũy tất cả các kỳ tính đến học kỳ gần nhất: CPA ≥ 2.0/4Yêu thích Yêu thích hoặc biết lập trình phần mềm (mức cơ bản): C/C++/JavaChưa được nhận học bổng STP, chưa từng tham dự SVMC Internship Program1.2. Thời gian: Thời gian 4 tuần, có 2 đợt vào tháng 07/2020 và tháng 08/2020Sinh viên được đăng ký lịch thực tập phù hợp với lịch học.1.3. Địa điểm: Trung tâm Nghiên cứu và Phát triển điện thoại di động Samsung Việt Nam (SVMC): số 1 Phạm Văn Bạch, Yên Hoà, Cầu Giấy, Hà Nội 1.4. Quyền lợi:Được đào tạo bài bản về: Thuật toán, C/C++/Java/Android,...Được hướng dẫn, giảng dạy bởi các kỹ sư giàu kinh nghiệm và tận tình của SVMCĐược tham gia và làm trực tiếp các mini-projectsĐược cấp giấy chứng nhận thực tập tại SVMCCó cơ hội nhận được học bổng Tài năng STP của SVMC và cơ hội trở thành nhân viên chính thức của SVMC nếu vượt qua bài thi cuối kỳ thực tậpĐược hỗ trợ 3,200,000 VNĐ/ sinh viên2. Quy trình xét tuyểnTừ ngày 15/05/2020 – 26/05/2020: Sinh viên đăng ký thực tập online tại đâyNgày 30/05/2020: Làm bài Test phân loại trình độ tại SVMCTừ ngày 02 ~ 03/06/2020: Phỏng vấn tại SVMCTháng 7/2020 – tháng 8/2020: Tham gia thực tập tại SVMC\nThứ Sáu, 14:02 22/05/2020\nnext_contents:\n- Chương trình thực tập tại SVMC ""SVMC Internship Program 2020""\nTrang HaUI\nPhòng\nPhòng Tổ chức hành chính\nPhòng Đào tạo\nPhòng Công tác sinh viên\nPhòng Khoa học công nghệ\nPhòng hợp tác đối ngoại\nPhòng Tài chính kế toán\nPhòng Quản trị\nPhòng Thanh tra Giáo dục\nKhoa\nKhoa Công nghệ Hoá\nKhoa Công nghệ may & TKTT\nKhoa Công nghệ thông tin\nKhoa Điện\nKhoa Điện tử\nKhoa Khoa học cơ bản\nKhoa Lý luận chính trị - Pháp luật\nTrung tâm Đào tạo\nTrung tâm Đào tạo Sau đại học\nTrung tâm Giáo dục thể chất và Thể thao\nTrung tâm Công nghệ Ô tô và Đào tạo lái xe\nTrung tâm Công nghệ thông tin\nTrung tâm Việt Nhật\nTrung tâm Giáo dục Quốc phòng An ninh\nTrung tâm Dịch vụ\nTrung tâm Truyền thông & Quan hệ Công chúng\nTrạm Y tế\nTrung tâm Hỗ trợ Sinh viên\nTrung tâm Đảm bảo chất lượng\nTrung tâm Thông tin Thư viện\nTrung tâm khảo thí\nViện nghiên cứu\nCông ty Letco\nThư điện tử\nSitemap\nLiên hệ\nToggle navigation\nGIỚI THIỆU\nTHÔNG TIN CHUNG\nCƠ CẤU TỔ CHỨC\nCHIẾN LƯỢC PHÁT TRIỂN\nCÁN BỘ GIẢNG VIÊN\nCƠ SỞ VẬT CHẤT\nLIÊN HỆ\nĐÀO TẠO\nĐẠI HỌC\nKHOA HỌC MÁY TÍNH\nKỸ THUẬT PHẦN MỀM\nHỆ THỐNG THÔNG TIN\nCÔNG NGHỆ THÔNG TIN\nCÔNG NGHỆ ĐA PHƯƠNG TIỆN\nAN TOÀN THÔNG TIN\nSAU ĐẠI HỌC\nHỆ THỐNG THÔNG TIN\nKẾ HOẠCH\nTIẾN ĐỘ\nQUY CHẾ, BIỂU MẪU\nNGHIÊN CỨU KHOA HỌC\nCÔNG TRÌNH CÔNG BỐ\nĐỀ TÀI, DỰ ÁN\nSINH VIÊN NCKH\nTIN KHCN\nCÔNG TÁC SINH VIÊN\nQUY CHẾ\nGƯƠNG SÁNG SINH VIÊN\nHỌC BỔNG\nCÂU LẠC BỘ\nTHƯ VIỆN ẢNH\nTUYỂN DỤNG\nTUYỂN DỤNG\nTRANG CHỦ > TUYỂN DỤNG\nChương trình thực tập tại SVMC ""SVMC Internship Program 2020""\n', 'content: QUY CHẾ\nGƯƠNG SÁNG SINH VIÊN\nHỌC BỔNG\nCÂU LẠC BỘ\nTHƯ VIỆN ẢNH\nTUYỂN DỤNG\nTUYỂN DỤNG\nTRANG CHỦ > TUYỂN DỤNG\nChương trình thực tập tại SVMC ""SVMC Internship Program 2020""\nSVMC Internship Program là chương trình ý nghĩa, thiết thực nhằm chuẩn bị hành trang trước khi ra trường cho các bạn sinh viên, cung cấp nền tảng tri thức và kỹ năng vững chắc cần có để trở thành một Kỹ sư Lập trình tài năng theo tiêu chuẩn toàn cầu của Tập đoàn Samsung.1. Thông tin chương trình thực tập Kỳ hè năm 20201.1. Đối tượng xét tuyển:Sinh viên Đại học chính quy dự kiến tốt nghiệp tháng 12/2020, 06/2021 Khoa Công nghệ thông tin Trường ĐH Công nghiệp Hà Nội.Điểm trung bình tích lũy tất cả các kỳ tính đến học kỳ gần nhất: CPA ≥ 2.0/4Yêu thích Yêu thích hoặc biết lập trình phần mềm (mức cơ bản): C/C++/JavaChưa được nhận học bổng STP, chưa từng tham dự SVMC Internship Program1.2. Thời gian: Thời gian 4 tuần, có 2 đợt vào tháng 07/2020 và tháng 08/2020Sinh viên được đăng ký lịch thực tập phù hợp với lịch học.1.3. Địa điểm: Trung tâm Nghiên cứu và Phát triển điện thoại di động Samsung Việt Nam (SVMC): số 1 Phạm Văn Bạch, Yên Hoà, Cầu Giấy, Hà Nội 1.4. Quyền lợi:Được đào tạo bài bản về: Thuật toán, C/C++/Java/Android,...Được hướng dẫn, giảng dạy bởi các kỹ sư giàu kinh nghiệm và tận tình của SVMCĐược tham gia và làm trực tiếp các mini-projectsĐược cấp giấy chứng nhận thực tập tại SVMCCó cơ hội nhận được học bổng Tài năng STP của SVMC và cơ hội trở thành nhân viên chính thức của SVMC nếu vượt qua bài thi cuối kỳ thực tậpĐược hỗ trợ 3,200,000 VNĐ/ sinh viên2. Quy trình xét tuyểnTừ ngày 15/05/2020 – 26/05/2020: Sinh viên đăng ký thực tập online tại đâyNgày 30/05/2020: Làm bài Test phân loại trình độ tại SVMCTừ ngày 02 ~ 03/06/2020: Phỏng vấn tại SVMCTháng 7/2020 – tháng 8/2020: Tham gia thực tập tại SVMC\nThứ Sáu, 14:02 22/05/2020\nnext_contents:\n- Chương trình thực tập tại SVMC ""SVMC Internship Program 2020""\nTrang HaUI\nPhòng\nPhòng Tổ chức hành chính\nPhòng Đào tạo\nPhòng Công tác sinh viên\nPhòng Khoa học công nghệ\nPhòng hợp tác đối ngoại\nPhòng Tài chính kế toán\nPhòng Quản trị\nPhòng Thanh tra Giáo dục\nKhoa\nKhoa Công nghệ Hoá\nKhoa Công nghệ may & TKTT\nKhoa Công nghệ thông tin\nKhoa Điện\nKhoa Điện tử\nKhoa Khoa học cơ bản\nKhoa Lý luận chính trị - Pháp luật\nTrung tâm Đào tạo\nTrung tâm Đào tạo Sau đại học\nTrung tâm Giáo dục thể chất và Thể thao\nTrung tâm Công nghệ Ô tô và Đào tạo lái xe\nTrung tâm Công nghệ thông tin\nTrung tâm Việt Nhật\nTrung tâm Giáo dục Quốc phòng An ninh\nTrung tâm Dịch vụ\nTrung tâm Truyền thông & Quan hệ Công chúng\nTrạm Y tế\nTrung tâm Hỗ trợ Sinh viên\nTrung tâm Đảm bảo chất lượng\nTrung tâm Thông tin Thư viện\nTrung tâm khảo thí\nViện nghiên cứu\nCông ty Letco\nThư điện tử\nSitemap\nLiên hệ\nToggle navigation\nGIỚI THIỆU\nTHÔNG TIN CHUNG\nCƠ CẤU TỔ CHỨC\nCHIẾN LƯỢC PHÁT TRIỂN\nCÁN BỘ GIẢNG VIÊN\nCƠ SỞ VẬT CHẤT\nLIÊN HỆ\nĐÀO TẠO\nĐẠI HỌC\nKHOA HỌC MÁY TÍNH\nKỸ THUẬT PHẦN MỀM\nHỆ THỐNG THÔNG TIN\nCÔNG NGHỆ THÔNG TIN\nCÔNG NGHỆ ĐA PHƯƠNG TIỆN\nAN TOÀN THÔNG TIN\nSAU ĐẠI HỌC\nHỆ THỐNG THÔNG TIN\nKẾ HOẠCH\nTIẾN ĐỘ\nQUY CHẾ, BIỂU MẪU\nNGHIÊN CỨU KHOA HỌC\nCÔNG TRÌNH CÔNG BỐ\nĐỀ TÀI, DỰ ÁN\nSINH VIÊN NCKH\nTIN KHCN\nCÔNG TÁC SINH VIÊN\nQUY CHẾ\nGƯƠNG SÁNG SINH VIÊN\nHỌC BỔNG\nCÂU LẠC BỘ\nTHƯ VIỆN ẢNH\nTUYỂN DỤNG\nTUYỂN DỤNG\nTRANG CHỦ > TUYỂN DỤNG\nChương trình thực tập tại SVMC ""SVMC Internship Program 2020""\n', 'content: GƯƠNG SÁNG SINH VIÊN\nHỌC BỔNG\nCÂU LẠC BỘ\nTHƯ VIỆN ẢNH\nTUYỂN DỤNG\nGƯƠNG SÁNG SINH VIÊN\nTRANG CHỦ > GƯƠNG SÁNG SINH VIÊN\nHọc bổng là phần thưởng xứng đáng cho nỗ lực của sinh viên\nHọc bổng Tài năng Samsung (Samsung Talent Program - STP) là sáng kiến hợp tác giữa tập đoàn Samsung và các trường Đại học lớn miền Bắc nhằm phát triển nguồn nhân lực chất lượng cao, ươm mầm và nuôi dưỡng tài năng xuất sắc cho lĩnh vực phần mềm sáng tạo của Việt Nam. Kể từ khi ra đời vào năm 2012, hơn 650 suất học bổng với tổng trị giá hơn 50 tỷ đồng đã được trao cho sinh viên của các trường Đại học, thể hiện trách nhiệm xã hội mà hơn hết là sự cam kết đầu tư lâu dài và bền vững của Samsung tại Việt Nam.Nhiều năm qua, Đại học Công nghiệp Hà Nội tích cực phối hợp với Samsung Việt Nam trong công tác đào tạo, tuyển dụng lao động. Bên cạnh đó, Công ty còn thường xuyên tài trợ cho Nhà trường như: Tài trợ thiết bị phục vụ việc giảng dạy, học tập và hoạt động của Nhà trường; tài trợ học bổng; tài trợ tổ chức các cuộc thi…Tuổi trẻ không thể thiếu đi sự bản lĩnh, nhiệt huyết và những trải nghiệm quý giá, vì thế, khi có cơ hội, hãy nắm bắt, vì biết đâu bạn sẽ được tỏa sáng theo cách của riêng mình, và trở thành một trong những “chiến thần” tiếp theo rinh học bổng có giá trị cao của Samsung Việt Nam.\nThứ Năm, 13:37 25/04/2024\nTags:\nTweet\nCác bài đã đăng\n» Sinh viên Khoa Công nghệ thông tin ghi thành tích nổi bật tại Olympic Tin học sinh viên Việt Nam lần thứ 33 và Kỳ thi Lập trình ICPC ASIA Hà Nội năm 2024 (16/12/2024)\n» Sinh viên Khoa Công nghệ thông tin xuất sắc nhận học bổng của Doanh nghiệp Hàn Quốc năm 2024 (09/12/2024)\n» Sinh viên Khoa Công nghệ thông tin nhận học bổng BROTHER năm học 2024-2025 (03/12/2024)\nnext_contents:\n- Học bổng là phần thưởng xứng đáng cho nỗ lực của sinh viên\nTrang HaUI\nPhòng\nPhòng Tổ chức hành chính\nPhòng Đào tạo\nPhòng Công tác sinh viên\nPhòng Khoa học công nghệ\nPhòng hợp tác đối ngoại\nPhòng Tài chính kế toán\nPhòng Quản trị\nPhòng Thanh tra Giáo dục\nKhoa\nKhoa Công nghệ Hoá\nKhoa Công nghệ may & TKTT\nKhoa Công nghệ thông tin\nKhoa Điện\nKhoa Điện tử\nKhoa Khoa học cơ bản\nKhoa Lý luận chính trị - Pháp luật\nTrung tâm Đào tạo\nTrung tâm Đào tạo Sau đại học\nTrung tâm Giáo dục thể chất và Thể thao\nTrung tâm Công nghệ Ô tô và Đào tạo lái xe\nTrung tâm Công nghệ thông tin\nTrung tâm Việt Nhật\nTrung tâm Giáo dục Quốc phòng An ninh\nTrung tâm Dịch vụ\nTrung tâm Truyền thông & Quan hệ Công chúng\nTrạm Y tế\nTrung tâm Hỗ trợ Sinh viên\nTrung tâm Đảm bảo chất lượng\nTrung tâm Thông tin Thư viện\nTrung tâm khảo thí\nViện nghiên cứu\nCông ty Letco\nThư điện tử\nSitemap\nLiên hệ\nToggle navigation\nGIỚI THIỆU\nTHÔNG TIN CHUNG\nCƠ CẤU TỔ CHỨC\nCHIẾN LƯỢC PHÁT TRIỂN\nCÁN BỘ GIẢNG VIÊN\nCƠ SỞ VẬT CHẤT\nLIÊN HỆ\nĐÀO TẠO\nĐẠI HỌC\nKHOA HỌC MÁY TÍNH\nKỸ THUẬT PHẦN MỀM\nHỆ THỐNG THÔNG TIN\nCÔNG NGHỆ THÔNG TIN\nCÔNG NGHỆ ĐA PHƯƠNG TIỆN\nAN TOÀN THÔNG TIN\nSAU ĐẠI HỌC\nHỆ THỐNG THÔNG TIN\nKẾ HOẠCH\nTIẾN ĐỘ\nQUY CHẾ, BIỂU MẪU\nNGHIÊN CỨU KHOA HỌC\nCÔNG TRÌNH CÔNG BỐ\nĐỀ TÀI, DỰ ÁN\nSINH VIÊN NCKH\nTIN KHCN\nCÔNG TÁC SINH VIÊN\nQUY CHẾ\nGƯƠNG SÁNG SINH VIÊN\nHỌC BỔNG\nCÂU LẠC BỘ\nTHƯ VIỆN ẢNH\nTUYỂN DỤNG\nGƯƠNG SÁNG SINH VIÊN\nTRANG CHỦ > GƯƠNG SÁNG SINH VIÊN\nHọc bổng là phần thưởng xứng đáng cho nỗ lực của sinh viên\n', 'content: GƯƠNG SÁNG SINH VIÊN\nHỌC BỔNG\nCÂU LẠC BỘ\nTHƯ VIỆN ẢNH\nTUYỂN DỤNG\nGƯƠNG SÁNG SINH VIÊN\nTRANG CHỦ > GƯƠNG SÁNG SINH VIÊN\nHọc bổng là phần thưởng xứng đáng cho nỗ lực của sinh viên\nHọc bổng Tài năng Samsung (Samsung Talent Program - STP) là sáng kiến hợp tác giữa tập đoàn Samsung và các trường Đại học lớn miền Bắc nhằm phát triển nguồn nhân lực chất lượng cao, ươm mầm và nuôi dưỡng tài năng xuất sắc cho lĩnh vực phần mềm sáng tạo của Việt Nam. Kể từ khi ra đời vào năm 2012, hơn 650 suất học bổng với tổng trị giá hơn 50 tỷ đồng đã được trao cho sinh viên của các trường Đại học, thể hiện trách nhiệm xã hội mà hơn hết là sự cam kết đầu tư lâu dài và bền vững của Samsung tại Việt Nam.Nhiều năm qua, Đại học Công nghiệp Hà Nội tích cực phối hợp với Samsung Việt Nam trong công tác đào tạo, tuyển dụng lao động. Bên cạnh đó, Công ty còn thường xuyên tài trợ cho Nhà trường như: Tài trợ thiết bị phục vụ việc giảng dạy, học tập và hoạt động của Nhà trường; tài trợ học bổng; tài trợ tổ chức các cuộc thi…Tuổi trẻ không thể thiếu đi sự bản lĩnh, nhiệt huyết và những trải nghiệm quý giá, vì thế, khi có cơ hội, hãy nắm bắt, vì biết đâu bạn sẽ được tỏa sáng theo cách của riêng mình, và trở thành một trong những “chiến thần” tiếp theo rinh học bổng có giá trị cao của Samsung Việt Nam.\nThứ Năm, 13:37 25/04/2024\nTags:\nTweet\nCác bài đã đăng\n» Sinh viên Khoa Công nghệ thông tin ghi thành tích nổi bật tại Olympic Tin học sinh viên Việt Nam lần thứ 33 và Kỳ thi Lập trình ICPC ASIA Hà Nội năm 2024 (16/12/2024)\n» Sinh viên Khoa Công nghệ thông tin xuất sắc nhận học bổng của Doanh nghiệp Hàn Quốc năm 2024 (09/12/2024)\n» Sinh viên Khoa Công nghệ thông tin nhận học bổng BROTHER năm học 2024-2025 (03/12/2024)\nnext_contents:\n- Học bổng là phần thưởng xứng đáng cho nỗ lực của sinh viên\nTrang HaUI\nPhòng\nPhòng Tổ chức hành chính\nPhòng Đào tạo\nPhòng Công tác sinh viên\nPhòng Khoa học công nghệ\nPhòng hợp tác đối ngoại\nPhòng Tài chính kế toán\nPhòng Quản trị\nPhòng Thanh tra Giáo dục\nKhoa\nKhoa Công nghệ Hoá\nKhoa Công nghệ may & TKTT\nKhoa Công nghệ thông tin\nKhoa Điện\nKhoa Điện tử\nKhoa Khoa học cơ bản\nKhoa Lý luận chính trị - Pháp luật\nTrung tâm Đào tạo\nTrung tâm Đào tạo Sau đại học\nTrung tâm Giáo dục thể chất và Thể thao\nTrung tâm Công nghệ Ô tô và Đào tạo lái xe\nTrung tâm Công nghệ thông tin\nTrung tâm Việt Nhật\nTrung tâm Giáo dục Quốc phòng An ninh\nTrung tâm Dịch vụ\nTrung tâm Truyền thông & Quan hệ Công chúng\nTrạm Y tế\nTrung tâm Hỗ trợ Sinh viên\nTrung tâm Đảm bảo chất lượng\nTrung tâm Thông tin Thư viện\nTrung tâm khảo thí\nViện nghiên cứu\nCông ty Letco\nThư điện tử\nSitemap\nLiên hệ\nToggle navigation\nGIỚI THIỆU\nTHÔNG TIN CHUNG\nCƠ CẤU TỔ CHỨC\nCHIẾN LƯỢC PHÁT TRIỂN\nCÁN BỘ GIẢNG VIÊN\nCƠ SỞ VẬT CHẤT\nLIÊN HỆ\nĐÀO TẠO\nĐẠI HỌC\nKHOA HỌC MÁY TÍNH\nKỸ THUẬT PHẦN MỀM\nHỆ THỐNG THÔNG TIN\nCÔNG NGHỆ THÔNG TIN\nCÔNG NGHỆ ĐA PHƯƠNG TIỆN\nAN TOÀN THÔNG TIN\nSAU ĐẠI HỌC\nHỆ THỐNG THÔNG TIN\nKẾ HOẠCH\nTIẾN ĐỘ\nQUY CHẾ, BIỂU MẪU\nNGHIÊN CỨU KHOA HỌC\nCÔNG TRÌNH CÔNG BỐ\nĐỀ TÀI, DỰ ÁN\nSINH VIÊN NCKH\nTIN KHCN\nCÔNG TÁC SINH VIÊN\nQUY CHẾ\nGƯƠNG SÁNG SINH VIÊN\nHỌC BỔNG\nCÂU LẠC BỘ\nTHƯ VIỆN ẢNH\nTUYỂN DỤNG\nGƯƠNG SÁNG SINH VIÊN\nTRANG CHỦ > GƯƠNG SÁNG SINH VIÊN\nHọc bổng là phần thưởng xứng đáng cho nỗ lực của sinh viên\n']","['Chương trình thực tập tại SVMC ""SVMC Internship Program 2020"" Trang HaUI Phòng Phòng Tổ chức hành chính Phòng Đào tạo Phòng Công tác sinh viên Phòng Khoa học công nghệ Phòng hợp tác đối ngoại Phòng Tài chính kế toán Phòng Quản trị Phòng Thanh tra Giáo dục Khoa Khoa Công nghệ Hoá Khoa Công nghệ may & TKTT Khoa Công nghệ thông tin Khoa Điện Khoa Điện tử Khoa Khoa học cơ bản Khoa Lý luận chính trị - Pháp luật Trung tâm Đào tạo Trung tâm Đào tạo Sau đại học Trung tâm Giáo dục thể chất và Thể thao Trung tâm Công nghệ Ô tô và Đào tạo lái xe Trung tâm Công nghệ thông tin Trung tâm Việt Nhật Trung tâm Giáo dục Quốc phòng An ninh Trung tâm Dịch vụ Trung tâm Truyền thông & Quan hệ Công chúng Trạm Y tế Trung tâm Hỗ trợ Sinh viên Trung tâm Đảm bảo chất lượng Trung tâm Thông tin Thư viện Trung tâm khảo thí Viện nghiên cứu Công ty Letco Thư điện tử Sitemap Liên hệ Toggle navigation GIỚI THIỆU THÔNG TIN CHUNG CƠ CẤU TỔ CHỨC CHIẾN LƯỢC PHÁT TRIỂN CÁN BỘ GIẢNG VIÊN CƠ SỞ VẬT CHẤT LIÊN HỆ ĐÀO TẠO ĐẠI HỌC KHOA HỌC MÁY TÍNH KỸ THUẬT PHẦN MỀM HỆ THỐNG THÔNG TIN CÔNG NGHỆ THÔNG TIN CÔNG NGHỆ ĐA PHƯƠNG TIỆN AN TOÀN THÔNG TIN SAU ĐẠI HỌC HỆ THỐNG THÔNG TIN KẾ HOẠCH TIẾN ĐỘ QUY CHẾ, BIỂU MẪU NGHIÊN CỨU KHOA HỌC CÔNG TRÌNH CÔNG BỐ ĐỀ TÀI, DỰ ÁN SINH VIÊN NCKH TIN KHCN CÔNG TÁC SINH VIÊN QUY CHẾ GƯƠNG SÁNG SINH VIÊN HỌC BỔNG CÂU LẠC BỘ THƯ VIỆN ẢNH TUYỂN DỤNG TUYỂN DỤNG TRANG CHỦ > TUYỂN DỤNG Chương trình thực tập tại SVMC ""SVMC Internship Program 2020"" SVMC Internship Program là chương trình ý nghĩa, thiết thực nhằm chuẩn bị hành trang trước khi ra trường cho các bạn sinh viên, cung cấp nền tảng tri thức và kỹ năng vững chắc cần có để trở thành một Kỹ sư Lập trình tài năng theo tiêu chuẩn toàn cầu của Tập đoàn Samsung.1. Thông tin chương trình thực tập Kỳ hè năm 20201.1. Đối tượng xét tuyển:Sinh viên Đại học chính quy dự kiến tốt nghiệp tháng 12/2020, 06/2021 Khoa Công nghệ thông tin Trường ĐH Công nghiệp Hà Nội.Điểm trung bình tích lũy tất cả các kỳ tính đến học kỳ gần nhất: CPA ≥ 2.0/4Yêu thích Yêu thích hoặc biết lập trình phần mềm (mức cơ bản): C/C++/JavaChưa được nhận học bổng STP, chưa từng tham dự SVMC Internship Program1.2. Thời gian: Thời gian 4 tuần, có 2 đợt vào tháng 07/2020 và tháng 08/2020Sinh viên được đăng ký lịch thực tập phù hợp với lịch học.1.3. Địa điểm: Trung tâm Nghiên cứu và Phát triển điện thoại di động Samsung Việt Nam (SVMC): số 1 Phạm Văn Bạch, Yên Hoà, Cầu Giấy, Hà Nội 1.4. Quyền lợi:Được đào tạo bài bản về: Thuật toán, C/C++/Java/Android,...Được hướng dẫn, giảng dạy bởi các kỹ sư giàu kinh nghiệm và tận tình của SVMCĐược tham gia và làm trực tiếp các mini-projectsĐược cấp giấy chứng nhận thực tập tại SVMCCó cơ hội nhận được học bổng Tài năng STP của SVMC và cơ hội trở thành nhân viên chính thức của SVMC nếu vượt qua bài thi cuối kỳ thực tậpĐược hỗ trợ 3,200,000 VNĐ/ sinh viên2.']","Chương trình thực tập tại Samsung (SVMC Internship Program) mang lại nhiều lợi ích cho sinh viên, cụ thể như sau:

1. **Đào tạo chuyên sâu**: Sinh viên được đào tạo bài bản về các lĩnh vực như thuật toán, C/C++, Java, Android, giúp nâng cao kiến thức và kỹ năng lập trình.

2. **Hướng dẫn từ chuyên gia**: Sinh viên sẽ được hướng dẫn và giảng dạy bởi các kỹ sư giàu kinh nghiệm và tận tình của Samsung, tạo cơ hội học hỏi từ những người có chuyên môn cao.

3. **Thực hành dự án thực tế**: Sinh viên có cơ hội tham gia và làm việc trực tiếp trên các mini-projects, giúp áp dụng lý thuyết vào thực tiễn.

4. **Chứng nhận thực tập**: Sau khi hoàn thành chương trình, sinh viên sẽ nhận được giấy chứng nhận thực tập tại SVMC, có giá trị trong hồ sơ xin việc.

5. **Cơ hội học bổng**: Sinh viên có cơ hội nhận học bổng Tài năng Samsung (STP) và có khả năng trở thành nhân viên chính thức của SVMC nếu vượt qua bài thi cuối kỳ thực tập.

6. **Hỗ trợ tài chính**: Mỗi sinh viên tham gia chương trình sẽ được hỗ trợ 3,200,000 VNĐ.

Chương trình này không chỉ giúp sinh viên chuẩn bị tốt hơn cho sự nghiệp mà còn mở ra nhiều cơ hội việc làm trong tương lai.

Nguồn: [Chương trình thực tập tại SVMC](https://fit.haui.edu.vn/vn/tuyen-dung/chuong-trinh-thuc-tap-tai-svmc-svmc-internship-program-2020/66304) - [**Link tham khảo**](https://fit.haui.edu.vn/vn/tuyen-dung/chuong-trinh-thuc-tap-tai-svmc-svmc-internship-program-2020/66304).

Nếu bạn có thêm câu hỏi nào khác hoặc cần thông tin chi tiết hơn, hãy cho tôi biết!","Chương trình thực tập tại Samsung mang lại nhiều lợi ích cho sinh viên, bao gồm được đào tạo bài bản về thuật toán, C/C++/Java/Android, hướng dẫn bởi các kỹ sư giàu kinh nghiệm, tham gia vào các mini-projects, cấp giấy chứng nhận thực tập, cơ hội nhận học bổng Tài năng STP và cơ hội trở thành nhân viên chính thức nếu vượt qua bài thi cuối kỳ thực tập.",0.99999999995,1.0,0.9047619047619048,0.8523107202341466,0.9408270570662688,0.574425220489502,16.628433227539062
21,Học bổng STP có những điều kiện gì để sinh viên có thể nhận được?,"['content: Học bổng là phần thưởng xứng đáng cho nỗ lực của sinh viên\nTrang HaUI\nPhòng\nPhòng Tổ chức hành chính\nPhòng Đào tạo\nPhòng Công tác sinh viên\nPhòng Khoa học công nghệ\nPhòng hợp tác đối ngoại\nPhòng Tài chính kế toán\nPhòng Quản trị\nPhòng Thanh tra Giáo dục\nKhoa\nKhoa Công nghệ Hoá\nKhoa Công nghệ may & TKTT\nKhoa Công nghệ thông tin\nKhoa Điện\nKhoa Điện tử\nKhoa Khoa học cơ bản\nKhoa Lý luận chính trị - Pháp luật\nTrung tâm Đào tạo\nTrung tâm Đào tạo Sau đại học\nTrung tâm Giáo dục thể chất và Thể thao\nTrung tâm Công nghệ Ô tô và Đào tạo lái xe\nTrung tâm Công nghệ thông tin\nTrung tâm Việt Nhật\nTrung tâm Giáo dục Quốc phòng An ninh\nTrung tâm Dịch vụ\nTrung tâm Truyền thông & Quan hệ Công chúng\nTrạm Y tế\nTrung tâm Hỗ trợ Sinh viên\nTrung tâm Đảm bảo chất lượng\nTrung tâm Thông tin Thư viện\nTrung tâm khảo thí\nViện nghiên cứu\nCông ty Letco\nThư điện tử\nSitemap\nLiên hệ\nToggle navigation\nGIỚI THIỆU\nTHÔNG TIN CHUNG\nCƠ CẤU TỔ CHỨC\nCHIẾN LƯỢC PHÁT TRIỂN\nCÁN BỘ GIẢNG VIÊN\nCƠ SỞ VẬT CHẤT\nLIÊN HỆ\nĐÀO TẠO\nĐẠI HỌC\nKHOA HỌC MÁY TÍNH\nKỸ THUẬT PHẦN MỀM\nHỆ THỐNG THÔNG TIN\nCÔNG NGHỆ THÔNG TIN\nCÔNG NGHỆ ĐA PHƯƠNG TIỆN\nAN TOÀN THÔNG TIN\nSAU ĐẠI HỌC\nHỆ THỐNG THÔNG TIN\nKẾ HOẠCH\nTIẾN ĐỘ\nQUY CHẾ, BIỂU MẪU\nNGHIÊN CỨU KHOA HỌC\nCÔNG TRÌNH CÔNG BỐ\nĐỀ TÀI, DỰ ÁN\nSINH VIÊN NCKH\nTIN KHCN\nCÔNG TÁC SINH VIÊN\nQUY CHẾ\nGƯƠNG SÁNG SINH VIÊN\nHỌC BỔNG\nCÂU LẠC BỘ\nTHƯ VIỆN ẢNH\nTUYỂN DỤNG\nGƯƠNG SÁNG SINH VIÊN\nTRANG CHỦ > GƯƠNG SÁNG SINH VIÊN\nHọc bổng là phần thưởng xứng đáng cho nỗ lực của sinh viên\nnext_contents:\n', 'content: Học bổng là phần thưởng xứng đáng cho nỗ lực của sinh viên\nTrang HaUI\nPhòng\nPhòng Tổ chức hành chính\nPhòng Đào tạo\nPhòng Công tác sinh viên\nPhòng Khoa học công nghệ\nPhòng hợp tác đối ngoại\nPhòng Tài chính kế toán\nPhòng Quản trị\nPhòng Thanh tra Giáo dục\nKhoa\nKhoa Công nghệ Hoá\nKhoa Công nghệ may & TKTT\nKhoa Công nghệ thông tin\nKhoa Điện\nKhoa Điện tử\nKhoa Khoa học cơ bản\nKhoa Lý luận chính trị - Pháp luật\nTrung tâm Đào tạo\nTrung tâm Đào tạo Sau đại học\nTrung tâm Giáo dục thể chất và Thể thao\nTrung tâm Công nghệ Ô tô và Đào tạo lái xe\nTrung tâm Công nghệ thông tin\nTrung tâm Việt Nhật\nTrung tâm Giáo dục Quốc phòng An ninh\nTrung tâm Dịch vụ\nTrung tâm Truyền thông & Quan hệ Công chúng\nTrạm Y tế\nTrung tâm Hỗ trợ Sinh viên\nTrung tâm Đảm bảo chất lượng\nTrung tâm Thông tin Thư viện\nTrung tâm khảo thí\nViện nghiên cứu\nCông ty Letco\nThư điện tử\nSitemap\nLiên hệ\nToggle navigation\nGIỚI THIỆU\nTHÔNG TIN CHUNG\nCƠ CẤU TỔ CHỨC\nCHIẾN LƯỢC PHÁT TRIỂN\nCÁN BỘ GIẢNG VIÊN\nCƠ SỞ VẬT CHẤT\nLIÊN HỆ\nĐÀO TẠO\nĐẠI HỌC\nKHOA HỌC MÁY TÍNH\nKỸ THUẬT PHẦN MỀM\nHỆ THỐNG THÔNG TIN\nCÔNG NGHỆ THÔNG TIN\nCÔNG NGHỆ ĐA PHƯƠNG TIỆN\nAN TOÀN THÔNG TIN\nSAU ĐẠI HỌC\nHỆ THỐNG THÔNG TIN\nKẾ HOẠCH\nTIẾN ĐỘ\nQUY CHẾ, BIỂU MẪU\nNGHIÊN CỨU KHOA HỌC\nCÔNG TRÌNH CÔNG BỐ\nĐỀ TÀI, DỰ ÁN\nSINH VIÊN NCKH\nTIN KHCN\nCÔNG TÁC SINH VIÊN\nQUY CHẾ\nGƯƠNG SÁNG SINH VIÊN\nHỌC BỔNG\nCÂU LẠC BỘ\nTHƯ VIỆN ẢNH\nTUYỂN DỤNG\nGƯƠNG SÁNG SINH VIÊN\nTRANG CHỦ > GƯƠNG SÁNG SINH VIÊN\nHọc bổng là phần thưởng xứng đáng cho nỗ lực của sinh viên\nnext_contents:\n', 'content: GƯƠNG SÁNG SINH VIÊN\nHỌC BỔNG\nCÂU LẠC BỘ\nTHƯ VIỆN ẢNH\nTUYỂN DỤNG\nGƯƠNG SÁNG SINH VIÊN\nTRANG CHỦ > GƯƠNG SÁNG SINH VIÊN\nHọc bổng là phần thưởng xứng đáng cho nỗ lực của sinh viên\nHọc bổng Tài năng Samsung (Samsung Talent Program - STP) là sáng kiến hợp tác giữa tập đoàn Samsung và các trường Đại học lớn miền Bắc nhằm phát triển nguồn nhân lực chất lượng cao, ươm mầm và nuôi dưỡng tài năng xuất sắc cho lĩnh vực phần mềm sáng tạo của Việt Nam. Kể từ khi ra đời vào năm 2012, hơn 650 suất học bổng với tổng trị giá hơn 50 tỷ đồng đã được trao cho sinh viên của các trường Đại học, thể hiện trách nhiệm xã hội mà hơn hết là sự cam kết đầu tư lâu dài và bền vững của Samsung tại Việt Nam.Nhiều năm qua, Đại học Công nghiệp Hà Nội tích cực phối hợp với Samsung Việt Nam trong công tác đào tạo, tuyển dụng lao động. Bên cạnh đó, Công ty còn thường xuyên tài trợ cho Nhà trường như: Tài trợ thiết bị phục vụ việc giảng dạy, học tập và hoạt động của Nhà trường; tài trợ học bổng; tài trợ tổ chức các cuộc thi…Tuổi trẻ không thể thiếu đi sự bản lĩnh, nhiệt huyết và những trải nghiệm quý giá, vì thế, khi có cơ hội, hãy nắm bắt, vì biết đâu bạn sẽ được tỏa sáng theo cách của riêng mình, và trở thành một trong những “chiến thần” tiếp theo rinh học bổng có giá trị cao của Samsung Việt Nam.\nThứ Năm, 13:37 25/04/2024\nTags:\nTweet\nCác bài đã đăng\n» Sinh viên Khoa Công nghệ thông tin ghi thành tích nổi bật tại Olympic Tin học sinh viên Việt Nam lần thứ 33 và Kỳ thi Lập trình ICPC ASIA Hà Nội năm 2024 (16/12/2024)\n» Sinh viên Khoa Công nghệ thông tin xuất sắc nhận học bổng của Doanh nghiệp Hàn Quốc năm 2024 (09/12/2024)\n» Sinh viên Khoa Công nghệ thông tin nhận học bổng BROTHER năm học 2024-2025 (03/12/2024)\nnext_contents:\n- Học bổng là phần thưởng xứng đáng cho nỗ lực của sinh viên\nTrang HaUI\nPhòng\nPhòng Tổ chức hành chính\nPhòng Đào tạo\nPhòng Công tác sinh viên\nPhòng Khoa học công nghệ\nPhòng hợp tác đối ngoại\nPhòng Tài chính kế toán\nPhòng Quản trị\nPhòng Thanh tra Giáo dục\nKhoa\nKhoa Công nghệ Hoá\nKhoa Công nghệ may & TKTT\nKhoa Công nghệ thông tin\nKhoa Điện\nKhoa Điện tử\nKhoa Khoa học cơ bản\nKhoa Lý luận chính trị - Pháp luật\nTrung tâm Đào tạo\nTrung tâm Đào tạo Sau đại học\nTrung tâm Giáo dục thể chất và Thể thao\nTrung tâm Công nghệ Ô tô và Đào tạo lái xe\nTrung tâm Công nghệ thông tin\nTrung tâm Việt Nhật\nTrung tâm Giáo dục Quốc phòng An ninh\nTrung tâm Dịch vụ\nTrung tâm Truyền thông & Quan hệ Công chúng\nTrạm Y tế\nTrung tâm Hỗ trợ Sinh viên\nTrung tâm Đảm bảo chất lượng\nTrung tâm Thông tin Thư viện\nTrung tâm khảo thí\nViện nghiên cứu\nCông ty Letco\nThư điện tử\nSitemap\nLiên hệ\nToggle navigation\nGIỚI THIỆU\nTHÔNG TIN CHUNG\nCƠ CẤU TỔ CHỨC\nCHIẾN LƯỢC PHÁT TRIỂN\nCÁN BỘ GIẢNG VIÊN\nCƠ SỞ VẬT CHẤT\nLIÊN HỆ\nĐÀO TẠO\nĐẠI HỌC\nKHOA HỌC MÁY TÍNH\nKỸ THUẬT PHẦN MỀM\nHỆ THỐNG THÔNG TIN\nCÔNG NGHỆ THÔNG TIN\nCÔNG NGHỆ ĐA PHƯƠNG TIỆN\nAN TOÀN THÔNG TIN\nSAU ĐẠI HỌC\nHỆ THỐNG THÔNG TIN\nKẾ HOẠCH\nTIẾN ĐỘ\nQUY CHẾ, BIỂU MẪU\nNGHIÊN CỨU KHOA HỌC\nCÔNG TRÌNH CÔNG BỐ\nĐỀ TÀI, DỰ ÁN\nSINH VIÊN NCKH\nTIN KHCN\nCÔNG TÁC SINH VIÊN\nQUY CHẾ\nGƯƠNG SÁNG SINH VIÊN\nHỌC BỔNG\nCÂU LẠC BỘ\nTHƯ VIỆN ẢNH\nTUYỂN DỤNG\nGƯƠNG SÁNG SINH VIÊN\nTRANG CHỦ > GƯƠNG SÁNG SINH VIÊN\nHọc bổng là phần thưởng xứng đáng cho nỗ lực của sinh viên\n', 'content: GƯƠNG SÁNG SINH VIÊN\nHỌC BỔNG\nCÂU LẠC BỘ\nTHƯ VIỆN ẢNH\nTUYỂN DỤNG\nGƯƠNG SÁNG SINH VIÊN\nTRANG CHỦ > GƯƠNG SÁNG SINH VIÊN\nHọc bổng là phần thưởng xứng đáng cho nỗ lực của sinh viên\nHọc bổng Tài năng Samsung (Samsung Talent Program - STP) là sáng kiến hợp tác giữa tập đoàn Samsung và các trường Đại học lớn miền Bắc nhằm phát triển nguồn nhân lực chất lượng cao, ươm mầm và nuôi dưỡng tài năng xuất sắc cho lĩnh vực phần mềm sáng tạo của Việt Nam. Kể từ khi ra đời vào năm 2012, hơn 650 suất học bổng với tổng trị giá hơn 50 tỷ đồng đã được trao cho sinh viên của các trường Đại học, thể hiện trách nhiệm xã hội mà hơn hết là sự cam kết đầu tư lâu dài và bền vững của Samsung tại Việt Nam.Nhiều năm qua, Đại học Công nghiệp Hà Nội tích cực phối hợp với Samsung Việt Nam trong công tác đào tạo, tuyển dụng lao động. Bên cạnh đó, Công ty còn thường xuyên tài trợ cho Nhà trường như: Tài trợ thiết bị phục vụ việc giảng dạy, học tập và hoạt động của Nhà trường; tài trợ học bổng; tài trợ tổ chức các cuộc thi…Tuổi trẻ không thể thiếu đi sự bản lĩnh, nhiệt huyết và những trải nghiệm quý giá, vì thế, khi có cơ hội, hãy nắm bắt, vì biết đâu bạn sẽ được tỏa sáng theo cách của riêng mình, và trở thành một trong những “chiến thần” tiếp theo rinh học bổng có giá trị cao của Samsung Việt Nam.\nThứ Năm, 13:37 25/04/2024\nTags:\nTweet\nCác bài đã đăng\n» Sinh viên Khoa Công nghệ thông tin ghi thành tích nổi bật tại Olympic Tin học sinh viên Việt Nam lần thứ 33 và Kỳ thi Lập trình ICPC ASIA Hà Nội năm 2024 (16/12/2024)\n» Sinh viên Khoa Công nghệ thông tin xuất sắc nhận học bổng của Doanh nghiệp Hàn Quốc năm 2024 (09/12/2024)\n» Sinh viên Khoa Công nghệ thông tin nhận học bổng BROTHER năm học 2024-2025 (03/12/2024)\nnext_contents:\n- Học bổng là phần thưởng xứng đáng cho nỗ lực của sinh viên\nTrang HaUI\nPhòng\nPhòng Tổ chức hành chính\nPhòng Đào tạo\nPhòng Công tác sinh viên\nPhòng Khoa học công nghệ\nPhòng hợp tác đối ngoại\nPhòng Tài chính kế toán\nPhòng Quản trị\nPhòng Thanh tra Giáo dục\nKhoa\nKhoa Công nghệ Hoá\nKhoa Công nghệ may & TKTT\nKhoa Công nghệ thông tin\nKhoa Điện\nKhoa Điện tử\nKhoa Khoa học cơ bản\nKhoa Lý luận chính trị - Pháp luật\nTrung tâm Đào tạo\nTrung tâm Đào tạo Sau đại học\nTrung tâm Giáo dục thể chất và Thể thao\nTrung tâm Công nghệ Ô tô và Đào tạo lái xe\nTrung tâm Công nghệ thông tin\nTrung tâm Việt Nhật\nTrung tâm Giáo dục Quốc phòng An ninh\nTrung tâm Dịch vụ\nTrung tâm Truyền thông & Quan hệ Công chúng\nTrạm Y tế\nTrung tâm Hỗ trợ Sinh viên\nTrung tâm Đảm bảo chất lượng\nTrung tâm Thông tin Thư viện\nTrung tâm khảo thí\nViện nghiên cứu\nCông ty Letco\nThư điện tử\nSitemap\nLiên hệ\nToggle navigation\nGIỚI THIỆU\nTHÔNG TIN CHUNG\nCƠ CẤU TỔ CHỨC\nCHIẾN LƯỢC PHÁT TRIỂN\nCÁN BỘ GIẢNG VIÊN\nCƠ SỞ VẬT CHẤT\nLIÊN HỆ\nĐÀO TẠO\nĐẠI HỌC\nKHOA HỌC MÁY TÍNH\nKỸ THUẬT PHẦN MỀM\nHỆ THỐNG THÔNG TIN\nCÔNG NGHỆ THÔNG TIN\nCÔNG NGHỆ ĐA PHƯƠNG TIỆN\nAN TOÀN THÔNG TIN\nSAU ĐẠI HỌC\nHỆ THỐNG THÔNG TIN\nKẾ HOẠCH\nTIẾN ĐỘ\nQUY CHẾ, BIỂU MẪU\nNGHIÊN CỨU KHOA HỌC\nCÔNG TRÌNH CÔNG BỐ\nĐỀ TÀI, DỰ ÁN\nSINH VIÊN NCKH\nTIN KHCN\nCÔNG TÁC SINH VIÊN\nQUY CHẾ\nGƯƠNG SÁNG SINH VIÊN\nHỌC BỔNG\nCÂU LẠC BỘ\nTHƯ VIỆN ẢNH\nTUYỂN DỤNG\nGƯƠNG SÁNG SINH VIÊN\nTRANG CHỦ > GƯƠNG SÁNG SINH VIÊN\nHọc bổng là phần thưởng xứng đáng cho nỗ lực của sinh viên\n']","['NGHIÊN CỨU KHOA HỌC CÔNG TRÌNH CÔNG BỐ ĐỀ TÀI, DỰ ÁN SINH VIÊN NCKH TIN KHCN CÔNG TÁC SINH VIÊN QUY CHẾ GƯƠNG SÁNG SINH VIÊN HỌC BỔNG CÂU LẠC BỘ THƯ VIỆN ẢNH TUYỂN DỤNG TUYỂN DỤNG TRANG CHỦ > TUYỂN DỤNG Chương trình thực tập tại SVMC ""SVMC Internship Program 2020"" SVMC Internship Program là chương trình ý nghĩa, thiết thực nhằm chuẩn bị hành trang trước khi ra trường cho các bạn sinh viên, cung cấp nền tảng tri thức và kỹ năng vững chắc cần có để trở thành một Kỹ sư Lập trình tài năng theo tiêu chuẩn toàn cầu của Tập đoàn Samsung.1. Thông tin chương trình thực tập Kỳ hè năm 20201.1. Đối tượng xét tuyển:Sinh viên Đại học chính quy dự kiến tốt nghiệp tháng 12/2020, 06/2021 Khoa Công nghệ thông tin Trường ĐH Công nghiệp Hà Nội.Điểm trung bình tích lũy tất cả các kỳ tính đến học kỳ gần nhất: CPA ≥ 2.0/4Yêu thích Yêu thích hoặc biết lập trình phần mềm (mức cơ bản): C/C++/JavaChưa được nhận học bổng STP, chưa từng tham dự SVMC Internship Program1.2. Thời gian: Thời gian 4 tuần, có 2 đợt vào tháng 07/2020 và tháng 08/2020Sinh viên được đăng ký lịch thực tập phù hợp với lịch học.1.3. Địa điểm: Trung tâm Nghiên cứu và Phát triển điện thoại di động Samsung Việt Nam (SVMC): số 1 Phạm Văn Bạch, Yên Hoà, Cầu Giấy, Hà Nội 1.4. Quyền lợi:Được đào tạo bài bản về: Thuật toán, C/C++/Java/Android,...Được hướng dẫn, giảng dạy bởi các kỹ sư giàu kinh nghiệm và tận tình của SVMCĐược tham gia và làm trực tiếp các mini-projectsĐược cấp giấy chứng nhận thực tập tại SVMCCó cơ hội nhận được học bổng Tài năng STP của SVMC và cơ hội trở thành nhân viên chính thức của SVMC nếu vượt qua bài thi cuối kỳ thực tậpĐược hỗ trợ 3,200,000 VNĐ/ sinh viên2. Quy trình xét tuyểnTừ ngày 15/05/2020 – 26/05/2020: Sinh viên đăng ký thực tập online tại đâyNgày 30/05/2020: Làm bài Test phân loại trình độ tại SVMCTừ ngày 02 ~ 03/06/2020: Phỏng vấn tại SVMCTháng 7/2020 – tháng 8/2020: Tham gia thực tập tại SVMC Thứ Sáu, 14:02 22/05/2020 Tags: Tweet Các bài đã đăng » Công ty Gameloft tuyển Thực tập sinh Developer 2024 (17/12/2024) » Trung tâm Nghiên cứu và Phát triển Samsung Việt Nam (SRV) tại Hà Nội thông báo tuyển dụng Kỹ sư lập trình (09/12/2024) » Công ty Nashtech tuyển dụng thực tập sinh năm 2024 (03/12/2024) » Thông báo tổ chức chương trình Hội thảo phỏng vấn thực tập, tuyển dụng của Công ty TNHH LG Innotek Việt Nam Hải Phòng - Thứ 3, ngày 12/11/2024 (07/11/2024) » Công ty TNHH Samsung Electronics Việt Nam thông báo chương trình tuyển thực tập sinh đợt 2 năm 2024 (30/10/2024) » TCT giải pháp doanh nghiệp Viettel tuyển dụng nhân sự ngành Công nghệ thông tin. (21/05/2020) » Công ty TNHH LinxHQ tuyển dụng (06/03/2020) » Công ty TNHH HITECH Việt Nam tuyển dụng (06/03/2020) » Thông tin tuyển dụng tháng 9/2019 (12/09/2019) » Công ty Simba Technology thông báo tuyển nhân sự (09/05/2019) Tin tiêu điểm Sinh viên Khóa 19 Khoa Công nghệ thông tin đạt Học bổng HaUI 100% toàn khóa học. Thứ Sáu, 11:07 20/09/2024 Đội bóng khoa Công nghệ thông tin cùng những trận cầu đáng nhớ Thứ Bảy, 10:00 23/07/2022 Đại hội đại biểu Liên chi Đoàn khoa Công nghệ thông tin lần thứ X, nhiệm kỳ 2022 - 2024 Thứ Hai, 15:00 18/04/2022 Gặp mặt tân Sinh viên K15 khoa Công nghệ thông tin Thứ Tư, 08:17 28/10/2020 Chương trình thực tập tại SVMC ""SVMC Internship Program 2020"" Thứ Sáu, 14:02 22/05/2020 Các bài đã đăng Công ty Gameloft tuyển Thực tập sinh Developer 2024 Thứ Ba, 15:50 17/12/2024 Trung tâm Nghiên cứu và Phát triển Samsung Việt Nam (SRV) tại Hà Nội thông báo tuyển dụng Kỹ sư lập trình Thứ Hai, 08:53 09/12/2024 Công ty Nashtech tuyển dụng thực tập sinh năm 2024 Thứ Ba, 09:17 03/12/2024 Thông báo tổ chức chương trình Hội thảo phỏng vấn thực tập, tuyển dụng của Công ty TNHH LG Innotek Việt Nam Hải Phòng - Thứ 3, ngày 12/11/2024 Thứ Năm, 11:20 07/11/2024 Công ty TNHH Samsung Electronics Việt Nam thông báo chương trình tuyển thực tập sinh đợt 2 năm 2024 Thứ Tư, 11:13 30/10/2024 TCT giải pháp doanh nghiệp Viettel tuyển dụng nhân sự ngành Công nghệ thông tin. Thứ Năm, 08:08 21/05/2020 Công ty TNHH LinxHQ tuyển dụng Thứ Sáu, 09:12 06/03/2020 Công ty TNHH HITECH Việt Nam tuyển dụng Thứ Sáu, 09:09 06/03/2020 Thông tin tuyển dụng tháng 9/2019 Thứ Năm, 08:12 12/09/2019 Công ty Simba Technology thông báo tuyển nhân sự Thứ Năm, 08:09 09/05/2019 Bản đồ chỉ dẫn Trường Đại học Công nghiệp Hà Nội Trụ sở chính Số 298 đường Cầu Diễn, quận Bắc Từ Liêm, Hà Nội +84 243 765 5121 Email: dhcnhn@haui.edu.vn Các cơ sở khác Cơ sở 2: Phường Tây Tựu, quận Bắc Từ Liêm, Hà Nội Cơ sở 3: Phường Lê Hồng Phong, thành phố Phủ Lý, Hà Nam Liên kết site Trường Đại học Công nghiệp Hà Nội Thông tin tuyển sinh Hành chính điện tử Đào tạo trực tuyến Cổng thông tin đào tạo Copyright © 2018 Hanoi University of Industry.']","Học bổng Tài năng Samsung (Samsung Talent Program - STP) là một sáng kiến hợp tác giữa tập đoàn Samsung và các trường Đại học lớn miền Bắc, nhằm phát triển nguồn nhân lực chất lượng cao trong lĩnh vực phần mềm sáng tạo tại Việt Nam. Để nhận được học bổng này, sinh viên cần đáp ứng một số điều kiện nhất định, bao gồm:

1. **Tham gia chương trình**: Sinh viên phải tham gia vào chương trình học bổng STP do Samsung tổ chức.
2. **Thành tích học tập**: Sinh viên cần có thành tích học tập tốt, thể hiện qua điểm số hoặc các chứng chỉ liên quan.
3. **Kỹ năng và năng lực**: Sinh viên cần có kỹ năng và năng lực phù hợp với yêu cầu của chương trình, có thể bao gồm các kỹ năng lập trình, tư duy sáng tạo, và khả năng làm việc nhóm.
4. **Hoạt động ngoại khóa**: Tham gia các hoạt động ngoại khóa, dự án nghiên cứu hoặc các cuộc thi liên quan đến công nghệ thông tin có thể là một lợi thế.

Học bổng này không chỉ là phần thưởng cho nỗ lực học tập mà còn là cơ hội để sinh viên phát triển bản thân và sự nghiệp trong lĩnh vực công nghệ thông tin.

Nếu bạn cần thêm thông tin chi tiết hoặc có câu hỏi khác, hãy cho tôi biết! 

[Học bổng Tài năng Samsung] - [**Link tham khảo**](https://fit.haui.edu.vn/vn/guong-sang/hoc-bong-la-phan-thuong-xung-dang-cho-no-luc-cua-sinh-vien/70891).","Để nhận được học bổng Tài năng STP, sinh viên cần chưa từng tham dự SVMC Internship Program và chưa được nhận học bổng STP trước đó.",0.0,0.0,0.46153846153846156,0.8005972967185994,0.8817544272939675,1.9074950218200684,10.321265935897827
22,Kỳ thi Olympic Tin học Sinh viên Việt Nam lần thứ 33 (OLP’24) sẽ diễn ra ở đâu và vào thời gian nào tại Hà Nội?,"['content: Trường Đại học Công Nghiệp Hà Nội (HaUI) sẽ tiếp nhận đăng cai tổ chức Kỳ thi Olympic Tin học Sinh viên Việt Nam lần thứ 33 (OLP’24) và Kỳ thi lập trình sinh viên Quốc tế ICPC ASIA 2024. Đây bước ngoặt đánh dấu sự phát triển vững mạnh của Trường ĐH Công Nghiệp Hà Nội trong đào tạo khối ngành Công nghệ, khẳng định vị thế Nhà trường trong cộng đồng giáo dục Việt Nam.Đây không chỉ là niềm tự hào đối với thầy trò Khoa Công nghệ thông tin, mà còn khẳng định vị thế của Nhà trường trong đào tạo khối ngành Công nghệ thông tin trên cả nước. Việc đăng cai tổ chức còn là cơ hội để Nhà trường mở rộng hợp tác và phát triển với các trường đại học trong và ngoài nước, cải tiến chương trình đào tạo phù hợp với nhu cầu thực tiễn, học hỏi các công nghệ hàng đầu trong nền giáo dục để ứng dụng trong phát triển đội ngũ Nhà trường.Cuộc thi còn là cơ hội để sinh viên Nhà trường kết nối với bạn bè trong nước và quốc tế, giao lưu, học hỏi kiến thức, kỹ năng, kinh nghiệm về ngành IT trong xu thế phát triển của xã hội. Từ đó, giúp các bạn nâng cao nhận thức về vai trò của công nghệ thông tin trong đời sống xã hội, khuyến khích đổi mới sáng tạo trong giáo dục.1. MỤC ĐÍCH- Tạo điều kiện cho Sinh viên tự nghiên cứu sáng tạo, nâng cao kỹ năng làm việc theo nhóm, hội nhập các tiêu chuẩn quốc tế của sinh viên trong lĩnh vực Công nghệ Thông tin ở các trường Đại học và Cao đẳng Việt Nam và các nước trong Khu vực Châu Á.- Làm cầu nối để các Trường Đại học và Cao đẳng Việt Nam và các nước trong khu vực Châu Á kết nối giao lưu và hợp tác.- Quảng bá, giới thiệu hình ảnh Trường Đại học Công Nghiệp Hà Nội tới bạn bè trong nước và quốc tế.2. THỜI GIAN, ĐỊA ĐIỂM- Thời gian: từ ngày 10 đến13 tháng 12 năm 2024.- Địa điểm: Trường Đại học Công nghiệp Hà Nội, Số 298 Đường Cầu Diễn, Quận Bắc Từ Liêm, Hà Nội.- Hình thức tổ chức: Trực tiếp và trực tuyến.3. NỘI DUNG THI3.1. Kỳ thi Olympic Tin học Sinh viên Việt Nam- Khối thi cá nhân Siêu cúp;- Khối thi cá nhân chuyên Tin học;- Khối thi cá nhân không chuyên Tin học;-\nnext_contents:\n- Trường Đại học Công Nghiệp Hà Nội vinh dự đăng cai tổ chức Kỳ thi Olympic Tin học Sinh viên Việt Nam lần thứ 33 (OLP’24) và Kỳ thi lập trình sinh viên Quốc tế ICPC ASIA 2024\nTrang HaUI\nPhòng\nPhòng Tổ chức hành chính\nPhòng Đào tạo\nPhòng Công tác sinh viên\nPhòng Khoa học công nghệ\nPhòng hợp tác đối ngoại\nPhòng Tài chính kế toán\nPhòng Quản trị\nPhòng Thanh tra Giáo dục\nKhoa\nKhoa Công nghệ Hoá\nKhoa Công nghệ may & TKTT\nKhoa Công nghệ thông tin\nKhoa Điện\nKhoa Điện tử\nKhoa Khoa học cơ bản\nKhoa Lý luận chính trị - Pháp luật\nTrung tâm Đào tạo\nTrung tâm Đào tạo Sau đại học\nTrung tâm Giáo dục thể chất và Thể thao\nTrung tâm Công nghệ Ô tô và Đào tạo lái xe\nTrung tâm Công nghệ thông tin\nTrung tâm Việt Nhật\nTrung tâm Giáo dục Quốc phòng An ninh\nTrung tâm Dịch vụ\nTrung tâm Truyền thông & Quan hệ Công chúng\nTrạm Y tế\nTrung tâm Hỗ trợ Sinh viên\nTrung tâm Đảm bảo chất lượng\nTrung tâm Thông tin Thư viện\nTrung tâm khảo thí\nViện nghiên cứu\nCông ty Letco\nThư điện tử\nSitemap\nLiên hệ\nToggle navigation\nGIỚI THIỆU\nTHÔNG TIN CHUNG\nCƠ CẤU TỔ CHỨC\nCHIẾN LƯỢC PHÁT TRIỂN\nCÁN BỘ GIẢNG VIÊN\nCƠ SỞ VẬT CHẤT\nLIÊN HỆ\nĐÀO TẠO\nĐẠI HỌC\nKHOA HỌC MÁY TÍNH\nKỸ THUẬT PHẦN MỀM\nHỆ THỐNG THÔNG TIN\nCÔNG NGHỆ THÔNG TIN\nCÔNG NGHỆ ĐA PHƯƠNG TIỆN\nAN TOÀN THÔNG TIN\nSAU ĐẠI HỌC\nHỆ THỐNG THÔNG TIN\nKẾ HOẠCH\nTIẾN ĐỘ\nQUY CHẾ, BIỂU MẪU\nNGHIÊN CỨU KHOA HỌC\nCÔNG TRÌNH CÔNG BỐ\nĐỀ TÀI, DỰ ÁN\nSINH VIÊN NCKH\nTIN KHCN\nCÔNG TÁC SINH VIÊN\nQUY CHẾ\nGƯƠNG SÁNG SINH VIÊN\nHỌC BỔNG\nCÂU LẠC BỘ\nTHƯ VIỆN ẢNH\nTUYỂN DỤNG\nTHÔNG BÁO\nTRANG CHỦ > THÔNG BÁO\nTrường Đại học Công Nghiệp Hà Nội vinh dự đăng cai tổ chức Kỳ thi Olympic Tin học Sinh viên Việt Nam lần thứ 33 (OLP’24) và Kỳ thi lập trình sinh viên Quốc tế ICPC ASIA 2024\n', 'content: Trường Đại học Công Nghiệp Hà Nội (HaUI) sẽ tiếp nhận đăng cai tổ chức Kỳ thi Olympic Tin học Sinh viên Việt Nam lần thứ 33 (OLP’24) và Kỳ thi lập trình sinh viên Quốc tế ICPC ASIA 2024. Đây bước ngoặt đánh dấu sự phát triển vững mạnh của Trường ĐH Công Nghiệp Hà Nội trong đào tạo khối ngành Công nghệ, khẳng định vị thế Nhà trường trong cộng đồng giáo dục Việt Nam.Đây không chỉ là niềm tự hào đối với thầy trò Khoa Công nghệ thông tin, mà còn khẳng định vị thế của Nhà trường trong đào tạo khối ngành Công nghệ thông tin trên cả nước. Việc đăng cai tổ chức còn là cơ hội để Nhà trường mở rộng hợp tác và phát triển với các trường đại học trong và ngoài nước, cải tiến chương trình đào tạo phù hợp với nhu cầu thực tiễn, học hỏi các công nghệ hàng đầu trong nền giáo dục để ứng dụng trong phát triển đội ngũ Nhà trường.Cuộc thi còn là cơ hội để sinh viên Nhà trường kết nối với bạn bè trong nước và quốc tế, giao lưu, học hỏi kiến thức, kỹ năng, kinh nghiệm về ngành IT trong xu thế phát triển của xã hội. Từ đó, giúp các bạn nâng cao nhận thức về vai trò của công nghệ thông tin trong đời sống xã hội, khuyến khích đổi mới sáng tạo trong giáo dục.1. MỤC ĐÍCH- Tạo điều kiện cho Sinh viên tự nghiên cứu sáng tạo, nâng cao kỹ năng làm việc theo nhóm, hội nhập các tiêu chuẩn quốc tế của sinh viên trong lĩnh vực Công nghệ Thông tin ở các trường Đại học và Cao đẳng Việt Nam và các nước trong Khu vực Châu Á.- Làm cầu nối để các Trường Đại học và Cao đẳng Việt Nam và các nước trong khu vực Châu Á kết nối giao lưu và hợp tác.- Quảng bá, giới thiệu hình ảnh Trường Đại học Công Nghiệp Hà Nội tới bạn bè trong nước và quốc tế.2. THỜI GIAN, ĐỊA ĐIỂM- Thời gian: từ ngày 10 đến13 tháng 12 năm 2024.- Địa điểm: Trường Đại học Công nghiệp Hà Nội, Số 298 Đường Cầu Diễn, Quận Bắc Từ Liêm, Hà Nội.- Hình thức tổ chức: Trực tiếp và trực tuyến.3. NỘI DUNG THI3.1. Kỳ thi Olympic Tin học Sinh viên Việt Nam- Khối thi cá nhân Siêu cúp;- Khối thi cá nhân chuyên Tin học;- Khối thi cá nhân không chuyên Tin học;-\nnext_contents:\n- Trường Đại học Công Nghiệp Hà Nội vinh dự đăng cai tổ chức Kỳ thi Olympic Tin học Sinh viên Việt Nam lần thứ 33 (OLP’24) và Kỳ thi lập trình sinh viên Quốc tế ICPC ASIA 2024\nTrang HaUI\nPhòng\nPhòng Tổ chức hành chính\nPhòng Đào tạo\nPhòng Công tác sinh viên\nPhòng Khoa học công nghệ\nPhòng hợp tác đối ngoại\nPhòng Tài chính kế toán\nPhòng Quản trị\nPhòng Thanh tra Giáo dục\nKhoa\nKhoa Công nghệ Hoá\nKhoa Công nghệ may & TKTT\nKhoa Công nghệ thông tin\nKhoa Điện\nKhoa Điện tử\nKhoa Khoa học cơ bản\nKhoa Lý luận chính trị - Pháp luật\nTrung tâm Đào tạo\nTrung tâm Đào tạo Sau đại học\nTrung tâm Giáo dục thể chất và Thể thao\nTrung tâm Công nghệ Ô tô và Đào tạo lái xe\nTrung tâm Công nghệ thông tin\nTrung tâm Việt Nhật\nTrung tâm Giáo dục Quốc phòng An ninh\nTrung tâm Dịch vụ\nTrung tâm Truyền thông & Quan hệ Công chúng\nTrạm Y tế\nTrung tâm Hỗ trợ Sinh viên\nTrung tâm Đảm bảo chất lượng\nTrung tâm Thông tin Thư viện\nTrung tâm khảo thí\nViện nghiên cứu\nCông ty Letco\nThư điện tử\nSitemap\nLiên hệ\nToggle navigation\nGIỚI THIỆU\nTHÔNG TIN CHUNG\nCƠ CẤU TỔ CHỨC\nCHIẾN LƯỢC PHÁT TRIỂN\nCÁN BỘ GIẢNG VIÊN\nCƠ SỞ VẬT CHẤT\nLIÊN HỆ\nĐÀO TẠO\nĐẠI HỌC\nKHOA HỌC MÁY TÍNH\nKỸ THUẬT PHẦN MỀM\nHỆ THỐNG THÔNG TIN\nCÔNG NGHỆ THÔNG TIN\nCÔNG NGHỆ ĐA PHƯƠNG TIỆN\nAN TOÀN THÔNG TIN\nSAU ĐẠI HỌC\nHỆ THỐNG THÔNG TIN\nKẾ HOẠCH\nTIẾN ĐỘ\nQUY CHẾ, BIỂU MẪU\nNGHIÊN CỨU KHOA HỌC\nCÔNG TRÌNH CÔNG BỐ\nĐỀ TÀI, DỰ ÁN\nSINH VIÊN NCKH\nTIN KHCN\nCÔNG TÁC SINH VIÊN\nQUY CHẾ\nGƯƠNG SÁNG SINH VIÊN\nHỌC BỔNG\nCÂU LẠC BỘ\nTHƯ VIỆN ẢNH\nTUYỂN DỤNG\nTHÔNG BÁO\nTRANG CHỦ > THÔNG BÁO\nTrường Đại học Công Nghiệp Hà Nội vinh dự đăng cai tổ chức Kỳ thi Olympic Tin học Sinh viên Việt Nam lần thứ 33 (OLP’24) và Kỳ thi lập trình sinh viên Quốc tế ICPC ASIA 2024\n', 'content: THƯ VIỆN ẢNH\nTUYỂN DỤNG\nTHÔNG BÁO\nTRANG CHỦ > THÔNG BÁO\nCẩm nang Kỳ thi Olympic Tin học Sinh viên Việt Nam lần thứ 33 (OLP’24) và Kỳ thi lập trình sinh viên Quốc tế ICPC ASIA 2024\nCHÚC CÁC ĐOÀN KHỞI HÀNH ĐẦY MAY MẮN!Hà nội: ngày OLP T3-T4 10-11/12 dễ chịu 20-24 độNgày ICPC: T5-T6 ngày lạnh dưới 20 độ sáng sớm và đêmCác Đoàn _Teams và Coachs xem (download) Cẩm nang OLP-PROCON-ICPC 2024 để theo dõi các thông tin và chỉ dẫn cụ thể và chi tiết các hoạt động, lịch thi, các lễ KM-BM, địa điểm - vị trí thi.Chú ý: Xem SBD các phòng thi SC, CT và KCT+CĐ: Xem tại đây.Cẩm nang Kỳ thi Olympic Tin học Sinh viên Việt Nam lần thứ 33 (OLP’24) và Kỳ thi lập trình sinh viên Quốc tế ICPC ASIA 2024: Xem tại đây.\nThứ Tư, 07:54 11/12/2024\nTags:\nTweet\nCác bài đã đăng\n» Cuộc thi:"" Học sinh, sinh viên với ý tưởng khởi nghiệp"" lần thứ VII. (18/12/2024)\n» Dự kiến chỉ tiêu và phương thức xét tuyển các ngành thuộc Khoa CNTT - Trường Đại học Công Nghiệp Hà Nội năm 2025 (18/12/2024)\n» Khảo sát mức độ quan tâm thị trường việc làm Nhật Bản đợt 2 (10/12/2024)\n» Khởi động Cuộc thi Huawei ICT toàn cầu 2024-2025 (09/12/2024)\n» Trường Đại học Công Nghiệp Hà Nội vinh dự đăng cai tổ chức Kỳ thi Olympic Tin học Sinh viên Việt Nam lần thứ 33 (OLP’24) và Kỳ thi lập trình sinh viên Quốc tế ICPC ASIA 2024 (06/12/2024)\n» Thông báo tổ chức chương trình Hội thảo thực tập, việc làm và thi tuyển trực tiếp của Công ty TNHH Ani Vina - Thứ 3, ngày 10/12/2024 (05/12/2024)\n» Thông báo tổ chức chương trình Hội thảo thực tập, việc làm và phỏng vấn trực tiếp của Công ty TNHH New Wing Interconnect Technology (Bắc Giang) - Thứ 5, ngày 05/12/2024 (29/11/2024)\nTin tiêu điểm\nSinh viên Khóa 19 Khoa Công nghệ thông tin đạt Học bổng HaUI 100% toàn khóa học.\nnext_contents:\n- Cẩm nang Kỳ thi Olympic Tin học Sinh viên Việt Nam lần thứ 33 (OLP’24) và Kỳ thi lập trình sinh viên Quốc tế ICPC ASIA 2024\nTrang HaUI\nPhòng\nPhòng Tổ chức hành chính\nPhòng Đào tạo\nPhòng Công tác sinh viên\nPhòng Khoa học công nghệ\nPhòng hợp tác đối ngoại\nPhòng Tài chính kế toán\nPhòng Quản trị\nPhòng Thanh tra Giáo dục\nKhoa\nKhoa Công nghệ Hoá\nKhoa Công nghệ may & TKTT\nKhoa Công nghệ thông tin\nKhoa Điện\nKhoa Điện tử\nKhoa Khoa học cơ bản\nKhoa Lý luận chính trị - Pháp luật\nTrung tâm Đào tạo\nTrung tâm Đào tạo Sau đại học\nTrung tâm Giáo dục thể chất và Thể thao\nTrung tâm Công nghệ Ô tô và Đào tạo lái xe\nTrung tâm Công nghệ thông tin\nTrung tâm Việt Nhật\nTrung tâm Giáo dục Quốc phòng An ninh\nTrung tâm Dịch vụ\nTrung tâm Truyền thông & Quan hệ Công chúng\nTrạm Y tế\nTrung tâm Hỗ trợ Sinh viên\nTrung tâm Đảm bảo chất lượng\nTrung tâm Thông tin Thư viện\nTrung tâm khảo thí\nViện nghiên cứu\nCông ty Letco\nThư điện tử\nSitemap\nLiên hệ\nToggle navigation\nGIỚI THIỆU\nTHÔNG TIN CHUNG\nCƠ CẤU TỔ CHỨC\nCHIẾN LƯỢC PHÁT TRIỂN\nCÁN BỘ GIẢNG VIÊN\nCƠ SỞ VẬT CHẤT\nLIÊN HỆ\nĐÀO TẠO\nĐẠI HỌC\nKHOA HỌC MÁY TÍNH\nKỸ THUẬT PHẦN MỀM\nHỆ THỐNG THÔNG TIN\nCÔNG NGHỆ THÔNG TIN\nCÔNG NGHỆ ĐA PHƯƠNG TIỆN\nAN TOÀN THÔNG TIN\nSAU ĐẠI HỌC\nHỆ THỐNG THÔNG TIN\nKẾ HOẠCH\nTIẾN ĐỘ\nQUY CHẾ, BIỂU MẪU\nNGHIÊN CỨU KHOA HỌC\nCÔNG TRÌNH CÔNG BỐ\nĐỀ TÀI, DỰ ÁN\nSINH VIÊN NCKH\nTIN KHCN\nCÔNG TÁC SINH VIÊN\nQUY CHẾ\nGƯƠNG SÁNG SINH VIÊN\nHỌC BỔNG\nCÂU LẠC BỘ\nTHƯ VIỆN ẢNH\nTUYỂN DỤNG\nTHÔNG BÁO\nTRANG CHỦ > THÔNG BÁO\nCẩm nang Kỳ thi Olympic Tin học Sinh viên Việt Nam lần thứ 33 (OLP’24) và Kỳ thi lập trình sinh viên Quốc tế ICPC ASIA 2024\n', 'content: THƯ VIỆN ẢNH\nTUYỂN DỤNG\nTHÔNG BÁO\nTRANG CHỦ > THÔNG BÁO\nCẩm nang Kỳ thi Olympic Tin học Sinh viên Việt Nam lần thứ 33 (OLP’24) và Kỳ thi lập trình sinh viên Quốc tế ICPC ASIA 2024\nCHÚC CÁC ĐOÀN KHỞI HÀNH ĐẦY MAY MẮN!Hà nội: ngày OLP T3-T4 10-11/12 dễ chịu 20-24 độNgày ICPC: T5-T6 ngày lạnh dưới 20 độ sáng sớm và đêmCác Đoàn _Teams và Coachs xem (download) Cẩm nang OLP-PROCON-ICPC 2024 để theo dõi các thông tin và chỉ dẫn cụ thể và chi tiết các hoạt động, lịch thi, các lễ KM-BM, địa điểm - vị trí thi.Chú ý: Xem SBD các phòng thi SC, CT và KCT+CĐ: Xem tại đây.Cẩm nang Kỳ thi Olympic Tin học Sinh viên Việt Nam lần thứ 33 (OLP’24) và Kỳ thi lập trình sinh viên Quốc tế ICPC ASIA 2024: Xem tại đây.\nThứ Tư, 07:54 11/12/2024\nTags:\nTweet\nCác bài đã đăng\n» Cuộc thi:"" Học sinh, sinh viên với ý tưởng khởi nghiệp"" lần thứ VII. (18/12/2024)\n» Dự kiến chỉ tiêu và phương thức xét tuyển các ngành thuộc Khoa CNTT - Trường Đại học Công Nghiệp Hà Nội năm 2025 (18/12/2024)\n» Khảo sát mức độ quan tâm thị trường việc làm Nhật Bản đợt 2 (10/12/2024)\n» Khởi động Cuộc thi Huawei ICT toàn cầu 2024-2025 (09/12/2024)\n» Trường Đại học Công Nghiệp Hà Nội vinh dự đăng cai tổ chức Kỳ thi Olympic Tin học Sinh viên Việt Nam lần thứ 33 (OLP’24) và Kỳ thi lập trình sinh viên Quốc tế ICPC ASIA 2024 (06/12/2024)\n» Thông báo tổ chức chương trình Hội thảo thực tập, việc làm và thi tuyển trực tiếp của Công ty TNHH Ani Vina - Thứ 3, ngày 10/12/2024 (05/12/2024)\n» Thông báo tổ chức chương trình Hội thảo thực tập, việc làm và phỏng vấn trực tiếp của Công ty TNHH New Wing Interconnect Technology (Bắc Giang) - Thứ 5, ngày 05/12/2024 (29/11/2024)\nTin tiêu điểm\nSinh viên Khóa 19 Khoa Công nghệ thông tin đạt Học bổng HaUI 100% toàn khóa học.\nnext_contents:\n- Cẩm nang Kỳ thi Olympic Tin học Sinh viên Việt Nam lần thứ 33 (OLP’24) và Kỳ thi lập trình sinh viên Quốc tế ICPC ASIA 2024\nTrang HaUI\nPhòng\nPhòng Tổ chức hành chính\nPhòng Đào tạo\nPhòng Công tác sinh viên\nPhòng Khoa học công nghệ\nPhòng hợp tác đối ngoại\nPhòng Tài chính kế toán\nPhòng Quản trị\nPhòng Thanh tra Giáo dục\nKhoa\nKhoa Công nghệ Hoá\nKhoa Công nghệ may & TKTT\nKhoa Công nghệ thông tin\nKhoa Điện\nKhoa Điện tử\nKhoa Khoa học cơ bản\nKhoa Lý luận chính trị - Pháp luật\nTrung tâm Đào tạo\nTrung tâm Đào tạo Sau đại học\nTrung tâm Giáo dục thể chất và Thể thao\nTrung tâm Công nghệ Ô tô và Đào tạo lái xe\nTrung tâm Công nghệ thông tin\nTrung tâm Việt Nhật\nTrung tâm Giáo dục Quốc phòng An ninh\nTrung tâm Dịch vụ\nTrung tâm Truyền thông & Quan hệ Công chúng\nTrạm Y tế\nTrung tâm Hỗ trợ Sinh viên\nTrung tâm Đảm bảo chất lượng\nTrung tâm Thông tin Thư viện\nTrung tâm khảo thí\nViện nghiên cứu\nCông ty Letco\nThư điện tử\nSitemap\nLiên hệ\nToggle navigation\nGIỚI THIỆU\nTHÔNG TIN CHUNG\nCƠ CẤU TỔ CHỨC\nCHIẾN LƯỢC PHÁT TRIỂN\nCÁN BỘ GIẢNG VIÊN\nCƠ SỞ VẬT CHẤT\nLIÊN HỆ\nĐÀO TẠO\nĐẠI HỌC\nKHOA HỌC MÁY TÍNH\nKỸ THUẬT PHẦN MỀM\nHỆ THỐNG THÔNG TIN\nCÔNG NGHỆ THÔNG TIN\nCÔNG NGHỆ ĐA PHƯƠNG TIỆN\nAN TOÀN THÔNG TIN\nSAU ĐẠI HỌC\nHỆ THỐNG THÔNG TIN\nKẾ HOẠCH\nTIẾN ĐỘ\nQUY CHẾ, BIỂU MẪU\nNGHIÊN CỨU KHOA HỌC\nCÔNG TRÌNH CÔNG BỐ\nĐỀ TÀI, DỰ ÁN\nSINH VIÊN NCKH\nTIN KHCN\nCÔNG TÁC SINH VIÊN\nQUY CHẾ\nGƯƠNG SÁNG SINH VIÊN\nHỌC BỔNG\nCÂU LẠC BỘ\nTHƯ VIỆN ẢNH\nTUYỂN DỤNG\nTHÔNG BÁO\nTRANG CHỦ > THÔNG BÁO\nCẩm nang Kỳ thi Olympic Tin học Sinh viên Việt Nam lần thứ 33 (OLP’24) và Kỳ thi lập trình sinh viên Quốc tế ICPC ASIA 2024\n']","['THÔNG BÁO TRANG CHỦ > THÔNG BÁO Cẩm nang Kỳ thi Olympic Tin học Sinh viên Việt Nam lần thứ 33 (OLP’24) và Kỳ thi lập trình sinh viên Quốc tế ICPC ASIA 2024 CHÚC CÁC ĐOÀN KHỞI HÀNH ĐẦY MAY MẮN!Hà nội: ngày OLP T3-T4 10-11/12 dễ chịu 20-24 độNgày ICPC: T5-T6 ngày lạnh dưới 20 độ sáng sớm và đêmCác Đoàn _Teams và Coachs xem (download) Cẩm nang OLP-PROCON-ICPC 2024 để theo dõi các thông tin và chỉ dẫn cụ thể và chi tiết các hoạt động, lịch thi, các lễ KM-BM, địa điểm - vị trí thi.Chú ý: Xem SBD các phòng thi SC, CT và KCT+CĐ: Xem tại đây.Cẩm nang Kỳ thi Olympic Tin học Sinh viên Việt Nam lần thứ 33 (OLP’24) và Kỳ thi lập trình sinh viên Quốc tế ICPC ASIA 2024: Xem tại đây. Thứ Tư, 07:54 11/12/2024 Tags: Tweet Các bài đã đăng » Cuộc thi:"" Học sinh, sinh viên với ý tưởng khởi nghiệp"" lần thứ VII. (18/12/2024) » Dự kiến chỉ tiêu và phương thức xét tuyển các ngành thuộc Khoa CNTT - Trường Đại học Công Nghiệp Hà Nội năm 2025 (18/12/2024) » Khảo sát mức độ quan tâm thị trường việc làm Nhật Bản đợt 2 (10/12/2024) » Khởi động Cuộc thi Huawei ICT toàn cầu 2024-2025 (09/12/2024) » Trường Đại học Công Nghiệp Hà Nội vinh dự đăng cai tổ chức Kỳ thi Olympic Tin học Sinh viên Việt Nam lần thứ 33 (OLP’24) và Kỳ thi lập trình sinh viên Quốc tế ICPC ASIA 2024 (06/12/2024) » Thông báo tổ chức chương trình Hội thảo thực tập, việc làm và thi tuyển trực tiếp của Công ty TNHH Ani Vina - Thứ 3, ngày 10/12/2024 (05/12/2024) » Thông báo tổ chức chương trình Hội thảo thực tập, việc làm và phỏng vấn trực tiếp của Công ty TNHH New Wing Interconnect Technology (Bắc Giang) - Thứ 5, ngày 05/12/2024 (29/11/2024) Tin tiêu điểm Sinh viên Khóa 19 Khoa Công nghệ thông tin đạt Học bổng HaUI 100% toàn khóa học. Thứ Sáu, 11:07 20/09/2024 Đội bóng khoa Công nghệ thông tin cùng những trận cầu đáng nhớ Thứ Bảy, 10:00 23/07/2022 Đại hội đại biểu Liên chi Đoàn khoa Công nghệ thông tin lần thứ X, nhiệm kỳ 2022 - 2024 Thứ Hai, 15:00 18/04/2022 Gặp mặt tân Sinh viên K15 khoa Công nghệ thông tin Thứ Tư, 08:17 28/10/2020 Chương trình thực tập tại SVMC ""SVMC Internship Program 2020"" Thứ Sáu, 14:02 22/05/2020 Các bài đã đăng Cuộc thi:"" Học sinh, sinh viên với ý tưởng khởi nghiệp"" lần thứ VII. Thứ Tư, 09:57 18/12/2024 Dự kiến chỉ tiêu và phương thức xét tuyển các ngành thuộc Khoa CNTT - Trường Đại học Công Nghiệp Hà Nội năm 2025 Thứ Tư, 09:14 18/12/2024 Khảo sát mức độ quan tâm thị trường việc làm Nhật Bản đợt 2 Thứ Ba, 12:34 10/12/2024 Khởi động Cuộc thi Huawei ICT toàn cầu 2024-2025 Thứ Hai, 09:04 09/12/2024 Trường Đại học Công Nghiệp Hà Nội vinh dự đăng cai tổ chức Kỳ thi Olympic Tin học Sinh viên Việt Nam lần thứ 33 (OLP’24) và Kỳ thi lập trình sinh viên Quốc tế ICPC ASIA 2024 Thứ Sáu, 16:12 06/12/2024 Thông báo tổ chức chương trình Hội thảo thực tập, việc làm và thi tuyển trực tiếp của Công ty TNHH Ani Vina - Thứ 3, ngày 10/12/2024 Thứ Năm, 15:00 05/12/2024 Thông báo tổ chức chương trình Hội thảo thực tập, việc làm và phỏng vấn trực tiếp của Công ty TNHH New Wing Interconnect Technology (Bắc Giang) - Thứ 5, ngày 05/12/2024 Thứ Sáu, 15:49 29/11/2024 Bản đồ chỉ dẫn Trường Đại học Công nghiệp Hà Nội Trụ sở chính Số 298 đường Cầu Diễn, quận Bắc Từ Liêm, Hà Nội +84 243 765 5121 Email: dhcnhn@haui.edu.vn Các cơ sở khác Cơ sở 2: Phường Tây Tựu, quận Bắc Từ Liêm, Hà Nội Cơ sở 3: Phường Lê Hồng Phong, thành phố Phủ Lý, Hà Nam Liên kết site Trường Đại học Công nghiệp Hà Nội Thông tin tuyển sinh Hành chính điện tử Đào tạo trực tuyến Cổng thông tin đào tạo Copyright © 2018 Hanoi University of Industry.']","Kỳ thi Olympic Tin học Sinh viên Việt Nam lần thứ 33 (OLP’24) sẽ diễn ra từ ngày **10 đến 13 tháng 12 năm 2024**. Địa điểm tổ chức là **Trường Đại học Công nghiệp Hà Nội**, cụ thể tại **Số 298 Đường Cầu Diễn, Quận Bắc Từ Liêm, Hà Nội**. Hình thức tổ chức sẽ bao gồm cả trực tiếp và trực tuyến.

Thông tin chi tiết có thể tham khảo tại [link tham khảo](https://fit.haui.edu.vn/vn/thong-bao/truong-dai-hoc-cong-nghiep-ha-noi-vinh-du-dang-cai-to-chuc-ky-thi-olympic-tin-hoc-sinh-vien-viet-nam-lan-thu-33-olp-24-va-ky-thi-lap-trinh-sinh-vien-quoc-te-icpc-asia-2024/71183).

Khuyến khích bạn hỏi thêm về các chủ đề liên quan hoặc cung cấp thông tin cần thiết. Nếu có vấn đề, bạn có thể liên hệ hỗ trợ qua người hỗ trợ.",Kỳ thi Olympic Tin học Sinh viên Việt Nam lần thứ 33 (OLP’24) sẽ diễn ra tại Hà Nội vào ngày 10-11 tháng 12 năm 2024.,0.999999999975,1.0,0.5,0.913220150520574,0.9590185585600441,1.608854055404663,8.471757650375366
23,Bộ Giáo dục và Đào tạo đã ban hành thông báo gì về chương trình tuyển sinh đi học tại Hungari diện Hiệp định năm 2025?,"['content: QUY CHẾ\nGƯƠNG SÁNG SINH VIÊN\nHỌC BỔNG\nCÂU LẠC BỘ\nTHƯ VIỆN ẢNH\nTUYỂN DỤNG\nTHÔNG BÁO\nTRANG CHỦ > THÔNG BÁO\nThông báo tuyển sinh đi học tại Hungari diện Hiệp định năm 2025\nBộ Giáo dục và Đào tạo ban hành Thông báo số 1743/TB-BGDĐT ngày 22 tháng 11 năm 2024 về Tuyển sinh đi học tại Hungari diện Hiệp định năm 2025 như sau:1. Thông tin chung về chương trình:- Chính phủ Hungari cấp 200 chỉ tiêu học bổng cho công dân Việt Nam đi đào tạo trình độ Tiến sĩ, Thạc sĩ, Thạc sĩ liên thông từ đại học, Đại học, Ngắn hạn tại Hungari.- Các lĩnh vực ưu tiên: Khoa học Công nghệ, Kỹ thuật, Toán học, Bán dẫn, Khoa học dữ liệu, Khoa học máy tính, Trí tuệ nhân tạo, Giáo dục, Kinh tế, Khoa học y tế và sức khỏe, Nông nghiệp, Khoa học tự nhiên, Nghệ thuật, Khoa học xã hội và Nhân văn, Luật, Kiến trúc, Thú y, Khoa học thể thao.1.2. Chế độ học bổng- Miễn phí đào tạo, nghiên cứu, cấp bảo hiểm y tế và hỗ trợ chỗ ở, sinh hoạt phí theo quy định của phía Hung-ga-ri.- Trong số 200 chỉ tiêu được Chính phủ Hung-ga-ri cấp học bổng sẽ có tối đa 100 chỉ tiêu được cấp bù học bổng của Chính phủ Việt Nam bao gồm: vé máy bay một lượt đi và về, phí đi đường, lệ phí làm hộ chiếu, visa và sinh hoạt phí theo chế độ hiện hành (nếu đáp ứng được các điều kiện).3. Đối tượng, điều kiện và hồ sơ dự tuyển: Xem tại đây.\nThứ Năm, 08:40 28/11/2024\nTags:\nTweet\nCác bài đã đăng\n» Cuộc thi:"" Học sinh, sinh viên với ý tưởng khởi nghiệp"" lần thứ VII. (18/12/2024)\n» Dự kiến chỉ tiêu và phương thức xét tuyển các ngành thuộc Khoa CNTT - Trường Đại học Công Nghiệp Hà Nội năm 2025 (18/12/2024)\n» Cẩm nang Kỳ thi Olympic Tin học Sinh viên Việt Nam lần thứ 33 (OLP’24) và Kỳ thi lập trình sinh viên Quốc tế ICPC ASIA 2024 (11/12/2024)\nnext_contents:\n- Thông báo tuyển sinh đi học tại Hungari diện Hiệp định năm 2025\nTrang HaUI\nPhòng\nPhòng Tổ chức hành chính\nPhòng Đào tạo\nPhòng Công tác sinh viên\nPhòng Khoa học công nghệ\nPhòng hợp tác đối ngoại\nPhòng Tài chính kế toán\nPhòng Quản trị\nPhòng Thanh tra Giáo dục\nKhoa\nKhoa Công nghệ Hoá\nKhoa Công nghệ may & TKTT\nKhoa Công nghệ thông tin\nKhoa Điện\nKhoa Điện tử\nKhoa Khoa học cơ bản\nKhoa Lý luận chính trị - Pháp luật\nTrung tâm Đào tạo\nTrung tâm Đào tạo Sau đại học\nTrung tâm Giáo dục thể chất và Thể thao\nTrung tâm Công nghệ Ô tô và Đào tạo lái xe\nTrung tâm Công nghệ thông tin\nTrung tâm Việt Nhật\nTrung tâm Giáo dục Quốc phòng An ninh\nTrung tâm Dịch vụ\nTrung tâm Truyền thông & Quan hệ Công chúng\nTrạm Y tế\nTrung tâm Hỗ trợ Sinh viên\nTrung tâm Đảm bảo chất lượng\nTrung tâm Thông tin Thư viện\nTrung tâm khảo thí\nViện nghiên cứu\nCông ty Letco\nThư điện tử\nSitemap\nLiên hệ\nToggle navigation\nGIỚI THIỆU\nTHÔNG TIN CHUNG\nCƠ CẤU TỔ CHỨC\nCHIẾN LƯỢC PHÁT TRIỂN\nCÁN BỘ GIẢNG VIÊN\nCƠ SỞ VẬT CHẤT\nLIÊN HỆ\nĐÀO TẠO\nĐẠI HỌC\nKHOA HỌC MÁY TÍNH\nKỸ THUẬT PHẦN MỀM\nHỆ THỐNG THÔNG TIN\nCÔNG NGHỆ THÔNG TIN\nCÔNG NGHỆ ĐA PHƯƠNG TIỆN\nAN TOÀN THÔNG TIN\nSAU ĐẠI HỌC\nHỆ THỐNG THÔNG TIN\nKẾ HOẠCH\nTIẾN ĐỘ\nQUY CHẾ, BIỂU MẪU\nNGHIÊN CỨU KHOA HỌC\nCÔNG TRÌNH CÔNG BỐ\nĐỀ TÀI, DỰ ÁN\nSINH VIÊN NCKH\nTIN KHCN\nCÔNG TÁC SINH VIÊN\nQUY CHẾ\nGƯƠNG SÁNG SINH VIÊN\nHỌC BỔNG\nCÂU LẠC BỘ\nTHƯ VIỆN ẢNH\nTUYỂN DỤNG\nTHÔNG BÁO\nTRANG CHỦ > THÔNG BÁO\nThông báo tuyển sinh đi học tại Hungari diện Hiệp định năm 2025\n', 'content: QUY CHẾ\nGƯƠNG SÁNG SINH VIÊN\nHỌC BỔNG\nCÂU LẠC BỘ\nTHƯ VIỆN ẢNH\nTUYỂN DỤNG\nTHÔNG BÁO\nTRANG CHỦ > THÔNG BÁO\nThông báo tuyển sinh đi học tại Hungari diện Hiệp định năm 2025\nBộ Giáo dục và Đào tạo ban hành Thông báo số 1743/TB-BGDĐT ngày 22 tháng 11 năm 2024 về Tuyển sinh đi học tại Hungari diện Hiệp định năm 2025 như sau:1. Thông tin chung về chương trình:- Chính phủ Hungari cấp 200 chỉ tiêu học bổng cho công dân Việt Nam đi đào tạo trình độ Tiến sĩ, Thạc sĩ, Thạc sĩ liên thông từ đại học, Đại học, Ngắn hạn tại Hungari.- Các lĩnh vực ưu tiên: Khoa học Công nghệ, Kỹ thuật, Toán học, Bán dẫn, Khoa học dữ liệu, Khoa học máy tính, Trí tuệ nhân tạo, Giáo dục, Kinh tế, Khoa học y tế và sức khỏe, Nông nghiệp, Khoa học tự nhiên, Nghệ thuật, Khoa học xã hội và Nhân văn, Luật, Kiến trúc, Thú y, Khoa học thể thao.1.2. Chế độ học bổng- Miễn phí đào tạo, nghiên cứu, cấp bảo hiểm y tế và hỗ trợ chỗ ở, sinh hoạt phí theo quy định của phía Hung-ga-ri.- Trong số 200 chỉ tiêu được Chính phủ Hung-ga-ri cấp học bổng sẽ có tối đa 100 chỉ tiêu được cấp bù học bổng của Chính phủ Việt Nam bao gồm: vé máy bay một lượt đi và về, phí đi đường, lệ phí làm hộ chiếu, visa và sinh hoạt phí theo chế độ hiện hành (nếu đáp ứng được các điều kiện).3. Đối tượng, điều kiện và hồ sơ dự tuyển: Xem tại đây.\nThứ Năm, 08:40 28/11/2024\nTags:\nTweet\nCác bài đã đăng\n» Cuộc thi:"" Học sinh, sinh viên với ý tưởng khởi nghiệp"" lần thứ VII. (18/12/2024)\n» Dự kiến chỉ tiêu và phương thức xét tuyển các ngành thuộc Khoa CNTT - Trường Đại học Công Nghiệp Hà Nội năm 2025 (18/12/2024)\n» Cẩm nang Kỳ thi Olympic Tin học Sinh viên Việt Nam lần thứ 33 (OLP’24) và Kỳ thi lập trình sinh viên Quốc tế ICPC ASIA 2024 (11/12/2024)\nnext_contents:\n- Thông báo tuyển sinh đi học tại Hungari diện Hiệp định năm 2025\nTrang HaUI\nPhòng\nPhòng Tổ chức hành chính\nPhòng Đào tạo\nPhòng Công tác sinh viên\nPhòng Khoa học công nghệ\nPhòng hợp tác đối ngoại\nPhòng Tài chính kế toán\nPhòng Quản trị\nPhòng Thanh tra Giáo dục\nKhoa\nKhoa Công nghệ Hoá\nKhoa Công nghệ may & TKTT\nKhoa Công nghệ thông tin\nKhoa Điện\nKhoa Điện tử\nKhoa Khoa học cơ bản\nKhoa Lý luận chính trị - Pháp luật\nTrung tâm Đào tạo\nTrung tâm Đào tạo Sau đại học\nTrung tâm Giáo dục thể chất và Thể thao\nTrung tâm Công nghệ Ô tô và Đào tạo lái xe\nTrung tâm Công nghệ thông tin\nTrung tâm Việt Nhật\nTrung tâm Giáo dục Quốc phòng An ninh\nTrung tâm Dịch vụ\nTrung tâm Truyền thông & Quan hệ Công chúng\nTrạm Y tế\nTrung tâm Hỗ trợ Sinh viên\nTrung tâm Đảm bảo chất lượng\nTrung tâm Thông tin Thư viện\nTrung tâm khảo thí\nViện nghiên cứu\nCông ty Letco\nThư điện tử\nSitemap\nLiên hệ\nToggle navigation\nGIỚI THIỆU\nTHÔNG TIN CHUNG\nCƠ CẤU TỔ CHỨC\nCHIẾN LƯỢC PHÁT TRIỂN\nCÁN BỘ GIẢNG VIÊN\nCƠ SỞ VẬT CHẤT\nLIÊN HỆ\nĐÀO TẠO\nĐẠI HỌC\nKHOA HỌC MÁY TÍNH\nKỸ THUẬT PHẦN MỀM\nHỆ THỐNG THÔNG TIN\nCÔNG NGHỆ THÔNG TIN\nCÔNG NGHỆ ĐA PHƯƠNG TIỆN\nAN TOÀN THÔNG TIN\nSAU ĐẠI HỌC\nHỆ THỐNG THÔNG TIN\nKẾ HOẠCH\nTIẾN ĐỘ\nQUY CHẾ, BIỂU MẪU\nNGHIÊN CỨU KHOA HỌC\nCÔNG TRÌNH CÔNG BỐ\nĐỀ TÀI, DỰ ÁN\nSINH VIÊN NCKH\nTIN KHCN\nCÔNG TÁC SINH VIÊN\nQUY CHẾ\nGƯƠNG SÁNG SINH VIÊN\nHỌC BỔNG\nCÂU LẠC BỘ\nTHƯ VIỆN ẢNH\nTUYỂN DỤNG\nTHÔNG BÁO\nTRANG CHỦ > THÔNG BÁO\nThông báo tuyển sinh đi học tại Hungari diện Hiệp định năm 2025\n', 'content: Thông báo tuyển sinh đi học tại Hungari diện Hiệp định năm 2025\nTrang HaUI\nPhòng\nPhòng Tổ chức hành chính\nPhòng Đào tạo\nPhòng Công tác sinh viên\nPhòng Khoa học công nghệ\nPhòng hợp tác đối ngoại\nPhòng Tài chính kế toán\nPhòng Quản trị\nPhòng Thanh tra Giáo dục\nKhoa\nKhoa Công nghệ Hoá\nKhoa Công nghệ may & TKTT\nKhoa Công nghệ thông tin\nKhoa Điện\nKhoa Điện tử\nKhoa Khoa học cơ bản\nKhoa Lý luận chính trị - Pháp luật\nTrung tâm Đào tạo\nTrung tâm Đào tạo Sau đại học\nTrung tâm Giáo dục thể chất và Thể thao\nTrung tâm Công nghệ Ô tô và Đào tạo lái xe\nTrung tâm Công nghệ thông tin\nTrung tâm Việt Nhật\nTrung tâm Giáo dục Quốc phòng An ninh\nTrung tâm Dịch vụ\nTrung tâm Truyền thông & Quan hệ Công chúng\nTrạm Y tế\nTrung tâm Hỗ trợ Sinh viên\nTrung tâm Đảm bảo chất lượng\nTrung tâm Thông tin Thư viện\nTrung tâm khảo thí\nViện nghiên cứu\nCông ty Letco\nThư điện tử\nSitemap\nLiên hệ\nToggle navigation\nGIỚI THIỆU\nTHÔNG TIN CHUNG\nCƠ CẤU TỔ CHỨC\nCHIẾN LƯỢC PHÁT TRIỂN\nCÁN BỘ GIẢNG VIÊN\nCƠ SỞ VẬT CHẤT\nLIÊN HỆ\nĐÀO TẠO\nĐẠI HỌC\nKHOA HỌC MÁY TÍNH\nKỸ THUẬT PHẦN MỀM\nHỆ THỐNG THÔNG TIN\nCÔNG NGHỆ THÔNG TIN\nCÔNG NGHỆ ĐA PHƯƠNG TIỆN\nAN TOÀN THÔNG TIN\nSAU ĐẠI HỌC\nHỆ THỐNG THÔNG TIN\nKẾ HOẠCH\nTIẾN ĐỘ\nQUY CHẾ, BIỂU MẪU\nNGHIÊN CỨU KHOA HỌC\nCÔNG TRÌNH CÔNG BỐ\nĐỀ TÀI, DỰ ÁN\nSINH VIÊN NCKH\nTIN KHCN\nCÔNG TÁC SINH VIÊN\nQUY CHẾ\nGƯƠNG SÁNG SINH VIÊN\nHỌC BỔNG\nCÂU LẠC BỘ\nTHƯ VIỆN ẢNH\nTUYỂN DỤNG\nTHÔNG BÁO\nTRANG CHỦ > THÔNG BÁO\nThông báo tuyển sinh đi học tại Hungari diện Hiệp định năm 2025\nnext_contents:\n', 'content: Thông báo tuyển sinh đi học tại Hungari diện Hiệp định năm 2025\nTrang HaUI\nPhòng\nPhòng Tổ chức hành chính\nPhòng Đào tạo\nPhòng Công tác sinh viên\nPhòng Khoa học công nghệ\nPhòng hợp tác đối ngoại\nPhòng Tài chính kế toán\nPhòng Quản trị\nPhòng Thanh tra Giáo dục\nKhoa\nKhoa Công nghệ Hoá\nKhoa Công nghệ may & TKTT\nKhoa Công nghệ thông tin\nKhoa Điện\nKhoa Điện tử\nKhoa Khoa học cơ bản\nKhoa Lý luận chính trị - Pháp luật\nTrung tâm Đào tạo\nTrung tâm Đào tạo Sau đại học\nTrung tâm Giáo dục thể chất và Thể thao\nTrung tâm Công nghệ Ô tô và Đào tạo lái xe\nTrung tâm Công nghệ thông tin\nTrung tâm Việt Nhật\nTrung tâm Giáo dục Quốc phòng An ninh\nTrung tâm Dịch vụ\nTrung tâm Truyền thông & Quan hệ Công chúng\nTrạm Y tế\nTrung tâm Hỗ trợ Sinh viên\nTrung tâm Đảm bảo chất lượng\nTrung tâm Thông tin Thư viện\nTrung tâm khảo thí\nViện nghiên cứu\nCông ty Letco\nThư điện tử\nSitemap\nLiên hệ\nToggle navigation\nGIỚI THIỆU\nTHÔNG TIN CHUNG\nCƠ CẤU TỔ CHỨC\nCHIẾN LƯỢC PHÁT TRIỂN\nCÁN BỘ GIẢNG VIÊN\nCƠ SỞ VẬT CHẤT\nLIÊN HỆ\nĐÀO TẠO\nĐẠI HỌC\nKHOA HỌC MÁY TÍNH\nKỸ THUẬT PHẦN MỀM\nHỆ THỐNG THÔNG TIN\nCÔNG NGHỆ THÔNG TIN\nCÔNG NGHỆ ĐA PHƯƠNG TIỆN\nAN TOÀN THÔNG TIN\nSAU ĐẠI HỌC\nHỆ THỐNG THÔNG TIN\nKẾ HOẠCH\nTIẾN ĐỘ\nQUY CHẾ, BIỂU MẪU\nNGHIÊN CỨU KHOA HỌC\nCÔNG TRÌNH CÔNG BỐ\nĐỀ TÀI, DỰ ÁN\nSINH VIÊN NCKH\nTIN KHCN\nCÔNG TÁC SINH VIÊN\nQUY CHẾ\nGƯƠNG SÁNG SINH VIÊN\nHỌC BỔNG\nCÂU LẠC BỘ\nTHƯ VIỆN ẢNH\nTUYỂN DỤNG\nTHÔNG BÁO\nTRANG CHỦ > THÔNG BÁO\nThông báo tuyển sinh đi học tại Hungari diện Hiệp định năm 2025\nnext_contents:\n']","['Thông báo tuyển sinh đi học tại Hungari diện Hiệp định năm 2025 Trang HaUI Phòng Phòng Tổ chức hành chính Phòng Đào tạo Phòng Công tác sinh viên Phòng Khoa học công nghệ Phòng hợp tác đối ngoại Phòng Tài chính kế toán Phòng Quản trị Phòng Thanh tra Giáo dục Khoa Khoa Công nghệ Hoá Khoa Công nghệ may & TKTT Khoa Công nghệ thông tin Khoa Điện Khoa Điện tử Khoa Khoa học cơ bản Khoa Lý luận chính trị - Pháp luật Trung tâm Đào tạo Trung tâm Đào tạo Sau đại học Trung tâm Giáo dục thể chất và Thể thao Trung tâm Công nghệ Ô tô và Đào tạo lái xe Trung tâm Công nghệ thông tin Trung tâm Việt Nhật Trung tâm Giáo dục Quốc phòng An ninh Trung tâm Dịch vụ Trung tâm Truyền thông & Quan hệ Công chúng Trạm Y tế Trung tâm Hỗ trợ Sinh viên Trung tâm Đảm bảo chất lượng Trung tâm Thông tin Thư viện Trung tâm khảo thí Viện nghiên cứu Công ty Letco Thư điện tử Sitemap Liên hệ Toggle navigation GIỚI THIỆU THÔNG TIN CHUNG CƠ CẤU TỔ CHỨC CHIẾN LƯỢC PHÁT TRIỂN CÁN BỘ GIẢNG VIÊN CƠ SỞ VẬT CHẤT LIÊN HỆ ĐÀO TẠO ĐẠI HỌC KHOA HỌC MÁY TÍNH KỸ THUẬT PHẦN MỀM HỆ THỐNG THÔNG TIN CÔNG NGHỆ THÔNG TIN CÔNG NGHỆ ĐA PHƯƠNG TIỆN AN TOÀN THÔNG TIN SAU ĐẠI HỌC HỆ THỐNG THÔNG TIN KẾ HOẠCH TIẾN ĐỘ QUY CHẾ, BIỂU MẪU NGHIÊN CỨU KHOA HỌC CÔNG TRÌNH CÔNG BỐ ĐỀ TÀI, DỰ ÁN SINH VIÊN NCKH TIN KHCN CÔNG TÁC SINH VIÊN QUY CHẾ GƯƠNG SÁNG SINH VIÊN HỌC BỔNG CÂU LẠC BỘ THƯ VIỆN ẢNH TUYỂN DỤNG THÔNG BÁO TRANG CHỦ > THÔNG BÁO Thông báo tuyển sinh đi học tại Hungari diện Hiệp định năm 2025 Bộ Giáo dục và Đào tạo ban hành Thông báo số 1743/TB-BGDĐT ngày 22 tháng 11 năm 2024 về Tuyển sinh đi học tại Hungari diện Hiệp định năm 2025 như sau:1. Thông tin chung về chương trình:- Chính phủ Hungari cấp 200 chỉ tiêu học bổng cho công dân Việt Nam đi đào tạo trình độ Tiến sĩ, Thạc sĩ, Thạc sĩ liên thông từ đại học, Đại học, Ngắn hạn tại Hungari.- Các lĩnh vực ưu tiên: Khoa học Công nghệ, Kỹ thuật, Toán học, Bán dẫn, Khoa học dữ liệu, Khoa học máy tính, Trí tuệ nhân tạo, Giáo dục, Kinh tế, Khoa học y tế và sức khỏe, Nông nghiệp, Khoa học tự nhiên, Nghệ thuật, Khoa học xã hội và Nhân văn, Luật, Kiến trúc, Thú y, Khoa học thể thao.1.2. Chế độ học bổng- Miễn phí đào tạo, nghiên cứu, cấp bảo hiểm y tế và hỗ trợ chỗ ở, sinh hoạt phí theo quy định của phía Hung-ga-ri.- Trong số 200 chỉ tiêu được Chính phủ Hung-ga-ri cấp học bổng sẽ có tối đa 100 chỉ tiêu được cấp bù học bổng của Chính phủ Việt Nam bao gồm: vé máy bay một lượt đi và về, phí đi đường, lệ phí làm hộ chiếu, visa và sinh hoạt phí theo chế độ hiện hành (nếu đáp ứng được các điều kiện).3.']",Tôi không có thông tin này và khuyến nghị bạn tham khảo nguồn khác để biết thêm chi tiết về chương trình tuyển sinh đi học tại Hungary diện Hiệp định năm 2025.,"Bộ Giáo dục và Đào tạo đã ban hành Thông báo số 1743/TB-BGDĐT ngày 22 tháng 11 năm 2024 về Tuyển sinh đi học tại Hungari diện Hiệp định năm 2025, trong đó Chính phủ Hungari cấp 200 chỉ tiêu học bổng cho công dân Việt Nam đi đào tạo trình độ Tiến sĩ, Thạc sĩ, Thạc sĩ liên thông từ đại học, Đại học, Ngắn hạn tại Hungari. Các lĩnh vực ưu tiên bao gồm Khoa học Công nghệ, Kỹ thuật, Toán học, Bán dẫn, Khoa học dữ liệu, Khoa học máy tính, Trí tuệ nhân tạo, Giáo dục, Kinh tế, Khoa học y tế và sức khỏe, Nông nghiệp, Khoa học tự nhiên, Nghệ thuật, Khoa học xã hội và Nhân văn, Luật, Kiến trúc, Thú y, Khoa học thể thao. Chế độ học bổng bao gồm miễn phí đào tạo, nghiên cứu, cấp bảo hiểm y tế và hỗ trợ chỗ ở, sinh hoạt phí theo quy định của phía Hung-ga-ri.",0.999999999975,1.0,0.0,0.0,0.8838362491397986,0.8021478652954102,2.3408608436584473
24,Tại sao mà việc học tập tại Việt Nam lại quan trọng cho con cái của tôi khi xét tuyển vào Đại học Công nghiệp Hà Nội?,"['content: vị thế đã được khẳng định, Khoa Công nghệ thông tin Trường Đại học Công Nghiệp Hà Nội đã và đang là cơ sở đào tạo cung ứng đội ngũ Kỹ sư thực hành cho nhiều Tập đoàn/Doanh nghiệp lớn. Nhiều trong số đó đảm nhiệm các vị trí quản lý, trở thành Kỹ sư cao cấp,…Kỳ thi kỹ năng nghề – dưới góc nhìn của Trường Đại học Công Nghiệp Hà Nội không chỉ mang tính chất lựa chọn thí sinh đi thi tay nghề các cấp mà còn lan tỏa kỹ năng, chất lượng của cuộc thi trong sinh viên toàn trường. Từ đó, nhà trường hướng tới việc hoàn thiện chương trình giảng dạy, thay đổi phương pháp dạy và học, đánh giá kỹ năng ở từng nghề cụ thể để có được bộ chương trình đào tạo tốt hơn, phương pháp dạy tốt hơn cho sinh viên.\nnext_contents:\n- Chiều 19/11/2024, Sở LĐTBXH TP Hà Nội đã tổ chức Lễ Kỷ niệm 42 năm Ngày Nhà giáo Việt Nam (20/11/1982 - 20/11/2024), tuyên dương nhà giáo và học sinh, sinh viên giáo dục nghề nghiệp có thành tích xuất sắc trong năm 2023 – 2024. Sinh viên Nguyễn Tiến Kiên đã xuất sắc vượt qua Kỳ thi Kỹ năng Nghề thành phố Hà Nội năm 2023 và đạt giải Nhất nghề giải pháp phần mềm CNTT.Chúc mừng sinh viên Nguyễn Tiến Kiên – lớp Đại học CNTT7 Khóa 16, Chủ nhiệm Câu lạc bộ Tin học HIT Khoa Công nghệ thông tin Trường Đại học Công Nghiệp Hà Nội vinh dự đón nhận Bằng khen của Chủ tịch Uỷ ban Nhân dân Thành phố Hà Nội vì đã có thành tích tại Kỹ thi Kỹ năng nghề thành phố Hà Nội năm 2023.Phó Giám đốc Sở LĐTB&XH Hà Nội, Ông Nguyễn Hồng Dân nhấn mạnh: “Để có được những kết quả như trên là sự nỗ lực không ngừng nghỉ của các thầy, cô giáo. Bao nhiêu thế hệ các thầy giáo, cô giáo đang ngày đêm làm việc, vượt qua mọi khó khăn, bỏ ra biết bao công sức, từng ngày cần mẫn, trách nhiệm cao cả với công việc của người thầy để đóng góp tích cực cho sự phát triển giáo dục nghề nghiệp Thủ đô - với vai trò nòng cốt trong công tác đào tạo và nâng cao chất lượng nguồn nhân lực, góp phần trong công cuộc xây dựng thành phố Hà Nội trở thành một đô thị thông minh, bền vững, giàu đẹp”.Thông qua mỗi Kỳ thi là cơ hội để nhà trường tiếp cận và gắn kết với xu thế mới của khoa học, công nghệ và việc làm trong đào tạo; thực hiện đổi mới, nâng cao chất lượng dạy và học, áp dụng những mô hình/chương trình/phương pháp đào tạo mới, đánh giá, phân loại kỹ năng mới… Sinh viên được trang bị, rèn luyện kỹ năng số trong học tập, làm việc, hướng đến tiêu chuẩn của công dân số, công dân toàn cầu.Bên cạnh đó, phát huy nội lực sẵn có với vị thế đã được khẳng định, Khoa Công nghệ thông tin Trường Đại học Công Nghiệp Hà Nội đã và đang là cơ sở đào tạo cung ứng đội ngũ Kỹ sư thực hành cho nhiều Tập đoàn/Doanh nghiệp lớn. Nhiều trong số đó đảm nhiệm các vị trí quản lý, trở thành Kỹ sư cao cấp,…Kỳ thi kỹ năng nghề – dưới góc nhìn của\n', 'content: Thứ Sáu, 14:02 22/05/2020\nCác bài đã đăng\nCuộc thi:"" Học sinh, sinh viên với ý tưởng khởi nghiệp"" lần thứ VII.\nThứ Tư, 09:57 18/12/2024\nDự kiến chỉ tiêu và phương thức xét tuyển các ngành thuộc Khoa CNTT - Trường Đại học Công Nghiệp Hà Nội năm 2025\nThứ Tư, 09:14 18/12/2024\nCẩm nang Kỳ thi Olympic Tin học Sinh viên Việt Nam lần thứ 33 (OLP’24) và Kỳ thi lập trình sinh viên Quốc tế ICPC ASIA 2024\nThứ Tư, 07:54 11/12/2024\nKhảo sát mức độ quan tâm thị trường việc làm Nhật Bản đợt 2\nThứ Ba, 12:34 10/12/2024\nKhởi động Cuộc thi Huawei ICT toàn cầu 2024-2025\nThứ Hai, 09:04 09/12/2024\nDanh sách các lớp học trực tuyến từ ngày 30/3/2020 đến ngày 5/4/2020\nThứ Bảy, 14:46 28/03/2020\nKế hoạch tổ chức hoạt động dạy học tuần từ 23/03/2020 đến 05/04/2020 khoa CNTT\nThứ Hai, 09:03 23/03/2020\nHội thảo hướng nghiệp trở thành người tiên phong với VTI\nThứ Tư, 09:59 25/12/2019\nĐăng ký tham gia cuộc đua số xe tự hành 2019-2020\nThứ Năm, 10:46 24/10/2019\nHọc bổng tài năng Samsung - STP 2019 ""DÁM THAY ĐỔI - DÁM DẪN ĐẦU""\nThứ Hai, 08:21 06/05/2019\nBản đồ chỉ dẫn\nTrường Đại học Công nghiệp Hà Nội\nTrụ sở chính\nSố 298 đường Cầu Diễn, quận Bắc Từ Liêm, Hà Nội\n+84 243 765 5121\nEmail: dhcnhn@haui.edu.vn\nCác cơ sở khác\nCơ sở 2: Phường Tây Tựu, quận Bắc Từ Liêm, Hà Nội\nCơ sở 3: Phường Lê Hồng Phong, thành phố Phủ Lý, Hà Nam\nLiên kết site\nTrường Đại học Công nghiệp Hà Nội\nThông tin tuyển sinh\nHành chính điện tử\nĐào tạo trực tuyến\nCổng thông tin đào tạo\nCopyright © 2018 Hanoi University of Industry.\nnext_contents:\n- Thứ Bảy, 12:42 04/04/2020\nTags:\nTweet\nCác bài đã đăng\n» Cuộc thi:"" Học sinh, sinh viên với ý tưởng khởi nghiệp"" lần thứ VII. (18/12/2024)\n» Dự kiến chỉ tiêu và phương thức xét tuyển các ngành thuộc Khoa CNTT - Trường Đại học Công Nghiệp Hà Nội năm 2025 (18/12/2024)\n» Cẩm nang Kỳ thi Olympic Tin học Sinh viên Việt Nam lần thứ 33 (OLP’24) và Kỳ thi lập trình sinh viên Quốc tế ICPC ASIA 2024 (11/12/2024)\n» Khảo sát mức độ quan tâm thị trường việc làm Nhật Bản đợt 2 (10/12/2024)\n» Khởi động Cuộc thi Huawei ICT toàn cầu 2024-2025 (09/12/2024)\n» Danh sách các lớp học trực tuyến từ ngày 30/3/2020 đến ngày 5/4/2020 (28/03/2020)\n» Kế hoạch tổ chức hoạt động dạy học tuần từ 23/03/2020 đến 05/04/2020 khoa CNTT (23/03/2020)\n» Hội thảo hướng nghiệp trở thành người tiên phong với VTI (25/12/2019)\n» Đăng ký tham gia cuộc đua số xe tự hành 2019-2020 (24/10/2019)\n» Học bổng tài năng Samsung - STP 2019 ""DÁM THAY ĐỔI - DÁM DẪN ĐẦU"" (06/05/2019)\nTin tiêu điểm\nSinh viên Khóa 19 Khoa Công nghệ thông tin đạt Học bổng HaUI 100% toàn khóa học.\nThứ Sáu, 11:07 20/09/2024\nĐội bóng khoa Công nghệ thông tin cùng những trận cầu đáng nhớ\nThứ Bảy, 10:00 23/07/2022\nĐại hội đại biểu Liên chi Đoàn khoa Công nghệ thông tin lần thứ X, nhiệm kỳ 2022 - 2024\nThứ Hai, 15:00 18/04/2022\nGặp mặt tân Sinh viên K15 khoa Công nghệ thông tin\nThứ Tư, 08:17 28/10/2020\nChương trình thực tập tại SVMC ""SVMC Internship Program 2020""\nThứ Sáu, 14:02 22/05/2020\nCác bài đã đăng\nCuộc thi:"" Học sinh, sinh viên với ý tưởng khởi nghiệp"" lần thứ VII.\nThứ Tư, 09:57 18/12/2024\nDự kiến chỉ tiêu và phương thức xét tuyển các ngành thuộc Khoa CNTT - Trường Đại học Công Nghiệp Hà Nội năm 2025\nThứ Tư, 09:14 18/12/2024\n', 'content: Thứ Sáu, 14:02 22/05/2020\nCác bài đã đăng\nCuộc thi:"" Học sinh, sinh viên với ý tưởng khởi nghiệp"" lần thứ VII.\nThứ Tư, 09:57 18/12/2024\nDự kiến chỉ tiêu và phương thức xét tuyển các ngành thuộc Khoa CNTT - Trường Đại học Công Nghiệp Hà Nội năm 2025\nThứ Tư, 09:14 18/12/2024\nCẩm nang Kỳ thi Olympic Tin học Sinh viên Việt Nam lần thứ 33 (OLP’24) và Kỳ thi lập trình sinh viên Quốc tế ICPC ASIA 2024\nThứ Tư, 07:54 11/12/2024\nKhảo sát mức độ quan tâm thị trường việc làm Nhật Bản đợt 2\nThứ Ba, 12:34 10/12/2024\nKhởi động Cuộc thi Huawei ICT toàn cầu 2024-2025\nThứ Hai, 09:04 09/12/2024\nDanh sách các lớp học trực tuyến từ ngày 30/3/2020 đến ngày 5/4/2020\nThứ Bảy, 14:46 28/03/2020\nKế hoạch tổ chức hoạt động dạy học tuần từ 23/03/2020 đến 05/04/2020 khoa CNTT\nThứ Hai, 09:03 23/03/2020\nHội thảo hướng nghiệp trở thành người tiên phong với VTI\nThứ Tư, 09:59 25/12/2019\nĐăng ký tham gia cuộc đua số xe tự hành 2019-2020\nThứ Năm, 10:46 24/10/2019\nHọc bổng tài năng Samsung - STP 2019 ""DÁM THAY ĐỔI - DÁM DẪN ĐẦU""\nThứ Hai, 08:21 06/05/2019\nBản đồ chỉ dẫn\nTrường Đại học Công nghiệp Hà Nội\nTrụ sở chính\nSố 298 đường Cầu Diễn, quận Bắc Từ Liêm, Hà Nội\n+84 243 765 5121\nEmail: dhcnhn@haui.edu.vn\nCác cơ sở khác\nCơ sở 2: Phường Tây Tựu, quận Bắc Từ Liêm, Hà Nội\nCơ sở 3: Phường Lê Hồng Phong, thành phố Phủ Lý, Hà Nam\nLiên kết site\nTrường Đại học Công nghiệp Hà Nội\nThông tin tuyển sinh\nHành chính điện tử\nĐào tạo trực tuyến\nCổng thông tin đào tạo\nCopyright © 2018 Hanoi University of Industry.\nnext_contents:\n- Thứ Bảy, 12:42 04/04/2020\nTags:\nTweet\nCác bài đã đăng\n» Cuộc thi:"" Học sinh, sinh viên với ý tưởng khởi nghiệp"" lần thứ VII. (18/12/2024)\n» Dự kiến chỉ tiêu và phương thức xét tuyển các ngành thuộc Khoa CNTT - Trường Đại học Công Nghiệp Hà Nội năm 2025 (18/12/2024)\n» Cẩm nang Kỳ thi Olympic Tin học Sinh viên Việt Nam lần thứ 33 (OLP’24) và Kỳ thi lập trình sinh viên Quốc tế ICPC ASIA 2024 (11/12/2024)\n» Khảo sát mức độ quan tâm thị trường việc làm Nhật Bản đợt 2 (10/12/2024)\n» Khởi động Cuộc thi Huawei ICT toàn cầu 2024-2025 (09/12/2024)\n» Danh sách các lớp học trực tuyến từ ngày 30/3/2020 đến ngày 5/4/2020 (28/03/2020)\n» Kế hoạch tổ chức hoạt động dạy học tuần từ 23/03/2020 đến 05/04/2020 khoa CNTT (23/03/2020)\n» Hội thảo hướng nghiệp trở thành người tiên phong với VTI (25/12/2019)\n» Đăng ký tham gia cuộc đua số xe tự hành 2019-2020 (24/10/2019)\n» Học bổng tài năng Samsung - STP 2019 ""DÁM THAY ĐỔI - DÁM DẪN ĐẦU"" (06/05/2019)\nTin tiêu điểm\nSinh viên Khóa 19 Khoa Công nghệ thông tin đạt Học bổng HaUI 100% toàn khóa học.\nThứ Sáu, 11:07 20/09/2024\nĐội bóng khoa Công nghệ thông tin cùng những trận cầu đáng nhớ\nThứ Bảy, 10:00 23/07/2022\nĐại hội đại biểu Liên chi Đoàn khoa Công nghệ thông tin lần thứ X, nhiệm kỳ 2022 - 2024\nThứ Hai, 15:00 18/04/2022\nGặp mặt tân Sinh viên K15 khoa Công nghệ thông tin\nThứ Tư, 08:17 28/10/2020\nChương trình thực tập tại SVMC ""SVMC Internship Program 2020""\nThứ Sáu, 14:02 22/05/2020\nCác bài đã đăng\nCuộc thi:"" Học sinh, sinh viên với ý tưởng khởi nghiệp"" lần thứ VII.\nThứ Tư, 09:57 18/12/2024\nDự kiến chỉ tiêu và phương thức xét tuyển các ngành thuộc Khoa CNTT - Trường Đại học Công Nghiệp Hà Nội năm 2025\nThứ Tư, 09:14 18/12/2024\n', 'content: Thứ Sáu, 14:02 22/05/2020\nCác bài đã đăng\nCuộc thi:"" Học sinh, sinh viên với ý tưởng khởi nghiệp"" lần thứ VII.\nThứ Tư, 09:57 18/12/2024\nDự kiến chỉ tiêu và phương thức xét tuyển các ngành thuộc Khoa CNTT - Trường Đại học Công Nghiệp Hà Nội năm 2025\nThứ Tư, 09:14 18/12/2024\nCẩm nang Kỳ thi Olympic Tin học Sinh viên Việt Nam lần thứ 33 (OLP’24) và Kỳ thi lập trình sinh viên Quốc tế ICPC ASIA 2024\nThứ Tư, 07:54 11/12/2024\nKhảo sát mức độ quan tâm thị trường việc làm Nhật Bản đợt 2\nThứ Ba, 12:34 10/12/2024\nKhởi động Cuộc thi Huawei ICT toàn cầu 2024-2025\nThứ Hai, 09:04 09/12/2024\nKế hoạch tổ chức hoạt động dạy học tuần từ 23/03/2020 đến 05/04/2020 khoa CNTT\nThứ Hai, 09:03 23/03/2020\nHội thảo hướng nghiệp trở thành người tiên phong với VTI\nThứ Tư, 09:59 25/12/2019\nĐăng ký tham gia cuộc đua số xe tự hành 2019-2020\nThứ Năm, 10:46 24/10/2019\nHọc bổng tài năng Samsung - STP 2019 ""DÁM THAY ĐỔI - DÁM DẪN ĐẦU""\nThứ Hai, 08:21 06/05/2019\nKế hoạch bảo vệ Đồ án tốt nghiệp các lớp Đại học Khóa 10\nThứ Tư, 14:51 24/04/2019\nBản đồ chỉ dẫn\nTrường Đại học Công nghiệp Hà Nội\nTrụ sở chính\nSố 298 đường Cầu Diễn, quận Bắc Từ Liêm, Hà Nội\n+84 243 765 5121\nEmail: dhcnhn@haui.edu.vn\nCác cơ sở khác\nCơ sở 2: Phường Tây Tựu, quận Bắc Từ Liêm, Hà Nội\nCơ sở 3: Phường Lê Hồng Phong, thành phố Phủ Lý, Hà Nam\nLiên kết site\nTrường Đại học Công nghiệp Hà Nội\nThông tin tuyển sinh\nHành chính điện tử\nĐào tạo trực tuyến\nCổng thông tin đào tạo\nCopyright © 2018 Hanoi University of Industry.\nnext_contents:\n- Thứ Bảy, 14:46 28/03/2020\nTags:\nTweet\nCác bài đã đăng\n» Cuộc thi:"" Học sinh, sinh viên với ý tưởng khởi nghiệp"" lần thứ VII. (18/12/2024)\n» Dự kiến chỉ tiêu và phương thức xét tuyển các ngành thuộc Khoa CNTT - Trường Đại học Công Nghiệp Hà Nội năm 2025 (18/12/2024)\n» Cẩm nang Kỳ thi Olympic Tin học Sinh viên Việt Nam lần thứ 33 (OLP’24) và Kỳ thi lập trình sinh viên Quốc tế ICPC ASIA 2024 (11/12/2024)\n» Khảo sát mức độ quan tâm thị trường việc làm Nhật Bản đợt 2 (10/12/2024)\n» Khởi động Cuộc thi Huawei ICT toàn cầu 2024-2025 (09/12/2024)\n» Kế hoạch tổ chức hoạt động dạy học tuần từ 23/03/2020 đến 05/04/2020 khoa CNTT (23/03/2020)\n» Hội thảo hướng nghiệp trở thành người tiên phong với VTI (25/12/2019)\n» Đăng ký tham gia cuộc đua số xe tự hành 2019-2020 (24/10/2019)\n» Học bổng tài năng Samsung - STP 2019 ""DÁM THAY ĐỔI - DÁM DẪN ĐẦU"" (06/05/2019)\n» Kế hoạch bảo vệ Đồ án tốt nghiệp các lớp Đại học Khóa 10 (24/04/2019)\nTin tiêu điểm\nSinh viên Khóa 19 Khoa Công nghệ thông tin đạt Học bổng HaUI 100% toàn khóa học.\nThứ Sáu, 11:07 20/09/2024\nĐội bóng khoa Công nghệ thông tin cùng những trận cầu đáng nhớ\nThứ Bảy, 10:00 23/07/2022\nĐại hội đại biểu Liên chi Đoàn khoa Công nghệ thông tin lần thứ X, nhiệm kỳ 2022 - 2024\nThứ Hai, 15:00 18/04/2022\nGặp mặt tân Sinh viên K15 khoa Công nghệ thông tin\nThứ Tư, 08:17 28/10/2020\nChương trình thực tập tại SVMC ""SVMC Internship Program 2020""\nThứ Sáu, 14:02 22/05/2020\nCác bài đã đăng\nCuộc thi:"" Học sinh, sinh viên với ý tưởng khởi nghiệp"" lần thứ VII.\nThứ Tư, 09:57 18/12/2024\nDự kiến chỉ tiêu và phương thức xét tuyển các ngành thuộc Khoa CNTT - Trường Đại học Công Nghiệp Hà Nội năm 2025\nThứ Tư, 09:14 18/12/2024\n']","['Liên hệ Toggle navigation GIỚI THIỆU THÔNG TIN CHUNG CƠ CẤU TỔ CHỨC CHIẾN LƯỢC PHÁT TRIỂN CÁN BỘ GIẢNG VIÊN CƠ SỞ VẬT CHẤT LIÊN HỆ ĐÀO TẠO ĐẠI HỌC KHOA HỌC MÁY TÍNH KỸ THUẬT PHẦN MỀM HỆ THỐNG THÔNG TIN CÔNG NGHỆ THÔNG TIN CÔNG NGHỆ ĐA PHƯƠNG TIỆN AN TOÀN THÔNG TIN SAU ĐẠI HỌC HỆ THỐNG THÔNG TIN KẾ HOẠCH TIẾN ĐỘ QUY CHẾ, BIỂU MẪU NGHIÊN CỨU KHOA HỌC CÔNG TRÌNH CÔNG BỐ ĐỀ TÀI, DỰ ÁN SINH VIÊN NCKH TIN KHCN CÔNG TÁC SINH VIÊN QUY CHẾ GƯƠNG SÁNG SINH VIÊN HỌC BỔNG CÂU LẠC BỘ THƯ VIỆN ẢNH TUYỂN DỤNG THÔNG BÁO TRANG CHỦ > THÔNG BÁO Thông báo tuyển sinh đi học tại Hungari diện Hiệp định năm 2025 Bộ Giáo dục và Đào tạo ban hành Thông báo số 1743/TB-BGDĐT ngày 22 tháng 11 năm 2024 về Tuyển sinh đi học tại Hungari diện Hiệp định năm 2025 như sau:1. Thông tin chung về chương trình:- Chính phủ Hungari cấp 200 chỉ tiêu học bổng cho công dân Việt Nam đi đào tạo trình độ Tiến sĩ, Thạc sĩ, Thạc sĩ liên thông từ đại học, Đại học, Ngắn hạn tại Hungari.- Các lĩnh vực ưu tiên: Khoa học Công nghệ, Kỹ thuật, Toán học, Bán dẫn, Khoa học dữ liệu, Khoa học máy tính, Trí tuệ nhân tạo, Giáo dục, Kinh tế, Khoa học y tế và sức khỏe, Nông nghiệp, Khoa học tự nhiên, Nghệ thuật, Khoa học xã hội và Nhân văn, Luật, Kiến trúc, Thú y, Khoa học thể thao.1.2. Chế độ học bổng- Miễn phí đào tạo, nghiên cứu, cấp bảo hiểm y tế và hỗ trợ chỗ ở, sinh hoạt phí theo quy định của phía Hung-ga-ri.- Trong số 200 chỉ tiêu được Chính phủ Hung-ga-ri cấp học bổng sẽ có tối đa 100 chỉ tiêu được cấp bù học bổng của Chính phủ Việt Nam bao gồm: vé máy bay một lượt đi và về, phí đi đường, lệ phí làm hộ chiếu, visa và sinh hoạt phí theo chế độ hiện hành (nếu đáp ứng được các điều kiện).3. Đối tượng, điều kiện và hồ sơ dự tuyển: Xem tại đây. Thứ Năm, 08:40 28/11/2024 Tags: Tweet Các bài đã đăng » Cuộc thi:"" Học sinh, sinh viên với ý tưởng khởi nghiệp"" lần thứ VII. (18/12/2024) » Dự kiến chỉ tiêu và phương thức xét tuyển các ngành thuộc Khoa CNTT - Trường Đại học Công Nghiệp Hà Nội năm 2025 (18/12/2024) » Cẩm nang Kỳ thi Olympic Tin học Sinh viên Việt Nam lần thứ 33 (OLP’24) và Kỳ thi lập trình sinh viên Quốc tế ICPC ASIA 2024 (11/12/2024) » Khảo sát mức độ quan tâm thị trường việc làm Nhật Bản đợt 2 (10/12/2024) » Khởi động Cuộc thi Huawei ICT toàn cầu 2024-2025 (09/12/2024) » Hướng dẫn cài đặt iHanoi - Bước tiên phong chuyển đổi số (27/11/2024) » Thông báo tuyển sinh đi học tại Trung Quốc năm 2025 (27/11/2024) » Đăng ký Hội thao Khoa Công nghệ thông tin năm 2024 (25/11/2024) » Thông báo tuyển sinh trình độ Thạc sỹ Hệ thống thông tin năm 2024 (23/11/2024) » Thông báo tổ chức chương trình Hội thảo thực tập, việc làm và phỏng vấn trực tiếp của Công ty TNHH Công nghiệp Brother Việt Nam - Thứ 5, ngày 28/11/2024 (22/11/2024) Tin tiêu điểm Sinh viên Khóa 19 Khoa Công nghệ thông tin đạt Học bổng HaUI 100% toàn khóa học. Thứ Sáu, 11:07 20/09/2024 Đội bóng khoa Công nghệ thông tin cùng những trận cầu đáng nhớ Thứ Bảy, 10:00 23/07/2022 Đại hội đại biểu Liên chi Đoàn khoa Công nghệ thông tin lần thứ X, nhiệm kỳ 2022 - 2024 Thứ Hai, 15:00 18/04/2022 Gặp mặt tân Sinh viên K15 khoa Công nghệ thông tin Thứ Tư, 08:17 28/10/2020 Chương trình thực tập tại SVMC ""SVMC Internship Program 2020"" Thứ Sáu, 14:02 22/05/2020 Các bài đã đăng Cuộc thi:"" Học sinh, sinh viên với ý tưởng khởi nghiệp"" lần thứ VII. Thứ Tư, 09:57 18/12/2024 Dự kiến chỉ tiêu và phương thức xét tuyển các ngành thuộc Khoa CNTT - Trường Đại học Công Nghiệp Hà Nội năm 2025 Thứ Tư, 09:14 18/12/2024 Cẩm nang Kỳ thi Olympic Tin học Sinh viên Việt Nam lần thứ 33 (OLP’24) và Kỳ thi lập trình sinh viên Quốc tế ICPC ASIA 2024 Thứ Tư, 07:54 11/12/2024 Khảo sát mức độ quan tâm thị trường việc làm Nhật Bản đợt 2 Thứ Ba, 12:34 10/12/2024 Khởi động Cuộc thi Huawei ICT toàn cầu 2024-2025 Thứ Hai, 09:04 09/12/2024 Hướng dẫn cài đặt iHanoi - Bước tiên phong chuyển đổi số Thứ Tư, 09:45 27/11/2024 Thông báo tuyển sinh đi học tại Trung Quốc năm 2025 Thứ Tư, 09:23 27/11/2024 Đăng ký Hội thao Khoa Công nghệ thông tin năm 2024 Thứ Hai, 09:51 25/11/2024 Thông báo tuyển sinh trình độ Thạc sỹ Hệ thống thông tin năm 2024 Thứ Bảy, 15:26 23/11/2024 Thông báo tổ chức chương trình Hội thảo thực tập, việc làm và phỏng vấn trực tiếp của Công ty TNHH Công nghiệp Brother Việt Nam - Thứ 5, ngày 28/11/2024 Thứ Sáu, 13:47 22/11/2024 Bản đồ chỉ dẫn Trường Đại học Công nghiệp Hà Nội Trụ sở chính Số 298 đường Cầu Diễn, quận Bắc Từ Liêm, Hà Nội +84 243 765 5121 Email: dhcnhn@haui.edu.vn Các cơ sở khác Cơ sở 2: Phường Tây Tựu, quận Bắc Từ Liêm, Hà Nội Cơ sở 3: Phường Lê Hồng Phong, thành phố Phủ Lý, Hà Nam Liên kết site Trường Đại học Công nghiệp Hà Nội Thông tin tuyển sinh Hành chính điện tử Đào tạo trực tuyến Cổng thông tin đào tạo Copyright © 2018 Hanoi University of Industry.']","Tôi không có thông tin này và khuyến nghị bạn tham khảo nguồn khác để tìm hiểu về tầm quan trọng của việc học tập tại Việt Nam trong việc xét tuyển vào Đại học Công nghiệp Hà Nội. Nếu bạn có câu hỏi khác liên quan đến khoa công nghệ thông tin hoặc các hoạt động tại trường, hãy cho tôi biết!","Việc học tập tại Việt Nam, đặc biệt là tại Đại học Công nghiệp Hà Nội, rất quan trọng vì trường cung cấp một môi trường học tập chất lượng với nhiều cơ hội việc làm sau khi tốt nghiệp. Hơn nữa, trường có các chương trình đào tạo đa dạng và hỗ trợ sinh viên tốt, giúp con cái bạn phát triển kỹ năng cần thiết cho tương lai.",0.9999999999,1.0,0.0,0.0,0.8901484015005604,1.0720300674438477,3.223050832748413
25,"Cuộc thi ""Học sinh, sinh viên với ý tưởng khởi nghiệp"" lần thứ VII diễn ra khi nào?","['content: Căn cứ tiến độ, kế hoạch đào tạo năm học 2024-2025;Nhà trường thông báo kế hoạch đăng ký, học tập tại học kỳ phụ 1 năm học 2024 - 2025 cho sinh viên Đại học các khóaThời khóa biểu học kỳ phụ 1 (2024-2025):Xem tại đây\nThứ Năm, 08:55 28/11/2024\nTags:\nTweet\nCác bài đã đăng\n» Cuộc thi:"" Học sinh, sinh viên với ý tưởng khởi nghiệp"" lần thứ VII. (18/12/2024)\n» Dự kiến chỉ tiêu và phương thức xét tuyển các ngành thuộc Khoa CNTT - Trường Đại học Công Nghiệp Hà Nội năm 2025 (18/12/2024)\n» Cẩm nang Kỳ thi Olympic Tin học Sinh viên Việt Nam lần thứ 33 (OLP’24) và Kỳ thi lập trình sinh viên Quốc tế ICPC ASIA 2024 (11/12/2024)\n» Khảo sát mức độ quan tâm thị trường việc làm Nhật Bản đợt 2 (10/12/2024)\n» Khởi động Cuộc thi Huawei ICT toàn cầu 2024-2025 (09/12/2024)\n» Thông báo tuyển sinh đi học tại Hungari diện Hiệp định năm 2025 (28/11/2024)\n» Hướng dẫn cài đặt iHanoi - Bước tiên phong chuyển đổi số (27/11/2024)\n» Thông báo tuyển sinh đi học tại Trung Quốc năm 2025 (27/11/2024)\n» Đăng ký Hội thao Khoa Công nghệ thông tin năm 2024 (25/11/2024)\n» Thông báo tuyển sinh trình độ Thạc sỹ Hệ thống thông tin năm 2024 (23/11/2024)\nTin tiêu điểm\nSinh viên Khóa 19 Khoa Công nghệ thông tin đạt Học bổng HaUI 100% toàn khóa học.\nThứ Sáu, 11:07 20/09/2024\nĐội bóng khoa Công nghệ thông tin cùng những trận cầu đáng nhớ\nThứ Bảy, 10:00 23/07/2022\nĐại hội đại biểu Liên chi Đoàn khoa Công nghệ thông tin lần thứ X, nhiệm kỳ 2022 - 2024\nThứ Hai, 15:00 18/04/2022\nGặp mặt tân Sinh viên K15 khoa Công nghệ thông tin\nThứ Tư, 08:17 28/10/2020\nChương trình thực tập tại SVMC ""SVMC Internship Program 2020""\nThứ Sáu, 14:02 22/05/2020\nCác bài đã đăng\nCuộc thi:"" Học sinh, sinh viên với ý tưởng khởi nghiệp"" lần thứ VII.\nThứ Tư, 09:57 18/12/2024\nnext_contents:\n- Thông báo kế hoạch học kỳ phụ 1 năm học 2024-2025 cho Sinh viên Đại học\nTrang HaUI\nPhòng\nPhòng Tổ chức hành chính\nPhòng Đào tạo\nPhòng Công tác sinh viên\nPhòng Khoa học công nghệ\nPhòng hợp tác đối ngoại\nPhòng Tài chính kế toán\nPhòng Quản trị\nPhòng Thanh tra Giáo dục\nKhoa\nKhoa Công nghệ Hoá\nKhoa Công nghệ may & TKTT\nKhoa Công nghệ thông tin\nKhoa Điện\nKhoa Điện tử\nKhoa Khoa học cơ bản\nKhoa Lý luận chính trị - Pháp luật\nTrung tâm Đào tạo\nTrung tâm Đào tạo Sau đại học\nTrung tâm Giáo dục thể chất và Thể thao\nTrung tâm Công nghệ Ô tô và Đào tạo lái xe\nTrung tâm Công nghệ thông tin\nTrung tâm Việt Nhật\nTrung tâm Giáo dục Quốc phòng An ninh\nTrung tâm Dịch vụ\nTrung tâm Truyền thông & Quan hệ Công chúng\nTrạm Y tế\nTrung tâm Hỗ trợ Sinh viên\nTrung tâm Đảm bảo chất lượng\nTrung tâm Thông tin Thư viện\nTrung tâm khảo thí\nViện nghiên cứu\nCông ty Letco\nThư điện tử\nSitemap\nLiên hệ\nToggle navigation\nGIỚI THIỆU\nTHÔNG TIN CHUNG\nCƠ CẤU TỔ CHỨC\nCHIẾN LƯỢC PHÁT TRIỂN\nCÁN BỘ GIẢNG VIÊN\nCƠ SỞ VẬT CHẤT\nLIÊN HỆ\nĐÀO TẠO\nĐẠI HỌC\nKHOA HỌC MÁY TÍNH\nKỸ THUẬT PHẦN MỀM\nHỆ THỐNG THÔNG TIN\nCÔNG NGHỆ THÔNG TIN\nCÔNG NGHỆ ĐA PHƯƠNG TIỆN\nAN TOÀN THÔNG TIN\nSAU ĐẠI HỌC\nHỆ THỐNG THÔNG TIN\nKẾ HOẠCH\nTIẾN ĐỘ\nQUY CHẾ, BIỂU MẪU\nNGHIÊN CỨU KHOA HỌC\nCÔNG TRÌNH CÔNG BỐ\nĐỀ TÀI, DỰ ÁN\nSINH VIÊN NCKH\nTIN KHCN\nCÔNG TÁC SINH VIÊN\nQUY CHẾ\nGƯƠNG SÁNG SINH VIÊN\nHỌC BỔNG\nCÂU LẠC BỘ\nTHƯ VIỆN ẢNH\nTUYỂN DỤNG\nTHÔNG BÁO\nTRANG CHỦ > THÔNG BÁO\nThông báo kế hoạch học kỳ phụ 1 năm học 2024-2025 cho Sinh viên Đại học\nCăn cứ tiến độ, kế hoạch đào tạo năm học 2024-2025;Nhà trường thông báo kế hoạch đăng ký, học tập tại học kỳ phụ 1 năm học 2024 - 2025 cho sinh viên Đại học các khóaThời khóa biểu học kỳ phụ 1 (2024-2025):Xem tại đây\n', 'content: Căn cứ tiến độ, kế hoạch đào tạo năm học 2024-2025;Nhà trường thông báo kế hoạch đăng ký, học tập tại học kỳ phụ 1 năm học 2024 - 2025 cho sinh viên Đại học các khóaThời khóa biểu học kỳ phụ 1 (2024-2025):Xem tại đây\nThứ Năm, 08:55 28/11/2024\nTags:\nTweet\nCác bài đã đăng\n» Cuộc thi:"" Học sinh, sinh viên với ý tưởng khởi nghiệp"" lần thứ VII. (18/12/2024)\n» Dự kiến chỉ tiêu và phương thức xét tuyển các ngành thuộc Khoa CNTT - Trường Đại học Công Nghiệp Hà Nội năm 2025 (18/12/2024)\n» Cẩm nang Kỳ thi Olympic Tin học Sinh viên Việt Nam lần thứ 33 (OLP’24) và Kỳ thi lập trình sinh viên Quốc tế ICPC ASIA 2024 (11/12/2024)\n» Khảo sát mức độ quan tâm thị trường việc làm Nhật Bản đợt 2 (10/12/2024)\n» Khởi động Cuộc thi Huawei ICT toàn cầu 2024-2025 (09/12/2024)\n» Thông báo tuyển sinh đi học tại Hungari diện Hiệp định năm 2025 (28/11/2024)\n» Hướng dẫn cài đặt iHanoi - Bước tiên phong chuyển đổi số (27/11/2024)\n» Thông báo tuyển sinh đi học tại Trung Quốc năm 2025 (27/11/2024)\n» Đăng ký Hội thao Khoa Công nghệ thông tin năm 2024 (25/11/2024)\n» Thông báo tuyển sinh trình độ Thạc sỹ Hệ thống thông tin năm 2024 (23/11/2024)\nTin tiêu điểm\nSinh viên Khóa 19 Khoa Công nghệ thông tin đạt Học bổng HaUI 100% toàn khóa học.\nThứ Sáu, 11:07 20/09/2024\nĐội bóng khoa Công nghệ thông tin cùng những trận cầu đáng nhớ\nThứ Bảy, 10:00 23/07/2022\nĐại hội đại biểu Liên chi Đoàn khoa Công nghệ thông tin lần thứ X, nhiệm kỳ 2022 - 2024\nThứ Hai, 15:00 18/04/2022\nGặp mặt tân Sinh viên K15 khoa Công nghệ thông tin\nThứ Tư, 08:17 28/10/2020\nChương trình thực tập tại SVMC ""SVMC Internship Program 2020""\nThứ Sáu, 14:02 22/05/2020\nCác bài đã đăng\nCuộc thi:"" Học sinh, sinh viên với ý tưởng khởi nghiệp"" lần thứ VII.\nThứ Tư, 09:57 18/12/2024\nnext_contents:\n- Thông báo kế hoạch học kỳ phụ 1 năm học 2024-2025 cho Sinh viên Đại học\nTrang HaUI\nPhòng\nPhòng Tổ chức hành chính\nPhòng Đào tạo\nPhòng Công tác sinh viên\nPhòng Khoa học công nghệ\nPhòng hợp tác đối ngoại\nPhòng Tài chính kế toán\nPhòng Quản trị\nPhòng Thanh tra Giáo dục\nKhoa\nKhoa Công nghệ Hoá\nKhoa Công nghệ may & TKTT\nKhoa Công nghệ thông tin\nKhoa Điện\nKhoa Điện tử\nKhoa Khoa học cơ bản\nKhoa Lý luận chính trị - Pháp luật\nTrung tâm Đào tạo\nTrung tâm Đào tạo Sau đại học\nTrung tâm Giáo dục thể chất và Thể thao\nTrung tâm Công nghệ Ô tô và Đào tạo lái xe\nTrung tâm Công nghệ thông tin\nTrung tâm Việt Nhật\nTrung tâm Giáo dục Quốc phòng An ninh\nTrung tâm Dịch vụ\nTrung tâm Truyền thông & Quan hệ Công chúng\nTrạm Y tế\nTrung tâm Hỗ trợ Sinh viên\nTrung tâm Đảm bảo chất lượng\nTrung tâm Thông tin Thư viện\nTrung tâm khảo thí\nViện nghiên cứu\nCông ty Letco\nThư điện tử\nSitemap\nLiên hệ\nToggle navigation\nGIỚI THIỆU\nTHÔNG TIN CHUNG\nCƠ CẤU TỔ CHỨC\nCHIẾN LƯỢC PHÁT TRIỂN\nCÁN BỘ GIẢNG VIÊN\nCƠ SỞ VẬT CHẤT\nLIÊN HỆ\nĐÀO TẠO\nĐẠI HỌC\nKHOA HỌC MÁY TÍNH\nKỸ THUẬT PHẦN MỀM\nHỆ THỐNG THÔNG TIN\nCÔNG NGHỆ THÔNG TIN\nCÔNG NGHỆ ĐA PHƯƠNG TIỆN\nAN TOÀN THÔNG TIN\nSAU ĐẠI HỌC\nHỆ THỐNG THÔNG TIN\nKẾ HOẠCH\nTIẾN ĐỘ\nQUY CHẾ, BIỂU MẪU\nNGHIÊN CỨU KHOA HỌC\nCÔNG TRÌNH CÔNG BỐ\nĐỀ TÀI, DỰ ÁN\nSINH VIÊN NCKH\nTIN KHCN\nCÔNG TÁC SINH VIÊN\nQUY CHẾ\nGƯƠNG SÁNG SINH VIÊN\nHỌC BỔNG\nCÂU LẠC BỘ\nTHƯ VIỆN ẢNH\nTUYỂN DỤNG\nTHÔNG BÁO\nTRANG CHỦ > THÔNG BÁO\nThông báo kế hoạch học kỳ phụ 1 năm học 2024-2025 cho Sinh viên Đại học\nCăn cứ tiến độ, kế hoạch đào tạo năm học 2024-2025;Nhà trường thông báo kế hoạch đăng ký, học tập tại học kỳ phụ 1 năm học 2024 - 2025 cho sinh viên Đại học các khóaThời khóa biểu học kỳ phụ 1 (2024-2025):Xem tại đây\n', 'content: Thứ Hai, 09:04 09/12/2024\nTags:\nTweet\nCác bài đã đăng\n» Cuộc thi:"" Học sinh, sinh viên với ý tưởng khởi nghiệp"" lần thứ VII. (18/12/2024)\n» Dự kiến chỉ tiêu và phương thức xét tuyển các ngành thuộc Khoa CNTT - Trường Đại học Công Nghiệp Hà Nội năm 2025 (18/12/2024)\n» Cẩm nang Kỳ thi Olympic Tin học Sinh viên Việt Nam lần thứ 33 (OLP’24) và Kỳ thi lập trình sinh viên Quốc tế ICPC ASIA 2024 (11/12/2024)\n» Khảo sát mức độ quan tâm thị trường việc làm Nhật Bản đợt 2 (10/12/2024)\n» Trường Đại học Công Nghiệp Hà Nội vinh dự đăng cai tổ chức Kỳ thi Olympic Tin học Sinh viên Việt Nam lần thứ 33 (OLP’24) và Kỳ thi lập trình sinh viên Quốc tế ICPC ASIA 2024 (06/12/2024)\n» Thông báo tổ chức chương trình Hội thảo thực tập, việc làm và thi tuyển trực tiếp của Công ty TNHH Ani Vina - Thứ 3, ngày 10/12/2024 (05/12/2024)\n» Thông báo tổ chức chương trình Hội thảo thực tập, việc làm và phỏng vấn trực tiếp của Công ty TNHH New Wing Interconnect Technology (Bắc Giang) - Thứ 5, ngày 05/12/2024 (29/11/2024)\n» Thông báo kế hoạch học kỳ phụ 1 năm học 2024-2025 cho Sinh viên Đại học (28/11/2024)\n» Thông báo tuyển sinh đi học tại Hungari diện Hiệp định năm 2025 (28/11/2024)\nTin tiêu điểm\nSinh viên Khóa 19 Khoa Công nghệ thông tin đạt Học bổng HaUI 100% toàn khóa học.\nThứ Sáu, 11:07 20/09/2024\nĐội bóng khoa Công nghệ thông tin cùng những trận cầu đáng nhớ\nThứ Bảy, 10:00 23/07/2022\nĐại hội đại biểu Liên chi Đoàn khoa Công nghệ thông tin lần thứ X, nhiệm kỳ 2022 - 2024\nThứ Hai, 15:00 18/04/2022\nGặp mặt tân Sinh viên K15 khoa Công nghệ thông tin\nThứ Tư, 08:17 28/10/2020\nChương trình thực tập tại SVMC ""SVMC Internship Program 2020""\nThứ Sáu, 14:02 22/05/2020\nCác bài đã đăng\nCuộc thi:"" Học sinh, sinh viên với ý tưởng khởi nghiệp"" lần thứ VII.\nThứ Tư, 09:57 18/12/2024\nnext_contents:\n- Cuộc thi Huawei ICT Toàn cầu 2024 - 2025 do Huawei tổ chức mùa 3 đã chính thức trở lại. Cuộc thi dành cho tất cả các bạn sinh viên tại các trường đại học, học viện trên toàn thế giới. Với chủ đề ""Kết nối, Vinh quang, Tương lai"" và khẩu hiệu ""I.C. The Future"", chương trình tạo ra một nền tảng cạnh tranh và giao lưu quốc tế cho sinh viên đại học và cao đẳng trên toàn thế giới, nâng cao kiến thức ICT và khả năng thực hành của sinh viên.Lộ trình học tập bao gồm 3 nội dung chính:Nội dung Cloud Track: bao gồm các kiến thức về Công nghệ thông tin như đám mây, big data và AINội dung Network Track: bao gồm các kiến thức về Công nghệ IP như truyền số liệu, bảo mật, Mạng WLAN, DCNNội dung Computing Track: bao gồm các kiến thức về: openEuler (Hệ điều hành mở Euler), open Gauss (Hệ quản trị cơ sở dữ liệu mở Gauss) và Kunpeng (Bộ xử lý Kunpeng).Thời gian mở đăng ký:Thời gian đăng ký: Từ ngày 15/11/2024 đến hết ngày 10/12/2024Thời gian thi Vòng Quốc gia (Việt Nam): Ngày 13/12/2024Thời gian thi Vòng Khu vực (Malaysia): Dự kiến tháng 2/2025Thời gian thi Vòng Chung kết Toàn cầu (Trung Quốc): Dự kiến tháng 5/2025Điều kiện tham dự:Sinh viên đang học tập tại Việt Nam về chuyên ngành liên quan công nghệ thông tin hoặc sinh viên các chuyên ngành khác có đam mê và mong muốn học hỏi về công nghệ thông tin.Sinh viên thông thạo tiếng Anh để thuận tiện cho việc học tập, tham gia cuộc thi và giao lưu văn hóa đa quốc gia.Sinh viên có phương tiện học trực tuyến (máy tính, điện thoại thông minh có kết nối Internet).Link đăng ký dự thi: https://e.huawei.com/en/talent/...Mọi thắc mắc xin liên hệ với Ms. Hoài Anh qua email lam.thi.anh@huawei.com hoặc số điện thoại 0853.209.555 để được giải đáp.Các bạn sinh viên yêu công nghệ đã sẵn sàng để tranh tài tại “đấu trường” kiến thức và thực hành uy tín này chưa?#Huawei#HuaweiVietnam#ICTCompetition#TalentCultivation#InVietnamforVietnam#Cloud#Network\nThứ Hai, 09:04 09/12/2024\n', 'content: Thứ Hai, 09:04 09/12/2024\nTags:\nTweet\nCác bài đã đăng\n» Cuộc thi:"" Học sinh, sinh viên với ý tưởng khởi nghiệp"" lần thứ VII. (18/12/2024)\n» Dự kiến chỉ tiêu và phương thức xét tuyển các ngành thuộc Khoa CNTT - Trường Đại học Công Nghiệp Hà Nội năm 2025 (18/12/2024)\n» Cẩm nang Kỳ thi Olympic Tin học Sinh viên Việt Nam lần thứ 33 (OLP’24) và Kỳ thi lập trình sinh viên Quốc tế ICPC ASIA 2024 (11/12/2024)\n» Khảo sát mức độ quan tâm thị trường việc làm Nhật Bản đợt 2 (10/12/2024)\n» Trường Đại học Công Nghiệp Hà Nội vinh dự đăng cai tổ chức Kỳ thi Olympic Tin học Sinh viên Việt Nam lần thứ 33 (OLP’24) và Kỳ thi lập trình sinh viên Quốc tế ICPC ASIA 2024 (06/12/2024)\n» Thông báo tổ chức chương trình Hội thảo thực tập, việc làm và thi tuyển trực tiếp của Công ty TNHH Ani Vina - Thứ 3, ngày 10/12/2024 (05/12/2024)\n» Thông báo tổ chức chương trình Hội thảo thực tập, việc làm và phỏng vấn trực tiếp của Công ty TNHH New Wing Interconnect Technology (Bắc Giang) - Thứ 5, ngày 05/12/2024 (29/11/2024)\n» Thông báo kế hoạch học kỳ phụ 1 năm học 2024-2025 cho Sinh viên Đại học (28/11/2024)\n» Thông báo tuyển sinh đi học tại Hungari diện Hiệp định năm 2025 (28/11/2024)\nTin tiêu điểm\nSinh viên Khóa 19 Khoa Công nghệ thông tin đạt Học bổng HaUI 100% toàn khóa học.\nThứ Sáu, 11:07 20/09/2024\nĐội bóng khoa Công nghệ thông tin cùng những trận cầu đáng nhớ\nThứ Bảy, 10:00 23/07/2022\nĐại hội đại biểu Liên chi Đoàn khoa Công nghệ thông tin lần thứ X, nhiệm kỳ 2022 - 2024\nThứ Hai, 15:00 18/04/2022\nGặp mặt tân Sinh viên K15 khoa Công nghệ thông tin\nThứ Tư, 08:17 28/10/2020\nChương trình thực tập tại SVMC ""SVMC Internship Program 2020""\nThứ Sáu, 14:02 22/05/2020\nCác bài đã đăng\nCuộc thi:"" Học sinh, sinh viên với ý tưởng khởi nghiệp"" lần thứ VII.\nThứ Tư, 09:57 18/12/2024\nnext_contents:\n- Cuộc thi Huawei ICT Toàn cầu 2024 - 2025 do Huawei tổ chức mùa 3 đã chính thức trở lại. Cuộc thi dành cho tất cả các bạn sinh viên tại các trường đại học, học viện trên toàn thế giới. Với chủ đề ""Kết nối, Vinh quang, Tương lai"" và khẩu hiệu ""I.C. The Future"", chương trình tạo ra một nền tảng cạnh tranh và giao lưu quốc tế cho sinh viên đại học và cao đẳng trên toàn thế giới, nâng cao kiến thức ICT và khả năng thực hành của sinh viên.Lộ trình học tập bao gồm 3 nội dung chính:Nội dung Cloud Track: bao gồm các kiến thức về Công nghệ thông tin như đám mây, big data và AINội dung Network Track: bao gồm các kiến thức về Công nghệ IP như truyền số liệu, bảo mật, Mạng WLAN, DCNNội dung Computing Track: bao gồm các kiến thức về: openEuler (Hệ điều hành mở Euler), open Gauss (Hệ quản trị cơ sở dữ liệu mở Gauss) và Kunpeng (Bộ xử lý Kunpeng).Thời gian mở đăng ký:Thời gian đăng ký: Từ ngày 15/11/2024 đến hết ngày 10/12/2024Thời gian thi Vòng Quốc gia (Việt Nam): Ngày 13/12/2024Thời gian thi Vòng Khu vực (Malaysia): Dự kiến tháng 2/2025Thời gian thi Vòng Chung kết Toàn cầu (Trung Quốc): Dự kiến tháng 5/2025Điều kiện tham dự:Sinh viên đang học tập tại Việt Nam về chuyên ngành liên quan công nghệ thông tin hoặc sinh viên các chuyên ngành khác có đam mê và mong muốn học hỏi về công nghệ thông tin.Sinh viên thông thạo tiếng Anh để thuận tiện cho việc học tập, tham gia cuộc thi và giao lưu văn hóa đa quốc gia.Sinh viên có phương tiện học trực tuyến (máy tính, điện thoại thông minh có kết nối Internet).Link đăng ký dự thi: https://e.huawei.com/en/talent/...Mọi thắc mắc xin liên hệ với Ms. Hoài Anh qua email lam.thi.anh@huawei.com hoặc số điện thoại 0853.209.555 để được giải đáp.Các bạn sinh viên yêu công nghệ đã sẵn sàng để tranh tài tại “đấu trường” kiến thức và thực hành uy tín này chưa?#Huawei#HuaweiVietnam#ICTCompetition#TalentCultivation#InVietnamforVietnam#Cloud#Network\nThứ Hai, 09:04 09/12/2024\n']","['CÔNG TÁC SINH VIÊN QUY CHẾ GƯƠNG SÁNG SINH VIÊN HỌC BỔNG CÂU LẠC BỘ THƯ VIỆN ẢNH TUYỂN DỤNG THÔNG BÁO TRANG CHỦ > THÔNG BÁO Hướng dẫn cài đặt iHanoi - Bước tiên phong chuyển đổi số Thực hiện theo CV số 3497 của Công an Quận Bắc Từ Liêm yêu cầu thực hiện cài đặt, kích hoạt tài khoản và sử dụng các tiện ích trên nền tảng Công dân Thủ đô số - iHanoi.✅ Ứng dụng iHanoi nhằm giúp người dân, doanh nghiệp tương tác với cơ quan chính quyền dễ dàng, thuận tiện hơn thông qua: Phản ánh hiện trường (là những vấn đề đời sống dân sinh bức xúc); phản ánh thủ tục hành chính (các hành vi chậm trễ, gây phiền hà hoặc không thực hiện đúng quy định của cán bộ, công chức, viên chức)...Video hướng dẫn cài đặt: Xem tại đâyHình ảnh hướng dẫn cài đặt:Ngoài ra, sinh viên cũng cần lưu ý cập nhật mã thẻ BHYT trên ứng dụng VNeID để sử dụng các tiện ích dành cho bản thân được hiệu quả, thuận tiện hơn. Thứ Tư, 09:45 27/11/2024 Tags: Tweet Các bài đã đăng » Cuộc thi:"" Học sinh, sinh viên với ý tưởng khởi nghiệp"" lần thứ VII. (18/12/2024) » Dự kiến chỉ tiêu và phương thức xét tuyển các ngành thuộc Khoa CNTT - Trường Đại học Công Nghiệp Hà Nội năm 2025 (18/12/2024) » Cẩm nang Kỳ thi Olympic Tin học Sinh viên Việt Nam lần thứ 33 (OLP’24) và Kỳ thi lập trình sinh viên Quốc tế ICPC ASIA 2024 (11/12/2024) » Khảo sát mức độ quan tâm thị trường việc làm Nhật Bản đợt 2 (10/12/2024) » Khởi động Cuộc thi Huawei ICT toàn cầu 2024-2025 (09/12/2024) » Thông báo tuyển sinh đi học tại Trung Quốc năm 2025 (27/11/2024) » Đăng ký Hội thao Khoa Công nghệ thông tin năm 2024 (25/11/2024) » Thông báo tuyển sinh trình độ Thạc sỹ Hệ thống thông tin năm 2024 (23/11/2024) » Thông báo tổ chức chương trình Hội thảo thực tập, việc làm và phỏng vấn trực tiếp của Công ty TNHH Công nghiệp Brother Việt Nam - Thứ 5, ngày 28/11/2024 (22/11/2024) » Thông báo tổ chức chương trình Hội thảo thực tập, việc làm và phỏng vấn trực tiếp Cán bộ nguồn Foxconn - Thứ 3, ngày 26/11/2024 (20/11/2024) Tin tiêu điểm Sinh viên Khóa 19 Khoa Công nghệ thông tin đạt Học bổng HaUI 100% toàn khóa học. Thứ Sáu, 11:07 20/09/2024 Đội bóng khoa Công nghệ thông tin cùng những trận cầu đáng nhớ Thứ Bảy, 10:00 23/07/2022 Đại hội đại biểu Liên chi Đoàn khoa Công nghệ thông tin lần thứ X, nhiệm kỳ 2022 - 2024 Thứ Hai, 15:00 18/04/2022 Gặp mặt tân Sinh viên K15 khoa Công nghệ thông tin Thứ Tư, 08:17 28/10/2020 Chương trình thực tập tại SVMC ""SVMC Internship Program 2020"" Thứ Sáu, 14:02 22/05/2020 Các bài đã đăng Cuộc thi:"" Học sinh, sinh viên với ý tưởng khởi nghiệp"" lần thứ VII. Thứ Tư, 09:57 18/12/2024 Dự kiến chỉ tiêu và phương thức xét tuyển các ngành thuộc Khoa CNTT - Trường Đại học Công Nghiệp Hà Nội năm 2025 Thứ Tư, 09:14 18/12/2024 Cẩm nang Kỳ thi Olympic Tin học Sinh viên Việt Nam lần thứ 33 (OLP’24) và Kỳ thi lập trình sinh viên Quốc tế ICPC ASIA 2024 Thứ Tư, 07:54 11/12/2024 Khảo sát mức độ quan tâm thị trường việc làm Nhật Bản đợt 2 Thứ Ba, 12:34 10/12/2024 Khởi động Cuộc thi Huawei ICT toàn cầu 2024-2025 Thứ Hai, 09:04 09/12/2024 Thông báo tuyển sinh đi học tại Trung Quốc năm 2025 Thứ Tư, 09:23 27/11/2024 Đăng ký Hội thao Khoa Công nghệ thông tin năm 2024 Thứ Hai, 09:51 25/11/2024 Thông báo tuyển sinh trình độ Thạc sỹ Hệ thống thông tin năm 2024 Thứ Bảy, 15:26 23/11/2024 Thông báo tổ chức chương trình Hội thảo thực tập, việc làm và phỏng vấn trực tiếp của Công ty TNHH Công nghiệp Brother Việt Nam - Thứ 5, ngày 28/11/2024 Thứ Sáu, 13:47 22/11/2024 Thông báo tổ chức chương trình Hội thảo thực tập, việc làm và phỏng vấn trực tiếp Cán bộ nguồn Foxconn - Thứ 3, ngày 26/11/2024 Thứ Tư, 10:03 20/11/2024 Bản đồ chỉ dẫn Trường Đại học Công nghiệp Hà Nội Trụ sở chính Số 298 đường Cầu Diễn, quận Bắc Từ Liêm, Hà Nội +84 243 765 5121 Email: dhcnhn@haui.edu.vn Các cơ sở khác Cơ sở 2: Phường Tây Tựu, quận Bắc Từ Liêm, Hà Nội Cơ sở 3: Phường Lê Hồng Phong, thành phố Phủ Lý, Hà Nam Liên kết site Trường Đại học Công nghiệp Hà Nội Thông tin tuyển sinh Hành chính điện tử Đào tạo trực tuyến Cổng thông tin đào tạo Copyright © 2018 Hanoi University of Industry.']","Cuộc thi ""Học sinh, sinh viên với ý tưởng khởi nghiệp"" lần thứ VII sẽ diễn ra vào ngày **18/12/2024**. 

Nếu bạn cần thêm thông tin hoặc có câu hỏi khác, hãy cho tôi biết!  
[Tài liệu thông báo] - [**Link tham khảo**](https://fit.haui.edu.vn/vn/thong-bao/thong-bao-ke-hoach-hoc-ky-phu-1-nam-hoc-2024-2025-cho-sinh-vien-dai-hoc/71169).","Cuộc thi ""Học sinh, sinh viên với ý tưởng khởi nghiệp"" lần thứ VII sẽ diễn ra vào ngày 18/12/2024.",0.999999999975,1.0,0.6666666666666666,0.8619781849172666,0.9691329477290612,0.7800419330596924,5.818439960479736
26,Bộ Giáo dục và Đào tạo đã công bố thông tin gì về chương trình tuyển sinh đi học tại Trung Quốc năm 2025?,"['content: CÔNG TÁC SINH VIÊN\nQUY CHẾ\nGƯƠNG SÁNG SINH VIÊN\nHỌC BỔNG\nCÂU LẠC BỘ\nTHƯ VIỆN ẢNH\nTUYỂN DỤNG\nTHÔNG BÁO\nTRANG CHỦ > THÔNG BÁO\nThông báo tuyển sinh đi học tại Trung Quốc năm 2025\nBộ Giáo dục và Đào tạo ban hành Thông báo số 1744/TB-BGDĐT ngày 22 tháng 11 năm 2024 về Tuyển sinh đi học tại Trung Quốc năm 2025 diện Hiệp định như sau:1. Thông tin chung về chương trình:Chính phủ Trung Quốc cấp 34 chỉ tiêu học bổng cho công dân Việt Nam đi đào tạo trình độ Tiến sĩ, Thạc sĩ, Đại học tại Trung Quốc. Trong đó, thời gian đào tạo:- Chương trình Tiến sĩ: từ 03 đến 05 năm học- Chương trình Thạc sĩ: từ 02 đến 04 năm học- Chương trình Đại học: từ 04 đến 05 năm học2. Quyền lợi khi đi học diện Hiệp định:- Chính phủ Trung Quốc miễn học phí cho quá trình học tập, bố trí chỗ ở, cấp bảo hiểm y tế, tài liệu học tập và học bổng hàng tháng theo mức quy định của Chính phủ Trung Quốc.- Chính phủ Việt Nam cấp vé máy bay một lượt đi và một lượt về, lệ phí làm hộ chiếu, visa, phí đi đường và cấp bù sinh hoạt phí theo quy định hiện hành căn cứ trên mức hỗ trợ của phía Trung Quốc dành cho du học sinh Việt Nam.3. Đối tượng, điều kiện và hồ sơ dự tuyển: Xem tại đây.\nThứ Tư, 09:23 27/11/2024\nTags:\nTweet\nCác bài đã đăng\n» Cuộc thi:"" Học sinh, sinh viên với ý tưởng khởi nghiệp"" lần thứ VII. (18/12/2024)\n» Dự kiến chỉ tiêu và phương thức xét tuyển các ngành thuộc Khoa CNTT - Trường Đại học Công Nghiệp Hà Nội năm 2025 (18/12/2024)\n» Cẩm nang Kỳ thi Olympic Tin học Sinh viên Việt Nam lần thứ 33 (OLP’24) và Kỳ thi lập trình sinh viên Quốc tế ICPC ASIA 2024 (11/12/2024)\n» Khảo sát mức độ quan tâm thị trường việc làm Nhật Bản đợt 2 (10/12/2024)\n» Khởi động Cuộc thi Huawei ICT toàn cầu 2024-2025 (09/12/2024)\nnext_contents:\n- Thông báo tuyển sinh đi học tại Trung Quốc năm 2025\nTrang HaUI\nPhòng\nPhòng Tổ chức hành chính\nPhòng Đào tạo\nPhòng Công tác sinh viên\nPhòng Khoa học công nghệ\nPhòng hợp tác đối ngoại\nPhòng Tài chính kế toán\nPhòng Quản trị\nPhòng Thanh tra Giáo dục\nKhoa\nKhoa Công nghệ Hoá\nKhoa Công nghệ may & TKTT\nKhoa Công nghệ thông tin\nKhoa Điện\nKhoa Điện tử\nKhoa Khoa học cơ bản\nKhoa Lý luận chính trị - Pháp luật\nTrung tâm Đào tạo\nTrung tâm Đào tạo Sau đại học\nTrung tâm Giáo dục thể chất và Thể thao\nTrung tâm Công nghệ Ô tô và Đào tạo lái xe\nTrung tâm Công nghệ thông tin\nTrung tâm Việt Nhật\nTrung tâm Giáo dục Quốc phòng An ninh\nTrung tâm Dịch vụ\nTrung tâm Truyền thông & Quan hệ Công chúng\nTrạm Y tế\nTrung tâm Hỗ trợ Sinh viên\nTrung tâm Đảm bảo chất lượng\nTrung tâm Thông tin Thư viện\nTrung tâm khảo thí\nViện nghiên cứu\nCông ty Letco\nThư điện tử\nSitemap\nLiên hệ\nToggle navigation\nGIỚI THIỆU\nTHÔNG TIN CHUNG\nCƠ CẤU TỔ CHỨC\nCHIẾN LƯỢC PHÁT TRIỂN\nCÁN BỘ GIẢNG VIÊN\nCƠ SỞ VẬT CHẤT\nLIÊN HỆ\nĐÀO TẠO\nĐẠI HỌC\nKHOA HỌC MÁY TÍNH\nKỸ THUẬT PHẦN MỀM\nHỆ THỐNG THÔNG TIN\nCÔNG NGHỆ THÔNG TIN\nCÔNG NGHỆ ĐA PHƯƠNG TIỆN\nAN TOÀN THÔNG TIN\nSAU ĐẠI HỌC\nHỆ THỐNG THÔNG TIN\nKẾ HOẠCH\nTIẾN ĐỘ\nQUY CHẾ, BIỂU MẪU\nNGHIÊN CỨU KHOA HỌC\nCÔNG TRÌNH CÔNG BỐ\nĐỀ TÀI, DỰ ÁN\nSINH VIÊN NCKH\nTIN KHCN\nCÔNG TÁC SINH VIÊN\nQUY CHẾ\nGƯƠNG SÁNG SINH VIÊN\nHỌC BỔNG\nCÂU LẠC BỘ\nTHƯ VIỆN ẢNH\nTUYỂN DỤNG\nTHÔNG BÁO\nTRANG CHỦ > THÔNG BÁO\nThông báo tuyển sinh đi học tại Trung Quốc năm 2025\n', 'content: CÔNG TÁC SINH VIÊN\nQUY CHẾ\nGƯƠNG SÁNG SINH VIÊN\nHỌC BỔNG\nCÂU LẠC BỘ\nTHƯ VIỆN ẢNH\nTUYỂN DỤNG\nTHÔNG BÁO\nTRANG CHỦ > THÔNG BÁO\nThông báo tuyển sinh đi học tại Trung Quốc năm 2025\nBộ Giáo dục và Đào tạo ban hành Thông báo số 1744/TB-BGDĐT ngày 22 tháng 11 năm 2024 về Tuyển sinh đi học tại Trung Quốc năm 2025 diện Hiệp định như sau:1. Thông tin chung về chương trình:Chính phủ Trung Quốc cấp 34 chỉ tiêu học bổng cho công dân Việt Nam đi đào tạo trình độ Tiến sĩ, Thạc sĩ, Đại học tại Trung Quốc. Trong đó, thời gian đào tạo:- Chương trình Tiến sĩ: từ 03 đến 05 năm học- Chương trình Thạc sĩ: từ 02 đến 04 năm học- Chương trình Đại học: từ 04 đến 05 năm học2. Quyền lợi khi đi học diện Hiệp định:- Chính phủ Trung Quốc miễn học phí cho quá trình học tập, bố trí chỗ ở, cấp bảo hiểm y tế, tài liệu học tập và học bổng hàng tháng theo mức quy định của Chính phủ Trung Quốc.- Chính phủ Việt Nam cấp vé máy bay một lượt đi và một lượt về, lệ phí làm hộ chiếu, visa, phí đi đường và cấp bù sinh hoạt phí theo quy định hiện hành căn cứ trên mức hỗ trợ của phía Trung Quốc dành cho du học sinh Việt Nam.3. Đối tượng, điều kiện và hồ sơ dự tuyển: Xem tại đây.\nThứ Tư, 09:23 27/11/2024\nTags:\nTweet\nCác bài đã đăng\n» Cuộc thi:"" Học sinh, sinh viên với ý tưởng khởi nghiệp"" lần thứ VII. (18/12/2024)\n» Dự kiến chỉ tiêu và phương thức xét tuyển các ngành thuộc Khoa CNTT - Trường Đại học Công Nghiệp Hà Nội năm 2025 (18/12/2024)\n» Cẩm nang Kỳ thi Olympic Tin học Sinh viên Việt Nam lần thứ 33 (OLP’24) và Kỳ thi lập trình sinh viên Quốc tế ICPC ASIA 2024 (11/12/2024)\n» Khảo sát mức độ quan tâm thị trường việc làm Nhật Bản đợt 2 (10/12/2024)\n» Khởi động Cuộc thi Huawei ICT toàn cầu 2024-2025 (09/12/2024)\nnext_contents:\n- Thông báo tuyển sinh đi học tại Trung Quốc năm 2025\nTrang HaUI\nPhòng\nPhòng Tổ chức hành chính\nPhòng Đào tạo\nPhòng Công tác sinh viên\nPhòng Khoa học công nghệ\nPhòng hợp tác đối ngoại\nPhòng Tài chính kế toán\nPhòng Quản trị\nPhòng Thanh tra Giáo dục\nKhoa\nKhoa Công nghệ Hoá\nKhoa Công nghệ may & TKTT\nKhoa Công nghệ thông tin\nKhoa Điện\nKhoa Điện tử\nKhoa Khoa học cơ bản\nKhoa Lý luận chính trị - Pháp luật\nTrung tâm Đào tạo\nTrung tâm Đào tạo Sau đại học\nTrung tâm Giáo dục thể chất và Thể thao\nTrung tâm Công nghệ Ô tô và Đào tạo lái xe\nTrung tâm Công nghệ thông tin\nTrung tâm Việt Nhật\nTrung tâm Giáo dục Quốc phòng An ninh\nTrung tâm Dịch vụ\nTrung tâm Truyền thông & Quan hệ Công chúng\nTrạm Y tế\nTrung tâm Hỗ trợ Sinh viên\nTrung tâm Đảm bảo chất lượng\nTrung tâm Thông tin Thư viện\nTrung tâm khảo thí\nViện nghiên cứu\nCông ty Letco\nThư điện tử\nSitemap\nLiên hệ\nToggle navigation\nGIỚI THIỆU\nTHÔNG TIN CHUNG\nCƠ CẤU TỔ CHỨC\nCHIẾN LƯỢC PHÁT TRIỂN\nCÁN BỘ GIẢNG VIÊN\nCƠ SỞ VẬT CHẤT\nLIÊN HỆ\nĐÀO TẠO\nĐẠI HỌC\nKHOA HỌC MÁY TÍNH\nKỸ THUẬT PHẦN MỀM\nHỆ THỐNG THÔNG TIN\nCÔNG NGHỆ THÔNG TIN\nCÔNG NGHỆ ĐA PHƯƠNG TIỆN\nAN TOÀN THÔNG TIN\nSAU ĐẠI HỌC\nHỆ THỐNG THÔNG TIN\nKẾ HOẠCH\nTIẾN ĐỘ\nQUY CHẾ, BIỂU MẪU\nNGHIÊN CỨU KHOA HỌC\nCÔNG TRÌNH CÔNG BỐ\nĐỀ TÀI, DỰ ÁN\nSINH VIÊN NCKH\nTIN KHCN\nCÔNG TÁC SINH VIÊN\nQUY CHẾ\nGƯƠNG SÁNG SINH VIÊN\nHỌC BỔNG\nCÂU LẠC BỘ\nTHƯ VIỆN ẢNH\nTUYỂN DỤNG\nTHÔNG BÁO\nTRANG CHỦ > THÔNG BÁO\nThông báo tuyển sinh đi học tại Trung Quốc năm 2025\n', 'content: Thông báo tuyển sinh đi học tại Trung Quốc năm 2025\nTrang HaUI\nPhòng\nPhòng Tổ chức hành chính\nPhòng Đào tạo\nPhòng Công tác sinh viên\nPhòng Khoa học công nghệ\nPhòng hợp tác đối ngoại\nPhòng Tài chính kế toán\nPhòng Quản trị\nPhòng Thanh tra Giáo dục\nKhoa\nKhoa Công nghệ Hoá\nKhoa Công nghệ may & TKTT\nKhoa Công nghệ thông tin\nKhoa Điện\nKhoa Điện tử\nKhoa Khoa học cơ bản\nKhoa Lý luận chính trị - Pháp luật\nTrung tâm Đào tạo\nTrung tâm Đào tạo Sau đại học\nTrung tâm Giáo dục thể chất và Thể thao\nTrung tâm Công nghệ Ô tô và Đào tạo lái xe\nTrung tâm Công nghệ thông tin\nTrung tâm Việt Nhật\nTrung tâm Giáo dục Quốc phòng An ninh\nTrung tâm Dịch vụ\nTrung tâm Truyền thông & Quan hệ Công chúng\nTrạm Y tế\nTrung tâm Hỗ trợ Sinh viên\nTrung tâm Đảm bảo chất lượng\nTrung tâm Thông tin Thư viện\nTrung tâm khảo thí\nViện nghiên cứu\nCông ty Letco\nThư điện tử\nSitemap\nLiên hệ\nToggle navigation\nGIỚI THIỆU\nTHÔNG TIN CHUNG\nCƠ CẤU TỔ CHỨC\nCHIẾN LƯỢC PHÁT TRIỂN\nCÁN BỘ GIẢNG VIÊN\nCƠ SỞ VẬT CHẤT\nLIÊN HỆ\nĐÀO TẠO\nĐẠI HỌC\nKHOA HỌC MÁY TÍNH\nKỸ THUẬT PHẦN MỀM\nHỆ THỐNG THÔNG TIN\nCÔNG NGHỆ THÔNG TIN\nCÔNG NGHỆ ĐA PHƯƠNG TIỆN\nAN TOÀN THÔNG TIN\nSAU ĐẠI HỌC\nHỆ THỐNG THÔNG TIN\nKẾ HOẠCH\nTIẾN ĐỘ\nQUY CHẾ, BIỂU MẪU\nNGHIÊN CỨU KHOA HỌC\nCÔNG TRÌNH CÔNG BỐ\nĐỀ TÀI, DỰ ÁN\nSINH VIÊN NCKH\nTIN KHCN\nCÔNG TÁC SINH VIÊN\nQUY CHẾ\nGƯƠNG SÁNG SINH VIÊN\nHỌC BỔNG\nCÂU LẠC BỘ\nTHƯ VIỆN ẢNH\nTUYỂN DỤNG\nTHÔNG BÁO\nTRANG CHỦ > THÔNG BÁO\nThông báo tuyển sinh đi học tại Trung Quốc năm 2025\nnext_contents:\n', 'content: Thông báo tuyển sinh đi học tại Trung Quốc năm 2025\nTrang HaUI\nPhòng\nPhòng Tổ chức hành chính\nPhòng Đào tạo\nPhòng Công tác sinh viên\nPhòng Khoa học công nghệ\nPhòng hợp tác đối ngoại\nPhòng Tài chính kế toán\nPhòng Quản trị\nPhòng Thanh tra Giáo dục\nKhoa\nKhoa Công nghệ Hoá\nKhoa Công nghệ may & TKTT\nKhoa Công nghệ thông tin\nKhoa Điện\nKhoa Điện tử\nKhoa Khoa học cơ bản\nKhoa Lý luận chính trị - Pháp luật\nTrung tâm Đào tạo\nTrung tâm Đào tạo Sau đại học\nTrung tâm Giáo dục thể chất và Thể thao\nTrung tâm Công nghệ Ô tô và Đào tạo lái xe\nTrung tâm Công nghệ thông tin\nTrung tâm Việt Nhật\nTrung tâm Giáo dục Quốc phòng An ninh\nTrung tâm Dịch vụ\nTrung tâm Truyền thông & Quan hệ Công chúng\nTrạm Y tế\nTrung tâm Hỗ trợ Sinh viên\nTrung tâm Đảm bảo chất lượng\nTrung tâm Thông tin Thư viện\nTrung tâm khảo thí\nViện nghiên cứu\nCông ty Letco\nThư điện tử\nSitemap\nLiên hệ\nToggle navigation\nGIỚI THIỆU\nTHÔNG TIN CHUNG\nCƠ CẤU TỔ CHỨC\nCHIẾN LƯỢC PHÁT TRIỂN\nCÁN BỘ GIẢNG VIÊN\nCƠ SỞ VẬT CHẤT\nLIÊN HỆ\nĐÀO TẠO\nĐẠI HỌC\nKHOA HỌC MÁY TÍNH\nKỸ THUẬT PHẦN MỀM\nHỆ THỐNG THÔNG TIN\nCÔNG NGHỆ THÔNG TIN\nCÔNG NGHỆ ĐA PHƯƠNG TIỆN\nAN TOÀN THÔNG TIN\nSAU ĐẠI HỌC\nHỆ THỐNG THÔNG TIN\nKẾ HOẠCH\nTIẾN ĐỘ\nQUY CHẾ, BIỂU MẪU\nNGHIÊN CỨU KHOA HỌC\nCÔNG TRÌNH CÔNG BỐ\nĐỀ TÀI, DỰ ÁN\nSINH VIÊN NCKH\nTIN KHCN\nCÔNG TÁC SINH VIÊN\nQUY CHẾ\nGƯƠNG SÁNG SINH VIÊN\nHỌC BỔNG\nCÂU LẠC BỘ\nTHƯ VIỆN ẢNH\nTUYỂN DỤNG\nTHÔNG BÁO\nTRANG CHỦ > THÔNG BÁO\nThông báo tuyển sinh đi học tại Trung Quốc năm 2025\nnext_contents:\n']","['Thông báo tuyển sinh đi học tại Trung Quốc năm 2025 Trang HaUI Phòng Phòng Tổ chức hành chính Phòng Đào tạo Phòng Công tác sinh viên Phòng Khoa học công nghệ Phòng hợp tác đối ngoại Phòng Tài chính kế toán Phòng Quản trị Phòng Thanh tra Giáo dục Khoa Khoa Công nghệ Hoá Khoa Công nghệ may & TKTT Khoa Công nghệ thông tin Khoa Điện Khoa Điện tử Khoa Khoa học cơ bản Khoa Lý luận chính trị - Pháp luật Trung tâm Đào tạo Trung tâm Đào tạo Sau đại học Trung tâm Giáo dục thể chất và Thể thao Trung tâm Công nghệ Ô tô và Đào tạo lái xe Trung tâm Công nghệ thông tin Trung tâm Việt Nhật Trung tâm Giáo dục Quốc phòng An ninh Trung tâm Dịch vụ Trung tâm Truyền thông & Quan hệ Công chúng Trạm Y tế Trung tâm Hỗ trợ Sinh viên Trung tâm Đảm bảo chất lượng Trung tâm Thông tin Thư viện Trung tâm khảo thí Viện nghiên cứu Công ty Letco Thư điện tử Sitemap Liên hệ Toggle navigation GIỚI THIỆU THÔNG TIN CHUNG CƠ CẤU TỔ CHỨC CHIẾN LƯỢC PHÁT TRIỂN CÁN BỘ GIẢNG VIÊN CƠ SỞ VẬT CHẤT LIÊN HỆ ĐÀO TẠO ĐẠI HỌC KHOA HỌC MÁY TÍNH KỸ THUẬT PHẦN MỀM HỆ THỐNG THÔNG TIN CÔNG NGHỆ THÔNG TIN CÔNG NGHỆ ĐA PHƯƠNG TIỆN AN TOÀN THÔNG TIN SAU ĐẠI HỌC HỆ THỐNG THÔNG TIN KẾ HOẠCH TIẾN ĐỘ QUY CHẾ, BIỂU MẪU NGHIÊN CỨU KHOA HỌC CÔNG TRÌNH CÔNG BỐ ĐỀ TÀI, DỰ ÁN SINH VIÊN NCKH TIN KHCN CÔNG TÁC SINH VIÊN QUY CHẾ GƯƠNG SÁNG SINH VIÊN HỌC BỔNG CÂU LẠC BỘ THƯ VIỆN ẢNH TUYỂN DỤNG THÔNG BÁO TRANG CHỦ > THÔNG BÁO Thông báo tuyển sinh đi học tại Trung Quốc năm 2025 Bộ Giáo dục và Đào tạo ban hành Thông báo số 1744/TB-BGDĐT ngày 22 tháng 11 năm 2024 về Tuyển sinh đi học tại Trung Quốc năm 2025 diện Hiệp định như sau:1. Thông tin chung về chương trình:Chính phủ Trung Quốc cấp 34 chỉ tiêu học bổng cho công dân Việt Nam đi đào tạo trình độ Tiến sĩ, Thạc sĩ, Đại học tại Trung Quốc. Trong đó, thời gian đào tạo:- Chương trình Tiến sĩ: từ 03 đến 05 năm học- Chương trình Thạc sĩ: từ 02 đến 04 năm học- Chương trình Đại học: từ 04 đến 05 năm học2. Quyền lợi khi đi học diện Hiệp định:- Chính phủ Trung Quốc miễn học phí cho quá trình học tập, bố trí chỗ ở, cấp bảo hiểm y tế, tài liệu học tập và học bổng hàng tháng theo mức quy định của Chính phủ Trung Quốc.- Chính phủ Việt Nam cấp vé máy bay một lượt đi và một lượt về, lệ phí làm hộ chiếu, visa, phí đi đường và cấp bù sinh hoạt phí theo quy định hiện hành căn cứ trên mức hỗ trợ của phía Trung Quốc dành cho du học sinh Việt Nam.3.']","Tôi không có thông tin này và khuyến nghị bạn tham khảo nguồn khác để biết thêm chi tiết về chương trình tuyển sinh đi học tại Trung Quốc năm 2025. Nếu bạn có câu hỏi khác liên quan đến khoa công nghệ thông tin tại trường đại học công nghiệp Hà Nội, tôi sẵn sàng hỗ trợ!","Bộ Giáo dục và Đào tạo đã ban hành Thông báo số 1744/TB-BGDĐT ngày 22 tháng 11 năm 2024 về tuyển sinh đi học tại Trung Quốc năm 2025, trong đó Chính phủ Trung Quốc cấp 34 chỉ tiêu học bổng cho công dân Việt Nam đi đào tạo trình độ Tiến sĩ, Thạc sĩ, Đại học. Thời gian đào tạo cho các chương trình là từ 03 đến 05 năm cho Tiến sĩ, 02 đến 04 năm cho Thạc sĩ, và 04 đến 05 năm cho Đại học. Quyền lợi khi đi học diện Hiệp định bao gồm miễn học phí, bố trí chỗ ở, cấp bảo hiểm y tế, tài liệu học tập và học bổng hàng tháng theo quy định của Chính phủ Trung Quốc. Chính phủ Việt Nam cũng cấp vé máy bay một lượt đi và một lượt về, lệ phí làm hộ chiếu, visa, phí đi đường và cấp bù sinh hoạt phí theo quy định hiện hành.",0.999999999975,1.0,0.0,0.0,0.8796073866653467,0.8196697235107422,3.304230213165283
27,Thông tin về chương trình Thạc sĩ tại Đại học Công nghiệp Hà Nội là gì?,"['content: Chương trình thực tập tại SVMC ""SVMC Internship Program 2020""\nThứ Sáu, 14:02 22/05/2020\nCác bài đã đăng\nSinh viên Khoa Công nghệ thông tin ghi thành tích nổi bật tại Olympic Tin học sinh viên Việt Nam lần thứ 33 và Kỳ thi Lập trình ICPC ASIA Hà Nội năm 2024\nThứ Hai, 11:30 16/12/2024\nSinh viên Khoa Công nghệ thông tin xuất sắc nhận học bổng của Doanh nghiệp Hàn Quốc năm 2024\nThứ Hai, 11:48 09/12/2024\nSinh viên Khoa Công nghệ thông tin nhận học bổng BROTHER năm học 2024-2025\nThứ Ba, 14:18 03/12/2024\nSinh viên Khoa Công nghệ thông tin đạt giải tại Cuộc thi “Sinh viên thông thái 2024”\nThứ Tư, 10:39 27/11/2024\nChi bộ Khoa Công nghệ thông tin tổ chức kết nạp Đảng viên cho 06 sinh viên xuất sắc\nThứ Sáu, 14:48 22/11/2024\nSinh viên tiêu biểu Khoa Công nghệ thông tin với Hành trình làm theo lời Bác\nThứ Ba, 13:37 11/06/2024\nHọc bổng là phần thưởng xứng đáng cho nỗ lực của sinh viên\nThứ Năm, 13:37 25/04/2024\nNguyễn Thanh Tùng, Cựu sinh viên khóa 14 Khoa CNTT – Một tấm gương sáng trong hoạt động tình nguyện\nThứ Tư, 15:57 24/04/2024\nNữ sinh Khoa Công nghệ thông tin mang nhiều năng lượng tích cực\nThứ Tư, 14:38 24/04/2024\nSinh viên Lê Thị Thanh Hoa, Cựu sinh viên Khoa CNTT – Một tấm gương sáng trong học tập và các hoạt động phong trào của Nhà trường\nThứ Tư, 11:00 24/04/2024\nBản đồ chỉ dẫn\nTrường Đại học Công nghiệp Hà Nội\nTrụ sở chính\nSố 298 đường Cầu Diễn, quận Bắc Từ Liêm, Hà Nội\n+84 243 765 5121\nEmail: dhcnhn@haui.edu.vn\nCác cơ sở khác\nCơ sở 2: Phường Tây Tựu, quận Bắc Từ Liêm, Hà Nội\nCơ sở 3: Phường Lê Hồng Phong, thành phố Phủ Lý, Hà Nam\nLiên kết site\nTrường Đại học Công nghiệp Hà Nội\nThông tin tuyển sinh\nHành chính điện tử\nĐào tạo trực tuyến\nCổng thông tin đào tạo\nnext_contents:\n- Thứ Sáu, 13:25 19/07/2024\nTags:\nTweet\nCác bài đã đăng\n» Sinh viên Khoa Công nghệ thông tin ghi thành tích nổi bật tại Olympic Tin học sinh viên Việt Nam lần thứ 33 và Kỳ thi Lập trình ICPC ASIA Hà Nội năm 2024 (16/12/2024)\n» Sinh viên Khoa Công nghệ thông tin xuất sắc nhận học bổng của Doanh nghiệp Hàn Quốc năm 2024 (09/12/2024)\n» Sinh viên Khoa Công nghệ thông tin nhận học bổng BROTHER năm học 2024-2025 (03/12/2024)\n» Sinh viên Khoa Công nghệ thông tin đạt giải tại Cuộc thi “Sinh viên thông thái 2024” (27/11/2024)\n» Chi bộ Khoa Công nghệ thông tin tổ chức kết nạp Đảng viên cho 06 sinh viên xuất sắc (22/11/2024)\n» Sinh viên tiêu biểu Khoa Công nghệ thông tin với Hành trình làm theo lời Bác (11/06/2024)\n» Học bổng là phần thưởng xứng đáng cho nỗ lực của sinh viên (25/04/2024)\n» Nguyễn Thanh Tùng, Cựu sinh viên khóa 14 Khoa CNTT – Một tấm gương sáng trong hoạt động tình nguyện (24/04/2024)\n» Nữ sinh Khoa Công nghệ thông tin mang nhiều năng lượng tích cực (24/04/2024)\n» Sinh viên Lê Thị Thanh Hoa, Cựu sinh viên Khoa CNTT – Một tấm gương sáng trong học tập và các hoạt động phong trào của Nhà trường (24/04/2024)\nTin tiêu điểm\nSinh viên Khóa 19 Khoa Công nghệ thông tin đạt Học bổng HaUI 100% toàn khóa học.\nThứ Sáu, 11:07 20/09/2024\nĐội bóng khoa Công nghệ thông tin cùng những trận cầu đáng nhớ\nThứ Bảy, 10:00 23/07/2022\nĐại hội đại biểu Liên chi Đoàn khoa Công nghệ thông tin lần thứ X, nhiệm kỳ 2022 - 2024\nThứ Hai, 15:00 18/04/2022\nGặp mặt tân Sinh viên K15 khoa Công nghệ thông tin\nThứ Tư, 08:17 28/10/2020\nChương trình thực tập tại SVMC ""SVMC Internship Program 2020""\nThứ Sáu, 14:02 22/05/2020\nCác bài đã đăng\nSinh viên Khoa Công nghệ thông tin ghi thành tích nổi bật tại Olympic Tin học sinh viên Việt Nam lần thứ 33 và Kỳ thi Lập trình ICPC ASIA Hà Nội năm 2024\n', 'content: TỐT NGHIỆP VÀ CẤP BẰNG\n» Quyết định công nhận tốt nghiệp và cấp bằng thạc sĩ đợt 2 năm 2024\n» Quyết định công nhận tốt nghiệp và cấp bằng thạc sĩ đợt 1 năm 2024\n» Xem tất cả\nThông báo\nThông tin công khai đề án mở ngành Ngôn ngữ Trung Quốc, trình độ tiến sĩ, mã ngành 9220204\nThông báo kế hoạch đăng ký các học phần đợt 3 năm 2024 cho học viên cao học và sinh viên đăng ký học trước CTĐT trình độ thạc sĩ\nThông tin công khai đề án mở ngành Công nghệ dệt, may trình độ tiến sĩ, mã ngành 9540204\nThông tin công khai đề án mở ngành Hệ thống thông tin trình độ tiến sĩ, mã ngành 9480104\nThông tin công khai đề án mở ngành Tài chính – Ngân hàng trình độ thạc sĩ, mã ngành 8340201\nBản đồ chỉ dẫn\nTrường Đại học Công nghiệp Hà Nội\nTrụ sở chính\nSố 298 đường Cầu Diễn, quận Bắc Từ Liêm, Hà Nội\n+84 243 765 5121\nEmail: dhcnhn@haui.edu.vn\nCác cơ sở khác\nCơ sở 2: Phường Tây Tựu, quận Bắc Từ Liêm, Hà Nội\nCơ sở 3: Phường Lê Hồng Phong, thành phố Phủ Lý, Hà Nam\nLiên kết site\nTrường Đại học Công nghiệp Hà Nội\nThông tin tuyển sinh\nHành chính điện tử\nĐào tạo trực tuyến\nCổng thông tin đào tạo\nCopyright © 2018 Hanoi University of Industry.\nnext_contents:\n- TRUNG TÂM ĐÀO TẠO SAU ĐẠI HỌC - ĐẠI HỌC CÔNG NGHIỆP HÀ NỘI || HaUI\nTrang HaUI\nPhòng\nPhòng Tổ chức hành chính\nPhòng Đào tạo\nPhòng Công tác sinh viên\nPhòng Khoa học công nghệ\nPhòng hợp tác đối ngoại\nPhòng Tài chính kế toán\nPhòng Quản trị\nPhòng Thanh tra Giáo dục\nKhoa\nKhoa Công nghệ Hoá\nKhoa Công nghệ may & TKTT\nKhoa Công nghệ thông tin\nKhoa Điện\nKhoa Điện tử\nKhoa Khoa học cơ bản\nKhoa Lý luận chính trị - Pháp luật\nTrung tâm Đào tạo\nTrung tâm Đào tạo Sau đại học\nTrung tâm Giáo dục thể chất và Thể thao\nTrung tâm Công nghệ Ô tô và Đào tạo lái xe\nTrung tâm Công nghệ thông tin\nTrung tâm Việt Nhật\nTrung tâm Giáo dục Quốc phòng An ninh\nTrung tâm Dịch vụ\nTrung tâm Truyền thông & Quan hệ Công chúng\nTrạm Y tế\nTrung tâm Hỗ trợ Sinh viên\nTrung tâm Đảm bảo chất lượng\nTrung tâm Thông tin Thư viện\nTrung tâm khảo thí\nViện nghiên cứu\nCông ty Letco\nThư điện tử\nSitemap\nLiên hệ\nToggle navigation\nGiới thiệu\nGiới thiệu chung\nCơ cấu tổ chức\nCơ sở vật chất\nQuy chế/Quy định đào tạo\nChương trình đào tạo\nĐịa chỉ liên hệ\nThông báo\nTuyển sinh\nTuyển sinh Thạc sĩ\nTuyển sinh Tiến sĩ\nNghiên cứu khoa học\nBiểu mẫu\nThông tin luận văn, luận án\nPrevious\nNext\nTin tức\nTổ chức bảo vệ Đề án tốt nghiệp thạc sĩ cho học viên cao học ngành Kỹ thuật điện tử khóa 12\nChào mừng học viên cao học khóa 14 đợt 3 năm 2024 nhập học và sinh hoạt đầu khóa\nTổ chức bảo vệ đề án tốt nghiệp thạc sĩ cho học viên cao học ngành Kỹ thuật Điện khóa 12\nTỐT NGHIỆP VÀ CẤP BẰNG\n» Quyết định công nhận tốt nghiệp và cấp bằng thạc sĩ đợt 2 năm 2024\n» Quyết định công nhận tốt nghiệp và cấp bằng thạc sĩ đợt 1 năm 2024\n» Xem tất cả\nThông báo\n', 'content: TỐT NGHIỆP VÀ CẤP BẰNG\n» Quyết định công nhận tốt nghiệp và cấp bằng thạc sĩ đợt 2 năm 2024\n» Quyết định công nhận tốt nghiệp và cấp bằng thạc sĩ đợt 1 năm 2024\n» Xem tất cả\nThông báo\nThông tin công khai đề án mở ngành Ngôn ngữ Trung Quốc, trình độ tiến sĩ, mã ngành 9220204\nThông báo kế hoạch đăng ký các học phần đợt 3 năm 2024 cho học viên cao học và sinh viên đăng ký học trước CTĐT trình độ thạc sĩ\nThông tin công khai đề án mở ngành Công nghệ dệt, may trình độ tiến sĩ, mã ngành 9540204\nThông tin công khai đề án mở ngành Hệ thống thông tin trình độ tiến sĩ, mã ngành 9480104\nThông tin công khai đề án mở ngành Tài chính – Ngân hàng trình độ thạc sĩ, mã ngành 8340201\nBản đồ chỉ dẫn\nTrường Đại học Công nghiệp Hà Nội\nTrụ sở chính\nSố 298 đường Cầu Diễn, quận Bắc Từ Liêm, Hà Nội\n+84 243 765 5121\nEmail: dhcnhn@haui.edu.vn\nCác cơ sở khác\nCơ sở 2: Phường Tây Tựu, quận Bắc Từ Liêm, Hà Nội\nCơ sở 3: Phường Lê Hồng Phong, thành phố Phủ Lý, Hà Nam\nLiên kết site\nTrường Đại học Công nghiệp Hà Nội\nThông tin tuyển sinh\nHành chính điện tử\nĐào tạo trực tuyến\nCổng thông tin đào tạo\nCopyright © 2018 Hanoi University of Industry.\nnext_contents:\n- TRUNG TÂM ĐÀO TẠO SAU ĐẠI HỌC - ĐẠI HỌC CÔNG NGHIỆP HÀ NỘI || HaUI\nTrang HaUI\nPhòng\nPhòng Tổ chức hành chính\nPhòng Đào tạo\nPhòng Công tác sinh viên\nPhòng Khoa học công nghệ\nPhòng hợp tác đối ngoại\nPhòng Tài chính kế toán\nPhòng Quản trị\nPhòng Thanh tra Giáo dục\nKhoa\nKhoa Công nghệ Hoá\nKhoa Công nghệ may & TKTT\nKhoa Công nghệ thông tin\nKhoa Điện\nKhoa Điện tử\nKhoa Khoa học cơ bản\nKhoa Lý luận chính trị - Pháp luật\nTrung tâm Đào tạo\nTrung tâm Đào tạo Sau đại học\nTrung tâm Giáo dục thể chất và Thể thao\nTrung tâm Công nghệ Ô tô và Đào tạo lái xe\nTrung tâm Công nghệ thông tin\nTrung tâm Việt Nhật\nTrung tâm Giáo dục Quốc phòng An ninh\nTrung tâm Dịch vụ\nTrung tâm Truyền thông & Quan hệ Công chúng\nTrạm Y tế\nTrung tâm Hỗ trợ Sinh viên\nTrung tâm Đảm bảo chất lượng\nTrung tâm Thông tin Thư viện\nTrung tâm khảo thí\nViện nghiên cứu\nCông ty Letco\nThư điện tử\nSitemap\nLiên hệ\nToggle navigation\nGiới thiệu\nGiới thiệu chung\nCơ cấu tổ chức\nCơ sở vật chất\nQuy chế/Quy định đào tạo\nChương trình đào tạo\nĐịa chỉ liên hệ\nThông báo\nTuyển sinh\nTuyển sinh Thạc sĩ\nTuyển sinh Tiến sĩ\nNghiên cứu khoa học\nBiểu mẫu\nThông tin luận văn, luận án\nPrevious\nNext\nTin tức\nTổ chức bảo vệ Đề án tốt nghiệp thạc sĩ cho học viên cao học ngành Kỹ thuật điện tử khóa 12\nChào mừng học viên cao học khóa 14 đợt 3 năm 2024 nhập học và sinh hoạt đầu khóa\nTổ chức bảo vệ đề án tốt nghiệp thạc sĩ cho học viên cao học ngành Kỹ thuật Điện khóa 12\nTỐT NGHIỆP VÀ CẤP BẰNG\n» Quyết định công nhận tốt nghiệp và cấp bằng thạc sĩ đợt 2 năm 2024\n» Quyết định công nhận tốt nghiệp và cấp bằng thạc sĩ đợt 1 năm 2024\n» Xem tất cả\nThông báo\n', 'content: Thứ Tư, 08:17 28/10/2020\nChương trình thực tập tại SVMC ""SVMC Internship Program 2020""\nThứ Sáu, 14:02 22/05/2020\nCác bài đã đăng\nCuộc thi:"" Học sinh, sinh viên với ý tưởng khởi nghiệp"" lần thứ VII.\nThứ Tư, 09:57 18/12/2024\nDự kiến chỉ tiêu và phương thức xét tuyển các ngành thuộc Khoa CNTT - Trường Đại học Công Nghiệp Hà Nội năm 2025\nThứ Tư, 09:14 18/12/2024\nCẩm nang Kỳ thi Olympic Tin học Sinh viên Việt Nam lần thứ 33 (OLP’24) và Kỳ thi lập trình sinh viên Quốc tế ICPC ASIA 2024\nThứ Tư, 07:54 11/12/2024\nKhảo sát mức độ quan tâm thị trường việc làm Nhật Bản đợt 2\nThứ Ba, 12:34 10/12/2024\nKhởi động Cuộc thi Huawei ICT toàn cầu 2024-2025\nThứ Hai, 09:04 09/12/2024\nThông báo tuyển sinh đi học tại Hungari diện Hiệp định năm 2025\nThứ Năm, 08:40 28/11/2024\nHướng dẫn cài đặt iHanoi - Bước tiên phong chuyển đổi số\nThứ Tư, 09:45 27/11/2024\nThông báo tuyển sinh đi học tại Trung Quốc năm 2025\nThứ Tư, 09:23 27/11/2024\nĐăng ký Hội thao Khoa Công nghệ thông tin năm 2024\nThứ Hai, 09:51 25/11/2024\nThông báo tuyển sinh trình độ Thạc sỹ Hệ thống thông tin năm 2024\nThứ Bảy, 15:26 23/11/2024\nBản đồ chỉ dẫn\nTrường Đại học Công nghiệp Hà Nội\nTrụ sở chính\nSố 298 đường Cầu Diễn, quận Bắc Từ Liêm, Hà Nội\n+84 243 765 5121\nEmail: dhcnhn@haui.edu.vn\nCác cơ sở khác\nCơ sở 2: Phường Tây Tựu, quận Bắc Từ Liêm, Hà Nội\nCơ sở 3: Phường Lê Hồng Phong, thành phố Phủ Lý, Hà Nam\nLiên kết site\nTrường Đại học Công nghiệp Hà Nội\nThông tin tuyển sinh\nHành chính điện tử\nĐào tạo trực tuyến\nCổng thông tin đào tạo\nCopyright © 2018 Hanoi University of Industry.\nnext_contents:\n- Căn cứ tiến độ, kế hoạch đào tạo năm học 2024-2025;Nhà trường thông báo kế hoạch đăng ký, học tập tại học kỳ phụ 1 năm học 2024 - 2025 cho sinh viên Đại học các khóaThời khóa biểu học kỳ phụ 1 (2024-2025):Xem tại đây\nThứ Năm, 08:55 28/11/2024\nTags:\nTweet\nCác bài đã đăng\n» Cuộc thi:"" Học sinh, sinh viên với ý tưởng khởi nghiệp"" lần thứ VII. (18/12/2024)\n» Dự kiến chỉ tiêu và phương thức xét tuyển các ngành thuộc Khoa CNTT - Trường Đại học Công Nghiệp Hà Nội năm 2025 (18/12/2024)\n» Cẩm nang Kỳ thi Olympic Tin học Sinh viên Việt Nam lần thứ 33 (OLP’24) và Kỳ thi lập trình sinh viên Quốc tế ICPC ASIA 2024 (11/12/2024)\n» Khảo sát mức độ quan tâm thị trường việc làm Nhật Bản đợt 2 (10/12/2024)\n» Khởi động Cuộc thi Huawei ICT toàn cầu 2024-2025 (09/12/2024)\n» Thông báo tuyển sinh đi học tại Hungari diện Hiệp định năm 2025 (28/11/2024)\n» Hướng dẫn cài đặt iHanoi - Bước tiên phong chuyển đổi số (27/11/2024)\n» Thông báo tuyển sinh đi học tại Trung Quốc năm 2025 (27/11/2024)\n» Đăng ký Hội thao Khoa Công nghệ thông tin năm 2024 (25/11/2024)\n» Thông báo tuyển sinh trình độ Thạc sỹ Hệ thống thông tin năm 2024 (23/11/2024)\nTin tiêu điểm\nSinh viên Khóa 19 Khoa Công nghệ thông tin đạt Học bổng HaUI 100% toàn khóa học.\nThứ Sáu, 11:07 20/09/2024\nĐội bóng khoa Công nghệ thông tin cùng những trận cầu đáng nhớ\nThứ Bảy, 10:00 23/07/2022\nĐại hội đại biểu Liên chi Đoàn khoa Công nghệ thông tin lần thứ X, nhiệm kỳ 2022 - 2024\nThứ Hai, 15:00 18/04/2022\nGặp mặt tân Sinh viên K15 khoa Công nghệ thông tin\nThứ Tư, 08:17 28/10/2020\nChương trình thực tập tại SVMC ""SVMC Internship Program 2020""\nThứ Sáu, 14:02 22/05/2020\nCác bài đã đăng\nCuộc thi:"" Học sinh, sinh viên với ý tưởng khởi nghiệp"" lần thứ VII.\nThứ Tư, 09:57 18/12/2024\n']","['Liên hệ Toggle navigation GIỚI THIỆU THÔNG TIN CHUNG CƠ CẤU TỔ CHỨC CHIẾN LƯỢC PHÁT TRIỂN CÁN BỘ GIẢNG VIÊN CƠ SỞ VẬT CHẤT LIÊN HỆ ĐÀO TẠO ĐẠI HỌC KHOA HỌC MÁY TÍNH KỸ THUẬT PHẦN MỀM HỆ THỐNG THÔNG TIN CÔNG NGHỆ THÔNG TIN CÔNG NGHỆ ĐA PHƯƠNG TIỆN AN TOÀN THÔNG TIN SAU ĐẠI HỌC HỆ THỐNG THÔNG TIN KẾ HOẠCH TIẾN ĐỘ QUY CHẾ, BIỂU MẪU NGHIÊN CỨU KHOA HỌC CÔNG TRÌNH CÔNG BỐ ĐỀ TÀI, DỰ ÁN SINH VIÊN NCKH TIN KHCN CÔNG TÁC SINH VIÊN QUY CHẾ GƯƠNG SÁNG SINH VIÊN HỌC BỔNG CÂU LẠC BỘ THƯ VIỆN ẢNH TUYỂN DỤNG THÔNG BÁO TRANG CHỦ > THÔNG BÁO Thông báo tuyển sinh đi học tại Trung Quốc năm 2025 Bộ Giáo dục và Đào tạo ban hành Thông báo số 1744/TB-BGDĐT ngày 22 tháng 11 năm 2024 về Tuyển sinh đi học tại Trung Quốc năm 2025 diện Hiệp định như sau:1. Thông tin chung về chương trình:Chính phủ Trung Quốc cấp 34 chỉ tiêu học bổng cho công dân Việt Nam đi đào tạo trình độ Tiến sĩ, Thạc sĩ, Đại học tại Trung Quốc. Trong đó, thời gian đào tạo:- Chương trình Tiến sĩ: từ 03 đến 05 năm học- Chương trình Thạc sĩ: từ 02 đến 04 năm học- Chương trình Đại học: từ 04 đến 05 năm học2. Quyền lợi khi đi học diện Hiệp định:- Chính phủ Trung Quốc miễn học phí cho quá trình học tập, bố trí chỗ ở, cấp bảo hiểm y tế, tài liệu học tập và học bổng hàng tháng theo mức quy định của Chính phủ Trung Quốc.- Chính phủ Việt Nam cấp vé máy bay một lượt đi và một lượt về, lệ phí làm hộ chiếu, visa, phí đi đường và cấp bù sinh hoạt phí theo quy định hiện hành căn cứ trên mức hỗ trợ của phía Trung Quốc dành cho du học sinh Việt Nam.3. Đối tượng, điều kiện và hồ sơ dự tuyển: Xem tại đây. Thứ Tư, 09:23 27/11/2024 Tags: Tweet Các bài đã đăng » Cuộc thi:"" Học sinh, sinh viên với ý tưởng khởi nghiệp"" lần thứ VII. (18/12/2024) » Dự kiến chỉ tiêu và phương thức xét tuyển các ngành thuộc Khoa CNTT - Trường Đại học Công Nghiệp Hà Nội năm 2025 (18/12/2024) » Cẩm nang Kỳ thi Olympic Tin học Sinh viên Việt Nam lần thứ 33 (OLP’24) và Kỳ thi lập trình sinh viên Quốc tế ICPC ASIA 2024 (11/12/2024) » Khảo sát mức độ quan tâm thị trường việc làm Nhật Bản đợt 2 (10/12/2024) » Khởi động Cuộc thi Huawei ICT toàn cầu 2024-2025 (09/12/2024) » Đăng ký Hội thao Khoa Công nghệ thông tin năm 2024 (25/11/2024) » Thông báo tuyển sinh trình độ Thạc sỹ Hệ thống thông tin năm 2024 (23/11/2024) » Thông báo tổ chức chương trình Hội thảo thực tập, việc làm và phỏng vấn trực tiếp của Công ty TNHH Công nghiệp Brother Việt Nam - Thứ 5, ngày 28/11/2024 (22/11/2024) » Thông báo tổ chức chương trình Hội thảo thực tập, việc làm và phỏng vấn trực tiếp Cán bộ nguồn Foxconn - Thứ 3, ngày 26/11/2024 (20/11/2024) » [Webinar] How to Become a Data Analyst? (18/11/2024) Tin tiêu điểm Sinh viên Khóa 19 Khoa Công nghệ thông tin đạt Học bổng HaUI 100% toàn khóa học. Thứ Sáu, 11:07 20/09/2024 Đội bóng khoa Công nghệ thông tin cùng những trận cầu đáng nhớ Thứ Bảy, 10:00 23/07/2022 Đại hội đại biểu Liên chi Đoàn khoa Công nghệ thông tin lần thứ X, nhiệm kỳ 2022 - 2024 Thứ Hai, 15:00 18/04/2022 Gặp mặt tân Sinh viên K15 khoa Công nghệ thông tin Thứ Tư, 08:17 28/10/2020 Chương trình thực tập tại SVMC ""SVMC Internship Program 2020"" Thứ Sáu, 14:02 22/05/2020 Các bài đã đăng Cuộc thi:"" Học sinh, sinh viên với ý tưởng khởi nghiệp"" lần thứ VII. Thứ Tư, 09:57 18/12/2024 Dự kiến chỉ tiêu và phương thức xét tuyển các ngành thuộc Khoa CNTT - Trường Đại học Công Nghiệp Hà Nội năm 2025 Thứ Tư, 09:14 18/12/2024 Cẩm nang Kỳ thi Olympic Tin học Sinh viên Việt Nam lần thứ 33 (OLP’24) và Kỳ thi lập trình sinh viên Quốc tế ICPC ASIA 2024 Thứ Tư, 07:54 11/12/2024 Khảo sát mức độ quan tâm thị trường việc làm Nhật Bản đợt 2 Thứ Ba, 12:34 10/12/2024 Khởi động Cuộc thi Huawei ICT toàn cầu 2024-2025 Thứ Hai, 09:04 09/12/2024 Đăng ký Hội thao Khoa Công nghệ thông tin năm 2024 Thứ Hai, 09:51 25/11/2024 Thông báo tuyển sinh trình độ Thạc sỹ Hệ thống thông tin năm 2024 Thứ Bảy, 15:26 23/11/2024 Thông báo tổ chức chương trình Hội thảo thực tập, việc làm và phỏng vấn trực tiếp của Công ty TNHH Công nghiệp Brother Việt Nam - Thứ 5, ngày 28/11/2024 Thứ Sáu, 13:47 22/11/2024 Thông báo tổ chức chương trình Hội thảo thực tập, việc làm và phỏng vấn trực tiếp Cán bộ nguồn Foxconn - Thứ 3, ngày 26/11/2024 Thứ Tư, 10:03 20/11/2024 [Webinar] How to Become a Data Analyst? Thứ Hai, 08:43 18/11/2024 Bản đồ chỉ dẫn Trường Đại học Công nghiệp Hà Nội Trụ sở chính Số 298 đường Cầu Diễn, quận Bắc Từ Liêm, Hà Nội +84 243 765 5121 Email: dhcnhn@haui.edu.vn Các cơ sở khác Cơ sở 2: Phường Tây Tựu, quận Bắc Từ Liêm, Hà Nội Cơ sở 3: Phường Lê Hồng Phong, thành phố Phủ Lý, Hà Nam Liên kết site Trường Đại học Công nghiệp Hà Nội Thông tin tuyển sinh Hành chính điện tử Đào tạo trực tuyến Cổng thông tin đào tạo Copyright © 2018 Hanoi University of Industry.']","Tôi không có thông tin này và khuyến nghị bạn tham khảo nguồn khác để biết thêm chi tiết về chương trình Thạc sĩ tại Đại học Công nghiệp Hà Nội. Nếu bạn có câu hỏi khác liên quan đến khoa công nghệ thông tin hoặc các hoạt động của sinh viên, hãy cho tôi biết!",Thông báo tuyển sinh trình độ Thạc sỹ Hệ thống thông tin năm 2024 đã được công bố. Chương trình Thạc sĩ có thời gian đào tạo từ 02 đến 04 năm học.,0.6388888888675925,0.5,0.0,0.0,0.8770100270329156,0.5964879989624023,2.865143060684204
28,Học bổng HaUI có ý nghĩa gì đối với sinh viên Khoa Công nghệ Thông tin?,"['content: Sinh viên Khóa 19 Khoa Công nghệ thông tin đạt Học bổng HaUI 100% toàn khóa học.\nHọc bổng chính là phần thưởng xứng đáng cho sự nỗ lực cố gắng không ngừng nghỉ. Học bổng HaUI là học bổng toàn khóa học và học bổng năm thứ nhất là cấp 100% học phí và các học phần lần thứ nhất trong học kỳ chính và các học phần học tại học kỳ phụ song song hoặc ngay sau liền (không tính các học phần học lại, học cải thiện điểm, các môn học Kỹ năng sử dụng công nghệ thông tin, Ngoại ngữ và các môn học khác (nếu có) theo chương trình đào tạo).Năm học 2024-2025, Khóa nhập học Khóa 19 Khoa Công nghệ thông tin vinh dự và tuyên dương 03 sinh viên đạt được học bổng 100% toàn khóa học.Nguyễn Thị Lan – Tân sinh viên lớp 2024DHCNTT02 quê ở Tân Yên, Bắc Giang với Thành tích đạt giải Nhì Học sinh giỏi tỉnh môn Tiếng Anh năm lớp 12, Em đã đạt số điểm xét tuyển 27,53 theo Phương thức 3 - Xét tuyển dựa trên kết quả thi tốt nghiệp THPT và ước mơ trở thành Lập trình viên phần mềm trong tương lai.Nguyễn Thành Đạt – Tân sinh viên lớp 2024DHCNTT03 quê ở Yên Bồng, Lạc Thủy, Hòa Bình với Thành tích đạt giải Nhất toán cấp tỉnh, Em đã đạt điểm số xét tuyển 29,29 theo Phương thức 2 - Xét tuyển thí sinh đoạt giải học sinh giỏi cấp tỉnh/thành phố và ước mơ trở thành Kỹ sư phần mềm trong tương lai.Dương Đinh Thượng Hải – Tân sinh viên lớp 2024DHCNTT02 quê ở Thái Bình với Thành tích 12 năm Học sinh giỏi cấp Trường và tham gia Cuộc thi học sinh giỏi cấp tỉnh môn Hóa, Em đạt điểm số xét tuyển 29,37 theo Phương thức 4 - Xét tuyển dựa trên kết quả học tập ở bậc học THPT và ước mơ trở thành Kỹ sư CNTT về lập trình và thiết kế.Với các thành tích đã tích lũy và niềm yêu thích với CNTT, các em đã chọn Khoa Công nghệ thông tin Trường Đại học Công Nghiệp Hà Nội là môi trường học tập lý tưởng và đúng đắn để theo đuổi niềm đam mê của mình và cố gắng học tập trong tương lai.Chúc các em luôn học tập tốt và thành công!\nnext_contents:\n- Sinh viên Khóa 19 Khoa Công nghệ thông tin đạt Học bổng HaUI 100% toàn khóa học.\nTrang HaUI\nPhòng\nPhòng Tổ chức hành chính\nPhòng Đào tạo\nPhòng Công tác sinh viên\nPhòng Khoa học công nghệ\nPhòng hợp tác đối ngoại\nPhòng Tài chính kế toán\nPhòng Quản trị\nPhòng Thanh tra Giáo dục\nKhoa\nKhoa Công nghệ Hoá\nKhoa Công nghệ may & TKTT\nKhoa Công nghệ thông tin\nKhoa Điện\nKhoa Điện tử\nKhoa Khoa học cơ bản\nKhoa Lý luận chính trị - Pháp luật\nTrung tâm Đào tạo\nTrung tâm Đào tạo Sau đại học\nTrung tâm Giáo dục thể chất và Thể thao\nTrung tâm Công nghệ Ô tô và Đào tạo lái xe\nTrung tâm Công nghệ thông tin\nTrung tâm Việt Nhật\nTrung tâm Giáo dục Quốc phòng An ninh\nTrung tâm Dịch vụ\nTrung tâm Truyền thông & Quan hệ Công chúng\nTrạm Y tế\nTrung tâm Hỗ trợ Sinh viên\nTrung tâm Đảm bảo chất lượng\nTrung tâm Thông tin Thư viện\nTrung tâm khảo thí\nViện nghiên cứu\nCông ty Letco\nThư điện tử\nSitemap\nLiên hệ\nToggle navigation\nGIỚI THIỆU\nTHÔNG TIN CHUNG\nCƠ CẤU TỔ CHỨC\nCHIẾN LƯỢC PHÁT TRIỂN\nCÁN BỘ GIẢNG VIÊN\nCƠ SỞ VẬT CHẤT\nLIÊN HỆ\nĐÀO TẠO\nĐẠI HỌC\nKHOA HỌC MÁY TÍNH\nKỸ THUẬT PHẦN MỀM\nHỆ THỐNG THÔNG TIN\nCÔNG NGHỆ THÔNG TIN\nCÔNG NGHỆ ĐA PHƯƠNG TIỆN\nAN TOÀN THÔNG TIN\nSAU ĐẠI HỌC\nHỆ THỐNG THÔNG TIN\nKẾ HOẠCH\nTIẾN ĐỘ\nQUY CHẾ, BIỂU MẪU\nNGHIÊN CỨU KHOA HỌC\nCÔNG TRÌNH CÔNG BỐ\nĐỀ TÀI, DỰ ÁN\nSINH VIÊN NCKH\nTIN KHCN\nCÔNG TÁC SINH VIÊN\nQUY CHẾ\nGƯƠNG SÁNG SINH VIÊN\nHỌC BỔNG\nCÂU LẠC BỘ\nTHƯ VIỆN ẢNH\nTUYỂN DỤNG\nGƯƠNG SÁNG SINH VIÊN\nTRANG CHỦ > GƯƠNG SÁNG SINH VIÊN\nSinh viên Khóa 19 Khoa Công nghệ thông tin đạt Học bổng HaUI 100% toàn khóa học.\n', 'content: Sinh viên Khóa 19 Khoa Công nghệ thông tin đạt Học bổng HaUI 100% toàn khóa học.\nHọc bổng chính là phần thưởng xứng đáng cho sự nỗ lực cố gắng không ngừng nghỉ. Học bổng HaUI là học bổng toàn khóa học và học bổng năm thứ nhất là cấp 100% học phí và các học phần lần thứ nhất trong học kỳ chính và các học phần học tại học kỳ phụ song song hoặc ngay sau liền (không tính các học phần học lại, học cải thiện điểm, các môn học Kỹ năng sử dụng công nghệ thông tin, Ngoại ngữ và các môn học khác (nếu có) theo chương trình đào tạo).Năm học 2024-2025, Khóa nhập học Khóa 19 Khoa Công nghệ thông tin vinh dự và tuyên dương 03 sinh viên đạt được học bổng 100% toàn khóa học.Nguyễn Thị Lan – Tân sinh viên lớp 2024DHCNTT02 quê ở Tân Yên, Bắc Giang với Thành tích đạt giải Nhì Học sinh giỏi tỉnh môn Tiếng Anh năm lớp 12, Em đã đạt số điểm xét tuyển 27,53 theo Phương thức 3 - Xét tuyển dựa trên kết quả thi tốt nghiệp THPT và ước mơ trở thành Lập trình viên phần mềm trong tương lai.Nguyễn Thành Đạt – Tân sinh viên lớp 2024DHCNTT03 quê ở Yên Bồng, Lạc Thủy, Hòa Bình với Thành tích đạt giải Nhất toán cấp tỉnh, Em đã đạt điểm số xét tuyển 29,29 theo Phương thức 2 - Xét tuyển thí sinh đoạt giải học sinh giỏi cấp tỉnh/thành phố và ước mơ trở thành Kỹ sư phần mềm trong tương lai.Dương Đinh Thượng Hải – Tân sinh viên lớp 2024DHCNTT02 quê ở Thái Bình với Thành tích 12 năm Học sinh giỏi cấp Trường và tham gia Cuộc thi học sinh giỏi cấp tỉnh môn Hóa, Em đạt điểm số xét tuyển 29,37 theo Phương thức 4 - Xét tuyển dựa trên kết quả học tập ở bậc học THPT và ước mơ trở thành Kỹ sư CNTT về lập trình và thiết kế.Với các thành tích đã tích lũy và niềm yêu thích với CNTT, các em đã chọn Khoa Công nghệ thông tin Trường Đại học Công Nghiệp Hà Nội là môi trường học tập lý tưởng và đúng đắn để theo đuổi niềm đam mê của mình và cố gắng học tập trong tương lai.Chúc các em luôn học tập tốt và thành công!\nnext_contents:\n- Sinh viên Khóa 19 Khoa Công nghệ thông tin đạt Học bổng HaUI 100% toàn khóa học.\nTrang HaUI\nPhòng\nPhòng Tổ chức hành chính\nPhòng Đào tạo\nPhòng Công tác sinh viên\nPhòng Khoa học công nghệ\nPhòng hợp tác đối ngoại\nPhòng Tài chính kế toán\nPhòng Quản trị\nPhòng Thanh tra Giáo dục\nKhoa\nKhoa Công nghệ Hoá\nKhoa Công nghệ may & TKTT\nKhoa Công nghệ thông tin\nKhoa Điện\nKhoa Điện tử\nKhoa Khoa học cơ bản\nKhoa Lý luận chính trị - Pháp luật\nTrung tâm Đào tạo\nTrung tâm Đào tạo Sau đại học\nTrung tâm Giáo dục thể chất và Thể thao\nTrung tâm Công nghệ Ô tô và Đào tạo lái xe\nTrung tâm Công nghệ thông tin\nTrung tâm Việt Nhật\nTrung tâm Giáo dục Quốc phòng An ninh\nTrung tâm Dịch vụ\nTrung tâm Truyền thông & Quan hệ Công chúng\nTrạm Y tế\nTrung tâm Hỗ trợ Sinh viên\nTrung tâm Đảm bảo chất lượng\nTrung tâm Thông tin Thư viện\nTrung tâm khảo thí\nViện nghiên cứu\nCông ty Letco\nThư điện tử\nSitemap\nLiên hệ\nToggle navigation\nGIỚI THIỆU\nTHÔNG TIN CHUNG\nCƠ CẤU TỔ CHỨC\nCHIẾN LƯỢC PHÁT TRIỂN\nCÁN BỘ GIẢNG VIÊN\nCƠ SỞ VẬT CHẤT\nLIÊN HỆ\nĐÀO TẠO\nĐẠI HỌC\nKHOA HỌC MÁY TÍNH\nKỸ THUẬT PHẦN MỀM\nHỆ THỐNG THÔNG TIN\nCÔNG NGHỆ THÔNG TIN\nCÔNG NGHỆ ĐA PHƯƠNG TIỆN\nAN TOÀN THÔNG TIN\nSAU ĐẠI HỌC\nHỆ THỐNG THÔNG TIN\nKẾ HOẠCH\nTIẾN ĐỘ\nQUY CHẾ, BIỂU MẪU\nNGHIÊN CỨU KHOA HỌC\nCÔNG TRÌNH CÔNG BỐ\nĐỀ TÀI, DỰ ÁN\nSINH VIÊN NCKH\nTIN KHCN\nCÔNG TÁC SINH VIÊN\nQUY CHẾ\nGƯƠNG SÁNG SINH VIÊN\nHỌC BỔNG\nCÂU LẠC BỘ\nTHƯ VIỆN ẢNH\nTUYỂN DỤNG\nGƯƠNG SÁNG SINH VIÊN\nTRANG CHỦ > GƯƠNG SÁNG SINH VIÊN\nSinh viên Khóa 19 Khoa Công nghệ thông tin đạt Học bổng HaUI 100% toàn khóa học.\n', 'content: Học bổng là phần thưởng xứng đáng cho nỗ lực của sinh viên\nTrang HaUI\nPhòng\nPhòng Tổ chức hành chính\nPhòng Đào tạo\nPhòng Công tác sinh viên\nPhòng Khoa học công nghệ\nPhòng hợp tác đối ngoại\nPhòng Tài chính kế toán\nPhòng Quản trị\nPhòng Thanh tra Giáo dục\nKhoa\nKhoa Công nghệ Hoá\nKhoa Công nghệ may & TKTT\nKhoa Công nghệ thông tin\nKhoa Điện\nKhoa Điện tử\nKhoa Khoa học cơ bản\nKhoa Lý luận chính trị - Pháp luật\nTrung tâm Đào tạo\nTrung tâm Đào tạo Sau đại học\nTrung tâm Giáo dục thể chất và Thể thao\nTrung tâm Công nghệ Ô tô và Đào tạo lái xe\nTrung tâm Công nghệ thông tin\nTrung tâm Việt Nhật\nTrung tâm Giáo dục Quốc phòng An ninh\nTrung tâm Dịch vụ\nTrung tâm Truyền thông & Quan hệ Công chúng\nTrạm Y tế\nTrung tâm Hỗ trợ Sinh viên\nTrung tâm Đảm bảo chất lượng\nTrung tâm Thông tin Thư viện\nTrung tâm khảo thí\nViện nghiên cứu\nCông ty Letco\nThư điện tử\nSitemap\nLiên hệ\nToggle navigation\nGIỚI THIỆU\nTHÔNG TIN CHUNG\nCƠ CẤU TỔ CHỨC\nCHIẾN LƯỢC PHÁT TRIỂN\nCÁN BỘ GIẢNG VIÊN\nCƠ SỞ VẬT CHẤT\nLIÊN HỆ\nĐÀO TẠO\nĐẠI HỌC\nKHOA HỌC MÁY TÍNH\nKỸ THUẬT PHẦN MỀM\nHỆ THỐNG THÔNG TIN\nCÔNG NGHỆ THÔNG TIN\nCÔNG NGHỆ ĐA PHƯƠNG TIỆN\nAN TOÀN THÔNG TIN\nSAU ĐẠI HỌC\nHỆ THỐNG THÔNG TIN\nKẾ HOẠCH\nTIẾN ĐỘ\nQUY CHẾ, BIỂU MẪU\nNGHIÊN CỨU KHOA HỌC\nCÔNG TRÌNH CÔNG BỐ\nĐỀ TÀI, DỰ ÁN\nSINH VIÊN NCKH\nTIN KHCN\nCÔNG TÁC SINH VIÊN\nQUY CHẾ\nGƯƠNG SÁNG SINH VIÊN\nHỌC BỔNG\nCÂU LẠC BỘ\nTHƯ VIỆN ẢNH\nTUYỂN DỤNG\nGƯƠNG SÁNG SINH VIÊN\nTRANG CHỦ > GƯƠNG SÁNG SINH VIÊN\nHọc bổng là phần thưởng xứng đáng cho nỗ lực của sinh viên\nnext_contents:\n', 'content: Học bổng- KHOA CÔNG NGHỆ THÔNG TIN - ĐẠI HỌC CÔNG NGHIỆP HÀ NỘI || HaUI\nTrang HaUI\nPhòng\nPhòng Tổ chức hành chính\nPhòng Đào tạo\nPhòng Công tác sinh viên\nPhòng Khoa học công nghệ\nPhòng hợp tác đối ngoại\nPhòng Tài chính kế toán\nPhòng Quản trị\nPhòng Thanh tra Giáo dục\nKhoa\nKhoa Công nghệ Hoá\nKhoa Công nghệ may & TKTT\nKhoa Công nghệ thông tin\nKhoa Điện\nKhoa Điện tử\nKhoa Khoa học cơ bản\nKhoa Lý luận chính trị - Pháp luật\nTrung tâm Đào tạo\nTrung tâm Đào tạo Sau đại học\nTrung tâm Giáo dục thể chất và Thể thao\nTrung tâm Công nghệ Ô tô và Đào tạo lái xe\nTrung tâm Công nghệ thông tin\nTrung tâm Việt Nhật\nTrung tâm Giáo dục Quốc phòng An ninh\nTrung tâm Dịch vụ\nTrung tâm Truyền thông & Quan hệ Công chúng\nTrạm Y tế\nTrung tâm Hỗ trợ Sinh viên\nTrung tâm Đảm bảo chất lượng\nTrung tâm Thông tin Thư viện\nTrung tâm khảo thí\nViện nghiên cứu\nCông ty Letco\nThư điện tử\nSitemap\nLiên hệ\nToggle navigation\nGIỚI THIỆU\nTHÔNG TIN CHUNG\nCƠ CẤU TỔ CHỨC\nCHIẾN LƯỢC PHÁT TRIỂN\nCÁN BỘ GIẢNG VIÊN\nCƠ SỞ VẬT CHẤT\nLIÊN HỆ\nĐÀO TẠO\nĐẠI HỌC\nKHOA HỌC MÁY TÍNH\nKỸ THUẬT PHẦN MỀM\nHỆ THỐNG THÔNG TIN\nCÔNG NGHỆ THÔNG TIN\nCÔNG NGHỆ ĐA PHƯƠNG TIỆN\nAN TOÀN THÔNG TIN\nSAU ĐẠI HỌC\nHỆ THỐNG THÔNG TIN\nKẾ HOẠCH\nTIẾN ĐỘ\nQUY CHẾ, BIỂU MẪU\nNGHIÊN CỨU KHOA HỌC\nCÔNG TRÌNH CÔNG BỐ\nĐỀ TÀI, DỰ ÁN\nSINH VIÊN NCKH\nTIN KHCN\nCÔNG TÁC SINH VIÊN\nQUY CHẾ\nGƯƠNG SÁNG SINH VIÊN\nHỌC BỔNG\nCÂU LẠC BỘ\nTHƯ VIỆN ẢNH\nTUYỂN DỤNG\nHỌC BỔNG\nTRANG CHỦ > HỌC BỔNG\nThông báo tuyển sinh chương trình Thạc sĩ tại Đài Loan\nThứ Tư, 14:55 08/11/2023\nXem thêm\n1\nTin tiêu điểm\nSinh viên Khóa 19 Khoa Công nghệ thông tin đạt Học bổng HaUI 100% toàn khóa học.\nThứ Sáu, 11:07 20/09/2024\nĐội bóng khoa Công nghệ thông tin cùng những trận cầu đáng nhớ\nThứ Bảy, 10:00 23/07/2022\nnext_contents:\n']","['CÔNG TÁC SINH VIÊN QUY CHẾ GƯƠNG SÁNG SINH VIÊN HỌC BỔNG CÂU LẠC BỘ THƯ VIỆN ẢNH TUYỂN DỤNG THÔNG BÁO TRANG CHỦ > THÔNG BÁO Đăng ký Hội thao Khoa Công nghệ thông tin năm 2024 Với mục tiêu mang tới một sân chơi lành mạnh cho các bạn sinh viên, Hội thao Khoa Công nghệ thông tin chính thức khởi tranh, hứa hẹn sẽ mang đến một làn gió mới ngoài những giờ học tập và làm việc đầy căng thẳng, hướng tới một môi trường học tập phát triển toàn diện, nơi mỗi trái tim sẽ được cháy vì đam mê thể thao, đồng thời xây dựng không khí thi đua, gắn kết giữa các sinh viên.""Hội thao khoa CNTT năm 2024"" bao gồm các phần thi như sau: 1. Phần thi Cầu lông: - Phần thi Cầu lông Hà Nam: Đăng ký tại đây - Phần thi Cầu lông Hà Nội: Đăng ký tại đây.2. Phần thi Cờ vua: Đăng ký tại đây. - Nhóm Zalo của giải đấu: Tại đây.3. Phần thi Chạy tiếp sức: Đăng ký tại đây.4. Phần thi Kéo co: Đăng ký tại đây.5. Phần thi Esport Liên Quân Mobile: - Phần thi Liên Quân Hà Nam: Đăng ký tại đây. - Phần thi Liên Quân Hà Nội: Đăng ký tại đây.Đừng ngần ngại đăng ký tham gia Hội thao khoa CNTT để được hòa mình vào không gian thể thao nồng nhiệt, tràn đầy sức sống và cùng nhau tạo nên những khoảnh khắc thật đáng nhớ nhé! Thứ Hai, 09:51 25/11/2024 Tags: Tweet Các bài đã đăng » Cuộc thi:"" Học sinh, sinh viên với ý tưởng khởi nghiệp"" lần thứ VII. (18/12/2024) » Dự kiến chỉ tiêu và phương thức xét tuyển các ngành thuộc Khoa CNTT - Trường Đại học Công Nghiệp Hà Nội năm 2025 (18/12/2024) » Cẩm nang Kỳ thi Olympic Tin học Sinh viên Việt Nam lần thứ 33 (OLP’24) và Kỳ thi lập trình sinh viên Quốc tế ICPC ASIA 2024 (11/12/2024) » Khảo sát mức độ quan tâm thị trường việc làm Nhật Bản đợt 2 (10/12/2024) » Khởi động Cuộc thi Huawei ICT toàn cầu 2024-2025 (09/12/2024) » Thông báo tuyển sinh trình độ Thạc sỹ Hệ thống thông tin năm 2024 (23/11/2024) » Thông báo tổ chức chương trình Hội thảo thực tập, việc làm và phỏng vấn trực tiếp của Công ty TNHH Công nghiệp Brother Việt Nam - Thứ 5, ngày 28/11/2024 (22/11/2024) » Thông báo tổ chức chương trình Hội thảo thực tập, việc làm và phỏng vấn trực tiếp Cán bộ nguồn Foxconn - Thứ 3, ngày 26/11/2024 (20/11/2024) » [Webinar] How to Become a Data Analyst? (18/11/2024) » Học bổng Digiworld ươm mầm xanh, đào tạo kỹ sư lập trình (08/11/2024) Tin tiêu điểm Sinh viên Khóa 19 Khoa Công nghệ thông tin đạt Học bổng HaUI 100% toàn khóa học. Thứ Sáu, 11:07 20/09/2024 Đội bóng khoa Công nghệ thông tin cùng những trận cầu đáng nhớ Thứ Bảy, 10:00 23/07/2022 Đại hội đại biểu Liên chi Đoàn khoa Công nghệ thông tin lần thứ X, nhiệm kỳ 2022 - 2024 Thứ Hai, 15:00 18/04/2022 Gặp mặt tân Sinh viên K15 khoa Công nghệ thông tin Thứ Tư, 08:17 28/10/2020 Chương trình thực tập tại SVMC ""SVMC Internship Program 2020"" Thứ Sáu, 14:02 22/05/2020 Các bài đã đăng Cuộc thi:"" Học sinh, sinh viên với ý tưởng khởi nghiệp"" lần thứ VII. Thứ Tư, 09:57 18/12/2024 Dự kiến chỉ tiêu và phương thức xét tuyển các ngành thuộc Khoa CNTT - Trường Đại học Công Nghiệp Hà Nội năm 2025 Thứ Tư, 09:14 18/12/2024 Cẩm nang Kỳ thi Olympic Tin học Sinh viên Việt Nam lần thứ 33 (OLP’24) và Kỳ thi lập trình sinh viên Quốc tế ICPC ASIA 2024 Thứ Tư, 07:54 11/12/2024 Khảo sát mức độ quan tâm thị trường việc làm Nhật Bản đợt 2 Thứ Ba, 12:34 10/12/2024 Khởi động Cuộc thi Huawei ICT toàn cầu 2024-2025 Thứ Hai, 09:04 09/12/2024 Thông báo tuyển sinh trình độ Thạc sỹ Hệ thống thông tin năm 2024 Thứ Bảy, 15:26 23/11/2024 Thông báo tổ chức chương trình Hội thảo thực tập, việc làm và phỏng vấn trực tiếp của Công ty TNHH Công nghiệp Brother Việt Nam - Thứ 5, ngày 28/11/2024 Thứ Sáu, 13:47 22/11/2024 Thông báo tổ chức chương trình Hội thảo thực tập, việc làm và phỏng vấn trực tiếp Cán bộ nguồn Foxconn - Thứ 3, ngày 26/11/2024 Thứ Tư, 10:03 20/11/2024 [Webinar] How to Become a Data Analyst? Thứ Hai, 08:43 18/11/2024 Học bổng Digiworld ươm mầm xanh, đào tạo kỹ sư lập trình Thứ Sáu, 10:46 08/11/2024 Bản đồ chỉ dẫn Trường Đại học Công nghiệp Hà Nội Trụ sở chính Số 298 đường Cầu Diễn, quận Bắc Từ Liêm, Hà Nội +84 243 765 5121 Email: dhcnhn@haui.edu.vn Các cơ sở khác Cơ sở 2: Phường Tây Tựu, quận Bắc Từ Liêm, Hà Nội Cơ sở 3: Phường Lê Hồng Phong, thành phố Phủ Lý, Hà Nam Liên kết site Trường Đại học Công nghiệp Hà Nội Thông tin tuyển sinh Hành chính điện tử Đào tạo trực tuyến Cổng thông tin đào tạo Copyright © 2018 Hanoi University of Industry.']","Học bổng HaUI có ý nghĩa rất lớn đối với sinh viên Khoa Công nghệ Thông tin, cụ thể như sau:

1. **Khuyến khích nỗ lực học tập**: Học bổng HaUI là phần thưởng xứng đáng cho những nỗ lực và cố gắng không ngừng nghỉ của sinh viên. Nó không chỉ công nhận thành tích học tập mà còn khuyến khích sinh viên phấn đấu hơn nữa trong quá trình học tập.

2. **Giảm bớt gánh nặng tài chính**: Học bổng này cấp 100% học phí cho toàn khóa học, giúp sinh viên giảm bớt gánh nặng tài chính trong suốt thời gian học tập tại trường. Điều này tạo điều kiện thuận lợi cho sinh viên tập trung vào việc học mà không phải lo lắng về chi phí học tập.

3. **Cơ hội phát triển nghề nghiệp**: Sinh viên nhận học bổng thường có thành tích học tập xuất sắc và tiềm năng cao trong lĩnh vực công nghệ thông tin. Điều này không chỉ giúp họ có cơ hội học tập tốt hơn mà còn mở ra nhiều cơ hội nghề nghiệp trong tương lai.

4. **Tạo động lực cho sinh viên khác**: Những sinh viên đạt học bổng HaUI trở thành hình mẫu cho các bạn khác, từ đó tạo ra một môi trường học tập tích cực và cạnh tranh hơn trong khoa.

Năm học 2024-2025, Khoa Công nghệ Thông tin đã vinh dự tuyên dương 03 sinh viên đạt học bổng 100% toàn khóa học, điều này càng khẳng định giá trị và ý nghĩa của học bổng HaUI đối với sinh viên.

Nguồn: [Học bổng - Khoa Công nghệ Thông tin - Đại học Công nghiệp Hà Nội](https://fit.haui.edu.vn/vn/guong-sang/sinh-vien-khoa-19-khoa-cong-nghe-thong-tin-dat-hoc-bong-haui-100-toan-khoa-hoc/71060) - [**Link tham khảo**](https://fit.haui.edu.vn/vn/guong-sang/sinh-vien-khoa-19-khoa-cong-nghe-thong-tin-dat-hoc-bong-haui-100-toan-khoa-hoc/71060).

Nếu bạn có thêm câu hỏi nào khác hoặc cần thông tin chi tiết hơn, hãy cho tôi biết!","Học bổng HaUI mang lại cơ hội học tập tốt hơn cho sinh viên Khoa Công nghệ Thông tin, giúp họ giảm bớt gánh nặng tài chính và tập trung vào việc học tập. Đặc biệt, sinh viên Khóa 19 Khoa Công nghệ thông tin đã đạt Học bổng HaUI 100% toàn khóa học, cho thấy sự hỗ trợ đáng kể từ nhà trường đối với sinh viên.",0.9166666666361111,1.0,0.23529411764705882,0.8577839634969816,0.9527337839085096,0.9203667640686035,14.122907161712646
29,Công ty TNHH Pegatron Việt Nam có vai trò gì trong chương trình hợp tác đào tạo của Trường Đại học Công nghiệp Hà Nội?,"['content: PHÒNG HỢP TÁC ĐỐI NGOẠI - ĐẠI HỌC CÔNG NGHIỆP HÀ NỘI\nMenu\nClose\nTrang HaUI\nGiới thiệu\nMạng lưới đối tác\nĐối tác doanh nghiệp\nĐối tác trường viện\nCơ quan tổ chức\nHoạt động hợp tác\nHợp tác đào tạo với doanh nghiệp\nLiên kết đào tạo quốc tế\nTrao đổi, giao lưu văn hóa\nDự án\nCổng việc làm HaUI\nTin tuyển dụng\nHướng nghiệp\nTài liệu\nQuy định\nBiểu mẫu\nTrang HaUI\nGiới thiệu\nMạng lưới đối tác\nĐối tác doanh nghiệp\nĐối tác trường viện\nCơ quan tổ chức\nHoạt động hợp tác\nHợp tác đào tạo với doanh nghiệp\nLiên kết đào tạo quốc tế\nTrao đổi, giao lưu văn hóa\nDự án\nHọc bổng\nHỖ TRỢ VIỆC LÀM\nCổng việc làm HaUI\nNgày hội việc làm\nTài liệu\nQuy định\nBiểu mẫu\nHướng nghiệp\nSổ tay hỗ trợ việc làm\nPhát triển kỹ năng\nPrevious\nNext\nTin Tức\nHaUI mở rộng hợp tác giáo dục đào tạo với các trường đại học Liên bang Nga\nNhằm thúc đẩy giao lưu và hợp tác giáo dục đào tạo, đoàn công tác của Đại sứ quán Liên bang Nga tại Việt Nam và một số trường đại học đến từ Liên bang Nga có chuyến thăm và làm việc với lãnh đạo tỉnh Hà Nam và đại diện các cơ sở giáo dục & đào tạo trên địa bàn tỉnh. PGS.TS. Phạm Văn Đông - Phó Hiệu trưởng Trường Đại học Công nghiệp Hà Nội tham dự hội nghị.\nĐọc thêm\nCông ty Ani Vina trao tài trợ hệ thống tự động hóa tích hợp robot cho Khoa Điện, Trường Đại học Công nghiệp Hà Nội\nChiều ngày 10/12, Khoa Điện, Trường Đại học Công nghiệp Hà Nội đã nhận bàn giao hệ thống tự động hóa tích hợp robot trị giá gần 700 triệu do Công ty TNHH Ani Vina tài trợ.\nĐọc thêm\nnext_contents:\n', 'content: PHÒNG HỢP TÁC ĐỐI NGOẠI - ĐẠI HỌC CÔNG NGHIỆP HÀ NỘI\nMenu\nClose\nTrang HaUI\nGiới thiệu\nMạng lưới đối tác\nĐối tác doanh nghiệp\nĐối tác trường viện\nCơ quan tổ chức\nHoạt động hợp tác\nHợp tác đào tạo với doanh nghiệp\nLiên kết đào tạo quốc tế\nTrao đổi, giao lưu văn hóa\nDự án\nCổng việc làm HaUI\nTin tuyển dụng\nHướng nghiệp\nTài liệu\nQuy định\nBiểu mẫu\nTrang HaUI\nGiới thiệu\nMạng lưới đối tác\nĐối tác doanh nghiệp\nĐối tác trường viện\nCơ quan tổ chức\nHoạt động hợp tác\nHợp tác đào tạo với doanh nghiệp\nLiên kết đào tạo quốc tế\nTrao đổi, giao lưu văn hóa\nDự án\nHọc bổng\nHỖ TRỢ VIỆC LÀM\nCổng việc làm HaUI\nNgày hội việc làm\nTài liệu\nQuy định\nBiểu mẫu\nHướng nghiệp\nSổ tay hỗ trợ việc làm\nPhát triển kỹ năng\nPrevious\nNext\nTin Tức\nHaUI mở rộng hợp tác giáo dục đào tạo với các trường đại học Liên bang Nga\nNhằm thúc đẩy giao lưu và hợp tác giáo dục đào tạo, đoàn công tác của Đại sứ quán Liên bang Nga tại Việt Nam và một số trường đại học đến từ Liên bang Nga có chuyến thăm và làm việc với lãnh đạo tỉnh Hà Nam và đại diện các cơ sở giáo dục & đào tạo trên địa bàn tỉnh. PGS.TS. Phạm Văn Đông - Phó Hiệu trưởng Trường Đại học Công nghiệp Hà Nội tham dự hội nghị.\nĐọc thêm\nCông ty Ani Vina trao tài trợ hệ thống tự động hóa tích hợp robot cho Khoa Điện, Trường Đại học Công nghiệp Hà Nội\nChiều ngày 10/12, Khoa Điện, Trường Đại học Công nghiệp Hà Nội đã nhận bàn giao hệ thống tự động hóa tích hợp robot trị giá gần 700 triệu do Công ty TNHH Ani Vina tài trợ.\nĐọc thêm\nnext_contents:\n', 'content: Trường Đại học Công nghiệp Hà Nội đón tiếp đoàn lãnh đạo trường Đại học Khoa học Kỹ thuật Minh Chí, Đài Loan\nSáng ngày 11/12, TS. Kiều Xuân Thực - Hiệu trưởng Trường Đại học Công nghiệp Hà Nội (HaUI) đã chủ trì buổi tiếp đón và làm việc với Trường Đại học Khoa học Kỹ thuật Minh Chí, Đài Loan (MCUT). Hai bên thống nhất hợp tác đào tạo cử nhân liên kết 2 + 2; xây dựng chương trình đào tạo thạc sỹ có học bổng và phối hợp thực hiện nghiên cứu khoa học trong lĩnh vực AI, năng lượng xanh, y tế thông minh.\nĐọc thêm\nHaUI – Steinbeis: Bước tiến mới trong quốc tế hoá giáo dục\nSinh viên Trường Đại học Công nghiệp Hà Nội ngay sau khi tốt nghiệp có thể học lên thạc sĩ của Trường Đại học Steinbeis (CHLB Đức) trong thời gian 1 năm theo hình thức trực tuyến, sau đó sẽ làm việc tại Đức với mức lương hấp dẫn và những cơ hội tham gia vào thị trường nhân lực quốc tế chất lượng cao cho người học được 2 trường đề xuất, trao đổi tại buổi làm việc sáng ngày 28/11.\nĐọc thêm\nThông báo\nThông báo tổ chức chương trình Hội thảo thực tập, việc làm và thi tuyển trực tiếp của Công ty TNHH Risuntek Việt Nam - Thứ 5, ngày 19/12/2024\nCông ty TNHH Risuntek Việt Nam được thành lập từ năm 2014, tập trung vào các nhà máy OEM và EMS. Trong 10 năm qua, chúng tôi đã phát triển đội ngũ và nguồn lực của mình tại Việt Nam. Nhân sự nhà máy của chúng tôi được xây dựng trên nền tảng là các kỹ sư có chuyên môn và tay nghề cao; các chuyên gia cao cấp đến từ Trung Quốc. Nhà máy của chúng tôi chuyên sản xuất, gia công, lắp ráp các sản phẩm, linh kiện và chi tiết điện tử như: Tai nghe Bluetooth, dây tai nghe, dây sạc, tai nghe không dây TWS, xe điện cân bằng….\nĐọc thêm\nnext_contents:\n- PHÒNG HỢP TÁC ĐỐI NGOẠI - ĐẠI HỌC CÔNG NGHIỆP HÀ NỘI\nMenu\nClose\nTrang HaUI\nGiới thiệu\nMạng lưới đối tác\nĐối tác doanh nghiệp\nĐối tác trường viện\nCơ quan tổ chức\nHoạt động hợp tác\nHợp tác đào tạo với doanh nghiệp\nLiên kết đào tạo quốc tế\nTrao đổi, giao lưu văn hóa\nDự án\nCổng việc làm HaUI\nTin tuyển dụng\nHướng nghiệp\nTài liệu\nQuy định\nBiểu mẫu\nTrang HaUI\nGiới thiệu\nMạng lưới đối tác\nĐối tác doanh nghiệp\nĐối tác trường viện\nCơ quan tổ chức\nHoạt động hợp tác\nHợp tác đào tạo với doanh nghiệp\nLiên kết đào tạo quốc tế\nTrao đổi, giao lưu văn hóa\nDự án\nHọc bổng\nHỖ TRỢ VIỆC LÀM\nCổng việc làm HaUI\nNgày hội việc làm\nTài liệu\nQuy định\nBiểu mẫu\nHướng nghiệp\nSổ tay hỗ trợ việc làm\nPhát triển kỹ năng\nPrevious\nNext\nTin Tức\nHaUI mở rộng hợp tác giáo dục đào tạo với các trường đại học Liên bang Nga\nNhằm thúc đẩy giao lưu và hợp tác giáo dục đào tạo, đoàn công tác của Đại sứ quán Liên bang Nga tại Việt Nam và một số trường đại học đến từ Liên bang Nga có chuyến thăm và làm việc với lãnh đạo tỉnh Hà Nam và đại diện các cơ sở giáo dục & đào tạo trên địa bàn tỉnh. PGS.TS. Phạm Văn Đông - Phó Hiệu trưởng Trường Đại học Công nghiệp Hà Nội tham dự hội nghị.\nĐọc thêm\nCông ty Ani Vina trao tài trợ hệ thống tự động hóa tích hợp robot cho Khoa Điện, Trường Đại học Công nghiệp Hà Nội\nChiều ngày 10/12, Khoa Điện, Trường Đại học Công nghiệp Hà Nội đã nhận bàn giao hệ thống tự động hóa tích hợp robot trị giá gần 700 triệu do Công ty TNHH Ani Vina tài trợ.\nĐọc thêm\n', 'content: Trường Đại học Công nghiệp Hà Nội đón tiếp đoàn lãnh đạo trường Đại học Khoa học Kỹ thuật Minh Chí, Đài Loan\nSáng ngày 11/12, TS. Kiều Xuân Thực - Hiệu trưởng Trường Đại học Công nghiệp Hà Nội (HaUI) đã chủ trì buổi tiếp đón và làm việc với Trường Đại học Khoa học Kỹ thuật Minh Chí, Đài Loan (MCUT). Hai bên thống nhất hợp tác đào tạo cử nhân liên kết 2 + 2; xây dựng chương trình đào tạo thạc sỹ có học bổng và phối hợp thực hiện nghiên cứu khoa học trong lĩnh vực AI, năng lượng xanh, y tế thông minh.\nĐọc thêm\nHaUI – Steinbeis: Bước tiến mới trong quốc tế hoá giáo dục\nSinh viên Trường Đại học Công nghiệp Hà Nội ngay sau khi tốt nghiệp có thể học lên thạc sĩ của Trường Đại học Steinbeis (CHLB Đức) trong thời gian 1 năm theo hình thức trực tuyến, sau đó sẽ làm việc tại Đức với mức lương hấp dẫn và những cơ hội tham gia vào thị trường nhân lực quốc tế chất lượng cao cho người học được 2 trường đề xuất, trao đổi tại buổi làm việc sáng ngày 28/11.\nĐọc thêm\nThông báo\nThông báo tổ chức chương trình Hội thảo thực tập, việc làm và thi tuyển trực tiếp của Công ty TNHH Risuntek Việt Nam - Thứ 5, ngày 19/12/2024\nCông ty TNHH Risuntek Việt Nam được thành lập từ năm 2014, tập trung vào các nhà máy OEM và EMS. Trong 10 năm qua, chúng tôi đã phát triển đội ngũ và nguồn lực của mình tại Việt Nam. Nhân sự nhà máy của chúng tôi được xây dựng trên nền tảng là các kỹ sư có chuyên môn và tay nghề cao; các chuyên gia cao cấp đến từ Trung Quốc. Nhà máy của chúng tôi chuyên sản xuất, gia công, lắp ráp các sản phẩm, linh kiện và chi tiết điện tử như: Tai nghe Bluetooth, dây tai nghe, dây sạc, tai nghe không dây TWS, xe điện cân bằng….\nĐọc thêm\nnext_contents:\n- PHÒNG HỢP TÁC ĐỐI NGOẠI - ĐẠI HỌC CÔNG NGHIỆP HÀ NỘI\nMenu\nClose\nTrang HaUI\nGiới thiệu\nMạng lưới đối tác\nĐối tác doanh nghiệp\nĐối tác trường viện\nCơ quan tổ chức\nHoạt động hợp tác\nHợp tác đào tạo với doanh nghiệp\nLiên kết đào tạo quốc tế\nTrao đổi, giao lưu văn hóa\nDự án\nCổng việc làm HaUI\nTin tuyển dụng\nHướng nghiệp\nTài liệu\nQuy định\nBiểu mẫu\nTrang HaUI\nGiới thiệu\nMạng lưới đối tác\nĐối tác doanh nghiệp\nĐối tác trường viện\nCơ quan tổ chức\nHoạt động hợp tác\nHợp tác đào tạo với doanh nghiệp\nLiên kết đào tạo quốc tế\nTrao đổi, giao lưu văn hóa\nDự án\nHọc bổng\nHỖ TRỢ VIỆC LÀM\nCổng việc làm HaUI\nNgày hội việc làm\nTài liệu\nQuy định\nBiểu mẫu\nHướng nghiệp\nSổ tay hỗ trợ việc làm\nPhát triển kỹ năng\nPrevious\nNext\nTin Tức\nHaUI mở rộng hợp tác giáo dục đào tạo với các trường đại học Liên bang Nga\nNhằm thúc đẩy giao lưu và hợp tác giáo dục đào tạo, đoàn công tác của Đại sứ quán Liên bang Nga tại Việt Nam và một số trường đại học đến từ Liên bang Nga có chuyến thăm và làm việc với lãnh đạo tỉnh Hà Nam và đại diện các cơ sở giáo dục & đào tạo trên địa bàn tỉnh. PGS.TS. Phạm Văn Đông - Phó Hiệu trưởng Trường Đại học Công nghiệp Hà Nội tham dự hội nghị.\nĐọc thêm\nCông ty Ani Vina trao tài trợ hệ thống tự động hóa tích hợp robot cho Khoa Điện, Trường Đại học Công nghiệp Hà Nội\nChiều ngày 10/12, Khoa Điện, Trường Đại học Công nghiệp Hà Nội đã nhận bàn giao hệ thống tự động hóa tích hợp robot trị giá gần 700 triệu do Công ty TNHH Ani Vina tài trợ.\nĐọc thêm\n']","['THÔNG BÁO TRANG CHỦ > THÔNG BÁO Thông báo tuyển sinh trình độ Thạc sỹ Hệ thống thông tin năm 2024 Thông báo tuyển sinh trình độ thạc sỹ năm 2024: Tải về tại đây.Chương trình đào tạo thạc sỹ ngành HTTT: Tải về tại đây. Thứ Bảy, 15:26 23/11/2024 Tags: Tweet Các bài đã đăng » Cuộc thi:"" Học sinh, sinh viên với ý tưởng khởi nghiệp"" lần thứ VII. (18/12/2024) » Dự kiến chỉ tiêu và phương thức xét tuyển các ngành thuộc Khoa CNTT - Trường Đại học Công Nghiệp Hà Nội năm 2025 (18/12/2024) » Cẩm nang Kỳ thi Olympic Tin học Sinh viên Việt Nam lần thứ 33 (OLP’24) và Kỳ thi lập trình sinh viên Quốc tế ICPC ASIA 2024 (11/12/2024) » Khảo sát mức độ quan tâm thị trường việc làm Nhật Bản đợt 2 (10/12/2024) » Khởi động Cuộc thi Huawei ICT toàn cầu 2024-2025 (09/12/2024) » Thông báo tổ chức chương trình Hội thảo thực tập, việc làm và phỏng vấn trực tiếp của Công ty TNHH Công nghiệp Brother Việt Nam - Thứ 5, ngày 28/11/2024 (22/11/2024) » Thông báo tổ chức chương trình Hội thảo thực tập, việc làm và phỏng vấn trực tiếp Cán bộ nguồn Foxconn - Thứ 3, ngày 26/11/2024 (20/11/2024) » [Webinar] How to Become a Data Analyst? (18/11/2024) » Học bổng Digiworld ươm mầm xanh, đào tạo kỹ sư lập trình (08/11/2024) » Triển khai chương trình hợp tác đào tạo với Công ty TNHH Pegatron Việt Nam_Lớp Ươm mầm tài năng Pegatron (07/11/2024) Tin tiêu điểm Sinh viên Khóa 19 Khoa Công nghệ thông tin đạt Học bổng HaUI 100% toàn khóa học. Thứ Sáu, 11:07 20/09/2024 Đội bóng khoa Công nghệ thông tin cùng những trận cầu đáng nhớ Thứ Bảy, 10:00 23/07/2022 Đại hội đại biểu Liên chi Đoàn khoa Công nghệ thông tin lần thứ X, nhiệm kỳ 2022 - 2024 Thứ Hai, 15:00 18/04/2022 Gặp mặt tân Sinh viên K15 khoa Công nghệ thông tin Thứ Tư, 08:17 28/10/2020 Chương trình thực tập tại SVMC ""SVMC Internship Program 2020"" Thứ Sáu, 14:02 22/05/2020 Các bài đã đăng Cuộc thi:"" Học sinh, sinh viên với ý tưởng khởi nghiệp"" lần thứ VII. Thứ Tư, 09:57 18/12/2024 Dự kiến chỉ tiêu và phương thức xét tuyển các ngành thuộc Khoa CNTT - Trường Đại học Công Nghiệp Hà Nội năm 2025 Thứ Tư, 09:14 18/12/2024 Cẩm nang Kỳ thi Olympic Tin học Sinh viên Việt Nam lần thứ 33 (OLP’24) và Kỳ thi lập trình sinh viên Quốc tế ICPC ASIA 2024 Thứ Tư, 07:54 11/12/2024 Khảo sát mức độ quan tâm thị trường việc làm Nhật Bản đợt 2 Thứ Ba, 12:34 10/12/2024 Khởi động Cuộc thi Huawei ICT toàn cầu 2024-2025 Thứ Hai, 09:04 09/12/2024 Thông báo tổ chức chương trình Hội thảo thực tập, việc làm và phỏng vấn trực tiếp của Công ty TNHH Công nghiệp Brother Việt Nam - Thứ 5, ngày 28/11/2024 Thứ Sáu, 13:47 22/11/2024 Thông báo tổ chức chương trình Hội thảo thực tập, việc làm và phỏng vấn trực tiếp Cán bộ nguồn Foxconn - Thứ 3, ngày 26/11/2024 Thứ Tư, 10:03 20/11/2024 [Webinar] How to Become a Data Analyst? Thứ Hai, 08:43 18/11/2024 Học bổng Digiworld ươm mầm xanh, đào tạo kỹ sư lập trình Thứ Sáu, 10:46 08/11/2024 Triển khai chương trình hợp tác đào tạo với Công ty TNHH Pegatron Việt Nam_Lớp Ươm mầm tài năng Pegatron Thứ Năm, 13:29 07/11/2024 Bản đồ chỉ dẫn Trường Đại học Công nghiệp Hà Nội Trụ sở chính Số 298 đường Cầu Diễn, quận Bắc Từ Liêm, Hà Nội +84 243 765 5121 Email: dhcnhn@haui.edu.vn Các cơ sở khác Cơ sở 2: Phường Tây Tựu, quận Bắc Từ Liêm, Hà Nội Cơ sở 3: Phường Lê Hồng Phong, thành phố Phủ Lý, Hà Nam Liên kết site Trường Đại học Công nghiệp Hà Nội Thông tin tuyển sinh Hành chính điện tử Đào tạo trực tuyến Cổng thông tin đào tạo Copyright © 2018 Hanoi University of Industry.']","Tôi không có thông tin này và khuyến nghị bạn tham khảo nguồn khác. Nếu bạn có câu hỏi khác liên quan đến khoa công nghệ thông tin tại Trường Đại học Công nghiệp Hà Nội, vui lòng cho tôi biết!",Công ty TNHH Pegatron Việt Nam triển khai chương trình hợp tác đào tạo với Trường Đại học Công nghiệp Hà Nội thông qua lớp Ươm mầm tài năng Pegatron.,0.0,0.0,0.0,0.0,0.8210468629120945,1.2064859867095947,2.681572198867798
